Bus Hound 6.01 capture on Windows Vista Service Pack 1 (x64). Complements of www.perisoft.net

1

  Device - Device ID (followed by the endpoint for USB devices)
            (15) USB3 Vision Device - libUSB for Certification Test
            (27) USB3 Vision Digital Camera
  Address - FireWire async address or channel number
  Length - Total transfer length
  Phase  - Phase Type
            CTL   USB control transfer
            IN    Data in transfer
            OUT   Data out transfer
  Data   - Hex dump of the data transferred
  Descr  - Description of the phase
  Delta  - Elapsed time from the previous phase to the current phase
  Cmd... - Position in the captured data
  Time   - Time the phase occurred in hour:minute:second.millisec form


Device  Address              Length    Phase  Data                                                Description       Delta  Cmd.Phase.Ofs(rep)  Time
------  -------------------  --------  -----  --------------------------------------------------  ----------------  -----  ------------------  ------------
  15.1                             24  OUT    55 33 56 43xx00 40x00 08xx0c 00 88 15xx04 00 01 00xxU3VC.@..........  520us         1.1.0        10:00:49.224
                                              00 00 00 00  00 00 08 00                            ........                        1.1.16
  15.1                             20  IN     55 33 56 43  00 00 01 08  08 00 88 15  03 00 00 00  U3VC............  676us         2.1.0        10:00:49.224
                                              00 00 00 00                                         ....                            2.1.16
  15.1                             24  OUT    55 33 56 43  00 40 00 08  0c 00 89 15  20 00 01 00  U3VC.@...... ...  128us         3.1.0        10:00:49.225
                                              00 00 00 00  00 00 08 00                            ........                        3.1.16
  15.1                             20  IN     55 33 56 43  00 00 01 08  08 00 89 15  00 00 02 00  U3VC............  670us         4.1.0        10:00:49.225
                                              00 00 00 00                                         ....                            4.1.16
  15.1                             24  OUT    55 33 56 43  00 40 00 08  0c 00 8a 15  04 00 01 00  U3VC.@..........  636us         5.1.0        10:00:49.227
                                              00 00 00 00  00 00 08 00                            ........                        5.1.16
  15.1                             20  IN     55 33 56 43  00 00 01 08  08 00 8a 15  03 00 00 00  U3VC............  675us         6.1.0        10:00:49.227
                                              00 00 00 00                                         ....                            6.1.16
  15.1                             24  OUT    55 33 56 43  00 40 00 08  0c 00 8b 15  2c 00 01 00  U3VC.@......,...  112us         7.1.0        10:00:49.227
                                              00 00 00 00  00 00 08 00                            ........                        7.1.16
  15.1                             20  IN     55 33 56 43  00 00 01 08  08 00 8b 15  00 10 02 00  U3VC............  695us         8.1.0        10:00:49.228
                                              00 00 00 00                                         ....                            8.1.16
  15.1                             24  OUT    55 33 56 43  00 40 02 08  0c 00 8c 15  08 00 90 00  U3VC.@..........  841us         9.1.0        10:00:49.228
                                              00 00 00 00  a8 00 00 00                            ........                        9.1.16
  15.1                             16  IN     55 33 56 43  00 00 03 08  04 00 8c 15  00 00 04 00  U3VC............  1.7ms        10.1.0        10:00:49.230
  15.1                             24  OUT    55 33 56 43  00 40 02 08  0c 00 8d 15  0c 00 90 00  U3VC.@..........  197us        11.1.0        10:00:49.230
                                              00 00 00 00  5a 03 00 00                            ....Z...                       11.1.16
  15.1                             16  IN     55 33 56 43  00 00 03 08  04 00 8d 15  00 00 04 00  U3VC............  1.7ms        12.1.0        10:00:49.232
  15.1                             24  OUT    55 33 56 43  00 40 02 08  0c 00 8e 15  00 00 80 00  U3VC.@..........  201us        13.1.0        10:00:49.233
                                              00 00 00 00  02 00 00 00                            ........                       13.1.16
  15.1                             16  IN     55 33 56 43  00 00 03 08  04 00 8e 15  00 00 04 00  U3VC............  493us        14.1.0        10:00:49.233
  15.1                             24  OUT    55 33 56 43  00 40 00 08  0c 00 8f 15  3c 00 90 00  U3VC.@......<...  189us        15.1.0        10:00:49.233
                                              00 00 00 00  00 00 04 00                            ........                       15.1.16
  15.1                             16  IN     55 33 56 43  00 00 01 08  04 00 8f 15  00 00 00 00  U3VC............  675us        16.1.0        10:00:49.234
  15.1                             24  OUT    55 33 56 43  00 40 02 08  0c 00 90 15  38 00 90 00  U3VC.@......8...  170us        17.1.0        10:00:49.234
                                              00 00 00 00  14 00 00 00                            ........                       17.1.16
  15.1                             16  IN     55 33 56 43  00 00 03 08  04 00 90 15  00 00 04 00  U3VC............  1.0ms        18.1.0        10:00:49.235
  15.1                             24  OUT    55 33 56 43  00 40 00 08  0c 00 91 15  3c 00 90 00  U3VC.@......<...  150us        19.1.0        10:00:49.235
                                              00 00 00 00  00 00 04 00                            ........                       19.1.16
  15.1                             16  IN     55 33 56 43  00 00 01 08  04 00 91 15  00 00 00 00  U3VC............  679us        20.1.0        10:00:49.235
  15.1                             24  OUT    55 33 56 43  00 40 00 08  0c 00 92 15  38 00 90 00  U3VC.@......8...  127us        21.1.0        10:00:49.235
                                              00 00 00 00  00 00 04 00                            ........                       21.1.16
  15.1                             16  IN     55 33 56 43  00 00 01 08  04 00 92 15  14 00 00 00  U3VC............  674us        22.1.0        10:00:49.237
  15.1                             24  OUT    55 33 56 43  00 40 02 08  0c 00 93 15  04 00 02 00  U3VC.@..........  157us        23.1.0        10:00:49.237
                                              00 00 00 00  00 00 00 00                            ........                       23.1.16
  15.1                             16  IN     55 33 56 43  00 00 03 08  04 00 93 15  00 00 04 00  U3VC............  9.5ms        24.1.0        10:00:49.247
  15.1                             24  OUT    55 33 56 43  00 40 00 08  0c 00 94 15  00 00 02 00  U3VC.@..........  6.1ms        25.1.0        10:00:49.253
                                              00 00 00 00  00 00 04 00                            ........                       25.1.16
  15.1                             16  IN     55 33 56 43  00 00 01 08  04 00 94 15  00 00 00 0a  U3VC............  672us        26.1.0        10:00:49.253
  15.1                             24  OUT    55 33 56 43  00 40 00 08  0c 00 95 15  08 00 02 00  U3VC.@..........  135us        27.1.0        10:00:49.253
                                              00 00 00 00  00 00 08 00                            ........                       27.1.16
  15.1                             20  IN     55 33 56 43  00 00 01 08  08 00 95 15  38 33 02 00  U3VC........83..  727us        28.1.0        10:00:49.254
                                              00 00 00 00                                         ....                           28.1.16
  15.1                             24  OUT    55 33 56 43  00 40 00 08  0c 00 96 15  10 00 02 00  U3VC.@..........  116us        29.1.0        10:00:49.254
                                              00 00 00 00  00 00 04 00                            ........                       29.1.16
  15.1                             16  IN     55 33 56 43  00 00 01 08  04 00 96 15  34 00 00 00  U3VC........4...  691us        30.1.0        10:00:49.255
  15.1                             24  OUT    55 33 56 43  00 40 00 08  0c 00 97 15  14 00 02 00  U3VC.@..........  124us        31.1.0        10:00:49.255
                                              00 00 00 00  00 00 04 00                            ........                       31.1.16
  15.1                             16  IN     55 33 56 43  00 00 01 08  04 00 97 15  24 00 00 00  U3VC........$...  684us        32.1.0        10:00:49.255
  15.1                             24  OUT    55 33 56 43  00 40 02 08  0c 00 98 15  18 00 02 00  U3VC.@..........  122us        33.1.0        10:00:49.255
                                              00 00 00 00  00 04 00 00                            ........                       33.1.16
  15.1                             16  IN     55 33 56 43  00 00 03 08  04 00 98 15  00 00 04 00  U3VC............  517us        34.1.0        10:00:49.257
  15.1                             24  OUT    55 33 56 43  00 40 02 08  0c 00 99 15  1c 00 02 00  U3VC.@..........  123us        35.1.0        10:00:49.257
                                              00 00 00 00  00 dc 00 00                            ........                       35.1.16
  15.1                             16  IN     55 33 56 43  00 00 03 08  04 00 99 15  00 00 04 00  U3VC............  508us        36.1.0        10:00:49.257
  15.1                             24  OUT    55 33 56 43  00 40 02 08  0c 00 9a 15  20 00 02 00  U3VC.@...... ...  138us        37.1.0        10:00:49.257
                                              00 00 00 00  02 00 00 00                            ........                       37.1.16
  15.1                             16  IN     55 33 56 43  00 00 03 08  04 00 9a 15  00 00 04 00  U3VC............  476us        38.1.0        10:00:49.258
  15.1                             24  OUT    55 33 56 43  00 40 02 08  0c 00 9b 15  24 00 02 00  U3VC.@......$...  109us        39.1.0        10:00:49.258
                                              00 00 00 00  00 78 00 00                            .....x..                       39.1.16
  15.1                             16  IN     55 33 56 43  00 00 03 08  04 00 9b 15  00 00 04 00  U3VC............  516us        40.1.0        10:00:49.258
  15.1                             24  OUT    55 33 56 43  00 40 02 08  0c 00 9c 15  28 00 02 00  U3VC.@......(...  113us        41.1.0        10:00:49.258
                                              00 00 00 00  00 04 00 00                            ........                       41.1.16
  15.1                             16  IN     55 33 56 43  00 00 03 08  04 00 9c 15  00 00 04 00  U3VC............  497us        42.1.0        10:00:49.259
  15.1                             24  OUT    55 33 56 43  00 40 02 08  0c 00 9d 15  2c 00 02 00  U3VC.@......,...  104us        43.1.0        10:00:49.259
                                              00 00 00 00  00 04 00 00                            ........                       43.1.16
  15.1                             16  IN     55 33 56 43  00 00 03 08  04 00 9d 15  00 00 04 00  U3VC............  487us        44.1.0        10:00:49.259
  15.1                             24  OUT    55 33 56 43  00 40 02 08  0c 00 9e 15  04 00 02 00  U3VC.@..........  107us        45.1.0        10:00:49.259
                                              00 00 00 00  01 00 00 00                            ........                       45.1.16
  15.1                             16  IN     55 33 56 43  00 00 03 08  04 00 9e 15  00 00 04 00  U3VC............  2.8ms        46.1.0        10:00:49.262
  15.1                             24  OUT    55 33 56 43  00 40 02 08  0c 00 9f 15  04 00 80 00  U3VC.@..........  1.0ms        47.1.0        10:00:49.263
                                              00 00 00 00  01 00 00 00                            ........                       47.1.16
  15.1                             16  IN     55 33 56 43  00 00 03 08  04 00 9f 15  00 00 04 00  U3VC............  1.6ms        48.1.0        10:00:49.265
  15.3                             52  IN     55 33 56 4c  00 00 34 00  00 00 00 00  00 00 00 00  U3VL..4.........   14us        49.1.0        10:00:49.265
                                              00 00 01 40  4c ce b3 12  0b 00 00 00  09 00 08 01  ...@L...........               49.1.16
                                              a8 00 00 00  5a 03 00 00  00 00 00 00  00 00 00 00  ....Z...........               49.1.32
                                              00 00 00 00                                         ....                           49.1.48
  15.3                          56320  IN     00 00 00 00  00 00 00 00  00 00 00 00  00 00 00 00  ................   13ms        50.1.0        10:00:49.278
                                              00 00 00 00  00 00 00 00  00 00 00 00  00 00 00 00  ................               50.1.16
                                              00 00 00 00  00 00 00 00  00 00 00 01  00 00 00 00  ................               50.1.32
                                              00 00 00 00  00 00 00 01  00 00 00 00  00 00 00 00  ................               50.1.48
  15.3                          56320  IN     00 00 00 00  00 00 00 00  00 00 00 00  00 00 00 00  ................   13ms        51.1.0(3)     10:00:49.292
                                              00 00 00 00  00 00 00 00  00 00 00 00  00 00 00 00  ................               51.1.16
                                              00 00 00 00  00 00 00 00  00 00 00 00  00 00 00 00  ................               51.1.32
                                              00 00 00 00  00 00 00 00  00 00 00 00  00 00 00 00  ................               51.1.48
  15.3                             36  IN     55 33 56 54  00 00 24 00  00 00 00 00  00 00 00 00  U3VT..$.........  2.6ms        54.1.0        10:00:49.294
                                              00 00 00 00  38 33 02 00  00 00 00 00  5a 03 00 00  ....83......Z...               54.1.16
                                              09 00 00 00                                         ....                           54.1.32
  15.3                             52  IN     55 33 56 4c  00 00 34 00  01 00 00 00  00 00 00 00  U3VL..4.........  948us        55.1.0        10:00:49.295
                                              00 00 01 40  fb 0f 80 14  0b 00 00 00  09 00 08 01  ...@............               55.1.16
                                              a8 00 00 00  5a 03 00 00  00 00 00 00  00 00 00 00  ....Z...........               55.1.32
                                              00 00 00 00                                         ....                           55.1.48
  15.3                          56320  IN     00 00 00 00  00 00 00 00  00 00 00 00  00 00 00 00  ................   13ms        56.1.0(2)     10:00:49.308
                                              00 00 00 00  00 00 00 00  00 00 00 00  00 00 00 00  ................               56.1.16
                                              00 00 00 00  00 00 00 00  00 00 00 00  00 00 00 00  ................               56.1.32
                                              00 00 00 00  00 00 00 00  00 00 00 00  00 00 00 00  ................               56.1.48
  15.3                          30720  IN     00 00 00 00  00 00 00 00  00 00 00 00  00 00 00 00  ................   15ms        58.1.0        10:00:49.324
                                              00 00 00 00  00 00 00 00  00 00 00 00  00 00 00 00  ................               58.1.16
                                              00 00 00 01  00 00 00 00  00 00 00 00  00 00 00 00  ................               58.1.32
                                              00 00 00 00  00 00 00 00  00 00 00 00  00 00 00 00  ................               58.1.48
  15.3                            824  IN     00 00 00 00  00 00 00 00  00 00 00 00  00 00 00 00  ................   15us        59.1.0        10:00:49.324
                                              00 00 00 00  00 00 00 00  00 00 00 00  00 00 00 00  ................               59.1.16
                                              00 00 00 00  00 00 00 00  00 00 00 00  00 00 00 00  ................               59.1.32
                                              00 00 00 00  00 00 00 00  00 00 00 00  00 00 00 00  ................               59.1.48
  15.3                             36  IN     55 33 56 54  00 00 24 00  01 00 00 00  00 00 00 00  U3VT..$.........   11us        60.1.0        10:00:49.324
                                              00 00 00 00  38 33 02 00  00 00 00 00  5a 03 00 00  ....83......Z...               60.1.16
                                              09 00 00 00                                         ....                           60.1.32
  15.3                             52  IN     55 33 56 4c  00 00 34 00  02 00 00 00  00 00 00 00  U3VL..4.........  995us        61.1.0        10:00:49.325
                                              00 00 01 40  aa 51 4c 16  0b 00 00 00  09 00 08 01  ...@.QL.........               61.1.16
                                              a8 00 00 00  5a 03 00 00  00 00 00 00  00 00 00 00  ....Z...........               61.1.32
                                              00 00 00 00                                         ....                           61.1.48
  15.3                          56320  IN     00 00 00 00  00 00 00 00  00 00 00 00  00 00 00 00  ................   13ms        62.1.0        10:00:49.339
                                              00 00 00 00  00 00 00 00  00 00 00 00  00 00 00 00  ................               62.1.16
                                              00 00 00 00  00 00 00 00  00 00 00 00  00 00 00 00  ................               62.1.32
                                              00 00 00 00  00 00 00 00  00 00 00 01  00 00 00 00  ................               62.1.48
  15.3                          56320  IN     00 00 00 00  00 00 00 00  00 00 00 00  00 00 00 00  ................   13ms        63.1.0        10:00:49.352
                                              00 00 00 00  00 00 00 00  00 00 00 00  00 00 00 00  ................               63.1.16
                                              00 00 00 00  00 00 00 00  00 00 00 00  00 00 00 00  ................               63.1.32
                                              00 00 00 00  00 00 00 00  00 00 00 00  00 00 00 00  ................               63.1.48
  15.3                          30720  IN     00 00 00 00  00 00 00 00  00 00 00 00  00 00 00 00  ................  2.5ms        64.1.0        10:00:49.354
                                              00 00 00 00  00 00 00 00  00 00 00 00  00 00 00 00  ................               64.1.16
                                              00 01 00 00  00 00 00 00  00 00 00 00  00 00 00 00  ................               64.1.32
                                              00 00 00 00  00 00 00 00  00 00 00 00  00 00 00 00  ................               64.1.48
  15.3                            824  IN     00 00 00 00  00 00 00 00  00 00 00 00  00 00 00 00  ................   17us        65.1.0        10:00:49.354
                                              00 00 00 00  00 00 00 00  00 00 00 00  00 00 00 00  ................               65.1.16
                                              00 00 00 00  00 00 00 00  00 00 00 00  00 00 00 00  ................               65.1.32
                                              00 00 00 00  00 00 00 00  00 00 00 00  00 00 00 00  ................               65.1.48
  15.3                             36  IN     55 33 56 54  00 00 24 00  02 00 00 00  00 00 00 00  U3VT..$.........   11us        66.1.0        10:00:49.354
                                              00 00 00 00  38 33 02 00  00 00 00 00  5a 03 00 00  ....83......Z...               66.1.16
                                              09 00 00 00                                         ....                           66.1.32
  15.3                             52  IN     55 33 56 4c  00 00 34 00  03 00 00 00  00 00 00 00  U3VL..4.........  945us        67.1.0        10:00:49.355
                                              00 00 01 40  59 93 18 18  0b 00 00 00  09 00 08 01  ...@Y...........               67.1.16
                                              a8 00 00 00  5a 03 00 00  00 00 00 00  00 00 00 00  ....Z...........               67.1.32
                                              00 00 00 00                                         ....                           67.1.48
  15.3                          56320  IN     00 00 00 00  00 00 00 00  00 00 00 00  00 00 00 00  ................   13ms        68.1.0(3)     10:00:49.369
                                              00 00 00 00  00 00 00 00  00 00 00 00  00 00 00 00  ................               68.1.16
                                              00 00 00 00  00 00 00 00  00 00 00 00  00 00 00 00  ................               68.1.32
                                              00 00 00 00  00 00 00 00  00 00 00 00  00 00 00 00  ................               68.1.48
  15.3                            824  IN     00 00 00 00  00 00 00 00  00 00 00 00  00 00 00 00  ................   15ms        71.1.0        10:00:49.384
                                              00 00 00 00  00 00 00 00  00 00 00 00  00 00 00 00  ................               71.1.16
                                              00 00 00 00  00 00 00 00  00 00 00 00  00 00 01 00  ................               71.1.32
                                              00 00 00 00  00 00 00 00  00 00 00 00  00 00 00 00  ................               71.1.48
  15.3                             36  IN     55 33 56 54  00 00 24 00  03 00 00 00  00 00 00 00  U3VT..$.........   14us        72.1.0        10:00:49.384
                                              00 00 00 00  38 33 02 00  00 00 00 00  5a 03 00 00  ....83......Z...               72.1.16
                                              09 00 00 00                                         ....                           72.1.32
  15.3                             52  IN     55 33 56 4c  00 00 34 00  04 00 00 00  00 00 00 00  U3VL..4.........  967us        73.1.0        10:00:49.385
                                              00 00 01 40  08 d5 e4 19  0b 00 00 00  09 00 08 01  ...@............               73.1.16
                                              a8 00 00 00  5a 03 00 00  00 00 00 00  00 00 00 00  ....Z...........               73.1.32
                                              00 00 00 00                                         ....                           73.1.48
  15.3                          56320  IN     00 00 00 00  00 00 00 00  00 00 00 00  00 00 00 00  ................   13ms        74.1.0        10:00:49.399
                                              00 00 00 00  00 00 00 00  00 00 00 00  00 00 00 00  ................               74.1.16
                                              00 00 00 00  00 00 00 00  00 00 00 00  00 01 00 00  ................               74.1.32
                                              00 00 00 00  00 00 00 00  00 00 00 00  00 00 00 00  ................               74.1.48
  15.3                          56320  IN     00 00 00 00  00 00 00 00  01 00 00 00  00 00 00 00  ................   13ms        75.1.0        10:00:49.412
                                              00 00 00 00  00 00 00 00  00 00 00 00  00 00 00 00  ................               75.1.16
                                              00 00 00 00  00 00 00 00  00 00 00 00  00 00 00 00  ................               75.1.32
                                              00 00 00 00  00 00 00 00  00 00 00 00  00 00 00 00  ................               75.1.48
  15.3                          30720  IN     00 00 00 00  00 00 00 00  00 00 00 00  00 00 00 00  ................  2.5ms        76.1.0(2)     10:00:49.415
                                              00 00 00 00  00 00 00 00  00 00 00 00  00 00 00 00  ................               76.1.16
                                              00 00 00 00  00 00 00 00  00 00 00 00  00 00 00 00  ................               76.1.32
                                              00 00 00 00  00 00 00 00  00 00 00 00  00 00 00 00  ................               76.1.48
  15.3                             36  IN     55 33 56 54  00 00 24 00  04 00 00 00  00 00 00 00  U3VT..$.........   35us        78.1.0        10:00:49.415
                                              00 00 00 00  38 33 02 00  00 00 00 00  5a 03 00 00  ....83......Z...               78.1.16
                                              09 00 00 00                                         ....                           78.1.32
  15.1                             24  OUT    55 33 56 43  00 40 02 08  0c 00 a0 15  04 00 80 00  U3VC.@..........  243us        79.1.0        10:00:49.415
                                              00 00 00 00  00 00 00 00                            ........                       79.1.16
  15.1                             16  IN     55 33 56 43  00 00 03 08  04 00 a0 15  00 00 04 00  U3VC............  774us        80.1.0        10:00:49.415
  15.1                             24  OUT    55 33 56 43  00 40 00 08  0c 00 a1 15  08 00 02 00  U3VC.@..........  382us        81.1.0        10:00:49.417
                                              00 00 00 00  00 00 04 00                            ........                       81.1.16
  15.1                             16  IN     55 33 56 43  00 00 01 08  04 00 a1 15  38 33 02 00  U3VC........83..  794us        82.1.0        10:00:49.417
  15.1                             24  OUT    55 33 56 43  00 40 02 08  0c 00 a2 15  04 00 02 00  U3VC.@..........  2.3ms        83.1.0        10:00:49.419
                                              00 00 00 00  00 00 00 00                            ........                       83.1.16
  15.1                             16  IN     55 33 56 43  00 00 03 08  04 00 a2 15  00 00 04 00  U3VC............  9.5ms        84.1.0        10:00:49.429
  15.1                             24  OUT    55 33 56 43  00 40 00 08  0c 00 a3 15  d8 01 00 00  U3VC.@..........  820us        85.1.0        10:00:49.430
                                              00 00 00 00  00 00 08 00                            ........                       85.1.16
  15.1                             20  IN     55 33 56 43  00 00 01 08  08 00 a3 15  00 00 01 00  U3VC............  696us        86.1.0        10:00:49.430
                                              00 00 00 00                                         ....                           86.1.16
  15.1                             24  OUT    55 33 56 43  00 40 00 08  0c 00 a4 15  04 00 01 00  U3VC.@..........  719us        87.1.0        10:00:49.432
                                              00 00 00 00  00 00 08 00                            ........                       87.1.16
  15.1                             20  IN     55 33 56 43  00 00 01 08  08 00 a4 15  03 00 00 00  U3VC............  682us        88.1.0        10:00:49.432
                                              00 00 00 00                                         ....                           88.1.16
  15.1                             24  OUT    55 33 56 43  00 40 00 08  0c 00 a5 15  20 00 01 00  U3VC.@...... ...  104us        89.1.0        10:00:49.432
                                              00 00 00 00  00 00 08 00                            ........                       89.1.16
  15.1                             20  IN     55 33 56 43  00 00 01 08  08 00 a5 15  00 00 02 00  U3VC............  686us        90.1.0        10:00:49.433
                                              00 00 00 00                                         ....                           90.1.16
  15.1                             24  OUT    55 33 56 43  00 40 00 08  0c 00 a6 15  04 00 01 00  U3VC.@..........  617us        91.1.0        10:00:49.433
                                              00 00 00 00  00 00 08 00                            ........                       91.1.16
  15.1                             20  IN     55 33 56 43  00 00 01 08  08 00 a6 15  03 00 00 00  U3VC............  681us        92.1.0        10:00:49.434
                                              00 00 00 00                                         ....                           92.1.16
  15.1                             24  OUT    55 33 56 43  00 40 00 08  0c 00 a7 15  2c 00 01 00  U3VC.@......,...  101us        93.1.0        10:00:49.434
                                              00 00 00 00  00 00 08 00                            ........                       93.1.16
  15.1                             20  IN     55 33 56 43  00 00 01 08  08 00 a7 15  00 10 02 00  U3VC............  681us        94.1.0        10:00:49.434
                                              00 00 00 00                                         ....                           94.1.16
  15.1                             24  OUT    55 33 56 43  00 40 02 08  0c 00 a8 15  08 00 90 00  U3VC.@..........  747us        95.1.0        10:00:49.435
                                              00 00 00 00  7c 02 00 00                            ........                       95.1.16
  15.1                             16  IN     55 33 56 43  00 00 03 08  04 00 a8 15  00 00 04 00  U3VC............  1.8ms        96.1.0        10:00:49.438
  15.1                             24  OUT    55 33 56 43  00 40 02 08  0c 00 a9 15  0c 00 90 00  U3VC.@..........  170us        97.1.0        10:00:49.438
                                              00 00 00 00  66 02 00 00                            ....f...                       97.1.16
  15.1                             16  IN     55 33 56 43  00 00 03 08  04 00 a9 15  00 00 04 00  U3VC............  1.7ms        98.1.0        10:00:49.439
  15.1                             24  OUT    55 33 56 43  00 40 02 08  0c 00 aa 15  00 00 80 00  U3VC.@..........  143us        99.1.0        10:00:49.439
                                              00 00 00 00  02 00 00 00                            ........                       99.1.16
  15.1                             16  IN     55 33 56 43  00 00 03 08  04 00 aa 15  00 00 04 00  U3VC............  484us       100.1.0        10:00:49.440
  15.1                             24  OUT    55 33 56 43  00 40 00 08  0c 00 ab 15  3c 00 90 00  U3VC.@......<...  154us       101.1.0        10:00:49.440
                                              00 00 00 00  00 00 04 00                            ........                      101.1.16
  15.1                             16  IN     55 33 56 43  00 00 01 08  04 00 ab 15  00 00 00 00  U3VC............  717us       102.1.0        10:00:49.440
  15.1                             24  OUT    55 33 56 43  00 40 02 08  0c 00 ac 15  38 00 90 00  U3VC.@......8...  137us       103.1.0        10:00:49.440
                                              00 00 00 00  14 00 00 00                            ........                      103.1.16
  15.1                             16  IN     55 33 56 43  00 00 03 08  04 00 ac 15  00 00 04 00  U3VC............  1.0ms       104.1.0        10:00:49.442
  15.1                             24  OUT    55 33 56 43  00 40 00 08  0c 00 ad 15  3c 00 90 00  U3VC.@......<...  132us       105.1.0        10:00:49.442
                                              00 00 00 00  00 00 04 00                            ........                      105.1.16
  15.1                             16  IN     55 33 56 43  00 00 01 08  04 00 ad 15  00 00 00 00  U3VC............  676us       106.1.0        10:00:49.443
  15.1                             24  OUT    55 33 56 43  00 40 00 08  0c 00 ae 15  38 00 90 00  U3VC.@......8...  106us       107.1.0        10:00:49.443
                                              00 00 00 00  00 00 04 00                            ........                      107.1.16
  15.1                             16  IN     55 33 56 43  00 00 01 08  04 00 ae 15  14 00 00 00  U3VC............  677us       108.1.0        10:00:49.444
  15.1                             24  OUT    55 33 56 43  00 40 02 08  0c 00 af 15  04 00 02 00  U3VC.@..........  147us       109.1.0        10:00:49.444
                                              00 00 00 00  00 00 00 00                            ........                      109.1.16
  15.1                             16  IN     55 33 56 43  00 00 03 08  04 00 af 15  00 00 04 00  U3VC............  9.5ms       110.1.0        10:00:49.453
  15.1                             24  OUT    55 33 56 43  00 40 00 08  0c 00 b0 15  00 00 02 00  U3VC.@..........  5.2ms       111.1.0        10:00:49.459
                                              00 00 00 00  00 00 04 00                            ........                      111.1.16
  15.1                             16  IN     55 33 56 43  00 00 01 08  04 00 b0 15  00 00 00 0a  U3VC............  677us       112.1.0        10:00:49.459
  15.1                             24  OUT    55 33 56 43  00 40 00 08  0c 00 b1 15  08 00 02 00  U3VC.@..........  124us       113.1.0        10:00:49.459
                                              00 00 00 00  00 00 08 00                            ........                      113.1.16
  15.1                             20  IN     55 33 56 43  00 00 01 08  08 00 b1 15  90 f5 05 00  U3VC............  681us       114.1.0        10:00:49.460
                                              00 00 00 00                                         ....                          114.1.16
  15.1                             24  OUT    55 33 56 43  00 40 00 08  0c 00 b2 15  10 00 02 00  U3VC.@..........  133us       115.1.0        10:00:49.460
                                              00 00 00 00  00 00 04 00                            ........                      115.1.16
  15.1                             16  IN     55 33 56 43  00 00 01 08  04 00 b2 15  34 00 00 00  U3VC........4...  677us       116.1.0        10:00:49.460
  15.1                             24  OUT    55 33 56 43  00 40 00 08  0c 00 b3 15  14 00 02 00  U3VC.@..........  112us       117.1.0        10:00:49.460
                                              00 00 00 00  00 00 04 00                            ........                      117.1.16
  15.1                             16  IN     55 33 56 43  00 00 01 08  04 00 b3 15  24 00 00 00  U3VC........$...  678us       118.1.0        10:00:49.462
  15.1                             24  OUT    55 33 56 43  00 40 02 08  0c 00 b4 15  18 00 02 00  U3VC.@..........  116us       119.1.0        10:00:49.462
                                              00 00 00 00  00 04 00 00                            ........                      119.1.16
  15.1                             16  IN     55 33 56 43  00 00 03 08  04 00 b4 15  00 00 04 00  U3VC............  477us       120.1.0        10:00:49.462
  15.1                             24  OUT    55 33 56 43  00 40 02 08  0c 00 b5 15  1c 00 02 00  U3VC.@..........  146us       121.1.0        10:00:49.463
                                              00 00 00 00  00 5c 00 00                            .....\..                      121.1.16
  15.1                             16  IN     55 33 56 43  00 00 03 08  04 00 b5 15  00 00 04 00  U3VC............  527us       122.1.0        10:00:49.463
  15.1                             24  OUT    55 33 56 43  00 40 02 08  0c 00 b6 15  20 00 02 00  U3VC.@...... ...  103us       123.1.0        10:00:49.463
                                              00 00 00 00  10 00 00 00                            ........                      123.1.16
  15.1                             16  IN     55 33 56 43  00 00 03 08  04 00 b6 15  00 00 04 00  U3VC............  479us       124.1.0        10:00:49.463
  15.1                             24  OUT    55 33 56 43  00 40 02 08  0c 00 b7 15  24 00 02 00  U3VC.@......$...  119us       125.1.0        10:00:49.464
                                              00 00 00 00  00 34 00 00                            .....4..                      125.1.16
  15.1                             16  IN     55 33 56 43  00 00 03 08  04 00 b7 15  00 00 04 00  U3VC............  477us       126.1.0        10:00:49.464
  15.1                             24  OUT    55 33 56 43  00 40 02 08  0c 00 b8 15  28 00 02 00  U3VC.@......(...  135us       127.1.0        10:00:49.464
                                              00 00 00 00  00 04 00 00                            ........                      127.1.16
  15.1                             16  IN     55 33 56 43  00 00 03 08  04 00 b8 15  00 00 04 00  U3VC............  482us       128.1.0        10:00:49.464
  15.1                             24  OUT    55 33 56 43  00 40 02 08  0c 00 b9 15  2c 00 02 00  U3VC.@......,...  115us       129.1.0        10:00:49.465
                                              00 00 00 00  00 04 00 00                            ........                      129.1.16
  15.1                             16  IN     55 33 56 43  00 00 03 08  04 00 b9 15  00 00 04 00  U3VC............  502us       130.1.0        10:00:49.465
  15.1                             24  OUT    55 33 56 43  00 40 02 08  0c 00 ba 15  04 00 02 00  U3VC.@..........  112us       131.1.0        10:00:49.465
                                              00 00 00 00  01 00 00 00                            ........                      131.1.16
  15.1                             16  IN     55 33 56 43  00 00 03 08  04 00 ba 15  00 00 04 00  U3VC............  2.7ms       132.1.0        10:00:49.468
  15.1                             24  OUT    55 33 56 43  00 40 02 08  0c 00 bb 15  04 00 80 00  U3VC.@..........  2.6ms       133.1.0        10:00:49.470
                                              00 00 00 00  01 00 00 00                            ........                      133.1.16
  15.3                             52  IN     55 33 56 4c  00 00 34 00  00 00 00 00  00 00 00 00  U3VL..4.........  1.6ms       134.1.0        10:00:49.473
                                              00 00 01 40  df ad 11 1f  0b 00 00 00  09 00 08 01  ...@............              134.1.16
                                              7c 02 00 00  66 02 00 00  00 00 00 00  00 00 00 00  ....f...........              134.1.32
                                              00 00 00 00                                         ....                          134.1.48
  15.1                             16  IN     55 33 56 43  00 00 03 08  04 00 bb 15  00 00 04 00  U3VC............   38us       135.1.0        10:00:49.473
  15.3                          23552  IN     00 00 00 00  00 00 00 00  00 00 00 00  00 00 00 00  ................  1.8ms       136.1.0        10:00:49.474
                                              00 00 00 00  00 00 00 00  00 00 00 00  00 00 00 00  ................              136.1.16
                                              00 00 00 00  00 00 00 00  00 00 00 00  00 00 00 00  ................              136.1.32
                                              00 00 00 00  00 00 00 00  00 00 00 00  00 00 00 00  ................              136.1.48
  15.3                          23552  IN     00 00 00 00  00 00 00 00  00 00 00 00  00 00 00 00  ................  1.6ms       137.1.0        10:00:49.475
                                              00 00 00 00  00 00 00 00  00 00 00 00  00 00 00 00  ................              137.1.16
                                              00 00 00 00  00 00 00 00  00 00 01 00  00 00 01 00  ................              137.1.32
                                              00 00 00 00  00 00 00 00  00 00 00 00  00 00 00 00  ................              137.1.48
  15.3                          23552  IN     00 00 00 00  00 00 00 00  00 00 00 00  00 00 00 00  ................  1.7ms       138.1.0        10:00:49.478
                                              00 00 00 00  00 00 00 00  00 00 00 00  00 00 00 00  ................              138.1.16
                                              00 00 00 00  00 00 00 00  00 00 00 00  00 00 00 00  ................              138.1.32
                                              00 00 00 00  00 00 00 00  00 00 00 00  00 00 00 00  ................              138.1.48
  15.3                          23552  IN     00 00 00 00  00 00 00 00  00 00 00 00  00 00 00 00  ................   42us       139.1.0        10:00:49.478
                                              00 00 00 00  00 00 00 00  01 00 00 00  00 00 00 00  ................              139.1.16
                                              00 00 00 00  00 00 00 00  00 00 00 00  00 00 00 00  ................              139.1.32
                                              00 00 00 00  00 00 00 00  00 00 00 00  00 00 00 00  ................              139.1.48
  15.3                          23552  IN     00 00 00 00  00 00 00 00  00 00 00 00  00 00 00 00  ................  1.7ms       140.1.0        10:00:49.479
                                              00 00 00 00  00 00 00 00  00 00 00 00  00 00 00 00  ................              140.1.16
                                              00 00 00 00  00 00 00 00  00 00 00 00  00 00 00 00  ................              140.1.32
                                              00 00 00 00  00 00 00 00  00 00 00 00  00 00 00 00  ................              140.1.48
  15.3                          23552  IN     00 00 00 00  00 00 00 00  00 00 00 00  00 00 01 00  ................  1.7ms       141.1.0        10:00:49.482
                                              00 00 00 00  00 00 00 00  00 00 00 00  00 00 00 00  ................              141.1.16
                                              00 00 00 00  00 00 00 00  00 00 00 00  00 00 00 00  ................              141.1.32
                                              00 00 00 00  00 00 00 00  00 00 00 00  00 00 00 00  ................              141.1.48
  15.3                          23552  IN     00 00 00 00  00 00 00 00  00 00 00 00  00 00 00 00  ................  1.6ms       142.1.0        10:00:49.483
                                              00 00 00 00  00 00 00 00  00 00 00 00  00 00 00 00  ................              142.1.16
                                              00 00 00 00  00 00 00 00  00 00 00 00  00 00 00 00  ................              142.1.32
                                              00 00 00 00  00 00 00 00  00 00 00 00  00 00 00 00  ................              142.1.48
  15.3                          23552  IN     00 00 00 00  00 00 00 00  00 00 00 00  00 00 00 00  ................   86us       143.1.0        10:00:49.483
                                              00 00 00 00  00 00 00 00  00 00 00 00  00 00 00 00  ................              143.1.16
                                              00 00 00 00  00 00 00 01  00 00 00 00  00 00 00 00  ................              143.1.32
                                              00 00 00 00  00 00 00 00  00 00 00 00  00 00 00 00  ................              143.1.48
  15.3                          23552  IN     00 00 00 00  00 00 00 00  00 00 00 00  00 00 00 00  ................  1.7ms       144.1.0        10:00:49.484
                                              00 01 00 00  00 00 00 00  00 00 00 00  00 00 00 00  ................              144.1.16
                                              00 00 00 00  00 00 00 00  00 00 00 00  00 00 00 00  ................              144.1.32
                                              00 00 00 00  00 00 00 00  00 00 00 00  00 00 00 00  ................              144.1.48
  15.3                          23552  IN     00 00 00 00  00 00 00 00  00 00 00 00  00 00 00 00  ................  1.7ms       145.1.0(2)     10:00:49.487
                                              00 00 00 00  00 00 00 00  00 00 00 00  00 00 00 00  ................              145.1.16
                                              00 00 00 00  00 00 00 00  00 00 00 00  00 00 00 00  ................              145.1.32
                                              00 00 00 00  00 00 00 00  00 00 00 00  00 00 00 00  ................              145.1.48
  15.3                          23552  IN     00 00 00 00  00 00 00 00  00 00 00 00  00 00 00 00  ................  1.8ms       147.1.0        10:00:49.488
                                              00 00 00 00  00 00 00 00  00 00 00 00  00 00 00 00  ................              147.1.16
                                              00 00 00 00  00 00 00 00  00 00 00 00  00 00 00 00  ................              147.1.32
                                              00 00 00 00  00 00 01 00  00 00 00 00  01 00 00 00  ................              147.1.48
  15.3                          23552  IN     00 00 00 00  00 00 00 00  00 00 00 00  00 00 00 00  ................  1.6ms       148.1.0        10:00:49.490
                                              00 00 00 00  00 00 00 00  00 00 00 00  00 00 00 00  ................              148.1.16
                                              00 00 00 00  00 00 00 00  00 00 00 00  00 00 00 00  ................              148.1.32
                                              00 00 00 00  00 00 00 00  00 00 00 01  00 00 00 00  ................              148.1.48
  15.3                          23552  IN     00 00 00 00  00 00 00 00  00 00 00 00  00 00 00 00  ................  1.7ms       149.1.0(2)     10:00:49.492
                                              00 00 00 00  00 00 00 00  00 00 00 00  00 00 00 00  ................              149.1.16
                                              00 00 00 00  00 00 00 00  00 00 00 00  00 00 00 00  ................              149.1.32
                                              00 00 00 00  00 00 00 00  00 00 00 00  00 00 00 00  ................              149.1.48
  15.3                          23552  IN     00 00 00 00  00 00 00 00  01 00 00 00  00 00 00 00  ................  1.6ms       151.1.0        10:00:49.493
                                              00 00 00 00  00 00 00 00  00 00 00 00  00 00 00 00  ................              151.1.16
                                              00 00 00 00  00 00 00 00  00 00 00 00  00 00 00 00  ................              151.1.32
                                              00 00 00 00  00 00 00 00  00 00 00 00  00 00 00 00  ................              151.1.48
  15.3                          13312  IN     00 00 00 00  00 00 00 00  00 00 00 00  00 00 00 01  ................   26us       152.1.0        10:00:49.493
                                              00 00 00 00  00 00 00 00  00 00 00 00  00 00 00 00  ................              152.1.16
                                              00 00 00 00  00 00 00 00  00 00 00 00  00 00 00 00  ................              152.1.32
                                              00 00 00 00  00 00 00 00  00 00 00 00  00 00 00 00  ................              152.1.48
  15.3                            400  IN     00 00 00 00  00 00 00 00  00 00 00 00  00 00 00 00  ................   14us       153.1.0        10:00:49.493
                                              00 00 00 00  00 00 00 00  00 00 00 00  00 00 00 00  ................              153.1.16
                                              00 00 00 00  00 00 00 00  00 00 00 00  00 00 00 00  ................              153.1.32
                                              00 00 00 00  00 00 00 00  00 00 00 00  00 00 00 00  ................              153.1.48
  15.3                             36  IN     55 33 56 54  00 00 24 00  00 00 00 00  00 00 00 00  U3VT..$.........   14us       154.1.0        10:00:49.493
                                              00 00 00 00  90 f5 05 00  00 00 00 00  66 02 00 00  ............f...              154.1.16
                                              09 00 00 00                                         ....                          154.1.32
  15.3                             52  IN     55 33 56 4c  00 00 34 00  01 00 00 00  00 00 00 00  U3VL..4.........  1.8ms       155.1.0        10:00:49.495
                                              00 00 01 40  92 c4 6e 20  0b 00 00 00  09 00 08 01  ...@..n ........              155.1.16
                                              7c 02 00 00  66 02 00 00  00 00 00 00  00 00 00 00  ....f...........              155.1.32
                                              00 00 00 00                                         ....                          155.1.48
  15.3                          23552  IN     00 00 00 00  00 00 00 00  00 00 00 00  00 00 00 00  ................  1.8ms       156.1.0(18)    10:00:49.497
                                              00 00 00 00  00 00 00 00  00 00 00 00  00 00 00 00  ................              156.1.16
                                              00 00 00 00  00 00 00 00  00 00 00 00  00 00 00 00  ................              156.1.32
                                              00 00 00 00  00 00 00 00  00 00 00 00  00 00 00 00  ................              156.1.48
  15.3                             36  IN     55 33 56 54  00 00 24 00  01 00 00 00  00 00 00 00  U3VT..$.........   19ms       174.1.0        10:00:49.517
                                              00 00 00 00  90 f5 05 00  00 00 00 00  66 02 00 00  ............f...              174.1.16
                                              09 00 00 00                                         ....                          174.1.32
  15.3                             52  IN     55 33 56 4c  00 00 34 00  02 00 00 00  00 00 00 00  U3VL..4.........  1.9ms       175.1.0        10:00:49.518
                                              00 00 01 40  45 db cb 21  0b 00 00 00  09 00 08 01  ...@E..!........              175.1.16
                                              7c 02 00 00  66 02 00 00  00 00 00 00  00 00 00 00  ....f...........              175.1.32
                                              00 00 00 00                                         ....                          175.1.48
  15.3                          23552  IN     00 00 00 00  00 00 00 00  00 00 00 00  00 00 00 00  ................  1.7ms       176.1.0(10)    10:00:49.520
                                              00 00 00 00  00 00 00 00  00 00 00 00  00 00 00 00  ................              176.1.16
                                              00 00 00 00  00 00 00 00  00 00 00 00  00 00 00 00  ................              176.1.32
                                              00 00 00 00  00 00 00 00  00 00 00 00  00 00 00 00  ................              176.1.48
  15.3                          23552  IN     00 00 00 00  00 00 00 00  00 00 00 00  00 00 00 00  ................   12ms       186.1.0        10:00:49.533
                                              00 00 00 00  00 00 00 00  00 00 00 00  00 00 00 00  ................              186.1.16
                                              00 00 00 00  00 00 00 00  00 00 00 00  00 00 00 00  ................              186.1.32
                                              00 01 00 00  00 00 00 00  00 00 00 00  00 00 00 00  ................              186.1.48
  15.3                          23552  IN     00 00 00 00  00 00 00 00  00 00 00 00  00 00 00 00  ................  1.7ms       187.1.0(7)     10:00:49.534
                                              00 00 00 00  00 00 00 00  00 00 00 00  00 00 00 00  ................              187.1.16
                                              00 00 00 00  00 00 00 00  00 00 00 00  00 00 00 00  ................              187.1.32
                                              00 00 00 00  00 00 00 00  00 00 00 00  00 00 00 00  ................              187.1.48
  15.3                             36  IN     55 33 56 54  00 00 24 00  02 00 00 00  00 00 00 00  U3VT..$.........  5.1ms       194.1.0        10:00:49.539
                                              00 00 00 00  90 f5 05 00  00 00 00 00  66 02 00 00  ............f...              194.1.16
                                              09 00 00 00                                         ....                          194.1.32
  15.3                             52  IN     55 33 56 4c  00 00 34 00  03 00 00 00  00 00 00 00  U3VL..4.........  1.8ms       195.1.0        10:00:49.540
                                              00 00 01 40  df f1 28 23  0b 00 00 00  09 00 08 01  ...@..(#........              195.1.16
                                              7c 02 00 00  66 02 00 00  00 00 00 00  00 00 00 00  ....f...........              195.1.32
                                              00 00 00 00                                         ....                          195.1.48
  15.3                          23552  IN     00 00 00 00  00 00 00 00  00 00 00 00  00 00 00 00  ................  1.8ms       196.1.0(3)     10:00:49.543
                                              00 00 00 00  00 00 00 00  00 00 00 00  00 00 00 00  ................              196.1.16
                                              00 00 00 00  00 00 00 00  00 00 00 00  00 00 00 00  ................              196.1.32
                                              00 00 00 00  00 00 00 00  00 00 00 00  00 00 00 00  ................              196.1.48
  15.3                          23552  IN     00 00 00 00  00 00 01 00  00 00 00 00  00 00 00 00  ................  3.4ms       199.1.0        10:00:49.547
                                              00 00 00 00  00 00 00 00  00 00 00 00  00 00 00 00  ................              199.1.16
                                              00 00 00 00  00 00 00 00  00 00 00 00  00 00 00 00  ................              199.1.32
                                              00 00 00 00  00 00 00 00  00 00 00 00  00 00 00 00  ................              199.1.48
  15.3                          23552  IN     00 00 00 00  00 00 00 00  00 00 00 00  00 00 00 00  ................  1.7ms       200.1.0(2)     10:00:49.548
                                              00 00 00 00  00 00 00 00  00 00 00 00  00 00 00 00  ................              200.1.16
                                              00 00 00 00  00 00 00 00  00 00 00 00  00 00 00 00  ................              200.1.32
                                              00 00 00 00  00 00 00 00  00 00 00 00  00 00 00 00  ................              200.1.48
  15.3                          23552  IN     00 00 00 00  00 00 00 00  00 00 00 00  00 00 00 00  ................  3.4ms       202.1.0        10:00:49.552
                                              00 00 00 00  00 00 00 00  00 00 00 00  00 00 00 00  ................              202.1.16
                                              00 01 00 00  00 00 00 00  00 00 00 00  00 00 00 00  ................              202.1.32
                                              00 00 00 00  00 00 00 00  00 00 00 00  00 00 00 00  ................              202.1.48
  15.3                          23552  IN     00 00 00 00  00 00 00 00  00 00 00 00  00 00 00 00  ................   77us       203.1.0(2)     10:00:49.552
                                              00 00 00 00  00 00 00 00  00 00 00 00  00 00 00 00  ................              203.1.16
                                              00 00 00 00  00 00 00 00  00 00 00 00  00 00 00 00  ................              203.1.32
                                              00 00 00 00  00 00 00 00  00 00 00 00  00 00 00 00  ................              203.1.48
  15.3                          23552  IN     00 00 00 00  00 00 00 00  00 00 00 00  00 00 00 00  ................  3.4ms       205.1.0        10:00:49.555
                                              00 00 00 00  00 00 00 00  00 00 00 00  01 00 00 00  ................              205.1.16
                                              00 00 00 00  00 00 00 00  00 00 00 00  00 00 00 00  ................              205.1.32
                                              00 00 00 00  00 00 00 00  00 00 00 00  00 00 00 00  ................              205.1.48
  15.3                          23552  IN     00 00 00 00  00 00 00 00  00 00 00 00  00 00 00 00  ................   69us       206.1.0(6)     10:00:49.555
                                              00 00 00 00  00 00 00 00  00 00 00 00  00 00 00 00  ................              206.1.16
                                              00 00 00 00  00 00 00 00  00 00 00 00  00 00 00 00  ................              206.1.32
                                              00 00 00 00  00 00 00 00  00 00 00 00  00 00 00 00  ................              206.1.48
  15.3                          13312  IN     00 00 00 00  00 00 00 00  00 00 00 00  00 00 00 00  ................  6.8ms       212.1.0        10:00:49.562
                                              00 00 00 00  00 00 00 00  00 00 00 00  00 00 00 00  ................              212.1.16
                                              00 00 00 00  00 00 00 00  01 00 00 00  00 00 00 00  ................              212.1.32
                                              00 00 00 00  00 00 00 00  00 00 00 00  00 00 00 00  ................              212.1.48
  15.3                            400  IN     00 00 00 00  00 00 00 00  00 00 00 00  00 00 00 00  ................   13us       213.1.0        10:00:49.562
                                              00 00 00 00  00 00 00 00  00 00 00 00  00 00 00 00  ................              213.1.16
                                              00 00 00 00  00 00 00 00  00 00 00 00  00 00 00 00  ................              213.1.32
                                              00 00 00 00  00 00 00 00  00 00 00 00  00 00 00 00  ................              213.1.48
  15.3                             36  IN     55 33 56 54  00 00 24 00  03 00 00 00  00 00 00 00  U3VT..$.........   13us       214.1.0        10:00:49.562
                                              00 00 00 00  90 f5 05 00  00 00 00 00  66 02 00 00  ............f...              214.1.16
                                              09 00 00 00                                         ....                          214.1.32
  15.3                             52  IN     55 33 56 4c  00 00 34 00  04 00 00 00  00 00 00 00  U3VL..4.........  1.9ms       215.1.0        10:00:49.564
                                              00 00 01 40  92 08 86 24  0b 00 00 00  09 00 08 01  ...@...$........              215.1.16
                                              7c 02 00 00  66 02 00 00  00 00 00 00  00 00 00 00  ....f...........              215.1.32
                                              00 00 00 00                                         ....                          215.1.48
  15.3                          23552  IN     00 00 00 00  00 00 00 00  00 00 00 00  00 00 00 00  ................  1.7ms       216.1.0(3)     10:00:49.565
                                              00 00 00 00  00 00 00 00  00 00 00 00  00 00 00 00  ................              216.1.16
                                              00 00 00 00  00 00 00 00  00 00 00 00  00 00 00 00  ................              216.1.32
                                              00 00 00 00  00 00 00 00  00 00 00 00  00 00 00 00  ................              216.1.48
  15.3                          23552  IN     00 00 00 00  00 00 00 00  00 00 00 00  00 00 00 00  ................  3.5ms       219.1.0        10:00:49.569
                                              00 00 00 00  00 00 00 00  00 00 00 00  00 00 00 00  ................              219.1.16
                                              01 00 00 00  00 00 00 00  00 00 00 00  00 00 00 00  ................              219.1.32
                                              00 00 00 00  00 00 00 00  00 00 00 00  00 00 00 00  ................              219.1.48
  15.3                          23552  IN     00 00 00 00  00 00 00 00  00 00 00 00  00 00 00 00  ................  1.6ms       220.1.0(4)     10:00:49.570
                                              00 00 00 00  00 00 00 00  00 00 00 00  00 00 00 00  ................              220.1.16
                                              00 00 00 00  00 00 00 00  00 00 00 00  00 00 00 00  ................              220.1.32
                                              00 00 00 00  00 00 00 00  00 00 00 00  00 00 00 00  ................              220.1.48
  15.3                          23552  IN     00 00 00 00  00 00 00 00  00 00 00 00  00 00 00 00  ................  5.3ms       224.1.0        10:00:49.577
                                              00 00 00 00  00 00 00 00  00 00 00 00  00 00 00 00  ................              224.1.16
                                              00 00 00 00  00 00 00 00  00 00 00 00  00 00 00 00  ................              224.1.32
                                              00 00 00 00  00 00 00 00  00 00 00 01  00 00 00 00  ................              224.1.48
  15.3                          23552  IN     00 00 00 00  00 00 00 00  00 00 00 00  00 00 00 00  ................  1.7ms       225.1.0(5)     10:00:49.578
                                              00 00 00 00  00 00 00 00  00 00 00 00  00 00 00 00  ................              225.1.16
                                              00 00 00 00  00 00 00 00  00 00 00 00  00 00 00 00  ................              225.1.32
                                              00 00 00 00  00 00 00 00  00 00 00 00  00 00 00 00  ................              225.1.48
  15.3                          23552  IN     00 00 00 00  00 00 00 00  00 00 00 00  00 00 00 00  ................  5.3ms       230.1.0        10:00:49.583
                                              00 00 00 00  00 00 00 00  00 01 00 00  00 00 00 00  ................              230.1.16
                                              00 00 00 00  00 00 00 00  00 00 00 00  00 00 00 00  ................              230.1.32
                                              00 00 00 00  00 00 00 00  00 00 00 00  00 00 00 00  ................              230.1.48
  15.3                          23552  IN     00 00 00 00  00 00 00 00  00 00 00 00  00 00 00 00  ................  1.5ms       231.1.0(3)     10:00:49.585
                                              00 00 00 00  00 00 00 00  00 00 00 00  00 00 00 00  ................              231.1.16
                                              00 00 00 00  00 00 00 00  00 00 00 00  00 00 00 00  ................              231.1.32
                                              00 00 00 00  00 00 00 00  00 00 00 00  00 00 00 00  ................              231.1.48
  15.3                             36  IN     55 33 56 54  00 00 24 00  04 00 00 00  00 00 00 00  U3VT..$.........   47us       234.1.0        10:00:49.585
                                              00 00 00 00  90 f5 05 00  00 00 00 00  66 02 00 00  ............f...              234.1.16
                                              09 00 00 00                                         ....                          234.1.32
  15.1                             24  OUT    55 33 56 43  00 40 02 08  0c 00 bc 15  04 00 80 00  U3VC.@..........  361us       235.1.0        10:00:49.585
                                              00 00 00 00  00 00 00 00                            ........                      235.1.16
  15.1                             16  IN     55 33 56 43  00 00 03 08  04 00 bc 15  00 00 04 00  U3VC............  748us       236.1.0        10:00:49.585
  15.1                             24  OUT    55 33 56 43  00 40 00 08  0c 00 bd 15  08 00 02 00  U3VC.@..........  352us       237.1.0        10:00:49.587
                                              00 00 00 00  00 00 04 00                            ........                      237.1.16
  15.1                             16  IN     55 33 56 43  00 00 01 08  04 00 bd 15  90 f5 05 00  U3VC............  679us       238.1.0        10:00:49.587
  15.1                             24  OUT    55 33 56 43  00 40 02 08  0c 00 be 15  04 00 02 00  U3VC.@..........  2.7ms       239.1.0        10:00:49.590
                                              00 00 00 00  00 00 00 00                            ........                      239.1.16
  15.1                             16  IN     55 33 56 43  00 00 03 08  04 00 be 15  00 00 04 00  U3VC............  9.5ms       240.1.0        10:00:49.599
  15.1                             24  OUT    55 33 56 43  00 40 00 08  0c 00 bf 15  d8 01 00 00  U3VC.@..........  761us       241.1.0        10:00:49.600
                                              00 00 00 00  00 00 08 00                            ........                      241.1.16
  15.1                             20  IN     55 33 56 43  00 00 01 08  08 00 bf 15  00 00 01 00  U3VC............  671us       242.1.0        10:00:49.600
                                              00 00 00 00                                         ....                          242.1.16
  15.1                             24  OUT    55 33 56 43  00 40 00 08  0c 00 c0 15  04 00 01 00  U3VC.@..........  626us       243.1.0        10:00:49.602
                                              00 00 00 00  00 00 08 00                            ........                      243.1.16
  15.1                             20  IN     55 33 56 43  00 00 01 08  08 00 c0 15  03 00 00 00  U3VC............  746us       244.1.0        10:00:49.602
                                              00 00 00 00                                         ....                          244.1.16
  15.1                             24  OUT    55 33 56 43  00 40 00 08  0c 00 c1 15  20 00 01 00  U3VC.@...... ...  104us       245.1.0        10:00:49.602
                                              00 00 00 00  00 00 08 00                            ........                      245.1.16
  15.1                             20  IN     55 33 56 43  00 00 01 08  08 00 c1 15  00 00 02 00  U3VC............  673us       246.1.0        10:00:49.603
                                              00 00 00 00                                         ....                          246.1.16
  15.1                             24  OUT    55 33 56 43  00 40 00 08  0c 00 c2 15  04 00 01 00  U3VC.@..........  655us       247.1.0        10:00:49.604
                                              00 00 00 00  00 00 08 00                            ........                      247.1.16
  15.1                             20  IN     55 33 56 43  00 00 01 08  08 00 c2 15  03 00 00 00  U3VC............  665us       248.1.0        10:00:49.604
                                              00 00 00 00                                         ....                          248.1.16
  15.1                             24  OUT    55 33 56 43  00 40 00 08  0c 00 c3 15  2c 00 01 00  U3VC.@......,...  130us       249.1.0        10:00:49.604
                                              00 00 00 00  00 00 08 00                            ........                      249.1.16
  15.1                             20  IN     55 33 56 43  00 00 01 08  08 00 c3 15  00 10 02 00  U3VC............  685us       250.1.0        10:00:49.605
                                              00 00 00 00                                         ....                          250.1.16
  15.1                             24  OUT    55 33 56 43  00 40 02 08  0c 00 c4 15  08 00 90 00  U3VC.@..........  957us       251.1.0        10:00:49.605
                                              00 00 00 00  60 00 00 00                            ....`...                      251.1.16
  15.1                             16  IN     55 33 56 43  00 00 03 08  04 00 c4 15  00 00 04 00  U3VC............  1.7ms       252.1.0        10:00:49.608
  15.1                             24  OUT    55 33 56 43  00 40 02 08  0c 00 c5 15  0c 00 90 00  U3VC.@..........  188us       253.1.0        10:00:49.608
                                              00 00 00 00  3e 03 00 00                            ....>...                      253.1.16
  15.1                             16  IN     55 33 56 43  00 00 03 08  04 00 c5 15  00 00 04 00  U3VC............  1.7ms       254.1.0        10:00:49.609
  15.1                             24  OUT    55 33 56 43  00 40 02 08  0c 00 c6 15  00 00 80 00  U3VC.@..........  149us       255.1.0        10:00:49.610
                                              00 00 00 00  02 00 00 00                            ........                      255.1.16
  15.1                             16  IN     55 33 56 43  00 00 03 08  04 00 c6 15  00 00 04 00  U3VC............  476us       256.1.0        10:00:49.610
  15.1                             24  OUT    55 33 56 43  00 40 00 08  0c 00 c7 15  3c 00 90 00  U3VC.@......<...  176us       257.1.0        10:00:49.610
                                              00 00 00 00  00 00 04 00                            ........                      257.1.16
  15.1                             16  IN     55 33 56 43  00 00 01 08  04 00 c7 15  00 00 00 00  U3VC............  679us       258.1.0        10:00:49.612
  15.1                             24  OUT    55 33 56 43  00 40 02 08  0c 00 c8 15  38 00 90 00  U3VC.@......8...  163us       259.1.0        10:00:49.612
                                              00 00 00 00  14 00 00 00                            ........                      259.1.16
  15.1                             16  IN     55 33 56 43  00 00 03 08  04 00 c8 15  00 00 04 00  U3VC............  1.0ms       260.1.0        10:00:49.613
  15.1                             24  OUT    55 33 56 43  00 40 00 08  0c 00 c9 15  3c 00 90 00  U3VC.@......<...  343us       261.1.0        10:00:49.613
                                              00 00 00 00  00 00 04 00                            ........                      261.1.16
  15.1                             16  IN     55 33 56 43  00 00 01 08  04 00 c9 15  00 00 00 00  U3VC............  659us       262.1.0        10:00:49.613
  15.1                             24  OUT    55 33 56 43  00 40 00 08  0c 00 ca 15  38 00 90 00  U3VC.@......8...   75us       263.1.0        10:00:49.613
                                              00 00 00 00  00 00 04 00                            ........                      263.1.16
  15.1                             16  IN     55 33 56 43  00 00 01 08  04 00 ca 15  14 00 00 00  U3VC............  666us       264.1.0        10:00:49.614
  15.1                             24  OUT    55 33 56 43  00 40 02 08  0c 00 cb 15  04 00 02 00  U3VC.@..........   97us       265.1.0        10:00:49.614
                                              00 00 00 00  00 00 00 00                            ........                      265.1.16
  15.1                             16  IN     55 33 56 43  00 00 03 08  04 00 cb 15  00 00 04 00  U3VC............  9.5ms       266.1.0        10:00:49.624
  15.1                             24  OUT    55 33 56 43  00 40 00 08  0c 00 cc 15  00 00 02 00  U3VC.@..........  6.1ms       267.1.0        10:00:49.630
                                              00 00 00 00  00 00 04 00                            ........                      267.1.16
  15.1                             16  IN     55 33 56 43  00 00 01 08  04 00 cc 15  00 00 00 0a  U3VC............  710us       268.1.0        10:00:49.630
  15.1                             24  OUT    55 33 56 43  00 40 00 08  0c 00 cd 15  08 00 02 00  U3VC.@..........  151us       269.1.0        10:00:49.630
                                              00 00 00 00  00 00 08 00                            ........                      269.1.16
  15.1                             20  IN     55 33 56 43  00 00 01 08  08 00 cd 15  68 37 01 00  U3VC........h7..  736us       270.1.0        10:00:49.632
                                              00 00 00 00                                         ....                          270.1.16
  15.1                             24  OUT    55 33 56 43  00 40 00 08  0c 00 ce 15  10 00 02 00  U3VC.@..........  154us       271.1.0        10:00:49.632
                                              00 00 00 00  00 00 04 00                            ........                      271.1.16
  15.1                             16  IN     55 33 56 43  00 00 01 08  04 00 ce 15  34 00 00 00  U3VC........4...  669us       272.1.0        10:00:49.633
  15.1                             24  OUT    55 33 56 43  00 40 00 08  0c 00 cf 15  14 00 02 00  U3VC.@..........  141us       273.1.0        10:00:49.633
                                              00 00 00 00  00 00 04 00                            ........                      273.1.16
  15.1                             16  IN     55 33 56 43  00 00 01 08  04 00 cf 15  24 00 00 00  U3VC........$...  673us       274.1.0        10:00:49.633
  15.1                             24  OUT    55 33 56 43  00 40 02 08  0c 00 d0 15  18 00 02 00  U3VC.@..........  139us       275.1.0        10:00:49.633
                                              00 00 00 00  00 04 00 00                            ........                      275.1.16
  15.1                             16  IN     55 33 56 43  00 00 03 08  04 00 d0 15  00 00 04 00  U3VC............  477us       276.1.0        10:00:49.634
  15.1                             24  OUT    55 33 56 43  00 40 02 08  0c 00 d1 15  1c 00 02 00  U3VC.@..........  125us       277.1.0        10:00:49.634
                                              00 00 00 00  00 78 00 00                            .....x..                      277.1.16
  15.1                             16  IN     55 33 56 43  00 00 03 08  04 00 d1 15  00 00 04 00  U3VC............  519us       278.1.0        10:00:49.634
  15.1                             24  OUT    55 33 56 43  00 40 02 08  0c 00 d2 15  20 00 02 00  U3VC.@...... ...  122us       279.1.0        10:00:49.634
                                              00 00 00 00  02 00 00 00                            ........                      279.1.16
  15.1                             16  IN     55 33 56 43  00 00 03 08  04 00 d2 15  00 00 04 00  U3VC............  502us       280.1.0        10:00:49.635
  15.1                             24  OUT    55 33 56 43  00 40 02 08  0c 00 d3 15  24 00 02 00  U3VC.@......$...  126us       281.1.0        10:00:49.635
                                              00 00 00 00  00 44 00 00                            .....D..                      281.1.16
  15.1                             16  IN     55 33 56 43  00 00 03 08  04 00 d3 15  00 00 04 00  U3VC............  480us       282.1.0        10:00:49.635
  15.1                             24  OUT    55 33 56 43  00 40 02 08  0c 00 d4 15  28 00 02 00  U3VC.@......(...  127us       283.1.0        10:00:49.635
                                              00 00 00 00  00 04 00 00                            ........                      283.1.16
  15.1                             16  IN     55 33 56 43  00 00 03 08  04 00 d4 15  00 00 04 00  U3VC............  482us       284.1.0        10:00:49.637
  15.1                             24  OUT    55 33 56 43  00 40 02 08  0c 00 d5 15  2c 00 02 00  U3VC.@......,...  117us       285.1.0        10:00:49.637
                                              00 00 00 00  00 04 00 00                            ........                      285.1.16
  15.1                             16  IN     55 33 56 43  00 00 03 08  04 00 d5 15  00 00 04 00  U3VC............  477us       286.1.0        10:00:49.637
  15.1                             24  OUT    55 33 56 43  00 40 02 08  0c 00 d6 15  04 00 02 00  U3VC.@..........  112us       287.1.0        10:00:49.637
                                              00 00 00 00  01 00 00 00                            ........                      287.1.16
  15.1                             16  IN     55 33 56 43  00 00 03 08  04 00 d6 15  00 00 04 00  U3VC............  2.7ms       288.1.0        10:00:49.639
  15.1                             24  OUT    55 33 56 43  00 40 02 08  0c 00 d7 15  04 00 80 00  U3VC.@..........  917us       289.1.0        10:00:49.640
                                              00 00 00 00  01 00 00 00                            ........                      289.1.16
  15.1                             16  IN     55 33 56 43  00 00 03 08  04 00 d7 15  00 00 04 00  U3VC............  1.6ms       290.1.0        10:00:49.642
  15.3                             52  IN     55 33 56 4c  00 00 34 00  00 00 00 00  00 00 00 00  U3VL..4.........   91us       291.1.0        10:00:49.643
                                              00 00 01 40  17 47 31 29  0b 00 00 00  09 00 08 01  ...@.G1)........              291.1.16
                                              60 00 00 00  3e 03 00 00  00 00 00 00  00 00 00 00  `...>...........              291.1.32
                                              00 00 00 00                                         ....                          291.1.48
  15.3                          30720  IN     00 00 00 00  00 00 00 00  00 00 00 00  00 00 00 01  ................   11ms       292.1.0        10:00:49.654
                                              00 00 00 00  00 00 00 00  00 00 00 00  01 00 00 00  ................              292.1.16
                                              00 00 00 00  00 00 00 01  00 01 00 00  00 00 00 00  ................              292.1.32
                                              01 00 00 00  00 00 00 00  00 00 00 00  00 00 00 00  ................              292.1.48
  15.3                          30720  IN     00 00 00 00  00 00 00 00  00 00 00 00  00 00 00 00  ................   11ms       293.1.0(3)     10:00:49.665
                                              00 00 00 00  00 00 00 00  00 00 00 00  00 00 00 00  ................              293.1.16
                                              00 00 00 00  00 00 00 00  00 00 00 00  00 00 00 00  ................              293.1.32
                                              00 00 00 00  00 00 00 00  00 00 00 00  00 00 00 00  ................              293.1.48
  15.3                             36  IN     55 33 56 54  00 00 24 00  00 00 00 00  00 00 00 00  U3VT..$.........  4.8ms       296.1.0        10:00:49.670
                                              00 00 00 00  68 37 01 00  00 00 00 00  3e 03 00 00  ....h7......>...              296.1.16
                                              09 00 00 00                                         ....                          296.1.32
  15.3                             52  IN     55 33 56 4c  00 00 34 00  01 00 00 00  00 00 00 00  U3VL..4.........  1.1ms       297.1.0        10:00:49.672
                                              00 00 01 40  2a 8c f0 2a  0b 00 00 00  09 00 08 01  ...@*..*........              297.1.16
                                              60 00 00 00  3e 03 00 00  00 00 00 00  00 00 00 00  `...>...........              297.1.32
                                              00 00 00 00                                         ....                          297.1.48
  15.3                          30720  IN     00 00 00 00  00 00 00 00  00 00 00 00  00 00 00 00  ................   11ms       298.1.0        10:00:49.683
                                              00 00 00 00  00 00 00 00  00 00 00 00  00 00 00 00  ................              298.1.16
                                              00 00 00 00  00 01 00 00  00 00 00 00  00 00 00 00  ................              298.1.32
                                              00 00 00 00  00 00 00 00  00 00 00 00  00 00 00 00  ................              298.1.48
  15.3                          30720  IN     00 00 00 00  00 00 00 00  00 00 00 00  00 00 00 00  ................   11ms       299.1.0(2)     10:00:49.695
                                              00 00 00 00  00 00 00 00  00 00 00 00  00 00 00 00  ................              299.1.16
                                              00 00 00 00  00 00 00 00  00 00 00 00  00 00 00 00  ................              299.1.32
                                              00 00 00 00  00 00 00 00  00 00 00 00  00 00 00 00  ................              299.1.48
  15.3                            872  IN     00 00 00 00  00 00 00 00  00 00 00 00  00 00 00 00  ................  4.8ms       301.1.0        10:00:49.700
                                              00 00 00 00  00 00 00 00  00 00 00 00  00 00 00 00  ................              301.1.16
                                              00 00 00 00  00 00 00 00  00 00 00 00  00 00 00 00  ................              301.1.32
                                              00 00 00 00  00 00 01 00  00 00 00 00  00 00 00 00  ................              301.1.48
  15.3                             36  IN     55 33 56 54  00 00 24 00  01 00 00 00  00 00 00 00  U3VT..$.........   13us       302.1.0        10:00:49.700
                                              00 00 00 00  68 37 01 00  00 00 00 00  3e 03 00 00  ....h7......>...              302.1.16
                                              09 00 00 00                                         ....                          302.1.32
  15.3                             52  IN     55 33 56 4c  00 00 34 00  02 00 00 00  00 00 00 00  U3VL..4.........  1.1ms       303.1.0        10:00:49.700
                                              00 00 01 40  3d d1 af 2c  0b 00 00 00  09 00 08 01  ...@=..,........              303.1.16
                                              60 00 00 00  3e 03 00 00  00 00 00 00  00 00 00 00  `...>...........              303.1.32
                                              00 00 00 00                                         ....                          303.1.48
  15.3                          30720  IN     00 00 00 00  00 00 00 00  00 00 00 00  00 00 00 00  ................   11ms       304.1.0        10:00:49.713
                                              00 00 00 00  00 00 00 00  00 00 00 00  00 00 00 00  ................              304.1.16
                                              00 00 00 00  00 00 00 00  00 00 00 00  00 00 00 00  ................              304.1.32
                                              00 00 00 00  00 00 00 00  00 01 00 00  00 00 00 00  ................              304.1.48
  15.3                          30720  IN     00 00 00 00  00 00 00 00  00 00 00 00  00 00 00 00  ................   11ms       305.1.0        10:00:49.724
                                              00 00 00 00  00 00 00 00  00 00 00 00  00 00 00 00  ................              305.1.16
                                              00 00 00 00  00 00 00 00  00 00 00 00  00 00 00 00  ................              305.1.32
                                              00 00 00 00  00 00 00 00  00 00 00 00  00 00 00 00  ................              305.1.48
  15.3                          17408  IN     00 00 00 00  00 00 00 00  00 00 00 00  00 00 00 00  ................  4.8ms       306.1.0        10:00:49.729
                                              00 00 00 00  00 00 00 00  00 00 00 00  00 00 00 00  ................              306.1.16
                                              00 00 00 00  00 00 00 00  00 00 00 00  00 00 00 00  ................              306.1.32
                                              00 00 00 00  00 00 00 00  00 00 00 01  00 00 00 00  ................              306.1.48
  15.3                            872  IN     00 00 00 00  00 00 00 00  00 00 00 00  00 00 00 00  ................   15us       307.1.0        10:00:49.729
                                              00 00 00 00  00 00 00 00  00 00 00 00  00 00 00 00  ................              307.1.16
                                              00 00 00 00  00 00 00 00  00 00 00 00  00 00 00 00  ................              307.1.32
                                              00 00 00 00  00 00 00 00  00 00 00 00  00 00 00 00  ................              307.1.48
  15.3                             36  IN     55 33 56 54  00 00 24 00  02 00 00 00  00 00 00 00  U3VT..$.........   14us       308.1.0        10:00:49.729
                                              00 00 00 00  68 37 01 00  00 00 00 00  3e 03 00 00  ....h7......>...              308.1.16
                                              09 00 00 00                                         ....                          308.1.32
  15.3                             52  IN     55 33 56 4c  00 00 34 00  03 00 00 00  00 00 00 00  U3VL..4.........  1.1ms       309.1.0        10:00:49.730
                                              00 00 01 40  37 16 6f 2e  0b 00 00 00  09 00 08 01  ...@7.o.........              309.1.16
                                              60 00 00 00  3e 03 00 00  00 00 00 00  00 00 00 00  `...>...........              309.1.32
                                              00 00 00 00                                         ....                          309.1.48
  15.3                          30720  IN     00 00 00 00  00 00 00 00  00 00 00 00  00 00 00 00  ................   11ms       310.1.0(2)     10:00:49.742
                                              00 00 00 00  00 00 00 00  00 00 00 00  00 00 00 00  ................              310.1.16
                                              00 00 00 00  00 00 00 00  00 00 00 00  00 00 00 00  ................              310.1.32
                                              00 00 00 00  00 00 00 00  00 00 00 00  00 00 00 00  ................              310.1.48
  15.3                          17408  IN     00 00 00 00  00 00 00 00  00 00 00 00  00 01 00 00  ................   16ms       312.1.0        10:00:49.758
                                              00 00 00 00  00 00 00 00  00 00 00 00  00 00 00 01  ................              312.1.16
                                              00 00 00 00  00 00 00 00  00 00 00 00  00 00 00 00  ................              312.1.32
                                              00 00 00 00  00 00 00 00  00 00 00 00  00 00 00 00  ................              312.1.48
  15.3                            872  IN     00 00 00 00  00 00 00 00  00 00 00 00  00 00 00 00  ................    7us       313.1.0        10:00:49.758
                                              00 00 00 00  00 00 00 00  00 00 00 00  00 00 00 00  ................              313.1.16
                                              00 00 00 00  00 00 00 00  00 00 00 00  00 00 00 00  ................              313.1.32
                                              00 00 00 00  00 00 00 00  00 00 00 00  00 00 00 00  ................              313.1.48
  15.3                             36  IN     55 33 56 54  00 00 24 00  03 00 00 00  00 00 00 00  U3VT..$.........    6us       314.1.0        10:00:49.758
                                              00 00 00 00  68 37 01 00  00 00 00 00  3e 03 00 00  ....h7......>...              314.1.16
                                              09 00 00 00                                         ....                          314.1.32
  15.3                             52  IN     55 33 56 4c  00 00 34 00  04 00 00 00  00 00 00 00  U3VL..4.........  1.1ms       315.1.0        10:00:49.759
                                              00 00 01 40  4a 5b 2e 30  0b 00 00 00  09 00 08 01  ...@J[.0........              315.1.16
                                              60 00 00 00  3e 03 00 00  00 00 00 00  00 00 00 00  `...>...........              315.1.32
                                              00 00 00 00                                         ....                          315.1.48
  15.3                          30720  IN     00 00 00 00  00 00 00 00  00 00 00 00  00 00 00 00  ................   11ms       316.1.0(4)     10:00:49.772
                                              00 00 00 00  00 00 00 00  00 00 00 00  00 00 00 00  ................              316.1.16
                                              00 00 00 00  00 00 00 00  00 00 00 00  00 00 00 00  ................              316.1.32
                                              00 00 00 00  00 00 00 00  00 00 00 00  00 00 00 00  ................              316.1.48
  15.3                             36  IN     55 33 56 54  00 00 24 00  04 00 00 00  00 00 00 00  U3VT..$.........   16ms       320.1.0        10:00:49.788
                                              00 00 00 00  68 37 01 00  00 00 00 00  3e 03 00 00  ....h7......>...              320.1.16
                                              09 00 00 00                                         ....                          320.1.32
  15.1                             24  OUT    55 33 56 43  00 40 02 08  0c 00 d8 15  04 00 80 00  U3VC.@..........  177us       321.1.0        10:00:49.788
                                              00 00 00 00  00 00 00 00                            ........                      321.1.16
  15.1                             16  IN     55 33 56 43  00 00 03 08  04 00 d8 15  00 00 04 00  U3VC............  811us       322.1.0        10:00:49.789
  15.1                             24  OUT    55 33 56 43  00 40 00 08  0c 00 d9 15  08 00 02 00  U3VC.@..........  381us       323.1.0        10:00:49.789
                                              00 00 00 00  00 00 04 00                            ........                      323.1.16
  15.1                             16  IN     55 33 56 43  00 00 01 08  04 00 d9 15  68 37 01 00  U3VC........h7..  685us       324.1.0        10:00:49.790
  15.1                             24  OUT    55 33 56 43  00 40 02 08  0c 00 da 15  04 00 02 00  U3VC.@..........  2.3ms       325.1.0        10:00:49.792
                                              00 00 00 00  00 00 00 00                            ........                      325.1.16
  15.1                             16  IN     55 33 56 43  00 00 03 08  04 00 da 15  00 00 04 00  U3VC............  9.5ms       326.1.0        10:00:49.802
  15.1                             24  OUT    55 33 56 43  00 40 00 08  0c 00 db 15  d8 01 00 00  U3VC.@..........  801us       327.1.0        10:00:49.803
                                              00 00 00 00  00 00 08 00                            ........                      327.1.16
  15.1                             20  IN     55 33 56 43  00 00 01 08  08 00 db 15  00 00 01 00  U3VC............  688us       328.1.0        10:00:49.803
                                              00 00 00 00                                         ....                          328.1.16
  15.1                             24  OUT    55 33 56 43  00 40 00 08  0c 00 dc 15  04 00 01 00  U3VC.@..........  649us       329.1.0        10:00:49.804
                                              00 00 00 00  00 00 08 00                            ........                      329.1.16
  15.1                             20  IN     55 33 56 43  00 00 01 08  08 00 dc 15  03 00 00 00  U3VC............  704us       330.1.0        10:00:49.804
                                              00 00 00 00                                         ....                          330.1.16
  15.1                             24  OUT    55 33 56 43  00 40 00 08  0c 00 dd 15  20 00 01 00  U3VC.@...... ...  131us       331.1.0        10:00:49.804
                                              00 00 00 00  00 00 08 00                            ........                      331.1.16
  15.1                             20  IN     55 33 56 43  00 00 01 08  08 00 dd 15  00 00 02 00  U3VC............  751us       332.1.0        10:00:49.805
                                              00 00 00 00                                         ....                          332.1.16
  15.1                             24  OUT    55 33 56 43  00 40 00 08  0c 00 de 15  04 00 01 00  U3VC.@..........  639us       333.1.0        10:00:49.807
                                              00 00 00 00  00 00 08 00                            ........                      333.1.16
  15.1                             20  IN     55 33 56 43  00 00 01 08  08 00 de 15  03 00 00 00  U3VC............  706us       334.1.0        10:00:49.807
                                              00 00 00 00                                         ....                          334.1.16
  15.1                             24  OUT    55 33 56 43  00 40 00 08  0c 00 df 15  2c 00 01 00  U3VC.@......,...  122us       335.1.0        10:00:49.807
                                              00 00 00 00  00 00 08 00                            ........                      335.1.16
  15.1                             20  IN     55 33 56 43  00 00 01 08  08 00 df 15  00 10 02 00  U3VC............  703us       336.1.0        10:00:49.808
                                              00 00 00 00                                         ....                          336.1.16
  15.1                             24  OUT    55 33 56 43  00 40 02 08  0c 00 e0 15  08 00 90 00  U3VC.@..........  726us       337.1.0        10:00:49.808
                                              00 00 00 00  44 01 00 00                            ....D...                      337.1.16
  15.1                             16  IN     55 33 56 43  00 00 03 08  04 00 e0 15  00 00 04 00  U3VC............  1.8ms       338.1.0        10:00:49.810
  15.1                             24  OUT    55 33 56 43  00 40 02 08  0c 00 e1 15  0c 00 90 00  U3VC.@..........  202us       339.1.0        10:00:49.810
                                              00 00 00 00  0e 03 00 00                            ........                      339.1.16
  15.1                             16  IN     55 33 56 43  00 00 03 08  04 00 e1 15  00 00 04 00  U3VC............  1.7ms       340.1.0        10:00:49.812
  15.1                             24  OUT    55 33 56 43  00 40 02 08  0c 00 e2 15  00 00 80 00  U3VC.@..........  203us       341.1.0        10:00:49.813
                                              00 00 00 00  02 00 00 00                            ........                      341.1.16
  15.1                             16  IN     55 33 56 43  00 00 03 08  04 00 e2 15  00 00 04 00  U3VC............  497us       342.1.0        10:00:49.813
  15.1                             24  OUT    55 33 56 43  00 40 00 08  0c 00 e3 15  3c 00 90 00  U3VC.@......<...  187us       343.1.0        10:00:49.813
                                              00 00 00 00  00 00 04 00                            ........                      343.1.16
  15.1                             16  IN     55 33 56 43  00 00 01 08  04 00 e3 15  00 00 00 00  U3VC............  683us       344.1.0        10:00:49.814
  15.1                             24  OUT    55 33 56 43  00 40 02 08  0c 00 e4 15  38 00 90 00  U3VC.@......8...  128us       345.1.0        10:00:49.814
                                              00 00 00 00  14 00 00 00                            ........                      345.1.16
  15.1                             16  IN     55 33 56 43  00 00 03 08  04 00 e4 15  00 00 04 00  U3VC............  1.0ms       346.1.0        10:00:49.815
  15.1                             24  OUT    55 33 56 43  00 40 00 08  0c 00 e5 15  3c 00 90 00  U3VC.@......<...  174us       347.1.0        10:00:49.815
                                              00 00 00 00  00 00 04 00                            ........                      347.1.16
  15.1                             16  IN     55 33 56 43  00 00 01 08  04 00 e5 15  00 00 00 00  U3VC............  687us       348.1.0        10:00:49.815
  15.1                             24  OUT    55 33 56 43  00 40 00 08  0c 00 e6 15  38 00 90 00  U3VC.@......8...  133us       349.1.0        10:00:49.815
                                              00 00 00 00  00 00 04 00                            ........                      349.1.16
  15.1                             16  IN     55 33 56 43  00 00 01 08  04 00 e6 15  14 00 00 00  U3VC............  682us       350.1.0        10:00:49.817
  15.1                             24  OUT    55 33 56 43  00 40 02 08  0c 00 e7 15  04 00 02 00  U3VC.@..........  111us       351.1.0        10:00:49.817
                                              00 00 00 00  00 00 00 00                            ........                      351.1.16
  15.1                             16  IN     55 33 56 43  00 00 03 08  04 00 e7 15  00 00 04 00  U3VC............  9.5ms       352.1.0        10:00:49.827
  15.1                             24  OUT    55 33 56 43  00 40 00 08  0c 00 e8 15  00 00 02 00  U3VC.@..........  6.1ms       353.1.0        10:00:49.833
                                              00 00 00 00  00 00 04 00                            ........                      353.1.16
  15.1                             16  IN     55 33 56 43  00 00 01 08  04 00 e8 15  00 00 00 0a  U3VC............  671us       354.1.0        10:00:49.833
  15.1                             24  OUT    55 33 56 43  00 40 00 08  0c 00 e9 15  08 00 02 00  U3VC.@..........  127us       355.1.0        10:00:49.833
                                              00 00 00 00  00 00 08 00                            ........                      355.1.16
  15.1                             20  IN     55 33 56 43  00 00 01 08  08 00 e9 15  e0 dd 03 00  U3VC............  674us       356.1.0        10:00:49.834
                                              00 00 00 00                                         ....                          356.1.16
  15.1                             24  OUT    55 33 56 43  00 40 00 08  0c 00 ea 15  10 00 02 00  U3VC.@..........  129us       357.1.0        10:00:49.834
                                              00 00 00 00  00 00 04 00                            ........                      357.1.16
  15.1                             16  IN     55 33 56 43  00 00 01 08  04 00 ea 15  34 00 00 00  U3VC........4...  678us       358.1.0        10:00:49.834
  15.1                             24  OUT    55 33 56 43  00 40 00 08  0c 00 eb 15  14 00 02 00  U3VC.@..........  113us       359.1.0        10:00:49.835
                                              00 00 00 00  00 00 04 00                            ........                      359.1.16
  15.1                             16  IN     55 33 56 43  00 00 01 08  04 00 eb 15  24 00 00 00  U3VC........$...  677us       360.1.0        10:00:49.835
  15.1                             24  OUT    55 33 56 43  00 40 02 08  0c 00 ec 15  18 00 02 00  U3VC.@..........  113us       361.1.0        10:00:49.835
                                              00 00 00 00  00 04 00 00                            ........                      361.1.16
  15.1                             16  IN     55 33 56 43  00 00 03 08  04 00 ec 15  00 00 04 00  U3VC............  480us       362.1.0        10:00:49.837
  15.1                             24  OUT    55 33 56 43  00 40 02 08  0c 00 ed 15  1c 00 02 00  U3VC.@..........  125us       363.1.0        10:00:49.837
                                              00 00 00 00  00 50 00 00                            .....P..                      363.1.16
  15.1                             16  IN     55 33 56 43  00 00 03 08  04 00 ed 15  00 00 04 00  U3VC............  504us       364.1.0        10:00:49.837
  15.1                             24  OUT    55 33 56 43  00 40 02 08  0c 00 ee 15  20 00 02 00  U3VC.@...... ...  111us       365.1.0        10:00:49.837
                                              00 00 00 00  0c 00 00 00                            ........                      365.1.16
  15.1                             16  IN     55 33 56 43  00 00 03 08  04 00 ee 15  00 00 04 00  U3VC............  483us       366.1.0        10:00:49.837
  15.1                             24  OUT    55 33 56 43  00 40 02 08  0c 00 ef 15  24 00 02 00  U3VC.@......$...  135us       367.1.0        10:00:49.838
                                              00 00 00 00  00 1c 00 00                            ........                      367.1.16
  15.1                             16  IN     55 33 56 43  00 00 03 08  04 00 ef 15  00 00 04 00  U3VC............  476us       368.1.0        10:00:49.838
  15.1                             24  OUT    55 33 56 43  00 40 02 08  0c 00 f0 15  28 00 02 00  U3VC.@......(...  118us       369.1.0        10:00:49.838
                                              00 00 00 00  00 04 00 00                            ........                      369.1.16
  15.1                             16  IN     55 33 56 43  00 00 03 08  04 00 f0 15  00 00 04 00  U3VC............  474us       370.1.0        10:00:49.838
  15.1                             24  OUT    55 33 56 43  00 40 02 08  0c 00 f1 15  2c 00 02 00  U3VC.@......,...  137us       371.1.0        10:00:49.839
                                              00 00 00 00  00 04 00 00                            ........                      371.1.16
  15.1                             16  IN     55 33 56 43  00 00 03 08  04 00 f1 15  00 00 04 00  U3VC............  460us       372.1.0        10:00:49.839
  15.1                             24  OUT    55 33 56 43  00 40 02 08  0c 00 f2 15  04 00 02 00  U3VC.@..........  125us       373.1.0        10:00:49.839
                                              00 00 00 00  01 00 00 00                            ........                      373.1.16
  15.1                             16  IN     55 33 56 43  00 00 03 08  04 00 f2 15  00 00 04 00  U3VC............  2.7ms       374.1.0        10:00:49.842
  15.1                             24  OUT    55 33 56 43  00 40 02 08  0c 00 f3 15  04 00 80 00  U3VC.@..........  2.0ms       375.1.0        10:00:49.844
                                              00 00 00 00  01 00 00 00                            ........                      375.1.16
  15.3                             52  IN     55 33 56 4c  00 00 34 00  00 00 00 00  00 00 00 00  U3VL..4.........  1.6ms       376.1.0        10:00:49.845
                                              00 00 01 40  51 04 51 35  0b 00 00 00  09 00 08 01  ...@Q.Q5........              376.1.16
                                              44 01 00 00  0e 03 00 00  00 00 00 00  00 00 00 00  D...............              376.1.32
                                              00 00 00 00                                         ....                          376.1.48
  15.1                             16  IN     55 33 56 43  00 00 03 08  04 00 f3 15  00 00 04 00  U3VC............    6us       377.1.0        10:00:49.845
  15.3                          20480  IN     00 00 00 00  00 00 00 00  00 00 00 00  00 00 00 00  ................  3.4ms       378.1.0(10)    10:00:49.849
                                              00 00 00 00  00 00 00 00  00 00 00 00  00 00 00 00  ................              378.1.16
                                              00 00 00 00  00 00 00 00  00 00 00 00  00 00 00 00  ................              378.1.32
                                              00 00 00 00  00 00 00 00  00 00 00 00  00 00 00 00  ................              378.1.48
  15.3                          20480  IN     00 00 00 00  00 00 00 00  00 00 00 00  00 00 00 00  ................   20ms       388.1.0        10:00:49.870
                                              00 00 00 00  00 00 00 00  00 00 00 00  00 00 00 00  ................              388.1.16
                                              00 00 00 00  00 00 00 00  00 00 00 00  00 00 00 01  ................              388.1.32
                                              00 00 00 00  00 00 00 00  00 00 00 00  00 00 00 00  ................              388.1.48
  15.3                          20480  IN     00 00 00 00  00 00 00 00  00 00 00 00  00 00 00 00  ................  2.4ms       389.1.0(2)     10:00:49.873
                                              00 00 00 00  00 00 00 00  00 00 00 00  00 00 00 00  ................              389.1.16
                                              00 00 00 00  00 00 00 00  00 00 00 00  00 00 00 00  ................              389.1.32
                                              00 00 00 00  00 00 00 00  00 00 00 00  00 00 00 00  ................              389.1.48
  15.3                            480  IN     00 00 00 00  00 00 00 00  00 00 00 00  00 00 00 00  ................   14us       391.1.0        10:00:49.873
                                              00 00 00 00  00 00 00 00  00 00 00 00  00 00 00 00  ................              391.1.16
                                              00 00 00 00  00 00 00 00  00 01 00 00  00 00 00 00  ................              391.1.32
                                              00 00 00 00  00 00 00 00  00 00 00 00  00 00 00 00  ................              391.1.48
  15.3                             36  IN     55 33 56 54  00 00 24 00  00 00 00 00  00 00 00 00  U3VT..$.........    7us       392.1.0        10:00:49.873
                                              00 00 00 00  e0 dd 03 00  00 00 00 00  0e 03 00 00  ................              392.1.16
                                              09 00 00 00                                         ....                          392.1.32
  15.3                             52  IN     55 33 56 4c  00 00 34 00  01 00 00 00  00 00 00 00  U3VL..4.........  1.2ms       393.1.0        10:00:49.874
                                              00 00 01 40  f1 77 fa 36  0b 00 00 00  09 00 08 01  ...@.w.6........              393.1.16
                                              44 01 00 00  0e 03 00 00  00 00 00 00  00 00 00 00  D...............              393.1.32
                                              00 00 00 00                                         ....                          393.1.48
  15.3                          20480  IN     00 00 00 00  00 00 00 00  00 00 00 00  00 00 00 00  ................  3.4ms       394.1.0(6)     10:00:49.877
                                              00 00 00 00  00 00 00 00  00 00 00 00  00 00 00 00  ................              394.1.16
                                              00 00 00 00  00 00 00 00  00 00 00 00  00 00 00 00  ................              394.1.32
                                              00 00 00 00  00 00 00 00  00 00 00 00  00 00 00 00  ................              394.1.48
  15.3                          20480  IN     00 00 00 00  00 00 00 00  00 00 00 00  00 00 01 00  ................   13ms       400.1.0        10:00:49.890
                                              00 00 00 00  00 00 00 00  00 00 00 00  00 00 00 00  ................              400.1.16
                                              00 00 00 00  00 00 00 00  00 00 00 00  00 00 00 00  ................              400.1.32
                                              00 00 00 00  00 00 00 00  00 00 00 00  00 00 00 00  ................              400.1.48
  15.3                          20480  IN     00 00 00 00  00 00 00 00  00 00 00 00  00 00 00 00  ................    7us       401.1.0        10:00:49.890
                                              00 00 00 00  00 00 00 00  00 00 00 00  00 00 00 00  ................              401.1.16
                                              00 00 00 00  00 00 00 00  00 00 00 00  00 00 00 00  ................              401.1.32
                                              00 00 00 00  00 00 00 00  00 00 00 00  00 00 00 00  ................              401.1.48
  15.3                          20480  IN     00 00 00 00  00 00 00 00  00 00 00 00  00 00 00 00  ................  3.3ms       402.1.0        10:00:49.894
                                              01 00 00 00  00 00 00 00  00 00 00 00  00 00 00 00  ................              402.1.16
                                              00 00 00 00  00 00 00 00  00 00 00 00  00 00 00 00  ................              402.1.32
                                              00 00 00 00  00 00 00 00  00 00 00 00  00 00 00 00  ................              402.1.48
  15.3                          20480  IN     00 00 00 00  00 00 00 00  00 00 00 00  00 00 00 00  ................  3.4ms       403.1.0(3)     10:00:49.898
                                              00 00 00 00  00 00 00 00  00 00 00 00  00 00 00 00  ................              403.1.16
                                              00 00 00 00  00 00 00 00  00 00 00 00  00 00 00 00  ................              403.1.32
                                              00 00 00 00  00 00 00 00  00 00 00 00  00 00 00 00  ................              403.1.48
  15.3                           7168  IN     00 00 00 00  00 00 00 00  00 00 00 00  00 00 00 00  ................  2.5ms       406.1.0        10:00:49.900
                                              00 01 00 00  00 00 00 00  00 00 00 00  00 00 00 00  ................              406.1.16
                                              00 00 00 00  00 00 00 00  00 00 00 00  00 00 00 00  ................              406.1.32
                                              00 00 00 00  00 00 00 00  00 00 00 00  00 00 00 00  ................              406.1.48
  15.3                            480  IN     00 00 00 00  00 00 00 00  00 00 00 00  00 00 00 00  ................    7us       407.1.0        10:00:49.900
                                              00 00 00 00  00 00 00 00  00 00 00 00  00 00 00 00  ................              407.1.16
                                              00 00 00 00  00 00 00 00  00 00 00 00  00 00 00 00  ................              407.1.32
                                              00 00 00 00  00 00 00 00  00 00 00 00  00 00 00 00  ................              407.1.48
  15.3                             36  IN     55 33 56 54  00 00 24 00  01 00 00 00  00 00 00 00  U3VT..$.........    6us       408.1.0        10:00:49.900
                                              00 00 00 00  e0 dd 03 00  00 00 00 00  0e 03 00 00  ................              408.1.16
                                              09 00 00 00                                         ....                          408.1.32
  15.3                             52  IN     55 33 56 4c  00 00 34 00  02 00 00 00  00 00 00 00  U3VL..4.........  1.2ms       409.1.0        10:00:49.902
                                              00 00 01 40  91 eb a3 38  0b 00 00 00  09 00 08 01  ...@...8........              409.1.16
                                              44 01 00 00  0e 03 00 00  00 00 00 00  00 00 00 00  D...............              409.1.32
                                              00 00 00 00                                         ....                          409.1.48
  15.3                          20480  IN     00 00 00 00  00 00 00 00  00 00 00 00  00 00 00 00  ................  3.4ms       410.1.0(2)     10:00:49.905
                                              00 00 00 00  00 00 00 00  00 00 00 00  00 00 00 00  ................              410.1.16
                                              00 00 00 00  00 00 00 00  00 00 00 00  00 00 00 00  ................              410.1.32
                                              00 00 00 00  00 00 00 00  00 00 00 00  00 00 00 00  ................              410.1.48
  15.3                          20480  IN     00 00 00 00  00 00 00 00  00 00 00 00  00 00 00 00  ................  3.4ms       412.1.0        10:00:49.908
                                              00 00 00 00  00 00 00 00  00 00 00 00  00 00 00 00  ................              412.1.16
                                              00 00 00 00  00 00 00 00  00 00 00 01  00 00 00 00  ................              412.1.32
                                              00 00 00 00  00 00 00 00  00 00 00 00  00 00 00 00  ................              412.1.48
  15.3                          20480  IN     00 00 00 00  00 00 00 00  00 00 00 00  00 00 00 00  ................  3.4ms       413.1.0(3)     10:00:49.912
                                              00 00 00 00  00 00 00 00  00 00 00 00  00 00 00 00  ................              413.1.16
                                              00 00 00 00  00 00 00 00  00 00 00 00  00 00 00 00  ................              413.1.32
                                              00 00 00 00  00 00 00 00  00 00 00 00  00 00 00 00  ................              413.1.48
  15.3                          20480  IN     00 00 01 00  00 00 00 00  00 00 00 00  00 00 00 00  ................  6.8ms       416.1.0        10:00:49.919
                                              00 00 00 00  00 00 00 00  00 00 00 00  00 00 00 00  ................              416.1.16
                                              00 00 00 00  00 00 00 00  00 00 00 00  00 00 00 00  ................              416.1.32
                                              00 00 00 00  00 00 00 00  00 00 00 00  00 00 00 00  ................              416.1.48
  15.3                          20480  IN     00 00 00 00  00 00 00 00  00 00 00 00  00 00 00 00  ................   33us       417.1.0        10:00:49.919
                                              00 00 00 00  00 00 00 00  00 00 00 00  00 00 00 00  ................              417.1.16
                                              00 00 00 00  00 01 00 00  00 00 00 00  00 00 00 00  ................              417.1.32
                                              00 00 00 00  00 00 00 00  00 00 00 00  00 00 00 00  ................              417.1.48
  15.3                          20480  IN     00 00 00 00  00 00 00 00  00 00 00 00  00 00 00 00  ................  3.4ms       418.1.0        10:00:49.922
                                              00 00 00 00  00 00 00 00  00 00 00 00  00 00 00 00  ................              418.1.16
                                              00 00 00 00  00 00 00 00  00 00 00 00  00 00 00 00  ................              418.1.32
                                              00 00 00 00  00 00 00 00  00 00 00 00  00 00 00 00  ................              418.1.48
  15.3                          20480  IN     00 00 00 00  00 00 00 00  00 00 00 00  00 00 00 00  ................  3.3ms       419.1.0        10:00:49.925
                                              00 01 00 00  00 00 00 00  00 00 00 00  00 00 00 00  ................              419.1.16
                                              00 00 00 00  00 00 00 00  00 00 00 00  00 00 00 00  ................              419.1.32
                                              00 00 00 00  00 00 00 00  00 00 00 00  00 00 00 00  ................              419.1.48
  15.3                          20480  IN     00 00 00 00  00 00 00 00  00 00 00 00  00 00 00 00  ................   76us       420.1.0(4)     10:00:49.925
                                              00 00 00 00  00 00 00 00  00 00 00 00  00 00 00 00  ................              420.1.16
                                              00 00 00 00  00 00 00 00  00 00 00 00  00 00 00 00  ................              420.1.32
                                              00 00 00 00  00 00 00 00  00 00 00 00  00 00 00 00  ................              420.1.48
  15.3                             36  IN     55 33 56 54  00 00 24 00  02 00 00 00  00 00 00 00  U3VT..$.........  2.4ms       424.1.0        10:00:49.928
                                              00 00 00 00  e0 dd 03 00  00 00 00 00  0e 03 00 00  ................              424.1.16
                                              09 00 00 00                                         ....                          424.1.32
  15.3                             52  IN     55 33 56 4c  00 00 34 00  03 00 00 00  00 00 00 00  U3VL..4.........  1.2ms       425.1.0        10:00:49.929
                                              00 00 01 40  31 5f 4d 3a  0b 00 00 00  09 00 08 01  ...@1_M:........              425.1.16
                                              44 01 00 00  0e 03 00 00  00 00 00 00  00 00 00 00  D...............              425.1.32
                                              00 00 00 00                                         ....                          425.1.48
  15.3                          20480  IN     00 00 00 00  00 00 00 00  00 00 00 00  00 00 00 00  ................  3.5ms       426.1.0(5)     10:00:49.933
                                              00 00 00 00  00 00 00 00  00 00 00 00  00 00 00 00  ................              426.1.16
                                              00 00 00 00  00 00 00 00  00 00 00 00  00 00 00 00  ................              426.1.32
                                              00 00 00 00  00 00 00 00  00 00 00 00  00 00 00 00  ................              426.1.48
  15.3                          20480  IN     00 00 00 00  00 00 00 00  00 00 00 00  00 00 00 00  ................   10ms       431.1.0        10:00:49.943
                                              00 00 00 00  00 00 00 00  00 01 00 00  00 00 00 00  ................              431.1.16
                                              00 00 00 00  00 00 00 00  00 00 00 00  00 00 00 00  ................              431.1.32
                                              00 00 00 00  00 00 00 00  00 00 00 00  00 00 00 00  ................              431.1.48
  15.3                          20480  IN     00 00 00 00  00 00 00 00  00 00 00 00  00 00 00 00  ................  3.4ms       432.1.0        10:00:49.947
                                              00 00 00 00  00 00 00 00  01 00 00 00  00 00 00 00  ................              432.1.16
                                              00 00 00 00  00 00 00 00  00 00 00 00  00 00 00 00  ................              432.1.32
                                              00 00 00 00  00 00 00 00  00 00 00 00  00 00 00 00  ................              432.1.48
  15.3                          20480  IN     00 00 00 00  00 00 00 00  00 00 00 00  00 00 00 00  ................   19us       433.1.0(7)     10:00:49.947
                                              00 00 00 00  00 00 00 00  00 00 00 00  00 00 00 00  ................              433.1.16
                                              00 00 00 00  00 00 00 00  00 00 00 00  00 00 00 00  ................              433.1.32
                                              00 00 00 00  00 00 00 00  00 00 00 00  00 00 00 00  ................              433.1.48
  15.3                             36  IN     55 33 56 54  00 00 24 00  03 00 00 00  00 00 00 00  U3VT..$.........  9.3ms       440.1.0        10:00:49.955
                                              00 00 00 00  e0 dd 03 00  00 00 00 00  0e 03 00 00  ................              440.1.16
                                              09 00 00 00                                         ....                          440.1.32
  15.3                             52  IN     55 33 56 4c  00 00 34 00  04 00 00 00  00 00 00 00  U3VL..4.........  1.2ms       441.1.0        10:00:49.957
                                              00 00 01 40  d1 d2 f6 3b  0b 00 00 00  09 00 08 01  ...@...;........              441.1.16
                                              44 01 00 00  0e 03 00 00  00 00 00 00  00 00 00 00  D...............              441.1.32
                                              00 00 00 00                                         ....                          441.1.48
  15.3                          20480  IN     00 00 00 00  00 00 00 00  00 00 00 00  00 00 00 00  ................  3.4ms       442.1.0(14)    10:00:49.960
                                              00 00 00 00  00 00 00 00  00 00 00 00  00 00 00 00  ................              442.1.16
                                              00 00 00 00  00 00 00 00  00 00 00 00  00 00 00 00  ................              442.1.32
                                              00 00 00 00  00 00 00 00  00 00 00 00  00 00 00 00  ................              442.1.48
  15.3                             36  IN     55 33 56 54  00 00 24 00  04 00 00 00  00 00 00 00  U3VT..$.........   23ms       456.1.0        10:00:49.984
                                              00 00 00 00  e0 dd 03 00  00 00 00 00  0e 03 00 00  ................              456.1.16
                                              09 00 00 00                                         ....                          456.1.32
  15.1                             24  OUT    55 33 56 43  00 40 02 08  0c 00 f4 15  04 00 80 00  U3VC.@..........  201us       457.1.0        10:00:49.984
                                              00 00 00 00  00 00 00 00                            ........                      457.1.16
  15.1                             16  IN     55 33 56 43  00 00 03 08  04 00 f4 15  00 00 04 00  U3VC............  774us       458.1.0        10:00:49.985
  15.1                             24  OUT    55 33 56 43  00 40 00 08  0c 00 f5 15  08 00 02 00  U3VC.@..........  377us       459.1.0        10:00:49.985
                                              00 00 00 00  00 00 04 00                            ........                      459.1.16
  15.1                             16  IN     55 33 56 43  00 00 01 08  04 00 f5 15  e0 dd 03 00  U3VC............  690us       460.1.0        10:00:49.985
  15.1                             24  OUT    55 33 56 43  00 40 02 08  0c 00 f6 15  04 00 02 00  U3VC.@..........  2.5ms       461.1.0        10:00:49.988
                                              00 00 00 00  00 00 00 00                            ........                      461.1.16
  15.1                             16  IN     55 33 56 43  00 00 03 08  04 00 f6 15  00 00 04 00  U3VC............  9.5ms       462.1.0        10:00:49.998
  15.1                             24  OUT    55 33 56 43  00 40 00 08  0c 00 f7 15  d8 01 00 00  U3VC.@..........  884us       463.1.0        10:00:49.999
                                              00 00 00 00  00 00 08 00                            ........                      463.1.16
  15.1                             20  IN     55 33 56 43  00 00 01 08  08 00 f7 15  00 00 01 00  U3VC............  714us       464.1.0        10:00:49.999
                                              00 00 00 00                                         ....                          464.1.16
  15.1                             24  OUT    55 33 56 43  00 40 00 08  0c 00 f8 15  04 00 01 00  U3VC.@..........  673us       465.1.0        10:00:50.000
                                              00 00 00 00  00 00 08 00                            ........                      465.1.16
  15.1                             20  IN     55 33 56 43  00 00 01 08  08 00 f8 15  03 00 00 00  U3VC............  708us       466.1.0        10:00:50.000
                                              00 00 00 00                                         ....                          466.1.16
  15.1                             24  OUT    55 33 56 43  00 40 00 08  0c 00 f9 15  20 00 01 00  U3VC.@...... ...  141us       467.1.0        10:00:50.002
                                              00 00 00 00  00 00 08 00                            ........                      467.1.16
  15.1                             20  IN     55 33 56 43  00 00 01 08  08 00 f9 15  00 00 02 00  U3VC............  714us       468.1.0        10:00:50.002
                                              00 00 00 00                                         ....                          468.1.16
  15.1                             24  OUT    55 33 56 43  00 40 00 08  0c 00 fa 15  04 00 01 00  U3VC.@..........  651us       469.1.0        10:00:50.003
                                              00 00 00 00  00 00 08 00                            ........                      469.1.16
  15.1                             20  IN     55 33 56 43  00 00 01 08  08 00 fa 15  03 00 00 00  U3VC............  677us       470.1.0        10:00:50.003
                                              00 00 00 00                                         ....                          470.1.16
  15.1                             24  OUT    55 33 56 43  00 40 00 08  0c 00 fb 15  2c 00 01 00  U3VC.@......,...  133us       471.1.0        10:00:50.003
                                              00 00 00 00  00 00 08 00                            ........                      471.1.16
  15.1                             20  IN     55 33 56 43  00 00 01 08  08 00 fb 15  00 10 02 00  U3VC............  698us       472.1.0        10:00:50.004
                                              00 00 00 00                                         ....                          472.1.16
  15.1                             24  OUT    55 33 56 43  00 40 02 08  0c 00 fc 15  08 00 90 00  U3VC.@..........  799us       473.1.0        10:00:50.005
                                              00 00 00 00  7c 04 00 00                            ........                      473.1.16
  15.1                             16  IN     55 33 56 43  00 00 03 08  04 00 fc 15  00 00 04 00  U3VC............  1.7ms       474.1.0        10:00:50.007
  15.1                             24  OUT    55 33 56 43  00 40 02 08  0c 00 fd 15  0c 00 90 00  U3VC.@..........  200us       475.1.0        10:00:50.007
                                              00 00 00 00  b8 02 00 00                            ........                      475.1.16
  15.1                             16  IN     55 33 56 43  00 00 03 08  04 00 fd 15  00 00 04 00  U3VC............  1.7ms       476.1.0        10:00:50.009
  15.1                             24  OUT    55 33 56 43  00 40 02 08  0c 00 fe 15  00 00 80 00  U3VC.@..........  247us       477.1.0        10:00:50.009
                                              00 00 00 00  02 00 00 00                            ........                      477.1.16
  15.1                             16  IN     55 33 56 43  00 00 03 08  04 00 fe 15  00 00 04 00  U3VC............  498us       478.1.0        10:00:50.009
  15.1                             24  OUT    55 33 56 43  00 40 00 08  0c 00 ff 15  3c 00 90 00  U3VC.@......<...  160us       479.1.0        10:00:50.009
                                              00 00 00 00  00 00 04 00                            ........                      479.1.16
  15.1                             16  IN     55 33 56 43  00 00 01 08  04 00 ff 15  00 00 00 00  U3VC............  713us       480.1.0        10:00:50.010
  15.1                             24  OUT    55 33 56 43  00 40 02 08  0c 00 00 16  38 00 90 00  U3VC.@......8...  136us       481.1.0        10:00:50.010
                                              00 00 00 00  14 00 00 00                            ........                      481.1.16
  15.1                             16  IN     55 33 56 43  00 00 03 08  04 00 00 16  00 00 04 00  U3VC............  1.0ms       482.1.0        10:00:50.012
  15.1                             24  OUT    55 33 56 43  00 40 00 08  0c 00 01 16  3c 00 90 00  U3VC.@......<...  118us       483.1.0        10:00:50.012
                                              00 00 00 00  00 00 04 00                            ........                      483.1.16
  15.1                             16  IN     55 33 56 43  00 00 01 08  04 00 01 16  00 00 00 00  U3VC............  783us       484.1.0        10:00:50.013
  15.1                             24  OUT    55 33 56 43  00 40 00 08  0c 00 02 16  38 00 90 00  U3VC.@......8...   76us       485.1.0        10:00:50.013
                                              00 00 00 00  00 00 04 00                            ........                      485.1.16
  15.1                             16  IN     55 33 56 43  00 00 01 08  04 00 02 16  14 00 00 00  U3VC............  679us       486.1.0        10:00:50.013
  15.1                             24  OUT    55 33 56 43  00 40 02 08  0c 00 03 16  04 00 02 00  U3VC.@..........  135us       487.1.0        10:00:50.013
                                              00 00 00 00  00 00 00 00                            ........                      487.1.16
  15.1                             16  IN     55 33 56 43  00 00 03 08  04 00 03 16  00 00 04 00  U3VC............  9.5ms       488.1.0        10:00:50.023
  15.1                             24  OUT    55 33 56 43  00 40 00 08  0c 00 04 16  00 00 02 00  U3VC.@..........  5.7ms       489.1.0        10:00:50.029
                                              00 00 00 00  00 00 04 00                            ........                      489.1.16
  15.1                             16  IN     55 33 56 43  00 00 01 08  04 00 04 16  00 00 00 0a  U3VC............  701us       490.1.0        10:00:50.029
  15.1                             24  OUT    55 33 56 43  00 40 00 08  0c 00 05 16  08 00 02 00  U3VC.@..........  125us       491.1.0        10:00:50.029
                                              00 00 00 00  00 00 08 00                            ........                      491.1.16
  15.1                             20  IN     55 33 56 43  00 00 01 08  08 00 05 16  48 31 0c 00  U3VC........H1..  710us       492.1.0        10:00:50.030
                                              00 00 00 00                                         ....                          492.1.16
  15.1                             24  OUT    55 33 56 43  00 40 00 08  0c 00 06 16  10 00 02 00  U3VC.@..........  127us       493.1.0        10:00:50.030
                                              00 00 00 00  00 00 04 00                            ........                      493.1.16
  15.1                             16  IN     55 33 56 43  00 00 01 08  04 00 06 16  34 00 00 00  U3VC........4...  704us       494.1.0        10:00:50.030
  15.1                             24  OUT    55 33 56 43  00 40 00 08  0c 00 07 16  14 00 02 00  U3VC.@..........  125us       495.1.0        10:00:50.032
                                              00 00 00 00  00 00 04 00                            ........                      495.1.16
  15.1                             16  IN     55 33 56 43  00 00 01 08  04 00 07 16  24 00 00 00  U3VC........$...  733us       496.1.0        10:00:50.032
  15.1                             24  OUT    55 33 56 43  00 40 02 08  0c 00 08 16  18 00 02 00  U3VC.@..........  132us       497.1.0        10:00:50.032
                                              00 00 00 00  00 04 00 00                            ........                      497.1.16
  15.1                             16  IN     55 33 56 43  00 00 03 08  04 00 08 16  00 00 04 00  U3VC............  509us       498.1.0        10:00:50.033
  15.1                             24  OUT    55 33 56 43  00 40 02 08  0c 00 09 16  1c 00 02 00  U3VC.@..........  132us       499.1.0        10:00:50.033
                                              00 00 00 00  00 70 00 00                            .....p..                      499.1.16
  15.1                             16  IN     55 33 56 43  00 00 03 08  04 00 09 16  00 00 04 00  U3VC............  492us       500.1.0        10:00:50.033
  15.1                             24  OUT    55 33 56 43  00 40 02 08  0c 00 0a 16  20 00 02 00  U3VC.@...... ...  128us       501.1.0        10:00:50.033
                                              00 00 00 00  1b 00 00 00                            ........                      501.1.16
  15.1                             16  IN     55 33 56 43  00 00 03 08  04 00 0a 16  00 00 04 00  U3VC............  487us       502.1.0        10:00:50.034
  15.1                             24  OUT    55 33 56 43  00 40 02 08  0c 00 0b 16  24 00 02 00  U3VC.@......$...  108us       503.1.0        10:00:50.034
                                              00 00 00 00  00 60 00 00                            .....`..                      503.1.16
  15.1                             16  IN     55 33 56 43  00 00 03 08  04 00 0b 16  00 00 04 00  U3VC............  483us       504.1.0        10:00:50.034
  15.1                             24  OUT    55 33 56 43  00 40 02 08  0c 00 0c 16  28 00 02 00  U3VC.@......(...  131us       505.1.0        10:00:50.034
                                              00 00 00 00  00 04 00 00                            ........                      505.1.16
  15.1                             16  IN     55 33 56 43  00 00 03 08  04 00 0c 16  00 00 04 00  U3VC............  485us       506.1.0        10:00:50.035
  15.1                             24  OUT    55 33 56 43  00 40 02 08  0c 00 0d 16  2c 00 02 00  U3VC.@......,...  151us       507.1.0        10:00:50.035
                                              00 00 00 00  00 04 00 00                            ........                      507.1.16
  15.1                             16  IN     55 33 56 43  00 00 03 08  04 00 0d 16  00 00 04 00  U3VC............  506us       508.1.0        10:00:50.035
  15.1                             24  OUT    55 33 56 43  00 40 02 08  0c 00 0e 16  04 00 02 00  U3VC.@..........  130us       509.1.0        10:00:50.035
                                              00 00 00 00  01 00 00 00                            ........                      509.1.16
  15.1                             16  IN     55 33 56 43  00 00 03 08  04 00 0e 16  00 00 04 00  U3VC............  2.7ms       510.1.0        10:00:50.038
  15.1                             24  OUT    55 33 56 43  00 40 02 08  0c 00 0f 16  04 00 80 00  U3VC.@..........  6.2ms       511.1.0        10:00:50.045
                                              00 00 00 00  01 00 00 00                            ........                      511.1.16
  15.3                             52  IN     55 33 56 4c  00 00 34 00  00 00 00 00  00 00 00 00  U3VL..4.........  1.5ms       512.1.0        10:00:50.046
                                              00 00 01 40  3b 96 46 41  0b 00 00 00  09 00 08 01  ...@;.FA........              512.1.16
                                              7c 04 00 00  b8 02 00 00  00 00 00 00  00 00 00 00  ................              512.1.32
                                              00 00 00 00                                         ....                          512.1.48
  15.1                             16  IN     55 33 56 43  00 00 03 08  04 00 0f 16  00 00 04 00  U3VC............   89us       513.1.0        10:00:50.046
  15.3                          28672  IN     00 00 00 00  00 00 00 00  00 00 00 00  00 00 00 00  ................  955us       514.1.0(29)    10:00:50.048
                                              00 00 00 00  00 00 00 00  00 00 00 00  00 00 00 00  ................              514.1.16
                                              00 00 00 00  00 00 00 00  00 00 00 00  00 00 00 00  ................              514.1.32
                                              00 00 00 00  00 00 00 00  00 00 00 00  00 00 00 00  ................              514.1.48
  15.3                             36  IN     55 33 56 54  00 00 24 00  00 00 00 00  00 00 00 00  U3VT..$.........   22ms       543.1.0        10:00:50.070
                                              00 00 00 00  48 31 0c 00  00 00 00 00  b8 02 00 00  ....H1..........              543.1.16
                                              09 00 00 00                                         ....                          543.1.32
  15.3                             52  IN     55 33 56 4c  00 00 34 00  01 00 00 00  00 00 00 00  U3VL..4.........  1.5ms       544.1.0        10:00:50.071
                                              00 00 01 40  ee 13 c9 42  0b 00 00 00  09 00 08 01  ...@...B........              544.1.16
                                              7c 04 00 00  b8 02 00 00  00 00 00 00  00 00 00 00  ................              544.1.32
                                              00 00 00 00                                         ....                          544.1.48
  15.3                          28672  IN     00 00 00 00  00 00 00 00  00 00 00 00  00 00 00 00  ................  979us       545.1.0(6)     10:00:50.073
                                              00 00 00 00  00 00 00 00  00 00 00 00  00 00 00 00  ................              545.1.16
                                              00 00 00 00  00 00 00 00  00 00 00 00  00 00 00 00  ................              545.1.32
                                              00 00 00 00  00 00 00 00  00 00 00 00  00 00 00 00  ................              545.1.48
  15.3                          28672  IN     00 00 00 00  00 00 00 00  00 00 00 00  00 00 00 00  ................  5.7ms       551.1.0        10:00:50.079
                                              00 00 00 00  00 00 00 00  00 00 00 00  00 00 00 00  ................              551.1.16
                                              00 00 00 00  00 00 00 00  00 00 00 00  00 00 00 00  ................              551.1.32
                                              00 00 00 00  00 00 00 00  00 00 00 00  00 00 01 00  ................              551.1.48
  15.3                          28672  IN     00 00 00 00  00 00 00 00  00 00 00 00  00 00 00 00  ................   55us       552.1.0        10:00:50.079
                                              00 00 00 00  00 00 00 00  00 00 00 00  00 00 00 00  ................              552.1.16
                                              00 00 00 00  00 00 00 00  00 00 00 00  00 01 00 00  ................              552.1.32
                                              00 00 00 00  00 00 00 00  00 00 00 00  00 00 00 00  ................              552.1.48
  15.3                          28672  IN     00 00 00 00  00 00 00 00  00 00 00 00  00 00 00 00  ................  1.0ms       553.1.0(3)     10:00:50.079
                                              00 00 00 00  00 00 00 00  00 00 00 00  00 00 00 00  ................              553.1.16
                                              00 00 00 00  00 00 00 00  00 00 00 00  00 00 00 00  ................              553.1.32
                                              00 00 00 00  00 00 00 00  00 00 00 00  00 00 00 00  ................              553.1.48
  15.3                          28672  IN     00 00 00 00  00 00 00 00  00 00 00 00  00 00 00 00  ................  2.8ms       556.1.0        10:00:50.083
                                              00 00 00 00  00 00 00 00  00 01 00 00  00 00 00 00  ................              556.1.16
                                              00 00 00 00  00 00 00 00  00 00 00 00  00 00 00 00  ................              556.1.32
                                              00 00 00 00  00 00 00 00  00 00 00 00  00 00 00 00  ................              556.1.48
  15.3                          28672  IN     00 00 00 00  00 00 00 00  00 00 00 00  00 00 00 00  ................  1.0ms       557.1.0(5)     10:00:50.084
                                              00 00 00 00  00 00 00 00  00 00 00 00  00 00 00 00  ................              557.1.16
                                              00 00 00 00  00 00 00 00  00 00 00 00  00 00 00 00  ................              557.1.32
                                              00 00 00 00  00 00 00 00  00 00 00 00  00 00 00 00  ................              557.1.48
  15.3                          28672  IN     00 00 00 00  00 00 00 00  00 00 00 00  00 00 00 00  ................  3.8ms       562.1.0        10:00:50.088
                                              00 01 00 00  00 00 00 00  00 00 00 00  00 00 00 00  ................              562.1.16
                                              00 00 00 00  00 00 00 00  00 00 00 00  00 00 00 00  ................              562.1.32
                                              00 00 00 00  00 00 00 00  00 00 00 00  00 00 00 00  ................              562.1.48
  15.3                          28672  IN     00 00 00 00  00 00 00 00  00 00 00 00  00 00 00 00  ................  957us       563.1.0(2)     10:00:50.088
                                              00 00 00 00  00 00 00 00  00 00 00 00  00 00 00 00  ................              563.1.16
                                              00 00 00 00  00 00 00 00  00 00 00 00  00 00 00 00  ................              563.1.32
                                              00 00 00 00  00 00 00 00  00 00 00 00  00 00 00 00  ................              563.1.48
  15.3                          28672  IN     01 00 00 00  00 00 00 00  00 00 00 00  00 00 00 00  ................  1.9ms       565.1.0        10:00:50.090
                                              00 00 00 00  00 00 00 00  00 00 00 00  00 00 00 00  ................              565.1.16
                                              00 00 00 00  00 00 00 00  00 00 00 00  00 00 00 00  ................              565.1.32
                                              00 00 00 00  00 00 00 00  00 00 00 00  00 00 00 00  ................              565.1.48
  15.3                          28672  IN     00 00 00 00  00 00 00 00  00 00 00 00  00 00 00 00  ................  973us       566.1.0(8)     10:00:50.091
                                              00 00 00 00  00 00 00 00  00 00 00 00  00 00 00 00  ................              566.1.16
                                              00 00 00 00  00 00 00 00  00 00 00 00  00 00 00 00  ................              566.1.32
                                              00 00 00 00  00 00 00 00  00 00 00 00  00 00 00 00  ................              566.1.48
  15.3                             36  IN     55 33 56 54  00 00 24 00  01 00 00 00  00 00 00 00  U3VT..$.........  4.2ms       574.1.0        10:00:50.095
                                              00 00 00 00  48 31 0c 00  00 00 00 00  b8 02 00 00  ....H1..........              574.1.16
                                              09 00 00 00                                         ....                          574.1.32
  15.3                             52  IN     55 33 56 4c  00 00 34 00  02 00 00 00  00 00 00 00  U3VL..4.........  1.5ms       575.1.0        10:00:50.096
                                              00 00 01 40  88 91 4b 44  0b 00 00 00  09 00 08 01  ...@..KD........              575.1.16
                                              7c 04 00 00  b8 02 00 00  00 00 00 00  00 00 00 00  ................              575.1.32
                                              00 00 00 00                                         ....                          575.1.48
  15.3                          28672  IN     00 00 00 00  00 00 00 00  00 00 00 00  00 00 00 00  ................  1.0ms       576.1.0(27)    10:00:50.098
                                              00 00 00 00  00 00 00 00  00 00 00 00  00 00 00 00  ................              576.1.16
                                              00 00 00 00  00 00 00 00  00 00 00 00  00 00 00 00  ................              576.1.32
                                              00 00 00 00  00 00 00 00  00 00 00 00  00 00 00 00  ................              576.1.48
  15.3                          24576  IN     00 00 00 00  00 00 00 00  00 00 00 00  00 01 00 00  ................   22ms       603.1.0        10:00:50.120
                                              00 00 00 00  00 00 00 00  00 00 00 00  00 00 00 00  ................              603.1.16
                                              00 00 00 00  00 00 00 00  00 00 00 00  00 00 00 00  ................              603.1.32
                                              00 00 00 00  00 00 00 00  00 00 00 00  00 00 00 00  ................              603.1.48
  15.3                            328  IN     00 00 00 00  00 00 00 00  00 00 00 00  00 00 00 00  ................   15us       604.1.0        10:00:50.120
                                              00 00 00 00  00 00 00 00  00 00 00 00  00 00 00 00  ................              604.1.16
                                              00 00 00 00  00 00 00 00  00 00 00 00  00 00 00 00  ................              604.1.32
                                              00 00 00 00  00 00 00 00  00 00 00 00  00 00 00 00  ................              604.1.48
  15.3                             36  IN     55 33 56 54  00 00 24 00  02 00 00 00  00 00 00 00  U3VT..$.........   14us       605.1.0        10:00:50.120
                                              00 00 00 00  48 31 0c 00  00 00 00 00  b8 02 00 00  ....H1..........              605.1.16
                                              09 00 00 00                                         ....                          605.1.32
  15.3                             52  IN     55 33 56 4c  00 00 34 00  03 00 00 00  00 00 00 00  U3VL..4.........  1.6ms       606.1.0        10:00:50.123
                                              00 00 01 40  3b 0f ce 45  0b 00 00 00  09 00 08 01  ...@;..E........              606.1.16
                                              7c 04 00 00  b8 02 00 00  00 00 00 00  00 00 00 00  ................              606.1.32
                                              00 00 00 00                                         ....                          606.1.48
  15.3                          28672  IN     00 00 00 00  00 00 00 00  00 00 00 00  00 00 00 00  ................  1.0ms       607.1.0        10:00:50.124
                                              00 00 00 00  00 00 00 00  00 00 00 00  00 00 00 00  ................              607.1.16
                                              00 00 00 00  00 00 00 01  00 00 00 00  00 00 00 00  ................              607.1.32
                                              00 00 00 00  00 00 00 00  00 00 00 00  00 00 00 00  ................              607.1.48
  15.3                          28672  IN     00 00 00 00  00 00 00 00  00 00 00 00  00 00 00 00  ................  979us       608.1.0(15)    10:00:50.124
                                              00 00 00 00  00 00 00 00  00 00 00 00  00 00 00 00  ................              608.1.16
                                              00 00 00 00  00 00 00 00  00 00 00 00  00 00 00 00  ................              608.1.32
                                              00 00 00 00  00 00 00 00  00 00 00 00  00 00 00 00  ................              608.1.48
  15.3                          28672  IN     00 00 00 00  00 00 00 00  00 00 00 00  00 00 01 00  ................   12ms       623.1.0        10:00:50.136
                                              00 00 00 00  00 00 00 00  00 00 00 00  00 00 00 00  ................              623.1.16
                                              00 00 00 00  00 00 00 00  00 00 00 00  00 00 00 00  ................              623.1.32
                                              00 00 00 00  00 00 00 00  00 00 00 00  00 00 00 00  ................              623.1.48
  15.3                          28672  IN     00 00 00 00  00 00 00 00  00 00 00 00  00 00 00 00  ................  922us       624.1.0(11)    10:00:50.138
                                              00 00 00 00  00 00 00 00  00 00 00 00  00 00 00 00  ................              624.1.16
                                              00 00 00 00  00 00 00 00  00 00 00 00  00 00 00 00  ................              624.1.32
                                              00 00 00 00  00 00 00 00  00 00 00 00  00 00 00 00  ................              624.1.48
  15.3                            328  IN     00 00 00 00  00 00 00 00  00 00 00 00  00 00 00 00  ................  8.1ms       635.1.0        10:00:50.146
                                              00 00 00 00  00 00 00 00  00 00 00 00  00 00 00 00  ................              635.1.16
                                              00 00 01 00  00 00 00 00  00 00 00 00  00 00 00 00  ................              635.1.32
                                              00 00 00 00  00 00 00 00  00 00 00 00  00 00 00 00  ................              635.1.48
  15.3                             36  IN     55 33 56 54  00 00 24 00  03 00 00 00  00 00 00 00  U3VT..$.........   12us       636.1.0        10:00:50.146
                                              00 00 00 00  48 31 0c 00  00 00 00 00  b8 02 00 00  ....H1..........              636.1.16
                                              09 00 00 00                                         ....                          636.1.32
  15.3                             52  IN     55 33 56 4c  00 00 34 00  04 00 00 00  00 00 00 00  U3VL..4.........  1.6ms       637.1.0        10:00:50.148
                                              00 00 01 40  ee 8c 50 47  0b 00 00 00  09 00 08 01  ...@..PG........              637.1.16
                                              7c 04 00 00  b8 02 00 00  00 00 00 00  00 00 00 00  ................              637.1.32
                                              00 00 00 00                                         ....                          637.1.48
  15.3                          28672  IN     00 00 00 00  00 00 00 00  00 00 00 00  00 00 00 00  ................  1.0ms       638.1.0(29)    10:00:50.149
                                              00 00 00 00  00 00 00 00  00 00 00 00  00 00 00 00  ................              638.1.16
                                              00 00 00 00  00 00 00 00  00 00 00 00  00 00 00 00  ................              638.1.32
                                              00 00 00 00  00 00 00 00  00 00 00 00  00 00 00 00  ................              638.1.48
  15.3                             36  IN     55 33 56 54  00 00 24 00  04 00 00 00  00 00 00 00  U3VT..$.........   22ms       667.1.0        10:00:50.171
                                              00 00 00 00  48 31 0c 00  00 00 00 00  b8 02 00 00  ....H1..........              667.1.16
                                              09 00 00 00                                         ....                          667.1.32
  15.1                             24  OUT    55 33 56 43  00 40 02 08  0c 00 10 16  04 00 80 00  U3VC.@..........  182us       668.1.0        10:00:50.171
                                              00 00 00 00  00 00 00 00                            ........                      668.1.16
  15.1                             16  IN     55 33 56 43  00 00 03 08  04 00 10 16  00 00 04 00  U3VC............  770us       669.1.0        10:00:50.173
  15.1                             24  OUT    55 33 56 43  00 40 00 08  0c 00 11 16  08 00 02 00  U3VC.@..........  385us       670.1.0        10:00:50.173
                                              00 00 00 00  00 00 04 00                            ........                      670.1.16
  15.1                             16  IN     55 33 56 43  00 00 01 08  04 00 11 16  48 31 0c 00  U3VC........H1..  673us       671.1.0        10:00:50.174
  15.1                             24  OUT    55 33 56 43  00 40 02 08  0c 00 12 16  04 00 02 00  U3VC.@..........  3.9ms       672.1.0        10:00:50.178
                                              00 00 00 00  00 00 00 00                            ........                      672.1.16
  15.1                             16  IN     55 33 56 43  00 00 03 08  04 00 12 16  00 00 04 00  U3VC............  9.5ms       673.1.0        10:00:50.186
  15.1                             24  OUT    55 33 56 43  00 40 00 08  0c 00 13 16  d8 01 00 00  U3VC.@..........  913us       674.1.0        10:00:50.188
                                              00 00 00 00  00 00 08 00                            ........                      674.1.16
  15.1                             20  IN     55 33 56 43  00 00 01 08  08 00 13 16  00 00 01 00  U3VC............  680us       675.1.0        10:00:50.189
                                              00 00 00 00                                         ....                          675.1.16
  15.1                             24  OUT    55 33 56 43  00 40 00 08  0c 00 14 16  04 00 01 00  U3VC.@..........  711us       676.1.0        10:00:50.189
                                              00 00 00 00  00 00 08 00                            ........                      676.1.16
  15.1                             20  IN     55 33 56 43  00 00 01 08  08 00 14 16  03 00 00 00  U3VC............  663us       677.1.0        10:00:50.190
                                              00 00 00 00                                         ....                          677.1.16
  15.1                             24  OUT    55 33 56 43  00 40 00 08  0c 00 15 16  20 00 01 00  U3VC.@...... ...  146us       678.1.0        10:00:50.190
                                              00 00 00 00  00 00 08 00                            ........                      678.1.16
  15.1                             20  IN     55 33 56 43  00 00 01 08  08 00 15 16  00 00 02 00  U3VC............  673us       679.1.0        10:00:50.190
                                              00 00 00 00                                         ....                          679.1.16
  15.1                             24  OUT    55 33 56 43  00 40 00 08  0c 00 16 16  04 00 01 00  U3VC.@..........  654us       680.1.0        10:00:50.191
                                              00 00 00 00  00 00 08 00                            ........                      680.1.16
  15.1                             20  IN     55 33 56 43  00 00 01 08  08 00 16 16  03 00 00 00  U3VC............  678us       681.1.0        10:00:50.191
                                              00 00 00 00                                         ....                          681.1.16
  15.1                             24  OUT    55 33 56 43  00 40 00 08  0c 00 17 16  2c 00 01 00  U3VC.@......,...  138us       682.1.0        10:00:50.193
                                              00 00 00 00  00 00 08 00                            ........                      682.1.16
  15.1                             20  IN     55 33 56 43  00 00 01 08  08 00 17 16  00 10 02 00  U3VC............  673us       683.1.0        10:00:50.193
                                              00 00 00 00                                         ....                          683.1.16
  15.1                             24  OUT    55 33 56 43  00 40 02 08  0c 00 18 16  08 00 90 00  U3VC.@..........  989us       684.1.0        10:00:50.194
                                              00 00 00 00  4c 00 00 00                            ....L...                      684.1.16
  15.1                             16  IN     55 33 56 43  00 00 03 08  04 00 18 16  00 00 04 00  U3VC............  1.7ms       685.1.0        10:00:50.195
  15.1                             24  OUT    55 33 56 43  00 40 02 08  0c 00 19 16  0c 00 90 00  U3VC.@..........  194us       686.1.0        10:00:50.195
                                              00 00 00 00  96 03 00 00                            ........                      686.1.16
  15.1                             16  IN     55 33 56 43  00 00 03 08  04 00 19 16  00 00 04 00  U3VC............  1.8ms       687.1.0        10:00:50.198
  15.1                             24  OUT    55 33 56 43  00 40 02 08  0c 00 1a 16  00 00 80 00  U3VC.@..........  168us       688.1.0        10:00:50.198
                                              00 00 00 00  02 00 00 00                            ........                      688.1.16
  15.1                             16  IN     55 33 56 43  00 00 03 08  04 00 1a 16  00 00 04 00  U3VC............  520us       689.1.0        10:00:50.198
  15.1                             24  OUT    55 33 56 43  00 40 00 08  0c 00 1b 16  3c 00 90 00  U3VC.@......<...  253us       690.1.0        10:00:50.199
                                              00 00 00 00  00 00 04 00                            ........                      690.1.16
  15.1                             16  IN     55 33 56 43  00 00 01 08  04 00 1b 16  00 00 00 00  U3VC............  692us       691.1.0        10:00:50.199
  15.1                             24  OUT    55 33 56 43  00 40 02 08  0c 00 1c 16  38 00 90 00  U3VC.@......8...  157us       692.1.0        10:00:50.199
                                              00 00 00 00  14 00 00 00                            ........                      692.1.16
  15.1                             16  IN     55 33 56 43  00 00 03 08  04 00 1c 16  00 00 04 00  U3VC............  1.0ms       693.1.0        10:00:50.200
  15.1                             24  OUT    55 33 56 43  00 40 00 08  0c 00 1d 16  3c 00 90 00  U3VC.@......<...  169us       694.1.0        10:00:50.200
                                              00 00 00 00  00 00 04 00                            ........                      694.1.16
  15.1                             16  IN     55 33 56 43  00 00 01 08  04 00 1d 16  00 00 00 00  U3VC............  673us       695.1.0        10:00:50.201
  15.1                             24  OUT    55 33 56 43  00 40 00 08  0c 00 1e 16  38 00 90 00  U3VC.@......8...  197us       696.1.0        10:00:50.201
                                              00 00 00 00  00 00 04 00                            ........                      696.1.16
  15.1                             16  IN     55 33 56 43  00 00 01 08  04 00 1e 16  14 00 00 00  U3VC............  631us       697.1.0        10:00:50.203
  15.1                             24  OUT    55 33 56 43  00 40 02 08  0c 00 1f 16  04 00 02 00  U3VC.@..........  191us       698.1.0        10:00:50.203
                                              00 00 00 00  00 00 00 00                            ........                      698.1.16
  15.1                             16  IN     55 33 56 43  00 00 03 08  04 00 1f 16  00 00 04 00  U3VC............  9.5ms       699.1.0        10:00:50.211
  15.1                             24  OUT    55 33 56 43  00 40 00 08  0c 00 20 16  00 00 02 00  U3VC.@.... .....  5.3ms       700.1.0        10:00:50.218
                                              00 00 00 00  00 00 04 00                            ........                      700.1.16
  15.1                             16  IN     55 33 56 43  00 00 01 08  04 00 20 16  00 00 00 0a  U3VC...... .....  719us       701.1.0        10:00:50.218
  15.1                             24  OUT    55 33 56 43  00 40 00 08  0c 00 21 16  08 00 02 00  U3VC.@....!.....  151us       702.1.0        10:00:50.218
                                              00 00 00 00  00 00 08 00                            ........                      702.1.16
  15.1                             20  IN     55 33 56 43  00 00 01 08  08 00 21 16  b0 10 01 00  U3VC......!.....  695us       703.1.0        10:00:50.219
                                              00 00 00 00                                         ....                          703.1.16
  15.1                             24  OUT    55 33 56 43  00 40 00 08  0c 00 22 16  10 00 02 00  U3VC.@....".....  149us       704.1.0        10:00:50.219
                                              00 00 00 00  00 00 04 00                            ........                      704.1.16
  15.1                             16  IN     55 33 56 43  00 00 01 08  04 00 22 16  34 00 00 00  U3VC......".4...  688us       705.1.0        10:00:50.220
  15.1                             24  OUT    55 33 56 43  00 40 00 08  0c 00 23 16  14 00 02 00  U3VC.@....#.....  142us       706.1.0        10:00:50.220
                                              00 00 00 00  00 00 04 00                            ........                      706.1.16
  15.1                             16  IN     55 33 56 43  00 00 01 08  04 00 23 16  24 00 00 00  U3VC......#.$...  680us       707.1.0        10:00:50.220
  15.1                             24  OUT    55 33 56 43  00 40 02 08  0c 00 24 16  18 00 02 00  U3VC.@....$.....  133us       708.1.0        10:00:50.220
                                              00 00 00 00  00 04 00 00                            ........                      708.1.16
  15.1                             16  IN     55 33 56 43  00 00 03 08  04 00 24 16  00 00 04 00  U3VC......$.....  489us       709.1.0        10:00:50.221
  15.1                             24  OUT    55 33 56 43  00 40 02 08  0c 00 25 16  1c 00 02 00  U3VC.@....%.....  140us       710.1.0        10:00:50.221
                                              00 00 00 00  00 64 00 00                            .....d..                      710.1.16
  15.1                             16  IN     55 33 56 43  00 00 03 08  04 00 25 16  00 00 04 00  U3VC......%.....  463us       711.1.0        10:00:50.221
  15.1                             24  OUT    55 33 56 43  00 40 02 08  0c 00 26 16  20 00 02 00  U3VC.@....&. ...   67us       712.1.0        10:00:50.221
                                              00 00 00 00  02 00 00 00                            ........                      712.1.16
  15.1                             16  IN     55 33 56 43  00 00 03 08  04 00 26 16  00 00 04 00  U3VC......&.....  472us       713.1.0        10:00:50.223
  15.1                             24  OUT    55 33 56 43  00 40 02 08  0c 00 27 16  24 00 02 00  U3VC.@....'.$...   95us       714.1.0        10:00:50.223
                                              00 00 00 00  00 48 00 00                            .....H..                      714.1.16
  15.1                             16  IN     55 33 56 43  00 00 03 08  04 00 27 16  00 00 04 00  U3VC......'.....  479us       715.1.0        10:00:50.223
  15.1                             24  OUT    55 33 56 43  00 40 02 08  0c 00 28 16  28 00 02 00  U3VC.@....(.(...   90us       716.1.0        10:00:50.223
                                              00 00 00 00  00 04 00 00                            ........                      716.1.16
  15.1                             16  IN     55 33 56 43  00 00 03 08  04 00 28 16  00 00 04 00  U3VC......(.....  485us       717.1.0        10:00:50.224
  15.1                             24  OUT    55 33 56 43  00 40 02 08  0c 00 29 16  2c 00 02 00  U3VC.@....).,...   85us       718.1.0        10:00:50.224
                                              00 00 00 00  00 04 00 00                            ........                      718.1.16
  15.1                             16  IN     55 33 56 43  00 00 03 08  04 00 29 16  00 00 04 00  U3VC......).....  477us       719.1.0        10:00:50.224
  15.1                             24  OUT    55 33 56 43  00 40 02 08  0c 00 2a 16  04 00 02 00  U3VC.@....*.....   91us       720.1.0        10:00:50.224
                                              00 00 00 00  01 00 00 00                            ........                      720.1.16
  15.1                             16  IN     55 33 56 43  00 00 03 08  04 00 2a 16  00 00 04 00  U3VC......*.....  2.7ms       721.1.0        10:00:50.226
  15.1                             24  OUT    55 33 56 43  00 40 02 08  0c 00 2b 16  04 00 80 00  U3VC.@....+.....  911us       722.1.0        10:00:50.228
                                              00 00 00 00  01 00 00 00                            ........                      722.1.16
  15.1                             16  IN     55 33 56 43  00 00 03 08  04 00 2b 16  00 00 04 00  U3VC......+.....  1.6ms       723.1.0        10:00:50.229
  15.3                             52  IN     55 33 56 4c  00 00 34 00  00 00 00 00  00 00 00 00  U3VL..4.........  117us       724.1.0        10:00:50.229
                                              00 00 01 40  48 64 2e 4c  0b 00 00 00  09 00 08 01  ...@Hd.L........              724.1.16
                                              4c 00 00 00  96 03 00 00  00 00 00 00  00 00 00 00  L...............              724.1.32
                                              00 00 00 00                                         ....                          724.1.48
  15.3                          25600  IN     00 00 00 00  00 00 00 00  00 00 00 00  00 00 00 00  ................   14ms       725.1.0        10:00:50.244
                                              00 00 00 00  00 00 00 00  00 00 00 00  00 00 00 00  ................              725.1.16
                                              00 00 00 00  00 00 00 00  00 00 00 01  00 00 00 00  ................              725.1.32
                                              00 00 00 00  00 00 00 00  00 00 00 00  00 00 00 00  ................              725.1.48
  15.3                          25600  IN     00 00 00 00  00 00 00 00  00 00 00 00  00 00 00 00  ................   14ms       726.1.0        10:00:50.259
                                              00 00 00 00  00 00 00 00  00 00 00 00  00 00 00 00  ................              726.1.16
                                              00 00 00 00  00 00 00 00  00 00 00 00  00 00 00 00  ................              726.1.32
                                              00 00 00 00  00 00 00 00  00 00 00 00  00 00 00 00  ................              726.1.48
  15.3                          18432  IN     00 00 00 00  00 00 00 00  00 00 00 00  01 00 00 00  ................  1.6ms       727.1.0        10:00:50.260
                                              00 00 00 00  00 00 00 00  00 00 00 00  00 00 00 00  ................              727.1.16
                                              00 00 00 00  00 00 00 00  00 00 00 00  00 00 00 00  ................              727.1.32
                                              00 00 00 00  00 00 00 00  00 00 00 00  00 00 00 00  ................              727.1.48
  15.3                            176  IN     00 00 00 00  00 00 00 00  00 00 00 00  00 00 00 00  ................   14us       728.1.0        10:00:50.260
                                              00 00 00 00  00 00 00 00  00 00 00 00  00 00 00 00  ................              728.1.16
                                              00 00 00 00  00 00 00 00  00 00 00 00  00 00 00 00  ................              728.1.32
                                              00 00 00 00  00 00 00 00  00 00 00 00  00 00 00 00  ................              728.1.48
  15.3                             36  IN     55 33 56 54  00 00 24 00  00 00 00 00  00 00 00 00  U3VT..$.........   14us       729.1.0        10:00:50.260
                                              00 00 00 00  b0 10 01 00  00 00 00 00  96 03 00 00  ................              729.1.16
                                              09 00 00 00                                         ....                          729.1.32
  15.3                             52  IN     55 33 56 4c  00 00 34 00  01 00 00 00  00 00 00 00  U3VL..4.........  807us       730.1.0        10:00:50.261
                                              00 00 01 40  4c a9 15 4e  0b 00 00 00  09 00 08 01  ...@L..N........              730.1.16
                                              4c 00 00 00  96 03 00 00  00 00 00 00  00 00 00 00  L...............              730.1.32
                                              00 00 00 00                                         ....                          730.1.48
  15.3                          25600  IN     00 00 00 00  00 00 00 00  00 00 00 00  00 00 00 00  ................   14ms       731.1.0(4)     10:00:50.276
                                              00 00 00 00  00 00 00 00  00 00 00 00  00 00 00 00  ................              731.1.16
                                              00 00 00 00  00 00 00 00  00 00 00 00  00 00 00 00  ................              731.1.32
                                              00 00 00 00  00 00 00 00  00 00 00 00  00 00 00 00  ................              731.1.48
  15.3                             36  IN     55 33 56 54  00 00 24 00  01 00 00 00  00 00 00 00  U3VT..$.........   16ms       735.1.0        10:00:50.293
                                              00 00 00 00  b0 10 01 00  00 00 00 00  96 03 00 00  ................              735.1.16
                                              09 00 00 00                                         ....                          735.1.32
  15.3                             52  IN     55 33 56 4c  00 00 34 00  02 00 00 00  00 00 00 00  U3VL..4.........  844us       736.1.0        10:00:50.294
                                              00 00 01 40  37 ee fc 4f  0b 00 00 00  09 00 08 01  ...@7..O........              736.1.16
                                              4c 00 00 00  96 03 00 00  00 00 00 00  00 00 00 00  L...............              736.1.32
                                              00 00 00 00                                         ....                          736.1.48
  15.3                          25600  IN     00 00 00 00  00 00 00 00  00 00 00 00  00 00 00 00  ................   14ms       737.1.0        10:00:50.308
                                              00 00 00 00  00 01 00 00  00 00 00 00  00 00 00 00  ................              737.1.16
                                              00 00 00 00  00 00 00 00  00 00 00 00  00 00 00 00  ................              737.1.32
                                              00 00 00 00  00 00 00 00  00 00 00 00  00 00 00 00  ................              737.1.48
  15.3                          25600  IN     00 00 00 01  00 00 00 00  00 00 00 00  00 00 00 00  ................   14ms       738.1.0        10:00:50.323
                                              00 00 00 00  00 00 00 00  01 00 00 00  00 00 00 00  ................              738.1.16
                                              00 00 00 00  00 00 00 00  00 00 00 00  00 00 00 00  ................              738.1.32
                                              00 00 00 00  00 00 00 00  00 00 00 00  00 00 00 00  ................              738.1.48
  15.3                          18432  IN     00 00 00 00  00 00 00 00  00 00 00 00  00 00 00 00  ................  1.7ms       739.1.0        10:00:50.324
                                              00 00 00 00  00 00 00 00  00 00 00 00  00 00 00 00  ................              739.1.16
                                              00 00 00 00  00 00 00 00  00 00 00 01  00 00 00 00  ................              739.1.32
                                              00 00 00 00  00 00 00 00  00 00 00 00  00 00 00 00  ................              739.1.48
  15.3                            176  IN     00 00 00 00  00 00 00 00  00 00 00 00  00 00 00 00  ................   13us       740.1.0        10:00:50.324
                                              00 00 00 00  00 00 00 00  00 00 00 00  00 00 00 00  ................              740.1.16
                                              00 00 00 00  00 00 00 00  00 00 00 00  00 00 00 00  ................              740.1.32
                                              00 00 00 00  00 00 00 00  00 00 00 00  00 00 00 00  ................              740.1.48
  15.3                             36  IN     55 33 56 54  00 00 24 00  02 00 00 00  00 00 00 00  U3VT..$.........   13us       741.1.0        10:00:50.324
                                              00 00 00 00  b0 10 01 00  00 00 00 00  96 03 00 00  ................              741.1.16
                                              09 00 00 00                                         ....                          741.1.32
  15.3                             52  IN     55 33 56 4c  00 00 34 00  03 00 00 00  00 00 00 00  U3VL..4.........  806us       742.1.0        10:00:50.325
                                              00 00 01 40  3b 33 e4 51  0b 00 00 00  09 00 08 01  ...@;3.Q........              742.1.16
                                              4c 00 00 00  96 03 00 00  00 00 00 00  00 00 00 00  L...............              742.1.32
                                              00 00 00 00                                         ....                          742.1.48
  15.3                          25600  IN     00 00 00 00  00 00 00 00  00 00 00 00  00 00 00 00  ................   14ms       743.1.0(2)     10:00:50.340
                                              00 00 00 00  00 00 00 00  00 00 00 00  00 00 00 00  ................              743.1.16
                                              00 00 00 00  00 00 00 00  00 00 00 00  00 00 00 00  ................              743.1.32
                                              00 00 00 00  00 00 00 00  00 00 00 00  00 00 00 00  ................              743.1.48
  15.3                          18432  IN     00 00 00 00  00 00 00 00  01 00 01 00  00 00 00 00  ................   16ms       745.1.0        10:00:50.356
                                              00 00 00 00  00 00 00 00  00 00 00 00  00 00 00 00  ................              745.1.16
                                              00 00 00 00  00 00 00 00  00 00 00 00  00 00 00 00  ................              745.1.32
                                              00 00 00 00  00 00 00 00  00 00 00 00  00 00 00 00  ................              745.1.48
  15.3                            176  IN     00 00 00 00  00 00 00 00  00 00 00 00  00 00 00 00  ................   16us       746.1.0        10:00:50.356
                                              00 00 00 00  00 00 00 00  00 00 00 00  00 00 00 00  ................              746.1.16
                                              00 00 00 00  00 00 00 00  00 00 01 00  00 00 00 00  ................              746.1.32
                                              00 00 00 00  00 00 00 00  00 00 00 00  00 00 00 00  ................              746.1.48
  15.3                             36  IN     55 33 56 54  00 00 24 00  03 00 00 00  00 00 00 00  U3VT..$.........   14us       747.1.0        10:00:50.356
                                              00 00 00 00  b0 10 01 00  00 00 00 00  96 03 00 00  ................              747.1.16
                                              09 00 00 00                                         ....                          747.1.32
  15.3                             52  IN     55 33 56 4c  00 00 34 00  04 00 00 00  00 00 00 00  U3VL..4.........  812us       748.1.0        10:00:50.358
                                              00 00 01 40  3f 78 cb 53  0b 00 00 00  09 00 08 01  ...@?x.S........              748.1.16
                                              4c 00 00 00  96 03 00 00  00 00 00 00  00 00 00 00  L...............              748.1.32
                                              00 00 00 00                                         ....                          748.1.48
  15.3                          25600  IN     00 00 00 00  00 00 00 00  00 00 00 00  00 00 00 00  ................   14ms       749.1.0(4)     10:00:50.371
                                              00 00 00 00  00 00 00 00  00 00 00 00  00 00 00 00  ................              749.1.16
                                              00 00 00 00  00 00 00 00  00 00 00 00  00 00 00 00  ................              749.1.32
                                              00 00 00 00  00 00 00 00  00 00 00 00  00 00 00 00  ................              749.1.48
  15.3                             36  IN     55 33 56 54  00 00 24 00  04 00 00 00  00 00 00 00  U3VT..$.........   16ms       753.1.0        10:00:50.389
                                              00 00 00 00  b0 10 01 00  00 00 00 00  96 03 00 00  ................              753.1.16
                                              09 00 00 00                                         ....                          753.1.32
  15.1                             24  OUT    55 33 56 43  00 40 02 08  0c 00 2c 16  04 00 80 00  U3VC.@....,.....  205us       754.1.0        10:00:50.389
                                              00 00 00 00  00 00 00 00                            ........                      754.1.16
  15.1                             16  IN     55 33 56 43  00 00 03 08  04 00 2c 16  00 00 04 00  U3VC......,.....  760us       755.1.0        10:00:50.389
  15.1                             24  OUT    55 33 56 43  00 40 00 08  0c 00 2d 16  08 00 02 00  U3VC.@....-.....  352us       756.1.0        10:00:50.390
                                              00 00 00 00  00 00 04 00                            ........                      756.1.16
  15.1                             16  IN     55 33 56 43  00 00 01 08  04 00 2d 16  b0 10 01 00  U3VC......-.....  686us       757.1.0        10:00:50.390
  15.1                             24  OUT    55 33 56 43  00 40 02 08  0c 00 2e 16  04 00 02 00  U3VC.@..........  2.4ms       758.1.0        10:00:50.393
                                              00 00 00 00  00 00 00 00                            ........                      758.1.16
  15.1                             16  IN     55 33 56 43  00 00 03 08  04 00 2e 16  00 00 04 00  U3VC............  9.5ms       759.1.0        10:00:50.403
  15.0                                 CTL    80 06 00 02  00 00 09 00                            GET DESCRIPTOR    2.3ms       760.1.0        10:00:50.405
  15.0                              9  IN     09 02 74 00  03 01 00 80  70                        ..t.....p          99us       760.2.0        10:00:50.405
  15.0                                 CTL    80 06 00 02  00 00 74 00                            GET DESCRIPTOR     80us       761.1.0        10:00:50.405
  15.0                            116  IN     09 02 74 00  03 01 00 80  70 08 0b 00  03 ef 05 00  ..t.....p.......  944us       761.2.0        10:00:50.406
                                              03 09 04 00  00 02 ef 05  00 00 14 24  01 00 00 01  ...........$....              761.2.16
                                              00 00 00 01  00 04 05 06  07 08 09 0a  0b 08 07 05  ................              761.2.32
                                              81 02 00 04  00 06 30 00  00 00 00 07  05 01 02 00  ......0.........              761.2.48
  15.0                                 CTL    80 06 00 01  00 00 12 00                            GET DESCRIPTOR    108us       762.1.0        10:00:50.406
  15.0                             18  IN     12 01 00 03  ef 02 01 09  a2 2b 55 4d  00 00 01 02  .........+UM....  865us       762.2.0        10:00:50.406
                                              0a 01                                               ..                            762.2.16
  15.0                                 CTL    80 06 04 03  00 00 02 00                            GET DESCRIPTOR    338us       763.1.0        10:00:50.408
  15.0                              2  IN     1a 03                                               ..                657us       763.2.0        10:00:50.408
  15.0                                 CTL    80 06 04 03  00 00 1a 00                            GET DESCRIPTOR    114us       764.1.0        10:00:50.408
  15.0                             26  IN     1a 03 32 00  42 00 41 00  32 00 30 00  30 00 30 00  ..2.B.A.2.0.0.0.  887us       764.2.0        10:00:50.409
                                              30 00 31 00  33 00 38 00  31 00                     0.1.3.8.1.                    764.2.16
  15.1                             24  OUT    55 33 56 43  00 40 00 08  0c 00 00 00  cc 01 00 00  U3VC.@..........   54ms       765.1.0        10:00:50.464
                                              00 00 00 00  00 00 04 00                            ........                      765.1.16
  15.1                             16  IN     55 33 56 43  00 00 01 08  04 00 00 00  2c 01 00 00  U3VC........,...  664us       766.1.0        10:00:50.464
  15.1                             24  OUT    55 33 56 43  00 40 00 08  0c 00 01 00  d8 01 00 00  U3VC.@..........  124us       767.1.0        10:00:50.464
                                              00 00 00 00  00 00 08 00                            ........                      767.1.16
  15.1                             20  IN     55 33 56 43  00 00 01 08  08 00 01 00  00 00 01 00  U3VC............  707us       768.1.0        10:00:50.465
                                              00 00 00 00                                         ....                          768.1.16
  15.1                             24  OUT    55 33 56 43  00 40 00 08  0c 00 02 00  14 00 01 00  U3VC.@..........  122us       769.1.0        10:00:50.465
                                              00 00 00 00  00 00 04 00                            ........                      769.1.16
  15.1                             16  IN     55 33 56 43  00 00 01 08  04 00 02 00  00 04 00 00  U3VC............  708us       770.1.0        10:00:50.465
  15.1                             24  OUT    55 33 56 43  00 40 00 08  0c 00 03 00  18 00 01 00  U3VC.@..........  124us       771.1.0        10:00:50.466
                                              00 00 00 00  00 00 04 00                            ........                      771.1.16
  15.1                             16  IN     55 33 56 43  00 00 01 08  04 00 03 00  00 04 00 00  U3VC............  708us       772.1.0        10:00:50.466
  15.1                             24  OUT    55 33 56 43  00 40 00 08  0c 00 04 00  c4 01 00 00  U3VC.@..........  139us       773.1.0        10:00:50.466
                                              00 00 00 00  00 00 08 00                            ........                      773.1.16
  15.1                             20  IN     55 33 56 43  00 00 01 08  08 00 04 00  0d 0f 00 00  U3VC............  713us       774.1.0        10:00:50.468
                                              00 00 00 00                                         ....                          774.1.16
  15.1                             24  OUT    55 33 56 43  00 40 00 08  0c 00 05 00  04 00 01 00  U3VC.@..........  114us       775.1.0        10:00:50.468
                                              00 00 00 00  00 00 08 00                            ........                      775.1.16
  15.1                             20  IN     55 33 56 43  00 00 01 08  08 00 05 00  03 00 00 00  U3VC............  670us       776.1.0        10:00:50.468
                                              00 00 00 00                                         ....                          776.1.16
  15.1                             24  OUT    55 33 56 43  00 40 00 08  0c 00 06 00  d0 01 00 00  U3VC.@..........  134us       777.1.0        10:00:50.469
                                              00 00 00 00  00 00 08 00                            ........                      777.1.16
  15.1                             20  IN     55 33 56 43  00 00 01 08  08 00 06 00  00 40 03 00  U3VC.........@..  675us       778.1.0        10:00:50.469
                                              00 00 00 00                                         ....                          778.1.16
  15.1                             24  OUT    55 33 56 43  00 40 00 08  0c 00 07 00  00 40 03 00  U3VC.@.......@..  118us       779.1.0        10:00:50.469
                                              00 00 00 00  00 00 08 00                            ........                      779.1.16
  15.1                             20  IN     55 33 56 43  00 00 01 08  08 00 07 00  01 00 00 00  U3VC............  719us       780.1.0        10:00:50.470
                                              00 00 00 00                                         ....                          780.1.16
  15.1                             24  OUT    55 33 56 43  00 40 00 08  0c 00 08 00  08 40 03 00  U3VC.@.......@..  121us       781.1.0        10:00:50.470
                                              00 00 00 00  00 00 2c 00                            ......,.                      781.1.16
  15.1                             56  IN     55 33 56 43  00 00 01 08  2c 00 08 00  04 00 01 01  U3VC....,.......  722us       782.1.0        10:00:50.470
                                              00 04 01 01  00 00 d0 00  00 00 00 00  a3 5e 00 00  .............^..              782.1.16
                                              00 00 00 00  5e 73 41 e2  22 32 73 d1  49 67 e0 b3  ....^sA."2s.Ig..              782.1.32
                                              66 50 05 09  e9 b3 b8 66                            fP.....f                      782.1.48
  15.1                             24  OUT    55 33 56 43  00 40 00 08  0c 00 09 00  00 00 d0 00  U3VC.@..........  165us       783.1.0        10:00:50.471
                                              00 00 00 00  00 00 f4 03                            ........                      783.1.16
  15.1                           1024  IN     55 33 56 43  00 00 01 08  f4 03 09 00  50 4b 03 04  U3VC........PK..   21ms       784.1.0        10:00:50.493
                                              14 00 00 00  08 00 77 84  87 47 f0 f1  92 8d f9 5d  ......w..G.....]              784.1.16
                                              00 00 b6 08  04 00 12 00  00 00 4d 45  52 2d 55 33  ..........MER-U3              784.1.32
                                              78 5f 56 78  2e 78 2e 78  2e 78 6d 6c  ec 5d db 72  x_Vx.x.x.xml.].r              784.1.48
  15.1                             24  OUT    55 33 56 43  00 40 00 08  0c 00 0a 00  f4 03 d0 00  U3VC.@..........  124us       785.1.0        10:00:50.493
                                              00 00 00 00  00 00 f4 03                            ........                      785.1.16
  15.1                           1024  IN     55 33 56 43  00 00 01 08  f4 03 0a 00  4b 70 64 e3  U3VC........Kpd.   21ms       786.1.0        10:00:50.514
                                              c7 6e 1b de  b1 8f 19 f1  60 00 45 31  bf 76 9d 2b  .n......`.E1.v.+              786.1.16
                                              20 cd be 66  ec f7 16 ec  24 ed 35 f4  95 7e 4b b8   ..f....$.5...K.              786.1.32
                                              2b c5 78 2d  e8 99 8e 91  c7 7c 82 c9  57 4c fb a6  +.x-........WL..              786.1.48
  15.1                             24  OUT    55 33 56 43  00 40 00 08  0c 00 0b 00  e8 07 d0 00  U3VC.@..........  162us       787.1.0        10:00:50.514
                                              00 00 00 00  00 00 f4 03                            ........                      787.1.16
  15.1                           1024  IN     55 33 56 43  00 00 01 08  f4 03 0b 00  c2 1a 0e c8  U3VC............   21ms       788.1.0        10:00:50.535
                                              b6 c3 31 9b  53 72 bc ec  97 4e 3a b1  e1 3c fc 56  ..1.Sr...N:..<.V              788.1.16
                                              f4 1b 78 1d  32 a0 9a fb  6c 27 da 55  b0 d2 ab b2  ..x.2...l'.U....              788.1.32
                                              fc 18 3b 19  f8 7f 99 8b  91 eb a0 42  af 47 23 1d  ..;........B.G#.              788.1.48
  15.1                             24  OUT    55 33 56 43  00 40 00 08  0c 00 0c 00  dc 0b d0 00  U3VC.@..........  156us       789.1.0        10:00:50.535
                                              00 00 00 00  00 00 f4 03                            ........                      789.1.16
  15.1                           1024  IN     55 33 56 43  00 00 01 08  f4 03 0c 00  78 cf a8 85  U3VC........x...   21ms       790.1.0        10:00:50.556
                                              77 59 f3 6d  8c 5f 2a 5b  be 75 3a f3  ea 12 9c 35  wY.m._*[.u:....5              790.1.16
                                              1c be 6b 18  ff e4 b3 43  eb b7 1c 2e  4d 50 b6 c7  ..k....C....MP..              790.1.32
                                              b0 38 0b 5f  36 e0 6f b3  b3 c0 3b d0  95 7b e4 b8  .8._6.o...;.....              790.1.48
  15.1                             24  OUT    55 33 56 43  00 40 00 08  0c 00 0d 00  d0 0f d0 00  U3VC.@..........  140us       791.1.0        10:00:50.556
                                              00 00 00 00  00 00 f4 03                            ........                      791.1.16
  15.1                           1024  IN     55 33 56 43  00 00 01 08  f4 03 0d 00  0e ff f9 3a  U3VC...........:   21ms       792.1.0        10:00:50.578
                                              c6 66 0c 43  49 e8 22 d4  a9 e4 bb 25  ce 5b 66 2e  .f.CI."....%.[f.              792.1.16
                                              86 b3 5f 4f  77 f8 ce f3  75 90 05 54  47 04 ba 05  .._Ow...u..TG...              792.1.32
                                              76 28 1e c2  eb 70 1d c2  5b 01 8d 21  70 f6 51 13  v(...p..[..!p.Q.              792.1.48
  15.1                             24  OUT    55 33 56 43  00 40 00 08  0c 00 0e 00  c4 13 d0 00  U3VC.@..........  191us       793.1.0        10:00:50.578
                                              00 00 00 00  00 00 f4 03                            ........                      793.1.16
  15.1                           1024  IN     55 33 56 43  00 00 01 08  f4 03 0e 00  24 99 12 dd  U3VC........$...   21ms       794.1.0        10:00:50.599
                                              5e 47 a2 29  a9 9b 3b d9  c4 06 26 97  6f 62 c4 f2  ^G.)..;...&.ob..              794.1.16
                                              29 27 d9 63  3a 54 43 6a  44 c3 b1 eb  43 c3 b1 c5  )'.c:TCjD...C...              794.1.32
                                              d0 70 6c 05  34 1c 5b 01  0d b9 15 22  a6 21 35 a2  .pl.4.[....".!5.              794.1.48
  15.1                             24  OUT    55 33 56 43  00 40 00 08  0c 00 0f 00  b8 17 d0 00  U3VC.@..........  233us       795.1.0        10:00:50.600
                                              00 00 00 00  00 00 f4 03                            ........                      795.1.16
  15.1                           1024  IN     55 33 56 43  00 00 01 08  f4 03 0f 00  73 ac b0 ee  U3VC........s...   21ms       796.1.0        10:00:50.621
                                              f1 4d 4a da  07 26 5b 4b  cb be 0a d3  ec bb 20 cb  .MJ..&[K...... .              796.1.16
                                              c2 75 3c 09  63 fe b7 64  9d bf 7d 89  af 35 cb db  .u<.c..d.....5..              796.1.32
                                              a7 ec f6 26  9a dd b0 0c  20 b2 95 04  c9 ae 73 98  ...&.... .....s.              796.1.48
  15.1                             24  OUT    55 33 56 43  00 40 00 08  0c 00 10 00  ac 1b d0 00  U3VC.@..........  164us       797.1.0        10:00:50.621
                                              00 00 00 00  00 00 f4 03                            ........                      797.1.16
  15.1                           1024  IN     55 33 56 43  00 00 01 08  f4 03 10 00  e7 3c f0 31  U3VC.........<.1   21ms       798.1.0        10:00:50.643
                                              cc 87 fd db  92 ad 57 e4  bf 4f 43 c8  29 67 2f 92  ......W..OC.)g/.              798.1.16
                                              40 e2 5c fd  23 b1 1c d3  6b 85 9c f0  9d 34 c2 43  @.\.#...k....4.C              798.1.32
                                              3e f3 d1 6c  c4 a5 9a 24  53 0a d2 84  ee 81 56 90  >..l...$S.....V.              798.1.48
  15.1                             24  OUT    55 33 56 43  00 40 00 08  0c 00 11 00  a0 1f d0 00  U3VC.@..........  169us       799.1.0        10:00:50.643
                                              00 00 00 00  00 00 f4 03                            ........                      799.1.16
  15.1                           1024  IN     55 33 56 43  00 00 01 08  f4 03 11 00  e0 77 73 fb  U3VC.........ws.   21ms       800.1.0        10:00:50.664
                                              a3 e9 c5 b9  b8 ea 65 6f  26 af 7c d8  db 41 65 05  ......eo&....Ae.              800.1.16
                                              58 bd 3f 61  1b fe 6c a3  14 c8 77 78  c5 8b 4c 88  X.?a..l...wx..L.              800.1.32
                                              f2 45 5a eb  67 1f e5 da  b2 bd 2c 6a  6d c5 62 b5  .EZ.g.....,jm.b.              800.1.48
  15.1                             24  OUT    55 33 56 43  00 40 00 08  0c 00 12 00  94 23 d0 00  U3VC.@.......#..  183us       801.1.0        10:00:50.664
                                              00 00 00 00  00 00 f4 03                            ........                      801.1.16
  15.1                           1024  IN     55 33 56 43  00 00 01 08  f4 03 12 00  48 54 1d 42  U3VC........HT.B   21ms       802.1.0        10:00:50.685
                                              77 a1 f3 f1  7b f6 5a 82  aa 04 8a 7f  bb 7f f9 11  w.....Z.........              802.1.16
                                              7e e9 89 af  fc b4 3b c5  65 8a d7 a2  98 a0 d1 c3  ......;.e.......              802.1.32
                                              11 13 ac 24  34 ba aa db  06 95 c0 51  bd 88 c9 dd  ...$4......Q....              802.1.48
  15.1                             24  OUT    55 33 56 43  00 40 00 08  0c 00 13 00  88 27 d0 00  U3VC.@.......'..  189us       803.1.0        10:00:50.685
                                              00 00 00 00  00 00 f4 03                            ........                      803.1.16
  15.1                           1024  IN     55 33 56 43  00 00 01 08  f4 03 13 00  ee 7f 28 12  U3VC..........(.   21ms       804.1.0        10:00:50.706
                                              a5 0a 52 97  5c b4 1b ea  72 9f 4e 84  7d 09 6c 57  ..R.\...r.N...lW              804.1.16
                                              a9 69 54 64  c9 07 f5 12  1a 79 92 5a  7d 7b b6 48  .iTd.....y.Z...H              804.1.32
                                              82 4c cd a6  5a 74 c3 21  b8 bc 7d 3b  fd 8a f7 66  .L..Zt.!...;...f              804.1.48
  15.1                             24  OUT    55 33 56 43  00 40 00 08  0c 00 14 00  7c 2b d0 00  U3VC.@.......+..  180us       805.1.0        10:00:50.708
                                              00 00 00 00  00 00 f4 03                            ........                      805.1.16
  15.1                           1024  IN     55 33 56 43  00 00 01 08  f4 03 14 00  b5 a3 37 24  U3VC..........7$   21ms       806.1.0        10:00:50.729
                                              6d 54 5a 2b  58 43 49 05  51 f4 ae 12  68 a3 da 14  mTZ+XCI.Q...h...              806.1.16
                                              de 6b ed 48  1b 95 37 eb  cb 69 06 71  de c1 46 b5  .k.H..7..i.q..F.              806.1.32
                                              56 5b ef be  a7 8f 00 61  a2 f2 da 7d  11 cc f2 df  V[.....a........              806.1.48
  15.1                             24  OUT    55 33 56 43  00 40 00 08  0c 00 15 00  70 2f d0 00  U3VC.@......p/..  180us       807.1.0        10:00:50.729
                                              00 00 00 00  00 00 f4 03                            ........                      807.1.16
  15.1                           1024  IN     55 33 56 43  00 00 01 08  f4 03 15 00  71 d7 68 43  U3VC........q.hC   21ms       808.1.0        10:00:50.750
                                              b0 18 73 99  3d b7 bc c7  8e 66 dd 30  cb 6e f5 a5  ..s.=....f.0.n..              808.1.16
                                              39 1f 29 2e  9a 34 bb 9b  ae eb a1 71  54 f4 d8 00  9.)..4.....qT...              808.1.32
                                              8e 8a 1e 6b  c4 51 d1 e3  4a 70 54 f4  d8 34 8e 8a  ...k.Q..JpT..4..              808.1.48
  15.1                             24  OUT    55 33 56 43  00 40 00 08  0c 00 16 00  64 33 d0 00  U3VC.@......d3..  194us       809.1.0        10:00:50.750
                                              00 00 00 00  00 00 f4 03                            ........                      809.1.16
  15.1                           1024  IN     55 33 56 43  00 00 01 08  f4 03 16 00  19 48 b4 5b  U3VC.........H.[   21ms       810.1.0        10:00:50.771
                                              a6 1f 21 24  c6 ce ef a4  db 3a 78 f6  8b 8c 33 be  ..!$.....:x...3.              810.1.16
                                              b3 f3 2b 22  d2 f8 f7 df  d9 d7 a5 0f  ee d8 5b ee  ..+"..........[.              810.1.32
                                              9e d5 e8 d2  e4 15 9a 5a  a0 8c 32 7c  ff 73 3a 9e  .......Z..2..s:.              810.1.48
  15.1                             24  OUT    55 33 56 43  00 40 00 08  0c 00 17 00  58 37 d0 00  U3VC.@......X7..  174us       811.1.0        10:00:50.771
                                              00 00 00 00  00 00 f4 03                            ........                      811.1.16
  15.1                           1024  IN     55 33 56 43  00 00 01 08  f4 03 17 00  a8 52 2e 80  U3VC.........R..   21ms       812.1.0        10:00:50.793
                                              68 3d fd 65  74 1a 55 c8  5f 02 e9 38  ca 75 67 69  h=.et.U._..8.ugi              812.1.16
                                              23 45 7b 5f  79 82 1a 06  3b 85 22 46  12 41 22 8f  #E._y...;."F.A".              812.1.32
                                              ec aa 43 d1  44 28 be 02  8b e2 1d a8  ef 79 87 05  ..C.D(.......y..              812.1.48
  15.1                             24  OUT    55 33 56 43  00 40 00 08  0c 00 18 00  4c 3b d0 00  U3VC.@......L;..  182us       813.1.0        10:00:50.793
                                              00 00 00 00  00 00 f4 03                            ........                      813.1.16
  15.1                           1024  IN     55 33 56 43  00 00 01 08  f4 03 18 00  b9 8a d9 d2  U3VC............   21ms       814.1.0        10:00:50.814
                                              79 aa 73 54  b1 bf 79 c4  c5 0a bd 1e  d6 ae 73 1e  y.sT..y.......s.              814.1.16
                                              1a 08 99 e5  d8 5c 3d f3  e0 11 2b 2b  f4 4e 59 a7  .....\=...++.NY.              814.1.32
                                              ce 79 68 20  8c 96 63 73  f5 cc 83 47  fc 2c a7 5b  .yh ..cs...G.,.[              814.1.48
  15.1                             24  OUT    55 33 56 43  00 40 00 08  0c 00 19 00  40 3f d0 00  U3VC.@......@?..  172us       815.1.0        10:00:50.814
                                              00 00 00 00  00 00 f4 03                            ........                      815.1.16
  15.1                           1024  IN     55 33 56 43  00 00 01 08  f4 03 19 00  07 53 a0 52  U3VC.........S.R   21ms       816.1.0        10:00:50.835
                                              3e b3 88 2e  38 f5 f7 8f  29 34 d2 3f  76 aa 93 e3  >...8...)4.?v...              816.1.16
                                              05 c4 40 f5  b7 22 28 b5  a0 17 22 66  9f 26 f4 ae  ..@.."(..."f.&..              816.1.32
                                              0e 17 a0 b0  17 d8 52 2c  59 9c 2c 06  dd cc e7 85  ......R,Y.,.....              816.1.48
  15.1                             24  OUT    55 33 56 43  00 40 00 08  0c 00 1a 00  34 43 d0 00  U3VC.@......4C..  201us       817.1.0        10:00:50.836
                                              00 00 00 00  00 00 f4 03                            ........                      817.1.16
  15.1                           1024  IN     55 33 56 43  00 00 01 08  f4 03 1a 00  25 7a 2a 12  U3VC........%z*.   21ms       818.1.0        10:00:50.858
                                              a5 6d b5 16  e8 96 51 a0  15 e0 c0 4a  97 2b fe c3  .m....Q....J.+..              818.1.16
                                              10 68 26 10  a0 fc ac 17  29 30 a0 53  08 9a de 1a  .h&.....)0.S....              818.1.32
                                              3d 02 cd 2e  f8 8c 72 f4  11 7b 76 b4  dc a4 8e 7e  =.....r...v.....              818.1.48
  15.1                             24  OUT    55 33 56 43  00 40 00 08  0c 00 1b 00  28 47 d0 00  U3VC.@......(G..  206us       819.1.0        10:00:50.858
                                              00 00 00 00  00 00 f4 03                            ........                      819.1.16
  15.1                           1024  IN     55 33 56 43  00 00 01 08  f4 03 1b 00  29 9b 2e ce  U3VC........)...   21ms       820.1.0        10:00:50.879
                                              37 4c 53 e5  66 ec a1 c1  92 59 8f 5e  b8 1c 8d 7a  7LS.f....Y.^...z              820.1.16
                                              68 2f 70 f1  e9 75 ab 77  bc 29 21 ab  b8 57 6c 72  h/p..u.w.)!..Wlr              820.1.32
                                              fc b1 b8 93  bb 2b 3f e0  a5 10 bf c7  80 04 18 f0  .....+?.........              820.1.48
  15.1                             24  OUT    55 33 56 43  00 40 00 08  0c 00 1c 00  1c 4b d0 00  U3VC.@.......K..  184us       821.1.0        10:00:50.879
                                              00 00 00 00  00 00 f4 03                            ........                      821.1.16
  15.1                           1024  IN     55 33 56 43  00 00 01 08  f4 03 1c 00  75 15 cb 6b  U3VC........u..k   21ms       822.1.0        10:00:50.900
                                              85 b0 fb 02  ec b2 b5 3f  b2 37 b9 4d  0b a3 78 55  .......?.7.M..xU              822.1.16
                                              b5 f0 25 4a  0b 8d 38 80  69 a1 2d e2  6c 8b 6e 75  ..%J..8.i.-.l.nu              822.1.32
                                              d4 c3 28 fe  df eb 21 2e  a0 81 99 57  6c 72 68 08  ..(...!....Wlrh.              822.1.48
  15.1                             24  OUT    55 33 56 43  00 40 00 08  0c 00 1d 00  10 4f d0 00  U3VC.@.......O..  119us       823.1.0        10:00:50.900
                                              00 00 00 00  00 00 f4 03                            ........                      823.1.16
  15.1                           1024  IN     55 33 56 43  00 00 01 08  f4 03 1d 00  9e eb 1e 11  U3VC............   21ms       824.1.0        10:00:50.921
                                              cf 75 cf 88  e7 1a 8d 78  ae 31 88 e7  1a 8f 78 ae  .u.....x.1....x.              824.1.16
                                              1f 01 f1 5c  63 10 cf 9b  c3 e3 d7 6f  2e 28 e4 11  ...\c......o.(..              824.1.32
                                              cb b4 1d e6  e1 e4 39 e8  e1 1c 4c a8  a7 a8 72 53  ......9...L...rS              824.1.48
  15.1                             24  OUT    55 33 56 43  00 40 00 08  0c 00 1e 00  04 53 d0 00  U3VC.@.......S..  171us       825.1.0        10:00:50.921
                                              00 00 00 00  00 00 f4 03                            ........                      825.1.16
  15.1                           1024  IN     55 33 56 43  00 00 01 08  f4 03 1e 00  cf 51 26 5f  U3VC.........Q&_   21ms       826.1.0        10:00:50.943
                                              d2 91 93 0c  8d 89 b8 a8  45 8a 45 e8  64 94 86 0c  ........E.E.d...              826.1.16
                                              86 c0 af da  2b 69 c0 9e  9a 33 92 18  8a dc 2c e2  ....+i...3....,.              826.1.32
                                              bf 48 c0 88  65 c7 ea f7  12 d9 28 f3  5e 62 91 67  .H..e.....(.^b.g              826.1.48
  15.1                             24  OUT    55 33 56 43  00 40 00 08  0c 00 1f 00  f8 56 d0 00  U3VC.@.......V..  182us       827.1.0        10:00:50.943
                                              00 00 00 00  00 00 f4 03                            ........                      827.1.16
  15.1                           1024  IN     55 33 56 43  00 00 01 08  f4 03 1f 00  1a 39 aa ec  U3VC.........9..   21ms       828.1.0        10:00:50.965
                                              a2 cd 84 98  66 cb b9 9b  4f 78 35 9f  c1 9f 66 00  ....f...Ox5...f.              828.1.16
                                              29 d3 8b 79  6e 70 26 20  5a 6d df ea  92 89 f6 83  )..ynp& Zm......              828.1.32
                                              70 f0 83 76  91 dd 18 02  6f 83 b5 11  57 73 b3 d6  p..v....o...Ws..              828.1.48
  15.1                             24  OUT    55 33 56 43  00 40 00 08  0c 00 20 00  ec 5a d0 00  U3VC.@.... ..Z..  167us       829.1.0        10:00:50.965
                                              00 00 00 00  00 00 b7 03                            ........                      829.1.16
  15.1                            963  IN     55 33 56 43  00 00 01 08  b7 03 20 00  47 e4 f7 eb  U3VC...... .G...   20ms       830.1.0        10:00:50.985
                                              a6 bb 66 f7  d7 10 d9 f2  5e dc 8c 24  da 40 5a 1f  ..f.....^..$.@Z.              830.1.16
                                              99 fd cf 57  9b d2 3e 08  b0 60 de 25  64 b9 38 af  ...W..>..`.%d.8.              830.1.32
                                              ff 65 bc 8b  2d 86 09 d2  71 d6 ba 3d  64 c2 10 e3  .e..-...q..=d...              830.1.48
  15.1                             24  OUT    55 33 56 43  00 40 00 08  0c 00 21 00  d8 01 00 00  U3VC.@....!.....  1.7ms       831.1.0        10:00:50.986
                                              00 00 00 00  00 00 08 00                            ........                      831.1.16
  15.1                             20  IN     55 33 56 43  00 00 01 08  08 00 21 00  00 00 01 00  U3VC......!.....  673us       832.1.0        10:00:50.988
                                              00 00 00 00                                         ....                          832.1.16
  15.1                             24  OUT    55 33 56 43  00 40 00 08  0c 00 22 00  04 00 01 00  U3VC.@....".....  662us       833.1.0        10:00:50.988
                                              00 00 00 00  00 00 08 00                            ........                      833.1.16
  15.1                             20  IN     55 33 56 43  00 00 01 08  08 00 22 00  03 00 00 00  U3VC......".....  683us       834.1.0        10:00:50.989
                                              00 00 00 00                                         ....                          834.1.16
  15.1                             24  OUT    55 33 56 43  00 40 00 08  0c 00 23 00  20 00 01 00  U3VC.@....#. ...  197us       835.1.0        10:00:50.989
                                              00 00 00 00  00 00 08 00                            ........                      835.1.16
  15.1                             20  IN     55 33 56 43  00 00 01 08  08 00 23 00  00 00 02 00  U3VC......#.....  664us       836.1.0        10:00:50.989
                                              00 00 00 00                                         ....                          836.1.16
  15.1                             24  OUT    55 33 56 43  00 40 00 08  0c 00 24 00  04 00 01 00  U3VC.@....$.....  627us       837.1.0        10:00:50.990
                                              00 00 00 00  00 00 08 00                            ........                      837.1.16
  15.1                             20  IN     55 33 56 43  00 00 01 08  08 00 24 00  03 00 00 00  U3VC......$.....  693us       838.1.0        10:00:50.990
                                              00 00 00 00                                         ....                          838.1.16
  15.1                             24  OUT    55 33 56 43  00 40 00 08  0c 00 25 00  2c 00 01 00  U3VC.@....%.,...   93us       839.1.0        10:00:50.991
                                              00 00 00 00  00 00 08 00                            ........                      839.1.16
  15.1                             20  IN     55 33 56 43  00 00 01 08  08 00 25 00  00 10 02 00  U3VC......%.....  676us       840.1.0        10:00:50.991
                                              00 00 00 00                                         ....                          840.1.16
  15.1                             24  OUT    55 33 56 43  00 40 00 08  0c 00 26 00  00 00 02 00  U3VC.@....&.....  572us       841.1.0        10:00:50.993
                                              00 00 00 00  00 00 04 00                            ........                      841.1.16
  15.1                             16  IN     55 33 56 43  00 00 01 08  04 00 26 00  00 00 00 0a  U3VC......&.....  679us       842.1.0        10:00:50.993
  15.1                             24  OUT    55 33 56 43  00 40 00 08  0c 00 27 00  60 00 40 00  U3VC.@....'.`.@.  134ms       843.1.0        10:00:51.128
                                              00 00 00 00  00 00 04 00                            ........                      843.1.16
  15.1                             16  IN     55 33 56 43  00 00 01 08  04 00 27 00  01 00 00 00  U3VC......'.....  697us       844.1.0        10:00:51.128
  15.1                             24  OUT    55 33 56 43  00 40 00 08  0c 00 28 00  3c 00 90 00  U3VC.@....(.<...  121us       845.1.0        10:00:51.128
                                              00 00 00 00  00 00 04 00                            ........                      845.1.16
  15.1                             16  IN     55 33 56 43  00 00 01 08  04 00 28 00  00 00 00 00  U3VC......(.....  703us       846.1.0        10:00:51.129
  15.1                             24  OUT    55 33 56 43  00 40 00 08  0c 00 29 00  68 01 40 00  U3VC.@....).h.@.  175us       847.1.0        10:00:51.129
                                              00 00 00 00  00 00 04 00                            ........                      847.1.16
  15.1                             16  IN     55 33 56 43  00 00 01 08  04 00 29 00  01 00 00 00  U3VC......).....  679us       848.1.0        10:00:51.130
  15.1                             24  OUT    55 33 56 43  00 40 00 08  0c 00 2a 00  6c 01 40 00  U3VC.@....*.l.@.  155us       849.1.0        10:00:51.130
                                              00 00 00 00  00 00 04 00                            ........                      849.1.16
  15.1                             16  IN     55 33 56 43  00 00 01 08  04 00 2a 00  01 00 00 00  U3VC......*.....  683us       850.1.0        10:00:51.130
  15.1                             24  OUT    55 33 56 43  00 40 00 08  0c 00 2b 00  84 00 50 00  U3VC.@....+...P.  107us       851.1.0        10:00:51.130
                                              00 00 00 00  00 00 04 00                            ........                      851.1.16
  15.1                             16  IN     55 33 56 43  00 00 01 08  04 00 2b 00  06 00 00 00  U3VC......+.....  679us       852.1.0        10:00:51.131
  15.1                             24  OUT    55 33 56 43  00 40 00 08  0c 00 2c 00  70 01 40 00  U3VC.@....,.p.@.  184us       853.1.0        10:00:51.131
                                              00 00 00 00  00 00 04 00                            ........                      853.1.16
  15.1                             16  IN     55 33 56 43  00 00 01 08  04 00 2c 00  01 00 00 00  U3VC......,.....  689us       854.1.0        10:00:51.133
  15.1                             24  OUT    55 33 56 43  00 40 02 08  0c 00 2d 00  dc 00 90 00  U3VC.@....-.....  145us       855.1.0        10:00:51.133
                                              00 00 00 00  00 00 00 00                            ........                      855.1.16
  15.1                             16  IN     55 33 56 43  00 00 03 08  04 00 2d 00  00 00 04 00  U3VC......-.....  638us       856.1.0        10:00:51.133
  15.1                             24  OUT    55 33 56 43  00 40 00 08  0c 00 2e 00  74 01 40 00  U3VC.@......t.@.  165us       857.1.0        10:00:51.133
                                              00 00 00 00  00 00 04 00                            ........                      857.1.16
  15.1                             16  IN     55 33 56 43  00 00 01 08  04 00 2e 00  01 00 00 00  U3VC............  707us       858.1.0        10:00:51.134
  15.1                             24  OUT    55 33 56 43  00 40 02 08  0c 00 2f 00  e0 00 90 00  U3VC.@..../.....  136us       859.1.0        10:00:51.134
                                              00 00 00 00  00 00 00 00                            ........                      859.1.16
  15.1                             16  IN     55 33 56 43  00 00 03 08  04 00 2f 00  00 00 04 00  U3VC....../.....  680us       860.1.0        10:00:51.135
  15.1                             24  OUT    55 33 56 43  00 40 02 08  0c 00 30 00  d8 00 90 00  U3VC.@....0.....  104us       861.1.0        10:00:51.135
                                              00 00 00 00  00 00 00 00                            ........                      861.1.16
  15.1                             16  IN     55 33 56 43  00 00 03 08  04 00 30 00  00 00 04 00  U3VC......0.....  650us       862.1.0        10:00:51.135
  15.1                             24  OUT    55 33 56 43  00 40 00 08  0c 00 31 00  d8 01 00 00  U3VC.@....1.....  822us       863.1.0        10:00:51.136
                                              00 00 00 00  00 00 08 00                            ........                      863.1.16
  15.1                             20  IN     55 33 56 43  00 00 01 08  08 00 31 00  00 00 01 00  U3VC......1.....  685us       864.1.0        10:00:51.136
                                              00 00 00 00                                         ....                          864.1.16
  15.1                             24  OUT    55 33 56 43  00 40 00 08  0c 00 32 00  04 00 01 00  U3VC.@....2.....  648us       865.1.0        10:00:51.138
                                              00 00 00 00  00 00 08 00                            ........                      865.1.16
  15.1                             20  IN     55 33 56 43  00 00 01 08  08 00 32 00  03 00 00 00  U3VC......2.....  687us       866.1.0        10:00:51.138
                                              00 00 00 00                                         ....                          866.1.16
  15.1                             24  OUT    55 33 56 43  00 40 00 08  0c 00 33 00  20 00 01 00  U3VC.@....3. ...  110us       867.1.0        10:00:51.138
                                              00 00 00 00  00 00 08 00                            ........                      867.1.16
  15.1                             20  IN     55 33 56 43  00 00 01 08  08 00 33 00  00 00 02 00  U3VC......3.....  674us       868.1.0        10:00:51.139
                                              00 00 00 00                                         ....                          868.1.16
  15.1                             24  OUT    55 33 56 43  00 40 00 08  0c 00 34 00  04 00 01 00  U3VC.@....4.....  595us       869.1.0        10:00:51.139
                                              00 00 00 00  00 00 08 00                            ........                      869.1.16
  15.1                             20  IN     55 33 56 43  00 00 01 08  08 00 34 00  03 00 00 00  U3VC......4.....  687us       870.1.0        10:00:51.140
                                              00 00 00 00                                         ....                          870.1.16
  15.1                             24  OUT    55 33 56 43  00 40 00 08  0c 00 35 00  2c 00 01 00  U3VC.@....5.,...  110us       871.1.0        10:00:51.140
                                              00 00 00 00  00 00 08 00                            ........                      871.1.16
  15.1                             20  IN     55 33 56 43  00 00 01 08  08 00 35 00  00 10 02 00  U3VC......5.....  683us       872.1.0        10:00:51.141
                                              00 00 00 00                                         ....                          872.1.16
  15.1                             24  OUT    55 33 56 43  00 40 00 08  0c 00 36 00  d8 01 00 00  U3VC.@....6.....  1.2ms       873.1.0        10:00:51.143
                                              00 00 00 00  00 00 08 00                            ........                      873.1.16
  15.1                             20  IN     55 33 56 43  00 00 01 08  08 00 36 00  00 00 01 00  U3VC......6.....  680us       874.1.0        10:00:51.143
                                              00 00 00 00                                         ....                          874.1.16
  15.1                             24  OUT    55 33 56 43  00 40 00 08  0c 00 37 00  04 00 01 00  U3VC.@....7.....  649us       875.1.0        10:00:51.144
                                              00 00 00 00  00 00 08 00                            ........                      875.1.16
  15.1                             20  IN     55 33 56 43  00 00 01 08  08 00 37 00  03 00 00 00  U3VC......7.....  685us       876.1.0        10:00:51.144
                                              00 00 00 00                                         ....                          876.1.16
  15.1                             24  OUT    55 33 56 43  00 40 00 08  0c 00 38 00  20 00 01 00  U3VC.@....8. ...  103us       877.1.0        10:00:51.144
                                              00 00 00 00  00 00 08 00                            ........                      877.1.16
  15.1                             20  IN     55 33 56 43  00 00 01 08  08 00 38 00  00 00 02 00  U3VC......8.....  706us       878.1.0        10:00:51.145
                                              00 00 00 00                                         ....                          878.1.16
  15.1                             24  OUT    55 33 56 43  00 40 00 08  0c 00 39 00  04 00 01 00  U3VC.@....9.....  619us       879.1.0        10:00:51.145
                                              00 00 00 00  00 00 08 00                            ........                      879.1.16
  15.1                             20  IN     55 33 56 43  00 00 01 08  08 00 39 00  03 00 00 00  U3VC......9.....  687us       880.1.0        10:00:51.146
                                              00 00 00 00                                         ....                          880.1.16
  15.1                             24  OUT    55 33 56 43  00 40 00 08  0c 00 3a 00  2c 00 01 00  U3VC.@....:.,...  104us       881.1.0        10:00:51.146
                                              00 00 00 00  00 00 08 00                            ........                      881.1.16
  15.1                             20  IN     55 33 56 43  00 00 01 08  08 00 3a 00  00 10 02 00  U3VC......:.....  759us       882.1.0        10:00:51.148
                                              00 00 00 00                                         ....                          882.1.16
  15.1                             24  OUT    55 33 56 43  00 40 00 08  0c 00 3b 00  10 00 40 00  U3VC.@....;...@.  610us       883.1.0        10:00:51.148
                                              00 00 00 00  00 00 04 00                            ........                      883.1.16
  15.1                             16  IN     55 33 56 43  00 00 01 08  04 00 3b 00  01 00 00 00  U3VC......;.....  688us       884.1.0        10:00:51.149
  15.1                             24  OUT    55 33 56 43  00 40 00 08  0c 00 3c 00  00 00 50 00  U3VC.@....<...P.  119us       885.1.0        10:00:51.149
                                              00 00 00 00  00 00 04 00                            ........                      885.1.16
  15.1                             16  IN     55 33 56 43  00 00 01 08  04 00 3c 00  01 00 00 00  U3VC......<.....  695us       886.1.0        10:00:51.149
  15.1                             24  OUT    55 33 56 43  00 40 00 08  0c 00 3d 00  0c 00 60 00  U3VC.@....=...`.  115us       887.1.0        10:00:51.149
                                              00 00 00 00  00 00 04 00                            ........                      887.1.16
  15.1                             16  IN     55 33 56 43  00 00 01 08  04 00 3d 00  40 00 00 00  U3VC......=.@...  687us       888.1.0        10:00:51.150
  15.1                             24  OUT    55 33 56 43  00 40 00 08  0c 00 3e 00  10 00 90 00  U3VC.@....>.....  126us       889.1.0        10:00:51.150
                                              00 00 00 00  00 00 04 00                            ........                      889.1.16
  15.1                             16  IN     55 33 56 43  00 00 01 08  04 00 3e 00  00 00 00 00  U3VC......>.....  687us       890.1.0        10:00:51.151
  15.1                             24  OUT    55 33 56 43  00 40 00 08  0c 00 3f 00  08 00 60 00  U3VC.@....?...`.   74us       891.1.0        10:00:51.151
                                              00 00 00 00  00 00 04 00                            ........                      891.1.16
  15.1                             16  IN     55 33 56 43  00 00 01 08  04 00 3f 00  0c 05 00 00  U3VC......?.....  681us       892.1.0        10:00:51.151
  15.1                             24  OUT    55 33 56 43  00 40 00 08  0c 00 40 00  00 00 70 00  U3VC.@....@...p.  130us       893.1.0        10:00:51.151
                                              00 00 00 00  00 00 04 00                            ........                      893.1.16
  15.1                             16  IN     55 33 56 43  00 00 01 08  04 00 40 00  04 00 00 00  U3VC......@.....  679us       894.1.0        10:00:51.153
  15.1                             24  OUT    55 33 56 43  00 40 02 08  0c 00 41 00  08 00 90 00  U3VC.@....A.....  154us       895.1.0        10:00:51.153
                                              00 00 00 00  5c 00 00 00                            ....\...                      895.1.16
  15.1                             16  IN     55 33 56 43  00 00 03 08  04 00 41 00  00 00 04 00  U3VC......A.....  1.7ms       896.1.0        10:00:51.154
  15.1                             24  OUT    55 33 56 43  00 40 00 08  0c 00 42 00  14 00 60 00  U3VC.@....B...`.  169us       897.1.0        10:00:51.155
                                              00 00 00 00  00 00 04 00                            ........                      897.1.16
  15.1                             16  IN     55 33 56 43  00 00 01 08  04 00 42 00  40 00 00 00  U3VC......B.@...  706us       898.1.0        10:00:51.155
  15.1                             24  OUT    55 33 56 43  00 40 00 08  0c 00 43 00  10 00 60 00  U3VC.@....C...`.  117us       899.1.0        10:00:51.155
                                              00 00 00 00  00 00 04 00                            ........                      899.1.16
  15.1                             16  IN     55 33 56 43  00 00 01 08  04 00 43 00  c4 03 00 00  U3VC......C.....  685us       900.1.0        10:00:51.156
  15.1                             24  OUT    55 33 56 43  00 40 00 08  0c 00 44 00  14 00 90 00  U3VC.@....D.....  118us       901.1.0        10:00:51.156
                                              00 00 00 00  00 00 04 00                            ........                      901.1.16
  15.1                             16  IN     55 33 56 43  00 00 01 08  04 00 44 00  00 00 00 00  U3VC......D.....  687us       902.1.0        10:00:51.156
  15.1                             24  OUT    55 33 56 43  00 40 00 08  0c 00 45 00  04 00 70 00  U3VC.@....E...p.  188us       903.1.0        10:00:51.158
                                              00 00 00 00  00 00 04 00                            ........                      903.1.16
  15.1                             16  IN     55 33 56 43  00 00 01 08  04 00 45 00  02 00 00 00  U3VC......E.....  673us       904.1.0        10:00:51.158
  15.1                             24  OUT    55 33 56 43  00 40 02 08  0c 00 46 00  0c 00 90 00  U3VC.@....F.....  148us       905.1.0        10:00:51.158
                                              00 00 00 00  38 01 00 00                            ....8...                      905.1.16
  15.1                             16  IN     55 33 56 43  00 00 03 08  04 00 46 00  00 00 04 00  U3VC......F.....  1.7ms       906.1.0        10:00:51.160
  15.1                             24  OUT    55 33 56 43  00 40 00 08  0c 00 47 00  30 00 40 00  U3VC.@....G.0.@.  111us       907.1.0        10:00:51.160
                                              00 00 00 00  00 00 04 00                            ........                      907.1.16
  15.1                             16  IN     55 33 56 43  00 00 01 08  04 00 47 00  01 00 00 00  U3VC......G.....  669us       908.1.0        10:00:51.160
  15.1                             24  OUT    55 33 56 43  00 40 00 08  0c 00 48 00  14 00 50 00  U3VC.@....H...P.   61us       909.1.0        10:00:51.160
                                              00 00 00 00  00 00 04 00                            ........                      909.1.16
  15.1                             16  IN     55 33 56 43  00 00 01 08  04 00 48 00  04 00 00 00  U3VC......H.....  670us       910.1.0        10:00:51.161
  15.1                             24  OUT    55 33 56 43  00 40 02 08  0c 00 49 00  00 00 80 00  U3VC.@....I.....   59us       911.1.0        10:00:51.161
                                              00 00 00 00  02 00 00 00                            ........                      911.1.16
  15.1                             16  IN     55 33 56 43  00 00 03 08  04 00 49 00  00 00 04 00  U3VC......I.....  493us       912.1.0        10:00:51.161
  15.1                             24  OUT    55 33 56 43  00 40 00 08  0c 00 4a 00  3c 00 60 00  U3VC.@....J.<.`.  138us       913.1.0        10:00:51.161
                                              00 00 00 00  00 00 04 00                            ........                      913.1.16
  15.1                             16  IN     55 33 56 43  00 00 01 08  04 00 4a 00  14 00 00 00  U3VC......J.....  674us       914.1.0        10:00:51.163
  15.1                             24  OUT    55 33 56 43  00 40 00 08  0c 00 4b 00  1c 00 70 00  U3VC.@....K...p.  111us       915.1.0        10:00:51.163
                                              00 00 00 00  00 00 04 00                            ........                      915.1.16
  15.1                             16  IN     55 33 56 43  00 00 01 08  04 00 4b 00  01 00 00 00  U3VC......K.....  679us       916.1.0        10:00:51.164
  15.1                             24  OUT    55 33 56 43  00 40 00 08  0c 00 4c 00  3c 00 90 00  U3VC.@....L.<...  110us       917.1.0        10:00:51.164
                                              00 00 00 00  00 00 04 00                            ........                      917.1.16
  15.1                             16  IN     55 33 56 43  00 00 01 08  04 00 4c 00  00 00 00 00  U3VC......L.....  673us       918.1.0        10:00:51.164
  15.1                             24  OUT    55 33 56 43  00 40 00 08  0c 00 4d 00  38 00 60 00  U3VC.@....M.8.`.  125us       919.1.0        10:00:51.164
                                              00 00 00 00  00 00 04 00                            ........                      919.1.16
  15.1                             16  IN     55 33 56 43  00 00 01 08  04 00 4d 00  40 42 0f 00  U3VC......M.@B..  687us       920.1.0        10:00:51.165
  15.1                             24  OUT    55 33 56 43  00 40 02 08  0c 00 4e 00  38 00 90 00  U3VC.@....N.8...  135us       921.1.0        10:00:51.165
                                              00 00 00 00  14 00 00 00                            ........                      921.1.16
  15.1                             16  IN     55 33 56 43  00 00 03 08  04 00 4e 00  00 00 04 00  U3VC......N.....  1.0ms       922.1.0        10:00:51.166
  15.1                             24  OUT    55 33 56 43  00 40 00 08  0c 00 4f 00  3c 00 90 00  U3VC.@....O.<...  200us       923.1.0        10:00:51.166
                                              00 00 00 00  00 00 04 00                            ........                      923.1.16
  15.1                             16  IN     55 33 56 43  00 00 01 08  04 00 4f 00  00 00 00 00  U3VC......O.....  674us       924.1.0        10:00:51.168
  15.1                             24  OUT    55 33 56 43  00 40 00 08  0c 00 50 00  38 00 90 00  U3VC.@....P.8...  160us       925.1.0        10:00:51.168
                                              00 00 00 00  00 00 04 00                            ........                      925.1.16
  15.1                             16  IN     55 33 56 43  00 00 01 08  04 00 50 00  14 00 00 00  U3VC......P.....  713us       926.1.0        10:00:51.168
  15.1                             24  OUT    55 33 56 43  00 40 02 08  0c 00 51 00  04 00 02 00  U3VC.@....Q.....  167us       927.1.0        10:00:51.168
                                              00 00 00 00  00 00 00 00                            ........                      927.1.16
  15.1                             16  IN     55 33 56 43  00 00 03 08  04 00 51 00  00 00 04 00  U3VC......Q.....  9.5ms       928.1.0        10:00:51.178
  15.1                             24  OUT    55 33 56 43  00 40 00 08  0c 00 52 00  00 00 02 00  U3VC.@....R.....  5.7ms       929.1.0        10:00:51.184
                                              00 00 00 00  00 00 04 00                            ........                      929.1.16
  15.1                             16  IN     55 33 56 43  00 00 01 08  04 00 52 00  00 00 00 0a  U3VC......R.....  707us       930.1.0        10:00:51.184
  15.1                             24  OUT    55 33 56 43  00 40 00 08  0c 00 53 00  08 00 02 00  U3VC.@....S.....  161us       931.1.0        10:00:51.184
                                              00 00 00 00  00 00 08 00                            ........                      931.1.16
  15.1                             20  IN     55 33 56 43  00 00 01 08  08 00 53 00  20 70 00 00  U3VC......S. p..  685us       932.1.0        10:00:51.185
                                              00 00 00 00                                         ....                          932.1.16
  15.1                             24  OUT    55 33 56 43  00 40 00 08  0c 00 54 00  10 00 02 00  U3VC.@....T.....  155us       933.1.0        10:00:51.185
                                              00 00 00 00  00 00 04 00                            ........                      933.1.16
  15.1                             16  IN     55 33 56 43  00 00 01 08  04 00 54 00  34 00 00 00  U3VC......T.4...  662us       934.1.0        10:00:51.186
  15.1                             24  OUT    55 33 56 43  00 40 00 08  0c 00 55 00  14 00 02 00  U3VC.@....U.....  147us       935.1.0        10:00:51.186
                                              00 00 00 00  00 00 04 00                            ........                      935.1.16
  15.1                             16  IN     55 33 56 43  00 00 01 08  04 00 55 00  20 00 00 00  U3VC......U. ...  705us       936.1.0        10:00:51.186
  15.1                             24  OUT    55 33 56 43  00 40 02 08  0c 00 56 00  18 00 02 00  U3VC.@....V.....  128us       937.1.0        10:00:51.186
                                              00 00 00 00  00 04 00 00                            ........                      937.1.16
  15.1                             16  IN     55 33 56 43  00 00 03 08  04 00 56 00  00 00 04 00  U3VC......V.....  483us       938.1.0        10:00:51.188
  15.1                             24  OUT    55 33 56 43  00 40 02 08  0c 00 57 00  1c 00 02 00  U3VC.@....W.....  103us       939.1.0        10:00:51.188
                                              00 00 00 00  00 28 00 00                            .....(..                      939.1.16
  15.1                             16  IN     55 33 56 43  00 00 03 08  04 00 57 00  00 00 04 00  U3VC......W.....  453us       940.1.0        10:00:51.188
  15.1                             24  OUT    55 33 56 43  00 40 02 08  0c 00 58 00  20 00 02 00  U3VC.@....X. ...   72us       941.1.0        10:00:51.188
                                              00 00 00 00  02 00 00 00                            ........                      941.1.16
  15.1                             16  IN     55 33 56 43  00 00 03 08  04 00 58 00  00 00 04 00  U3VC......X.....  470us       942.1.0        10:00:51.189
  15.1                             24  OUT    55 33 56 43  00 40 02 08  0c 00 59 00  24 00 02 00  U3VC.@....Y.$...   74us       943.1.0        10:00:51.189
                                              00 00 00 00  00 20 00 00                            ..... ..                      943.1.16
  15.1                             16  IN     55 33 56 43  00 00 03 08  04 00 59 00  00 00 04 00  U3VC......Y.....  472us       944.1.0        10:00:51.189
  15.1                             24  OUT    55 33 56 43  00 40 02 08  0c 00 5a 00  28 00 02 00  U3VC.@....Z.(...  114us       945.1.0        10:00:51.189
                                              00 00 00 00  00 04 00 00                            ........                      945.1.16
  15.1                             16  IN     55 33 56 43  00 00 03 08  04 00 5a 00  00 00 04 00  U3VC......Z.....  479us       946.1.0        10:00:51.190
  15.1                             24  OUT    55 33 56 43  00 40 02 08  0c 00 5b 00  2c 00 02 00  U3VC.@....[.,...  196us       947.1.0        10:00:51.190
                                              00 00 00 00  00 04 00 00                            ........                      947.1.16
  15.1                             16  IN     55 33 56 43  00 00 03 08  04 00 5b 00  00 00 04 00  U3VC......[.....  485us       948.1.0        10:00:51.190
  15.1                             24  OUT    55 33 56 43  00 40 02 08  0c 00 5c 00  04 00 02 00  U3VC.@....\.....  106us       949.1.0        10:00:51.190
                                              00 00 00 00  01 00 00 00                            ........                      949.1.16
  15.1                             16  IN     55 33 56 43  00 00 03 08  04 00 5c 00  00 00 04 00  U3VC......\.....  2.7ms       950.1.0        10:00:51.193
  15.1                             24  OUT    55 33 56 43  00 40 02 08  0c 00 5d 00  04 00 02 00  U3VC.@....].....  150us       951.1.0        10:00:51.193
                                              00 00 00 00  00 00 00 00                            ........                      951.1.16
  15.1                             16  IN     55 33 56 43  00 00 03 08  04 00 5d 00  00 00 04 00  U3VC......].....  9.5ms       952.1.0        10:00:51.203
  15.1                             24  OUT    55 33 56 43  00 40 00 08  0c 00 5e 00  00 00 02 00  U3VC.@....^.....  5.3ms       953.1.0        10:00:51.208
                                              00 00 00 00  00 00 04 00                            ........                      953.1.16
  15.1                             16  IN     55 33 56 43  00 00 01 08  04 00 5e 00  00 00 00 0a  U3VC......^.....  683us       954.1.0        10:00:51.209
  15.1                             24  OUT    55 33 56 43  00 40 00 08  0c 00 5f 00  08 00 02 00  U3VC.@...._.....  103us       955.1.0        10:00:51.209
                                              00 00 00 00  00 00 08 00                            ........                      955.1.16
  15.1                             20  IN     55 33 56 43  00 00 01 08  08 00 5f 00  20 70 00 00  U3VC......_. p..  682us       956.1.0        10:00:51.210
                                              00 00 00 00                                         ....                          956.1.16
  15.1                             24  OUT    55 33 56 43  00 40 00 08  0c 00 60 00  10 00 02 00  U3VC.@....`.....   95us       957.1.0        10:00:51.210
                                              00 00 00 00  00 00 04 00                            ........                      957.1.16
  15.1                             16  IN     55 33 56 43  00 00 01 08  04 00 60 00  34 00 00 00  U3VC......`.4...  679us       958.1.0        10:00:51.210
  15.1                             24  OUT    55 33 56 43  00 40 00 08  0c 00 61 00  14 00 02 00  U3VC.@....a.....   90us       959.1.0        10:00:51.210
                                              00 00 00 00  00 00 04 00                            ........                      959.1.16
  15.1                             16  IN     55 33 56 43  00 00 01 08  04 00 61 00  20 00 00 00  U3VC......a. ...  674us       960.1.0        10:00:51.211
  15.1                             24  OUT    55 33 56 43  00 40 02 08  0c 00 62 00  18 00 02 00  U3VC.@....b.....   99us       961.1.0        10:00:51.211
                                              00 00 00 00  00 04 00 00                            ........                      961.1.16
  15.1                             16  IN     55 33 56 43  00 00 03 08  04 00 62 00  00 00 04 00  U3VC......b.....  483us       962.1.0        10:00:51.211
  15.1                             24  OUT    55 33 56 43  00 40 02 08  0c 00 63 00  1c 00 02 00  U3VC.@....c.....   98us       963.1.0        10:00:51.211
                                              00 00 00 00  00 c0 00 00                            ........                      963.1.16
  15.1                             16  IN     55 33 56 43  00 00 03 08  04 00 63 00  00 00 04 00  U3VC......c.....  483us       964.1.0        10:00:51.213
  15.1                             24  OUT    55 33 56 43  00 40 02 08  0c 00 64 00  20 00 02 00  U3VC.@....d. ...   97us       965.1.0        10:00:51.213
                                              00 00 00 00  00 00 00 00                            ........                      965.1.16
  15.1                             16  IN     55 33 56 43  00 00 03 08  04 00 64 00  00 00 04 00  U3VC......d.....  475us       966.1.0        10:00:51.213
  15.1                             24  OUT    55 33 56 43  00 40 02 08  0c 00 65 00  24 00 02 00  U3VC.@....e.$...   95us       967.1.0        10:00:51.213
                                              00 00 00 00  00 70 00 00                            .....p..                      967.1.16
  15.1                             16  IN     55 33 56 43  00 00 03 08  04 00 65 00  00 00 04 00  U3VC......e.....  505us       968.1.0        10:00:51.214
  15.1                             24  OUT    55 33 56 43  00 40 02 08  0c 00 66 00  28 00 02 00  U3VC.@....f.(...  112us       969.1.0        10:00:51.214
                                              00 00 00 00  00 04 00 00                            ........                      969.1.16
  15.1                             16  IN     55 33 56 43  00 00 03 08  04 00 66 00  00 00 04 00  U3VC......f.....  470us       970.1.0        10:00:51.214
  15.1                             24  OUT    55 33 56 43  00 40 02 08  0c 00 67 00  2c 00 02 00  U3VC.@....g.,...   96us       971.1.0        10:00:51.214
                                              00 00 00 00  00 04 00 00                            ........                      971.1.16
  15.1                             16  IN     55 33 56 43  00 00 03 08  04 00 67 00  00 00 04 00  U3VC......g.....  483us       972.1.0        10:00:51.215
  15.1                             24  OUT    55 33 56 43  00 40 02 08  0c 00 68 00  04 00 02 00  U3VC.@....h.....  100us       973.1.0        10:00:51.215
                                              00 00 00 00  01 00 00 00                            ........                      973.1.16
  15.1                             16  IN     55 33 56 43  00 00 03 08  04 00 68 00  00 00 04 00  U3VC......h.....  2.7ms       974.1.0        10:00:51.218
  15.1                             24  OUT    55 33 56 43  00 40 00 08  0c 00 69 00  00 00 02 00  U3VC.@....i.....   97us       975.1.0        10:00:51.218
                                              00 00 00 00  00 00 04 00                            ........                      975.1.16
  15.1                             16  IN     55 33 56 43  00 00 01 08  04 00 69 00  00 00 00 0a  U3VC......i.....  682us       976.1.0        10:00:51.219
  15.1                             24  OUT    55 33 56 43  00 40 00 08  0c 00 6a 00  08 00 02 00  U3VC.@....j.....  159us       977.1.0        10:00:51.219
                                              00 00 00 00  00 00 08 00                            ........                      977.1.16
  15.1                             20  IN     55 33 56 43  00 00 01 08  08 00 6a 00  20 70 00 00  U3VC......j. p..  686us       978.1.0        10:00:51.219
                                              00 00 00 00                                         ....                          978.1.16
  15.1                             24  OUT    55 33 56 43  00 40 00 08  0c 00 6b 00  10 00 02 00  U3VC.@....k.....  157us       979.1.0        10:00:51.219
                                              00 00 00 00  00 00 04 00                            ........                      979.1.16
  15.1                             16  IN     55 33 56 43  00 00 01 08  04 00 6b 00  34 00 00 00  U3VC......k.4...  672us       980.1.0        10:00:51.220
  15.1                             24  OUT    55 33 56 43  00 40 00 08  0c 00 6c 00  14 00 02 00  U3VC.@....l.....  154us       981.1.0        10:00:51.220
                                              00 00 00 00  00 00 04 00                            ........                      981.1.16
  15.1                             16  IN     55 33 56 43  00 00 01 08  04 00 6c 00  20 00 00 00  U3VC......l. ...  673us       982.1.0        10:00:51.221
  15.1                             24  OUT    55 33 56 43  00 40 02 08  0c 00 6d 00  18 00 02 00  U3VC.@....m.....  145us       983.1.0        10:00:51.221
                                              00 00 00 00  00 04 00 00                            ........                      983.1.16
  15.1                             16  IN     55 33 56 43  00 00 03 08  04 00 6d 00  00 00 04 00  U3VC......m.....  482us       984.1.0        10:00:51.221
  15.1                             24  OUT    55 33 56 43  00 40 02 08  0c 00 6e 00  1c 00 02 00  U3VC.@....n.....  180us       985.1.0        10:00:51.221
                                              00 00 00 00  00 28 00 00                            .....(..                      985.1.16
  15.1                             16  IN     55 33 56 43  00 00 03 08  04 00 6e 00  00 00 04 00  U3VC......n.....  487us       986.1.0        10:00:51.223
  15.1                             24  OUT    55 33 56 43  00 40 02 08  0c 00 6f 00  20 00 02 00  U3VC.@....o. ...  145us       987.1.0        10:00:51.223
                                              00 00 00 00  02 00 00 00                            ........                      987.1.16
  15.1                             16  IN     55 33 56 43  00 00 03 08  04 00 6f 00  00 00 04 00  U3VC......o.....  474us       988.1.0        10:00:51.223
  15.1                             24  OUT    55 33 56 43  00 40 02 08  0c 00 70 00  24 00 02 00  U3VC.@....p.$...  192us       989.1.0        10:00:51.223
                                              00 00 00 00  00 20 00 00                            ..... ..                      989.1.16
  15.1                             16  IN     55 33 56 43  00 00 03 08  04 00 70 00  00 00 04 00  U3VC......p.....  462us       990.1.0        10:00:51.224
  15.1                             24  OUT    55 33 56 43  00 40 02 08  0c 00 71 00  28 00 02 00  U3VC.@....q.(...  108us       991.1.0        10:00:51.224
                                              00 00 00 00  00 04 00 00                            ........                      991.1.16
  15.1                             16  IN     55 33 56 43  00 00 03 08  04 00 71 00  00 00 04 00  U3VC......q.....  481us       992.1.0        10:00:51.224
  15.1                             24  OUT    55 33 56 43  00 40 02 08  0c 00 72 00  2c 00 02 00  U3VC.@....r.,...  127us       993.1.0        10:00:51.224
                                              00 00 00 00  00 04 00 00                            ........                      993.1.16
  15.1                             16  IN     55 33 56 43  00 00 03 08  04 00 72 00  00 00 04 00  U3VC......r.....  475us       994.1.0        10:00:51.225
  15.1                             24  OUT    55 33 56 43  00 40 00 08  0c 00 73 00  34 00 40 00  U3VC.@....s.4.@.  731us       995.1.0        10:00:51.225
                                              00 00 00 00  00 00 04 00                            ........                      995.1.16
  15.1                             16  IN     55 33 56 43  00 00 01 08  04 00 73 00  01 00 00 00  U3VC......s.....  671us       996.1.0        10:00:51.226
  15.1                             24  OUT    55 33 56 43  00 40 02 08  0c 00 74 00  04 00 80 00  U3VC.@....t.....   98us       997.1.0        10:00:51.226
                                              00 00 00 00  01 00 00 00                            ........                      997.1.16
  15.1                             16  IN     55 33 56 43  00 00 03 08  04 00 74 00  00 00 04 00  U3VC......t.....  1.6ms       998.1.0        10:00:51.228
  15.3                             52  IN     55 33 56 4c  00 00 34 00  00 00 00 00  00 00 00 00  U3VL..4.........   91us       999.1.0        10:00:51.228
                                              00 00 01 00  e3 36 b2 87  0b 00 00 00  09 00 08 01  .....6..........              999.1.16
                                              5c 00 00 00  38 01 00 00  00 00 00 00  00 00 00 00  \...8...........              999.1.32
                                              00 00 00 00                                         ....                          999.1.48
  15.3                          28672  IN     00 00 00 00  00 00 00 00  00 00 00 00  00 00 00 00  ................   10ms      1000.1.0        10:00:51.239
                                              00 00 00 00  00 00 00 00  00 00 00 00  00 00 00 00  ................             1000.1.16
                                              00 00 00 00  00 00 00 00  00 00 00 00  00 00 00 00  ................             1000.1.32
                                              00 00 00 00  00 00 00 00  00 00 00 00  00 00 00 00  ................             1000.1.48
  15.3                             32  IN     00 00 00 00  00 00 00 00  00 00 00 00  00 00 00 00  ................    8us      1001.1.0        10:00:51.239
                                              00 00 00 00  00 00 00 00  00 00 00 00  00 00 00 00  ................             1001.1.16
  15.3                             32  IN     55 33 56 54  00 00 20 00  00 00 00 00  00 00 00 00  U3VT.. .........    7us      1002.1.0        10:00:51.239
                                              00 00 00 00  20 70 00 00  00 00 00 00  38 01 00 00  .... p......8...             1002.1.16
  15.3                             52  IN     55 33 56 4c  00 00 34 00  01 00 00 00  00 00 00 00  U3VL..4.........  3.3ms      1003.1.0        10:00:51.241
                                              00 00 01 00  30 29 86 88  0b 00 00 00  09 00 08 01  ....0)..........             1003.1.16
                                              5c 00 00 00  38 01 00 00  00 00 00 00  00 00 00 00  \...8...........             1003.1.32
                                              00 00 00 00                                         ....                         1003.1.48
  15.3                          28672  IN     00 00 00 00  00 00 00 00  00 00 00 00  00 00 00 00  ................   10ms      1004.1.0        10:00:51.253
                                              00 00 00 00  00 00 00 00  00 00 00 00  00 00 00 00  ................             1004.1.16
                                              00 00 00 00  00 00 00 00  00 00 00 00  00 00 00 00  ................             1004.1.32
                                              00 00 00 00  00 00 00 00  00 00 00 00  00 00 00 00  ................             1004.1.48
  15.3                             32  IN     00 00 00 00  00 00 00 00  00 00 00 00  00 00 00 00  ................   15us      1005.1.0        10:00:51.253
                                              00 00 00 00  00 00 00 00  00 00 00 00  00 00 00 00  ................             1005.1.16
  15.3                             32  IN     55 33 56 54  00 00 20 00  01 00 00 00  00 00 00 00  U3VT.. .........   13us      1006.1.0        10:00:51.253
                                              00 00 00 00  20 70 00 00  00 00 00 00  38 01 00 00  .... p......8...             1006.1.16
  15.3                             52  IN     55 33 56 4c  00 00 34 00  02 00 00 00  00 00 00 00  U3VL..4.........  3.3ms      1007.1.0        10:00:51.255
                                              00 00 01 00  96 1b 5a 89  0b 00 00 00  09 00 08 01  ......Z.........             1007.1.16
                                              5c 00 00 00  38 01 00 00  00 00 00 00  00 00 00 00  \...8...........             1007.1.32
                                              00 00 00 00                                         ....                         1007.1.48
  15.3                          28672  IN     00 00 00 00  00 00 00 00  00 00 00 00  00 00 00 00  ................   10ms      1008.1.0        10:00:51.266
                                              00 00 00 00  00 00 00 00  00 00 00 00  00 00 00 00  ................             1008.1.16
                                              00 00 00 00  00 00 00 00  00 00 00 00  00 00 00 00  ................             1008.1.32
                                              00 00 00 00  00 00 00 00  00 00 00 00  00 00 00 00  ................             1008.1.48
  15.3                             32  IN     00 00 00 00  00 00 00 00  00 00 00 00  00 00 00 00  ................   16us      1009.1.0        10:00:51.266
                                              00 00 00 00  00 00 00 00  00 00 00 00  00 00 00 00  ................             1009.1.16
  15.3                             32  IN     55 33 56 54  00 00 20 00  02 00 00 00  00 00 00 00  U3VT.. .........   13us      1010.1.0        10:00:51.266
                                              00 00 00 00  20 70 00 00  00 00 00 00  38 01 00 00  .... p......8...             1010.1.16
  15.3                             52  IN     55 33 56 4c  00 00 34 00  03 00 00 00  00 00 00 00  U3VL..4.........  3.3ms      1011.1.0        10:00:51.269
                                              00 00 01 00  e3 0d 2e 8a  0b 00 00 00  09 00 08 01  ................             1011.1.16
                                              5c 00 00 00  38 01 00 00  00 00 00 00  00 00 00 00  \...8...........             1011.1.32
                                              00 00 00 00                                         ....                         1011.1.48
  15.3                          28672  IN     00 00 00 00  00 00 00 00  00 00 00 00  00 00 00 00  ................   10ms      1012.1.0        10:00:51.280
                                              00 00 00 00  00 00 00 00  00 00 00 00  00 00 00 00  ................             1012.1.16
                                              00 00 00 00  00 00 00 00  00 00 00 00  00 00 00 00  ................             1012.1.32
                                              00 00 00 00  00 00 00 00  00 00 00 00  00 00 00 00  ................             1012.1.48
  15.3                             32  IN     00 00 00 00  00 00 00 00  00 00 00 00  00 00 00 00  ................   15us      1013.1.0        10:00:51.280
                                              00 00 00 00  00 00 00 00  00 00 00 00  00 00 00 00  ................             1013.1.16
  15.3                             32  IN     55 33 56 54  00 00 20 00  03 00 00 00  00 00 00 00  U3VT.. .........   12us      1014.1.0        10:00:51.280
                                              00 00 00 00  20 70 00 00  00 00 00 00  38 01 00 00  .... p......8...             1014.1.16
  15.3                             52  IN     55 33 56 4c  00 00 34 00  04 00 00 00  00 00 00 00  U3VL..4.........  3.2ms      1015.1.0        10:00:51.284
                                              00 00 01 00  30 00 02 8b  0b 00 00 00  09 00 08 01  ....0...........             1015.1.16
                                              5c 00 00 00  38 01 00 00  00 00 00 00  00 00 00 00  \...8...........             1015.1.32
                                              00 00 00 00                                         ....                         1015.1.48
  15.3                          28672  IN     00 00 00 00  00 00 00 00  00 00 00 00  00 00 00 00  ................   10ms      1016.1.0        10:00:51.294
                                              00 00 00 00  00 00 00 00  00 00 00 00  00 00 00 00  ................             1016.1.16
                                              00 00 00 00  00 00 00 00  00 00 00 00  00 00 00 00  ................             1016.1.32
                                              00 00 00 00  00 00 00 00  00 00 00 00  00 00 00 00  ................             1016.1.48
  15.3                             32  IN     00 00 00 00  00 00 00 00  00 00 00 00  00 00 00 00  ................   16us      1017.1.0        10:00:51.294
                                              00 00 00 00  00 00 00 00  00 00 00 00  00 00 00 00  ................             1017.1.16
  15.3                             32  IN     55 33 56 54  00 00 20 00  04 00 00 00  00 00 00 00  U3VT.. .........   12us      1018.1.0        10:00:51.294
                                              00 00 00 00  20 70 00 00  00 00 00 00  38 01 00 00  .... p......8...             1018.1.16
  15.1                             24  OUT    55 33 56 43  00 40 00 08  0c 00 75 00  38 00 40 00  U3VC.@....u.8.@.  151us      1019.1.0        10:00:51.294
                                              00 00 00 00  00 00 04 00                            ........                     1019.1.16
  15.1                             16  IN     55 33 56 43  00 00 01 08  04 00 75 00  01 00 00 00  U3VC......u.....  712us      1020.1.0        10:00:51.295
  15.1                             24  OUT    55 33 56 43  00 40 02 08  0c 00 76 00  04 00 80 00  U3VC.@....v.....  156us      1021.1.0        10:00:51.295
                                              00 00 00 00  00 00 00 00                            ........                     1021.1.16
  15.1                             16  IN     55 33 56 43  00 00 03 08  04 00 76 00  00 00 04 00  U3VC......v.....  800us      1022.1.0        10:00:51.296
  15.1                             24  OUT    55 33 56 43  00 40 00 08  0c 00 77 00  24 00 40 00  U3VC.@....w.$.@.  237us      1023.1.0        10:00:51.296
                                              00 00 00 00  00 00 04 00                            ........                     1023.1.16
  15.1                             16  IN     55 33 56 43  00 00 01 08  04 00 77 00  01 00 00 00  U3VC......w.....  681us      1024.1.0        10:00:51.296
  15.1                             24  OUT    55 33 56 43  00 40 00 08  0c 00 78 00  08 00 50 00  U3VC.@....x...P.  191us      1025.1.0        10:00:51.296
                                              00 00 00 00  00 00 04 00                            ........                     1025.1.16
  15.1                             16  IN     55 33 56 43  00 00 01 08  04 00 78 00  00 20 20 00  U3VC......x..  .  692us      1026.1.0        10:00:51.298
  15.1                             24  OUT    55 33 56 43  00 40 00 08  0c 00 79 00  04 00 50 00  U3VC.@....y...P.  152us      1027.1.0        10:00:51.298
                                              00 00 00 00  00 00 04 00                            ........                     1027.1.16
  15.1                             16  IN     55 33 56 43  00 00 01 08  04 00 79 00  00 00 00 00  U3VC......y.....  696us      1028.1.0        10:00:51.299
  15.1                             24  OUT    55 33 56 43  00 40 00 08  0c 00 7a 00  18 00 90 00  U3VC.@....z.....  107us      1029.1.0        10:00:51.299
                                              00 00 00 00  00 00 04 00                            ........                     1029.1.16
  15.1                             16  IN     55 33 56 43  00 00 01 08  04 00 7a 00  09 00 08 01  U3VC......z.....  675us      1030.1.0        10:00:51.299
  15.1                             24  OUT    55 33 56 43  00 40 00 08  0c 00 7b 00  1c 00 40 00  U3VC.@........@.  244us      1031.1.0        10:00:51.299
                                              00 00 00 00  00 00 04 00                            ........                     1031.1.16
  15.1                             16  IN     55 33 56 43  00 00 01 08  04 00 7b 00  01 00 00 00  U3VC............  671us      1032.1.0        10:00:51.300
  15.1                             24  OUT    55 33 56 43  00 40 00 08  0c 00 7c 00  20 00 40 00  U3VC.@...... .@.  199us      1033.1.0        10:00:51.300
                                              00 00 00 00  00 00 04 00                            ........                     1033.1.16
  15.1                             16  IN     55 33 56 43  00 00 01 08  04 00 7c 00  01 00 00 00  U3VC............  667us      1034.1.0        10:00:51.301
  15.1                             24  OUT    55 33 56 43  00 40 00 08  0c 00 7d 00  d8 01 00 00  U3VC.@..........  173us      1035.1.0        10:00:51.301
                                              00 00 00 00  00 00 08 00                            ........                     1035.1.16
  15.1                             20  IN     55 33 56 43  00 00 01 08  08 00 7d 00  00 00 01 00  U3VC............  695us      1036.1.0        10:00:51.301
                                              00 00 00 00                                         ....                         1036.1.16
  15.1                             24  OUT    55 33 56 43  00 40 00 08  0c 00 7e 00  20 00 01 00  U3VC.@...... ...  120us      1037.1.0        10:00:51.301
                                              00 00 00 00  00 00 08 00                            ........                     1037.1.16
  15.1                             20  IN     55 33 56 43  00 00 01 08  08 00 7e 00  00 00 02 00  U3VC............  679us      1038.1.0        10:00:51.303
                                              00 00 00 00                                         ....                         1038.1.16
  15.1                             24  OUT    55 33 56 43  00 40 00 08  0c 00 7f 00  08 00 02 00  U3VC.@..........  119us      1039.1.0        10:00:51.303
                                              00 00 00 00  00 00 04 00                            ........                     1039.1.16
  15.1                             16  IN     55 33 56 43  00 00 01 08  04 00 7f 00  20 70 00 00  U3VC........ p..  677us      1040.1.0        10:00:51.304
  15.1                             24  OUT    55 33 56 43  00 40 02 08  0c 00 80 00  04 00 02 00  U3VC.@..........  633us      1041.1.0        10:00:51.304
                                              00 00 00 00  00 00 00 00                            ........                     1041.1.16
  15.1                             16  IN     55 33 56 43  00 00 03 08  04 00 80 00  00 00 04 00  U3VC............  9.5ms      1042.1.0        10:00:51.314
  15.1                             24  OUT    55 33 56 43  00 40 02 08  0c 00 81 00  04 00 02 00  U3VC.@..........  145us      1043.1.0        10:00:51.314
                                              00 00 00 00  01 00 00 00                            ........                     1043.1.16
  15.1                             16  IN     55 33 56 43  00 00 03 08  04 00 81 00  00 00 04 00  U3VC............  2.7ms      1044.1.0        10:00:51.316
  15.1                             24  OUT    55 33 56 43  00 40 02 08  0c 00 82 00  04 00 80 00  U3VC.@..........  881us      1045.1.0        10:00:51.318
                                              00 00 00 00  01 00 00 00                            ........                     1045.1.16
  15.1                             16  IN     55 33 56 43  00 00 03 08  04 00 82 00  00 00 04 00  U3VC............  1.6ms      1046.1.0        10:00:51.319
  15.3                             52  IN     55 33 56 4c  00 00 34 00  00 00 00 00  00 00 00 00  U3VL..4.........   86us      1047.1.0        10:00:51.319
                                              00 00 01 00  94 18 24 8d  0b 00 00 00  09 00 08 01  ......$.........             1047.1.16
                                              5c 00 00 00  38 01 00 00  00 00 00 00  00 00 00 00  \...8...........             1047.1.32
                                              00 00 00 00                                         ....                         1047.1.48
  15.3                          10240  IN     00 00 00 00  00 00 00 00  00 00 00 00  00 00 00 00  ................  9.3ms      1048.1.0(3)     10:00:51.329
                                              00 00 00 00  00 00 00 00  00 00 00 00  00 00 00 00  ................             1048.1.16
                                              00 00 00 00  00 00 00 00  00 00 00 00  00 00 00 00  ................             1048.1.32
                                              00 00 00 00  00 00 00 00  00 00 00 00  00 00 00 00  ................             1048.1.48
  15.3                             32  IN     00 00 00 00  00 00 00 00  00 00 00 00  00 00 00 00  ................   64us      1051.1.0        10:00:51.329
                                              00 00 00 00  00 00 00 00  00 00 00 00  00 00 00 00  ................             1051.1.16
  15.3                             32  IN     55 33 56 54  00 00 20 00  00 00 00 00  00 00 00 00  U3VT.. .........    6us      1052.1.0        10:00:51.329
                                              00 00 00 00  40 64 00 00  00 00 00 00  38 01 00 00  ....@d......8...             1052.1.16
  15.0                                 CTL    80 06 00 02  00 00 09 00                            GET DESCRIPTOR    1.0sc      1053.1.0        10:00:52.333
  15.0                              9  IN     09 02 74 00  03 01 00 80  70                        ..t.....p         109us      1053.2.0        10:00:52.333
  15.0                                 CTL    80 06 00 02  00 00 74 00                            GET DESCRIPTOR     77us      1054.1.0        10:00:52.333
  15.0                            116  IN     09 02 74 00  03 01 00 80  70 08 0b 00  03 ef 05 00  ..t.....p.......  916us      1054.2.0        10:00:52.334
                                              03 09 04 00  00 02 ef 05  00 00 14 24  01 00 00 01  ...........$....             1054.2.16
                                              00 00 00 01  00 04 05 06  07 08 09 0a  0b 08 07 05  ................             1054.2.32
                                              81 02 00 04  00 06 30 00  00 00 00 07  05 01 02 00  ......0.........             1054.2.48
  15.0                                 CTL    80 06 00 01  00 00 12 00                            GET DESCRIPTOR    115us      1055.1.0        10:00:52.334
  15.0                             18  IN     12 01 00 03  ef 02 01 09  a2 2b 55 4d  00 00 01 02  .........+UM....  881us      1055.2.0        10:00:52.335
                                              0a 01                                               ..                           1055.2.16
  15.0                                 CTL    80 06 04 03  00 00 02 00                            GET DESCRIPTOR    323us      1056.1.0        10:00:52.335
  15.0                              2  IN     1a 03                                               ..                676us      1056.2.0        10:00:52.336
  15.0                                 CTL    80 06 04 03  00 00 1a 00                            GET DESCRIPTOR     86us      1057.1.0        10:00:52.336
  15.0                             26  IN     1a 03 32 00  42 00 41 00  32 00 30 00  30 00 30 00  ..2.B.A.2.0.0.0.  914us      1057.2.0        10:00:52.336
                                              30 00 31 00  33 00 38 00  31 00                     0.1.3.8.1.                   1057.2.16
  15.1                             24  OUT    55 33 56 43  00 40 00 08  0c 00 00 00  cc 01 00 00  U3VC.@..........   55ms      1058.1.0        10:00:52.393
                                              00 00 00 00  00 00 04 00                            ........                     1058.1.16
  15.1                             16  IN     55 33 56 43  00 00 01 08  04 00 00 00  2c 01 00 00  U3VC........,...  680us      1059.1.0        10:00:52.393
  15.1                             24  OUT    55 33 56 43  00 40 00 08  0c 00 01 00  d8 01 00 00  U3VC.@..........  147us      1060.1.0        10:00:52.393
                                              00 00 00 00  00 00 08 00                            ........                     1060.1.16
  15.1                             20  IN     55 33 56 43  00 00 01 08  08 00 01 00  00 00 01 00  U3VC............  714us      1061.1.0        10:00:52.394
                                              00 00 00 00                                         ....                         1061.1.16
  15.1                             24  OUT    55 33 56 43  00 40 00 08  0c 00 02 00  14 00 01 00  U3VC.@..........  103us      1062.1.0        10:00:52.394
                                              00 00 00 00  00 00 04 00                            ........                     1062.1.16
  15.1                             16  IN     55 33 56 43  00 00 01 08  04 00 02 00  00 04 00 00  U3VC............  664us      1063.1.0        10:00:52.394
  15.1                             24  OUT    55 33 56 43  00 40 00 08  0c 00 03 00  18 00 01 00  U3VC.@..........   71us      1064.1.0        10:00:52.394
                                              00 00 00 00  00 00 04 00                            ........                     1064.1.16
  15.1                             16  IN     55 33 56 43  00 00 01 08  04 00 03 00  00 04 00 00  U3VC............  700us      1065.1.0        10:00:52.395
  15.1                             24  OUT    55 33 56 43  00 40 00 08  0c 00 04 00  c4 01 00 00  U3VC.@..........   91us      1066.1.0        10:00:52.395
                                              00 00 00 00  00 00 08 00                            ........                     1066.1.16
  15.1                             20  IN     55 33 56 43  00 00 01 08  08 00 04 00  0d 0f 00 00  U3VC............  679us      1067.1.0        10:00:52.396
                                              00 00 00 00                                         ....                         1067.1.16
  15.1                             24  OUT    55 33 56 43  00 40 00 08  0c 00 05 00  04 00 01 00  U3VC.@..........   92us      1068.1.0        10:00:52.396
                                              00 00 00 00  00 00 08 00                            ........                     1068.1.16
  15.1                             20  IN     55 33 56 43  00 00 01 08  08 00 05 00  03 00 00 00  U3VC............  676us      1069.1.0        10:00:52.396
                                              00 00 00 00                                         ....                         1069.1.16
  15.1                             24  OUT    55 33 56 43  00 40 00 08  0c 00 06 00  d0 01 00 00  U3VC.@..........   95us      1070.1.0        10:00:52.396
                                              00 00 00 00  00 00 08 00                            ........                     1070.1.16
  15.1                             20  IN     55 33 56 43  00 00 01 08  08 00 06 00  00 40 03 00  U3VC.........@..  679us      1071.1.0        10:00:52.398
                                              00 00 00 00                                         ....                         1071.1.16
  15.1                             24  OUT    55 33 56 43  00 40 00 08  0c 00 07 00  00 40 03 00  U3VC.@.......@..   85us      1072.1.0        10:00:52.398
                                              00 00 00 00  00 00 08 00                            ........                     1072.1.16
  15.1                             20  IN     55 33 56 43  00 00 01 08  08 00 07 00  01 00 00 00  U3VC............  684us      1073.1.0        10:00:52.398
                                              00 00 00 00                                         ....                         1073.1.16
  15.1                             24  OUT    55 33 56 43  00 40 00 08  0c 00 08 00  08 40 03 00  U3VC.@.......@..   97us      1074.1.0        10:00:52.399
                                              00 00 00 00  00 00 2c 00                            ......,.                     1074.1.16
  15.1                             56  IN     55 33 56 43  00 00 01 08  2c 00 08 00  04 00 01 01  U3VC....,.......  713us      1075.1.0        10:00:52.399
                                              00 04 01 01  00 00 d0 00  00 00 00 00  a3 5e 00 00  .............^..             1075.1.16
                                              00 00 00 00  5e 73 41 e2  22 32 73 d1  49 67 e0 b3  ....^sA."2s.Ig..             1075.1.32
                                              66 50 05 09  e9 b3 b8 66                            fP.....f                     1075.1.48
  15.1                             24  OUT    55 33 56 43  00 40 00 08  0c 00 09 00  00 00 d0 00  U3VC.@..........  130us      1076.1.0        10:00:52.399
                                              00 00 00 00  00 00 f4 03                            ........                     1076.1.16
  15.1                           1024  IN     55 33 56 43  00 00 01 08  f4 03 09 00  50 4b 03 04  U3VC........PK..   21ms      1077.1.0        10:00:52.420
                                              14 00 00 00  08 00 77 84  87 47 f0 f1  92 8d f9 5d  ......w..G.....]             1077.1.16
                                              00 00 b6 08  04 00 12 00  00 00 4d 45  52 2d 55 33  ..........MER-U3             1077.1.32
                                              78 5f 56 78  2e 78 2e 78  2e 78 6d 6c  ec 5d db 72  x_Vx.x.x.xml.].r             1077.1.48
  15.1                             24  OUT    55 33 56 43  00 40 00 08  0c 00 0a 00  f4 03 d0 00  U3VC.@..........  181us      1078.1.0        10:00:52.420
                                              00 00 00 00  00 00 f4 03                            ........                     1078.1.16
  15.1                           1024  IN     55 33 56 43  00 00 01 08  f4 03 0a 00  4b 70 64 e3  U3VC........Kpd.   21ms      1079.1.0        10:00:52.441
                                              c7 6e 1b de  b1 8f 19 f1  60 00 45 31  bf 76 9d 2b  .n......`.E1.v.+             1079.1.16
                                              20 cd be 66  ec f7 16 ec  24 ed 35 f4  95 7e 4b b8   ..f....$.5...K.             1079.1.32
                                              2b c5 78 2d  e8 99 8e 91  c7 7c 82 c9  57 4c fb a6  +.x-........WL..             1079.1.48
  15.1                             24  OUT    55 33 56 43  00 40 00 08  0c 00 0b 00  e8 07 d0 00  U3VC.@..........  218us      1080.1.0        10:00:52.443
                                              00 00 00 00  00 00 f4 03                            ........                     1080.1.16
  15.1                           1024  IN     55 33 56 43  00 00 01 08  f4 03 0b 00  c2 1a 0e c8  U3VC............   21ms      1081.1.0        10:00:52.464
                                              b6 c3 31 9b  53 72 bc ec  97 4e 3a b1  e1 3c fc 56  ..1.Sr...N:..<.V             1081.1.16
                                              f4 1b 78 1d  32 a0 9a fb  6c 27 da 55  b0 d2 ab b2  ..x.2...l'.U....             1081.1.32
                                              fc 18 3b 19  f8 7f 99 8b  91 eb a0 42  af 47 23 1d  ..;........B.G#.             1081.1.48
  15.1                             24  OUT    55 33 56 43  00 40 00 08  0c 00 0c 00  dc 0b d0 00  U3VC.@..........  188us      1082.1.0        10:00:52.464
                                              00 00 00 00  00 00 f4 03                            ........                     1082.1.16
  15.1                           1024  IN     55 33 56 43  00 00 01 08  f4 03 0c 00  78 cf a8 85  U3VC........x...   21ms      1083.1.0        10:00:52.485
                                              77 59 f3 6d  8c 5f 2a 5b  be 75 3a f3  ea 12 9c 35  wY.m._*[.u:....5             1083.1.16
                                              1c be 6b 18  ff e4 b3 43  eb b7 1c 2e  4d 50 b6 c7  ..k....C....MP..             1083.1.32
                                              b0 38 0b 5f  36 e0 6f b3  b3 c0 3b d0  95 7b e4 b8  .8._6.o...;.....             1083.1.48
  15.1                             24  OUT    55 33 56 43  00 40 00 08  0c 00 0d 00  d0 0f d0 00  U3VC.@..........  180us      1084.1.0        10:00:52.485
                                              00 00 00 00  00 00 f4 03                            ........                     1084.1.16
  15.1                           1024  IN     55 33 56 43  00 00 01 08  f4 03 0d 00  0e ff f9 3a  U3VC...........:   21ms      1085.1.0        10:00:52.506
                                              c6 66 0c 43  49 e8 22 d4  a9 e4 bb 25  ce 5b 66 2e  .f.CI."....%.[f.             1085.1.16
                                              86 b3 5f 4f  77 f8 ce f3  75 90 05 54  47 04 ba 05  .._Ow...u..TG...             1085.1.32
                                              76 28 1e c2  eb 70 1d c2  5b 01 8d 21  70 f6 51 13  v(...p..[..!p.Q.             1085.1.48
  15.1                             24  OUT    55 33 56 43  00 40 00 08  0c 00 0e 00  c4 13 d0 00  U3VC.@..........  175us      1086.1.0        10:00:52.506
                                              00 00 00 00  00 00 f4 03                            ........                     1086.1.16
  15.1                           1024  IN     55 33 56 43  00 00 01 08  f4 03 0e 00  24 99 12 dd  U3VC........$...   21ms      1087.1.0        10:00:52.528
                                              5e 47 a2 29  a9 9b 3b d9  c4 06 26 97  6f 62 c4 f2  ^G.)..;...&.ob..             1087.1.16
                                              29 27 d9 63  3a 54 43 6a  44 c3 b1 eb  43 c3 b1 c5  )'.c:TCjD...C...             1087.1.32
                                              d0 70 6c 05  34 1c 5b 01  0d b9 15 22  a6 21 35 a2  .pl.4.[....".!5.             1087.1.48
  15.1                             24  OUT    55 33 56 43  00 40 00 08  0c 00 0f 00  b8 17 d0 00  U3VC.@..........  190us      1088.1.0        10:00:52.528
                                              00 00 00 00  00 00 f4 03                            ........                     1088.1.16
  15.1                           1024  IN     55 33 56 43  00 00 01 08  f4 03 0f 00  73 ac b0 ee  U3VC........s...   21ms      1089.1.0        10:00:52.549
                                              f1 4d 4a da  07 26 5b 4b  cb be 0a d3  ec bb 20 cb  .MJ..&[K...... .             1089.1.16
                                              c2 75 3c 09  63 fe b7 64  9d bf 7d 89  af 35 cb db  .u<.c..d.....5..             1089.1.32
                                              a7 ec f6 26  9a dd b0 0c  20 b2 95 04  c9 ae 73 98  ...&.... .....s.             1089.1.48
  15.1                             24  OUT    55 33 56 43  00 40 00 08  0c 00 10 00  ac 1b d0 00  U3VC.@..........  173us      1090.1.0        10:00:52.550
                                              00 00 00 00  00 00 f4 03                            ........                     1090.1.16
  15.1                           1024  IN     55 33 56 43  00 00 01 08  f4 03 10 00  e7 3c f0 31  U3VC.........<.1   21ms      1091.1.0        10:00:52.571
                                              cc 87 fd db  92 ad 57 e4  bf 4f 43 c8  29 67 2f 92  ......W..OC.)g/.             1091.1.16
                                              40 e2 5c fd  23 b1 1c d3  6b 85 9c f0  9d 34 c2 43  @.\.#...k....4.C             1091.1.32
                                              3e f3 d1 6c  c4 a5 9a 24  53 0a d2 84  ee 81 56 90  >..l...$S.....V.             1091.1.48
  15.1                             24  OUT    55 33 56 43  00 40 00 08  0c 00 11 00  a0 1f d0 00  U3VC.@..........  146us      1092.1.0        10:00:52.571
                                              00 00 00 00  00 00 f4 03                            ........                     1092.1.16
  15.1                           1024  IN     55 33 56 43  00 00 01 08  f4 03 11 00  e0 77 73 fb  U3VC.........ws.   21ms      1093.1.0        10:00:52.593
                                              a3 e9 c5 b9  b8 ea 65 6f  26 af 7c d8  db 41 65 05  ......eo&....Ae.             1093.1.16
                                              58 bd 3f 61  1b fe 6c a3  14 c8 77 78  c5 8b 4c 88  X.?a..l...wx..L.             1093.1.32
                                              f2 45 5a eb  67 1f e5 da  b2 bd 2c 6a  6d c5 62 b5  .EZ.g.....,jm.b.             1093.1.48
  15.1                             24  OUT    55 33 56 43  00 40 00 08  0c 00 12 00  94 23 d0 00  U3VC.@.......#..  213us      1094.1.0        10:00:52.593
                                              00 00 00 00  00 00 f4 03                            ........                     1094.1.16
  15.1                           1024  IN     55 33 56 43  00 00 01 08  f4 03 12 00  48 54 1d 42  U3VC........HT.B   21ms      1095.1.0        10:00:52.614
                                              77 a1 f3 f1  7b f6 5a 82  aa 04 8a 7f  bb 7f f9 11  w.....Z.........             1095.1.16
                                              7e e9 89 af  fc b4 3b c5  65 8a d7 a2  98 a0 d1 c3  ......;.e.......             1095.1.32
                                              11 13 ac 24  34 ba aa db  06 95 c0 51  bd 88 c9 dd  ...$4......Q....             1095.1.48
  15.1                             24  OUT    55 33 56 43  00 40 00 08  0c 00 13 00  88 27 d0 00  U3VC.@.......'..   97us      1096.1.0        10:00:52.614
                                              00 00 00 00  00 00 f4 03                            ........                     1096.1.16
  15.1                           1024  IN     55 33 56 43  00 00 01 08  f4 03 13 00  ee 7f 28 12  U3VC..........(.   21ms      1097.1.0        10:00:52.635
                                              a5 0a 52 97  5c b4 1b ea  72 9f 4e 84  7d 09 6c 57  ..R.\...r.N...lW             1097.1.16
                                              a9 69 54 64  c9 07 f5 12  1a 79 92 5a  7d 7b b6 48  .iTd.....y.Z...H             1097.1.32
                                              82 4c cd a6  5a 74 c3 21  b8 bc 7d 3b  fd 8a f7 66  .L..Zt.!...;...f             1097.1.48
  15.1                             24  OUT    55 33 56 43  00 40 00 08  0c 00 14 00  7c 2b d0 00  U3VC.@.......+..  194us      1098.1.0        10:00:52.635
                                              00 00 00 00  00 00 f4 03                            ........                     1098.1.16
  15.1                           1024  IN     55 33 56 43  00 00 01 08  f4 03 14 00  b5 a3 37 24  U3VC..........7$   21ms      1099.1.0        10:00:52.656
                                              6d 54 5a 2b  58 43 49 05  51 f4 ae 12  68 a3 da 14  mTZ+XCI.Q...h...             1099.1.16
                                              de 6b ed 48  1b 95 37 eb  cb 69 06 71  de c1 46 b5  .k.H..7..i.q..F.             1099.1.32
                                              56 5b ef be  a7 8f 00 61  a2 f2 da 7d  11 cc f2 df  V[.....a........             1099.1.48
  15.1                             24  OUT    55 33 56 43  00 40 00 08  0c 00 15 00  70 2f d0 00  U3VC.@......p/..  128us      1100.1.0        10:00:52.656
                                              00 00 00 00  00 00 f4 03                            ........                     1100.1.16
  15.1                           1024  IN     55 33 56 43  00 00 01 08  f4 03 15 00  71 d7 68 43  U3VC........q.hC   21ms      1101.1.0        10:00:52.678
                                              b0 18 73 99  3d b7 bc c7  8e 66 dd 30  cb 6e f5 a5  ..s.=....f.0.n..             1101.1.16
                                              39 1f 29 2e  9a 34 bb 9b  ae eb a1 71  54 f4 d8 00  9.)..4.....qT...             1101.1.32
                                              8e 8a 1e 6b  c4 51 d1 e3  4a 70 54 f4  d8 34 8e 8a  ...k.Q..JpT..4..             1101.1.48
  15.1                             24  OUT    55 33 56 43  00 40 00 08  0c 00 16 00  64 33 d0 00  U3VC.@......d3..  157us      1102.1.0        10:00:52.678
                                              00 00 00 00  00 00 f4 03                            ........                     1102.1.16
  15.1                           1024  IN     55 33 56 43  00 00 01 08  f4 03 16 00  19 48 b4 5b  U3VC.........H.[   21ms      1103.1.0        10:00:52.699
                                              a6 1f 21 24  c6 ce ef a4  db 3a 78 f6  8b 8c 33 be  ..!$.....:x...3.             1103.1.16
                                              b3 f3 2b 22  d2 f8 f7 df  d9 d7 a5 0f  ee d8 5b ee  ..+"..........[.             1103.1.32
                                              9e d5 e8 d2  e4 15 9a 5a  a0 8c 32 7c  ff 73 3a 9e  .......Z..2..s:.             1103.1.48
  15.1                             24  OUT    55 33 56 43  00 40 00 08  0c 00 17 00  58 37 d0 00  U3VC.@......X7..  297us      1104.1.0        10:00:52.700
                                              00 00 00 00  00 00 f4 03                            ........                     1104.1.16
  15.1                           1024  IN     55 33 56 43  00 00 01 08  f4 03 17 00  a8 52 2e 80  U3VC.........R..   21ms      1105.1.0        10:00:52.721
                                              68 3d fd 65  74 1a 55 c8  5f 02 e9 38  ca 75 67 69  h=.et.U._..8.ugi             1105.1.16
                                              23 45 7b 5f  79 82 1a 06  3b 85 22 46  12 41 22 8f  #E._y...;."F.A".             1105.1.32
                                              ec aa 43 d1  44 28 be 02  8b e2 1d a8  ef 79 87 05  ..C.D(.......y..             1105.1.48
  15.1                             24  OUT    55 33 56 43  00 40 00 08  0c 00 18 00  4c 3b d0 00  U3VC.@......L;..  114us      1106.1.0        10:00:52.721
                                              00 00 00 00  00 00 f4 03                            ........                     1106.1.16
  15.1                           1024  IN     55 33 56 43  00 00 01 08  f4 03 18 00  b9 8a d9 d2  U3VC............   21ms      1107.1.0        10:00:52.743
                                              79 aa 73 54  b1 bf 79 c4  c5 0a bd 1e  d6 ae 73 1e  y.sT..y.......s.             1107.1.16
                                              1a 08 99 e5  d8 5c 3d f3  e0 11 2b 2b  f4 4e 59 a7  .....\=...++.NY.             1107.1.32
                                              ce 79 68 20  8c 96 63 73  f5 cc 83 47  fc 2c a7 5b  .yh ..cs...G.,.[             1107.1.48
  15.1                             24  OUT    55 33 56 43  00 40 00 08  0c 00 19 00  40 3f d0 00  U3VC.@......@?..  184us      1108.1.0        10:00:52.743
                                              00 00 00 00  00 00 f4 03                            ........                     1108.1.16
  15.1                           1024  IN     55 33 56 43  00 00 01 08  f4 03 19 00  07 53 a0 52  U3VC.........S.R   21ms      1109.1.0        10:00:52.764
                                              3e b3 88 2e  38 f5 f7 8f  29 34 d2 3f  76 aa 93 e3  >...8...)4.?v...             1109.1.16
                                              05 c4 40 f5  b7 22 28 b5  a0 17 22 66  9f 26 f4 ae  ..@.."(..."f.&..             1109.1.32
                                              0e 17 a0 b0  17 d8 52 2c  59 9c 2c 06  dd cc e7 85  ......R,Y.,.....             1109.1.48
  15.1                             24  OUT    55 33 56 43  00 40 00 08  0c 00 1a 00  34 43 d0 00  U3VC.@......4C..  191us      1110.1.0        10:00:52.764
                                              00 00 00 00  00 00 f4 03                            ........                     1110.1.16
  15.1                           1024  IN     55 33 56 43  00 00 01 08  f4 03 1a 00  25 7a 2a 12  U3VC........%z*.   21ms      1111.1.0        10:00:52.785
                                              a5 6d b5 16  e8 96 51 a0  15 e0 c0 4a  97 2b fe c3  .m....Q....J.+..             1111.1.16
                                              10 68 26 10  a0 fc ac 17  29 30 a0 53  08 9a de 1a  .h&.....)0.S....             1111.1.32
                                              3d 02 cd 2e  f8 8c 72 f4  11 7b 76 b4  dc a4 8e 7e  =.....r...v.....             1111.1.48
  15.1                             24  OUT    55 33 56 43  00 40 00 08  0c 00 1b 00  28 47 d0 00  U3VC.@......(G..  184us      1112.1.0        10:00:52.785
                                              00 00 00 00  00 00 f4 03                            ........                     1112.1.16
  15.1                           1024  IN     55 33 56 43  00 00 01 08  f4 03 1b 00  29 9b 2e ce  U3VC........)...   21ms      1113.1.0        10:00:52.806
                                              37 4c 53 e5  66 ec a1 c1  92 59 8f 5e  b8 1c 8d 7a  7LS.f....Y.^...z             1113.1.16
                                              68 2f 70 f1  e9 75 ab 77  bc 29 21 ab  b8 57 6c 72  h/p..u.w.)!..Wlr             1113.1.32
                                              fc b1 b8 93  bb 2b 3f e0  a5 10 bf c7  80 04 18 f0  .....+?.........             1113.1.48
  15.1                             24  OUT    55 33 56 43  00 40 00 08  0c 00 1c 00  1c 4b d0 00  U3VC.@.......K..  184us      1114.1.0        10:00:52.808
                                              00 00 00 00  00 00 f4 03                            ........                     1114.1.16
  15.1                           1024  IN     55 33 56 43  00 00 01 08  f4 03 1c 00  75 15 cb 6b  U3VC........u..k   21ms      1115.1.0        10:00:52.829
                                              85 b0 fb 02  ec b2 b5 3f  b2 37 b9 4d  0b a3 78 55  .......?.7.M..xU             1115.1.16
                                              b5 f0 25 4a  0b 8d 38 80  69 a1 2d e2  6c 8b 6e 75  ..%J..8.i.-.l.nu             1115.1.32
                                              d4 c3 28 fe  df eb 21 2e  a0 81 99 57  6c 72 68 08  ..(...!....Wlrh.             1115.1.48
  15.1                             24  OUT    55 33 56 43  00 40 00 08  0c 00 1d 00  10 4f d0 00  U3VC.@.......O..  159us      1116.1.0        10:00:52.829
                                              00 00 00 00  00 00 f4 03                            ........                     1116.1.16
  15.1                           1024  IN     55 33 56 43  00 00 01 08  f4 03 1d 00  9e eb 1e 11  U3VC............   21ms      1117.1.0        10:00:52.850
                                              cf 75 cf 88  e7 1a 8d 78  ae 31 88 e7  1a 8f 78 ae  .u.....x.1....x.             1117.1.16
                                              1f 01 f1 5c  63 10 cf 9b  c3 e3 d7 6f  2e 28 e4 11  ...\c......o.(..             1117.1.32
                                              cb b4 1d e6  e1 e4 39 e8  e1 1c 4c a8  a7 a8 72 53  ......9...L...rS             1117.1.48
  15.1                             24  OUT    55 33 56 43  00 40 00 08  0c 00 1e 00  04 53 d0 00  U3VC.@.......S..  130us      1118.1.0        10:00:52.850
                                              00 00 00 00  00 00 f4 03                            ........                     1118.1.16
  15.1                           1024  IN     55 33 56 43  00 00 01 08  f4 03 1e 00  cf 51 26 5f  U3VC.........Q&_   21ms      1119.1.0        10:00:52.871
                                              d2 91 93 0c  8d 89 b8 a8  45 8a 45 e8  64 94 86 0c  ........E.E.d...             1119.1.16
                                              86 c0 af da  2b 69 c0 9e  9a 33 92 18  8a dc 2c e2  ....+i...3....,.             1119.1.32
                                              bf 48 c0 88  65 c7 ea f7  12 d9 28 f3  5e 62 91 67  .H..e.....(.^b.g             1119.1.48
  15.1                             24  OUT    55 33 56 43  00 40 00 08  0c 00 1f 00  f8 56 d0 00  U3VC.@.......V..  198us      1120.1.0        10:00:52.871
                                              00 00 00 00  00 00 f4 03                            ........                     1120.1.16
  15.1                           1024  IN     55 33 56 43  00 00 01 08  f4 03 1f 00  1a 39 aa ec  U3VC.........9..   21ms      1121.1.0        10:00:52.893
                                              a2 cd 84 98  66 cb b9 9b  4f 78 35 9f  c1 9f 66 00  ....f...Ox5...f.             1121.1.16
                                              29 d3 8b 79  6e 70 26 20  5a 6d df ea  92 89 f6 83  )..ynp& Zm......             1121.1.32
                                              70 f0 83 76  91 dd 18 02  6f 83 b5 11  57 73 b3 d6  p..v....o...Ws..             1121.1.48
  15.1                             24  OUT    55 33 56 43  00 40 00 08  0c 00 20 00  ec 5a d0 00  U3VC.@.... ..Z..  140us      1122.1.0        10:00:52.893
                                              00 00 00 00  00 00 b7 03                            ........                     1122.1.16
  15.1                            963  IN     55 33 56 43  00 00 01 08  b7 03 20 00  47 e4 f7 eb  U3VC...... .G...   20ms      1123.1.0        10:00:52.913
                                              a6 bb 66 f7  d7 10 d9 f2  5e dc 8c 24  da 40 5a 1f  ..f.....^..$.@Z.             1123.1.16
                                              99 fd cf 57  9b d2 3e 08  b0 60 de 25  64 b9 38 af  ...W..>..`.%d.8.             1123.1.32
                                              ff 65 bc 8b  2d 86 09 d2  71 d6 ba 3d  64 c2 10 e3  .e..-...q..=d...             1123.1.48
  15.1                             24  OUT    55 33 56 43  00 40 00 08  0c 00 21 00  d8 01 00 00  U3VC.@....!.....  1.7ms      1124.1.0        10:00:52.915
                                              00 00 00 00  00 00 08 00                            ........                     1124.1.16
  15.1                             20  IN     55 33 56 43  00 00 01 08  08 00 21 00  00 00 01 00  U3VC......!.....  698us      1125.1.0        10:00:52.915
                                              00 00 00 00                                         ....                         1125.1.16
  15.1                             24  OUT    55 33 56 43  00 40 00 08  0c 00 22 00  04 00 01 00  U3VC.@....".....  695us      1126.1.0        10:00:52.916
                                              00 00 00 00  00 00 08 00                            ........                     1126.1.16
  15.1                             20  IN     55 33 56 43  00 00 01 08  08 00 22 00  03 00 00 00  U3VC......".....  688us      1127.1.0        10:00:52.916
                                              00 00 00 00                                         ....                         1127.1.16
  15.1                             24  OUT    55 33 56 43  00 40 00 08  0c 00 23 00  20 00 01 00  U3VC.@....#. ...  149us      1128.1.0        10:00:52.916
                                              00 00 00 00  00 00 08 00                            ........                     1128.1.16
  15.1                             20  IN     55 33 56 43  00 00 01 08  08 00 23 00  00 00 02 00  U3VC......#.....  713us      1129.1.0        10:00:52.918
                                              00 00 00 00                                         ....                         1129.1.16
  15.1                             24  OUT    55 33 56 43  00 40 00 08  0c 00 24 00  04 00 01 00  U3VC.@....$.....  656us      1130.1.0        10:00:52.918
                                              00 00 00 00  00 00 08 00                            ........                     1130.1.16
  15.1                             20  IN     55 33 56 43  00 00 01 08  08 00 24 00  03 00 00 00  U3VC......$.....  705us      1131.1.0        10:00:52.919
                                              00 00 00 00                                         ....                         1131.1.16
  15.1                             24  OUT    55 33 56 43  00 40 00 08  0c 00 25 00  2c 00 01 00  U3VC.@....%.,...  127us      1132.1.0        10:00:52.919
                                              00 00 00 00  00 00 08 00                            ........                     1132.1.16
  15.1                             20  IN     55 33 56 43  00 00 01 08  08 00 25 00  00 10 02 00  U3VC......%.....  674us      1133.1.0        10:00:52.920
                                              00 00 00 00                                         ....                         1133.1.16
  15.1                             24  OUT    55 33 56 43  00 40 00 08  0c 00 26 00  00 00 02 00  U3VC.@....&.....  591us      1134.1.0        10:00:52.920
                                              00 00 00 00  00 00 04 00                            ........                     1134.1.16
  15.1                             16  IN     55 33 56 43  00 00 01 08  04 00 26 00  00 00 00 0a  U3VC......&.....  680us      1135.1.0        10:00:52.921
  15.1                             24  OUT    55 33 56 43  00 40 00 08  0c 00 27 00  60 00 40 00  U3VC.@....'.`.@.  135ms      1136.1.0        10:00:53.056
                                              00 00 00 00  00 00 04 00                            ........                     1136.1.16
  15.1                             16  IN     55 33 56 43  00 00 01 08  04 00 27 00  01 00 00 00  U3VC......'.....  658us      1137.1.0        10:00:53.056
  15.1                             24  OUT    55 33 56 43  00 40 00 08  0c 00 28 00  3c 00 90 00  U3VC.@....(.<...  116us      1138.1.0        10:00:53.056
                                              00 00 00 00  00 00 04 00                            ........                     1138.1.16
  15.1                             16  IN     55 33 56 43  00 00 01 08  04 00 28 00  00 00 00 00  U3VC......(.....  675us      1139.1.0        10:00:53.058
  15.1                             24  OUT    55 33 56 43  00 40 00 08  0c 00 29 00  68 01 40 00  U3VC.@....).h.@.  174us      1140.1.0        10:00:53.058
                                              00 00 00 00  00 00 04 00                            ........                     1140.1.16
  15.1                             16  IN     55 33 56 43  00 00 01 08  04 00 29 00  01 00 00 00  U3VC......).....  676us      1141.1.0        10:00:53.059
  15.1                             24  OUT    55 33 56 43  00 40 00 08  0c 00 2a 00  6c 01 40 00  U3VC.@....*.l.@.  153us      1142.1.0        10:00:53.059
                                              00 00 00 00  00 00 04 00                            ........                     1142.1.16
  15.1                             16  IN     55 33 56 43  00 00 01 08  04 00 2a 00  01 00 00 00  U3VC......*.....  692us      1143.1.0        10:00:53.059
  15.1                             24  OUT    55 33 56 43  00 40 00 08  0c 00 2b 00  84 00 50 00  U3VC.@....+...P.  122us      1144.1.0        10:00:53.059
                                              00 00 00 00  00 00 04 00                            ........                     1144.1.16
  15.1                             16  IN     55 33 56 43  00 00 01 08  04 00 2b 00  06 00 00 00  U3VC......+.....  662us      1145.1.0        10:00:53.060
  15.1                             24  OUT    55 33 56 43  00 40 00 08  0c 00 2c 00  70 01 40 00  U3VC.@....,.p.@.  193us      1146.1.0        10:00:53.060
                                              00 00 00 00  00 00 04 00                            ........                     1146.1.16
  15.1                             16  IN     55 33 56 43  00 00 01 08  04 00 2c 00  01 00 00 00  U3VC......,.....  660us      1147.1.0        10:00:53.061
  15.1                             24  OUT    55 33 56 43  00 40 02 08  0c 00 2d 00  dc 00 90 00  U3VC.@....-.....  157us      1148.1.0        10:00:53.061
                                              00 00 00 00  00 00 00 00                            ........                     1148.1.16
  15.1                             16  IN     55 33 56 43  0f 80 03 08  04 00 2d 00  00 00 00 00  U3VC......-.....  460us      1149.1.0        10:00:53.061
  15.0                                 CTL    80 06 00 02  00 00 09 00                            GET DESCRIPTOR    2.8ms      1150.1.0(8)     10:00:53.064
  15.0                              9  IN     09 02 74 00  03 01 00 80  70                        ..t.....p         111us      1150.2.0        10:00:53.064
  15.0                                 CTL    80 06 00 02  00 00 74 00                            GET DESCRIPTOR     79us      1151.1.0(8)     10:00:53.064
  15.0                            116  IN     09 02 74 00  03 01 00 80  70 08 0b 00  03 ef 05 00  ..t.....p.......  916us      1151.2.0        10:00:53.065
                                              03 09 04 00  00 02 ef 05  00 00 14 24  01 00 00 01  ...........$....             1151.2.16
                                              00 00 00 01  00 04 05 06  07 08 09 0a  0b 08 07 05  ................             1151.2.32
                                              81 02 00 04  00 06 30 00  00 00 00 07  05 01 02 00  ......0.........             1151.2.48
  15.0                                 CTL    80 06 00 01  00 00 12 00                            GET DESCRIPTOR    113us      1152.1.0(8)     10:00:53.065
  15.0                             18  IN     12 01 00 03  ef 02 01 09  a2 2b 55 4d  00 00 01 02  .........+UM....  887us      1152.2.0        10:00:53.066
                                              0a 01                                               ..                           1152.2.16
