Bus Hound 6.01 capture on Windows Vista Service Pack 1 (x64). Complements of www.perisoft.net

  Device - Device ID (followed by the endpoint for USB devices)
            (24) HID Keyboard Device
            (29) USB3 Vision Digital Camera
  Length - Total transfer length
  Phase  - Phase Type
            IN    Data in transfer           
  Data   - Hex dump of the data transferred
  Descr  - Description of the phase
  Delta  - Elapsed time from the previous phase to the current phase
  Date   - Date the phase occurred in year/month/day form
  Time   - Time the phase occurred in hour:minute:second.millisec form
  Driver - Driver that submitted the command
            ntoskrnl     : NT Kernel & System 6.1.7601.17514 (win7sp1_rtm.101119-1850)


Device  Length    Phase  Data                                                Description       Delta  Date        Time          Driver      
------  --------  -----  --------------------------------------------------  ----------------  -----  ----------  ------------  ------------
  29.3   1048576  IN     00 00 00 00  00 00 00 00  00 00 00 00  00 00 00 00  ................  926us  2017/07/18  15:11:34.495  ntoskrnl      
                         00 00 00 00  00 00 00 00  00 00 00 00  00 00 00 00  ................                                                 
                         00 00 01 00  00 00 00 00  00 01 00 01  00 00 00 00  ................                                                 
                         01 00 00 01  00 00 00 01  01 00 00 00  00 00 00 00  ................                                                 
  29.3    262144  IN     00 01 01 01  01 02 01 01  01 02 01 01  02 01 01 01  ................  2.0ms  2017/07/18  15:11:34.497  ntoskrnl      
                         02 02 01 01  01 01 01 01  01 02 01 01  01 01 00 01  ................                                                 
                         00 01 01 02  01 02 01 01  01 02 01 01  01 01 03 01  ................                                                 
                         02 01 01 01  02 01 01 01  01 01 01 01  01 01 01 01  ................                                                 
  29.3        32  IN     55 33 56 54  00 00 20 00  6e 0f 00 00  00 00 00 00  U3VT.. .n.......   17us  2017/07/18  15:11:34.497  ntoskrnl      
                         00 00 00 00  00 00 14 00  00 00 00 00  00 04 00 00  ................                                                 
  29.3        52  IN     55 33 56 4c  00 00 34 00  6f 0f 00 00  00 00 00 00  U3VL..4.o.......   25us  2017/07/18  15:11:34.497  ntoskrnl      
                         00 00 01 00  0d 84 04 21  0d 00 00 00  09 00 08 01  .......!........                                                 
                         00 05 00 00  00 04 00 00  00 00 00 00  00 00 00 00  ................                                                 
                         00 00 00 00                                         ....                                                             
  29.3   1048576  IN     00 00 00 00  00 00 01 00  00 00 00 00  00 01 00 01  ................  8.6ms  2017/07/18  15:11:34.506  ntoskrnl      
                         00 00 00 00  00 00 00 00  00 00 00 00  00 00 00 00  ................                                                 
                         00 00 00 01  00 00 01 00  00 00 00 01  00 00 00 00  ................                                                 
                         00 01 00 00  00 00 00 00  01 00 00 00  01 00 00 00  ................                                                 
  29.3    262144  IN     02 01 01 01  01 01 02 01  02 01 01 01  01 01 01 01  ................  2.0ms  2017/07/18  15:11:34.508  ntoskrnl      
                         01 02 01 01  01 01 01 01  01 01 01 01  01 02 01 01  ................                                                 
                         00 01 01 01  01 01 01 01  01 01 01 01  01 01 02 01  ................                                                 
                         02 01 01 02  01 02 01 01  01 01 02 01  02 02 01 01  ................                                                 
  29.3        32  IN     55 33 56 54  00 00 20 00  6f 0f 00 00  00 00 00 00  U3VT.. .o.......   40us  2017/07/18  15:11:34.508  ntoskrnl      
                         00 00 00 00  00 00 14 00  00 00 00 00  00 04 00 00  ................                                                 
  29.3        52  IN     55 33 56 4c  00 00 34 00  70 0f 00 00  00 00 00 00  U3VL..4.p.......   24us  2017/07/18  15:11:34.508  ntoskrnl      
                         00 00 01 00  17 8a a8 21  0d 00 00 00  09 00 08 01  .......!........                                                 
                         00 05 00 00  00 04 00 00  00 00 00 00  00 00 00 00  ................                                                 
                         00 00 00 00                                         ....                                                             
  29.3   1048576  IN     00 00 00 00  01 00 00 00  00 00 00 00  00 00 00 01  ................  8.5ms  2017/07/18  15:11:34.517  ntoskrnl      
                         00 00 00 01  00 00 00 00  00 00 00 01  00 00 01 01  ................                                                 
                         00 00 01 00  00 00 01 00  00 01 00 00  00 00 00 00  ................                                                 
                         00 00 00 00  00 00 00 01  01 00 00 00  00 01 00 00  ................                                                 
  29.3    262144  IN     02 02 01 01  01 01 01 01  01 01 01 01  01 01 01 01  ................  2.0ms  2017/07/18  15:11:34.519  ntoskrnl      
                         01 02 02 01  01 01 01 01  01 01 01 01  01 01 01 01  ................                                                 
                         00 01 01 02  02 02 01 01  01 01 01 01  01 01 02 01  ................                                                 
                         02 01 01 01  01 01 01 01  01 01 01 01  02 01 02 01  ................                                                 
  29.3        32  IN     55 33 56 54  00 00 20 00  70 0f 00 00  00 00 00 00  U3VT.. .p.......   26us  2017/07/18  15:11:34.519  ntoskrnl      
                         00 00 00 00  00 00 14 00  00 00 00 00  00 04 00 00  ................                                                 
  29.3        52  IN     55 33 56 4c  00 00 34 00  71 0f 00 00  00 00 00 00  U3VL..4.q.......   12us  2017/07/18  15:11:34.519  ntoskrnl      
                         00 00 01 00  08 90 4c 22  0d 00 00 00  09 00 08 01  ......L"........                                                 
                         00 05 00 00  00 04 00 00  00 00 00 00  00 00 00 00  ................                                                 
                         00 00 00 00                                         ....                                                             
  29.3   1048576  IN     00 00 00 00  00 01 01 00  00 00 00 00  01 00 00 01  ................  8.6ms  2017/07/18  15:11:34.527  ntoskrnl      
                         00 01 00 00  00 00 00 00  00 00 00 00  00 00 00 00  ................                                                 
                         00 01 00 00  00 01 00 00  00 00 00 00  01 00 00 00  ................                                                 
                         01 01 00 00  00 00 00 01  01 00 00 00  00 00 00 00  ................                                                 
  29.3    262144  IN     01 01 01 01  01 01 01 01  01 01 01 01  01 01 01 01  ................  2.0ms  2017/07/18  15:11:34.530  ntoskrnl      
                         00 01 01 01  00 01 01 01  01 01 01 01  00 01 01 00  ................                                                 
                         00 01 01 01  01 01 01 01  00 01 01 01  01 01 02 01  ................                                                 
                         02 01 01 01  01 01 01 01  01 01 01 01  01 01 01 01  ................                                                 
  29.3        32  IN     55 33 56 54  00 00 20 00  71 0f 00 00  00 00 00 00  U3VT.. .q.......   40us  2017/07/18  15:11:34.530  ntoskrnl      
                         00 00 00 00  00 00 14 00  00 00 00 00  00 04 00 00  ................                                                 
  29.3        52  IN     55 33 56 4c  00 00 34 00  72 0f 00 00  00 00 00 00  U3VL..4.r.......   17us  2017/07/18  15:11:34.530  ntoskrnl      
                         00 00 01 00  12 96 f0 22  0d 00 00 00  09 00 08 01  ......."........                                                 
                         00 05 00 00  00 04 00 00  00 00 00 00  00 00 00 00  ................                                                 
                         00 00 00 00                                         ....                                                             
  29.3   1048576  IN     00 00 00 00  00 00 00 00  00 00 01 00  00 00 00 01  ................  8.5ms  2017/07/18  15:11:34.538  ntoskrnl      
                         00 01 00 00  00 00 00 00  00 00 00 00  00 00 00 00  ................                                                 
                         00 00 01 00  00 00 01 00  00 00 00 00  00 00 00 00  ................                                                 
                         00 00 00 00  00 00 01 00  01 00 00 00  00 00 00 00  ................                                                 
  29.3    262144  IN     01 01 01 01  01 02 02 01  01 02 02 01  02 01 01 01  ................  2.0ms  2017/07/18  15:11:34.540  ntoskrnl      
                         01 01 01 01  01 02 01 01  01 02 01 01  01 02 01 01  ................                                                 
                         00 01 01 02  02 02 01 01  01 01 02 02  01 01 02 01  ................                                                 
                         02 01 01 02  02 02 02 01  01 02 02 01  02 01 01 01  ................                                                 
  29.3        32  IN     55 33 56 54  00 00 20 00  72 0f 00 00  00 00 00 00  U3VT.. .r.......   22us  2017/07/18  15:11:34.540  ntoskrnl      
                         00 00 00 00  00 00 14 00  00 00 00 00  00 04 00 00  ................                                                 
  29.3        52  IN     55 33 56 4c  00 00 34 00  73 0f 00 00  00 00 00 00  U3VL..4.s.......   19us  2017/07/18  15:11:34.540  ntoskrnl      
                         00 00 01 00  1c 9c 94 23  0d 00 00 00  09 00 08 01  .......#........                                                 
                         00 05 00 00  00 04 00 00  00 00 00 00  00 00 00 00  ................                                                 
                         00 00 00 00                                         ....                                                             
  29.3   1048576  IN     00 00 00 00  00 00 01 00  00 00 00 00  00 00 00 01  ................  8.6ms  2017/07/18  15:11:34.549  ntoskrnl      
                         00 00 00 01  00 00 00 00  00 01 01 00  00 00 00 00  ................                                                 
                         00 00 00 00  00 00 01 00  00 00 00 00  00 00 00 00  ................                                                 
                         00 00 01 00  00 00 01 00  01 00 00 00  00 01 00 00  ................                                                 
  29.3    262144  IN     01 01 01 01  01 01 01 02  01 01 02 01  01 01 01 01  ................  2.0ms  2017/07/18  15:11:34.551  ntoskrnl      
                         01 01 01 01  01 02 01 01  01 01 01 00  01 00 01 01  ................                                                 
                         00 01 01 02  02 02 01 01  01 01 01 01  01 02 02 01  ................                                                 
                         02 01 01 02  01 02 01 01  01 01 01 01  02 01 01 01  ................                                                 
  29.3        32  IN     55 33 56 54  00 00 20 00  73 0f 00 00  00 00 00 00  U3VT.. .s.......   25us  2017/07/18  15:11:34.551  ntoskrnl      
                         00 00 00 00  00 00 14 00  00 00 00 00  00 04 00 00  ................                                                 
  29.3        52  IN     55 33 56 4c  00 00 34 00  74 0f 00 00  00 00 00 00  U3VL..4.t.......   18us  2017/07/18  15:11:34.551  ntoskrnl      
                         00 00 01 00  26 a2 38 24  0d 00 00 00  09 00 08 01  ....&.8$........                                                 
                         00 05 00 00  00 04 00 00  00 00 00 00  00 00 00 00  ................                                                 
                         00 00 00 00                                         ....                                                             
  29.3   1048576  IN     00 01 01 01  01 00 01 00  00 00 00 00  00 01 00 01  ................  8.6ms  2017/07/18  15:11:34.560  ntoskrnl      
                         00 00 01 00  01 00 01 00  00 00 00 01  00 00 00 00  ................                                                 
                         00 00 01 01  00 01 00 00  00 00 00 01  01 00 01 00  ................                                                 
                         00 01 00 01  00 00 01 01  00 00 00 00  01 01 00 00  ................                                                 
  29.3    262144  IN     02 01 01 01  02 02 01 01  01 01 02 01  01 01 01 01  ................  2.0ms  2017/07/18  15:11:34.562  ntoskrnl      
                         01 01 01 01  01 01 01 01  01 01 01 01  01 02 00 01  ................                                                 
                         00 01 01 01  01 01 01 01  01 01 01 01  01 01 02 01  ................                                                 
                         02 01 01 02  01 01 01 01  01 01 01 01  02 02 01 01  ................                                                 
  29.3        32  IN     55 33 56 54  00 00 20 00  74 0f 00 00  00 00 00 00  U3VT.. .t.......   27us  2017/07/18  15:11:34.562  ntoskrnl      
                         00 00 00 00  00 00 14 00  00 00 00 00  00 04 00 00  ................                                                 
  29.3        52  IN     55 33 56 4c  00 00 34 00  75 0f 00 00  00 00 00 00  U3VL..4.u.......    9us  2017/07/18  15:11:34.562  ntoskrnl      
                         00 00 01 00  3f 80 dc 24  0d 00 00 00  09 00 08 01  ....?..$........                                                 
                         00 05 00 00  00 04 00 00  00 00 00 00  00 00 00 00  ................                                                 
                         00 00 00 00                                         ....                                                             
  29.3   1048576  IN     01 01 01 00  01 00 00 00  00 00 00 00  00 00 01 01  ................  8.6ms  2017/07/18  15:11:34.571  ntoskrnl      
                         00 00 00 00  00 00 01 00  00 00 00 01  01 00 01 00  ................                                                 
                         01 00 01 00  01 00 01 00  00 00 01 01  01 00 01 00  ................                                                 
                         00 00 00 00  00 00 01 01  00 01 00 01  01 01 00 01  ................                                                 
  29.3    262144  IN     01 01 01 01  02 01 01 01  01 01 02 01  01 01 01 01  ................  2.0ms  2017/07/18  15:11:34.573  ntoskrnl      
                         01 02 02 02  01 01 01 02  01 01 01 02  01 01 01 01  ................                                                 
                         00 01 01 02  01 02 01 01  01 01 01 01  01 02 02 01  ................                                                 
                         02 01 01 01  01 02 02 01  00 02 01 01  02 01 01 02  ................                                                 
  29.3        32  IN     55 33 56 54  00 00 20 00  75 0f 00 00  00 00 00 00  U3VT.. .u.......   36us  2017/07/18  15:11:34.573  ntoskrnl      
                         00 00 00 00  00 00 14 00  00 00 00 00  00 04 00 00  ................                                                 
  29.3        52  IN     55 33 56 4c  00 00 34 00  76 0f 00 00  00 00 00 00  U3VL..4.v.......   25us  2017/07/18  15:11:34.573  ntoskrnl      
                         00 00 01 00  30 86 80 25  0d 00 00 00  09 00 08 01  ....0..%........                                                 
                         00 05 00 00  00 04 00 00  00 00 00 00  00 00 00 00  ................                                                 
                         00 00 00 00                                         ....                                                             
  29.3   1048576  IN     00 00 00 00  00 01 00 00  00 00 00 00  00 00 00 01  ................  8.6ms  2017/07/18  15:11:34.581  ntoskrnl      
                         00 01 00 00  00 00 00 00  00 00 00 01  00 00 00 00  ................                                                 
                         00 00 00 00  00 00 00 00  00 00 00 00  00 00 01 00  ................                                                 
                         00 00 00 00  00 00 00 00  01 01 00 00  00 00 00 00  ................                                                 
  29.3    262144  IN     01 01 01 01  02 02 01 01  02 01 02 01  01 01 01 01  ................  2.0ms  2017/07/18  15:11:34.583  ntoskrnl      
                         02 02 01 02  01 01 01 01  01 01 01 01  01 01 01 01  ................                                                 
                         00 01 02 02  02 02 01 01  01 02 01 01  01 01 02 01  ................                                                 
                         02 01 02 02  01 01 01 01  01 01 02 01  01 01 01 01  ................                                                 
  29.3        32  IN     55 33 56 54  00 00 20 00  76 0f 00 00  00 00 00 00  U3VT.. .v.......   44us  2017/07/18  15:11:34.583  ntoskrnl      
                         00 00 00 00  00 00 14 00  00 00 00 00  00 04 00 00  ................                                                 
  29.3        52  IN     55 33 56 4c  00 00 34 00  77 0f 00 00  00 00 00 00  U3VL..4.w.......   32us  2017/07/18  15:11:34.583  ntoskrnl      
                         00 00 01 00  3a 8c 24 26  0d 00 00 00  09 00 08 01  ....:.$&........                                                 
                         00 05 00 00  00 04 00 00  00 00 00 00  00 00 00 00  ................                                                 
                         00 00 00 00                                         ....                                                             
  29.3   1048576  IN     00 01 00 00  00 00 00 00  00 00 00 00  00 00 00 01  ................  8.5ms  2017/07/18  15:11:34.592  ntoskrnl      
                         00 00 00 00  00 00 01 00  01 00 00 01  00 01 00 00  ................                                                 
                         00 00 01 01  00 01 00 00  00 00 00 00  00 00 00 00  ................                                                 
                         01 00 00 00  00 00 01 01  01 00 00 00  00 01 00 00  ................                                                 
  29.3    262144  IN     02 01 01 01  01 01 01 01  02 01 02 01  01 01 01 01  ................  2.0ms  2017/07/18  15:11:34.594  ntoskrnl      
                         01 01 01 01  01 01 01 01  01 02 00 01  01 01 01 00  ................                                                 
                         00 01 01 02  02 01 01 01  01 01 01 01  01 01 02 01  ................                                                 
                         02 01 01 02  02 02 02 02  01 01 01 01  02 02 01 01  ................                                                 
  29.3        32  IN     55 33 56 54  00 00 20 00  77 0f 00 00  00 00 00 00  U3VT.. .w.......   14us  2017/07/18  15:11:34.594  ntoskrnl      
                         00 00 00 00  00 00 14 00  00 00 00 00  00 04 00 00  ................                                                 
  29.3        52  IN     55 33 56 4c  00 00 34 00  78 0f 00 00  00 00 00 00  U3VL..4.x.......   22us  2017/07/18  15:11:34.594  ntoskrnl      
                         00 00 01 00  44 92 c8 26  0d 00 00 00  09 00 08 01  ....D..&........                                                 
                         00 05 00 00  00 04 00 00  00 00 00 00  00 00 00 00  ................                                                 
                         00 00 00 00                                         ....                                                             
  29.3   1048576  IN     00 00 00 00  01 00 00 00  00 00 00 00  00 00 00 01  ................  8.6ms  2017/07/18  15:11:34.603  ntoskrnl      
                         00 01 00 00  00 00 00 01  00 00 00 00  00 00 00 01  ................                                                 
                         00 00 00 01  00 00 01 00  00 00 00 00  00 00 00 01  ................                                                 
                         00 01 00 00  00 00 00 00  00 00 00 01  00 00 00 00  ................                                                 
  29.3    262144  IN     01 01 01 01  02 01 01 01  01 01 01 01  01 01 01 01  ................  2.0ms  2017/07/18  15:11:34.605  ntoskrnl      
                         02 01 01 01  01 01 01 01  01 01 00 01  00 01 01 01  ................                                                 
                         00 01 01 02  01 01 01 00  01 01 01 01  01 01 02 01  ................                                                 
                         02 01 01 01  01 01 01 01  01 01 01 01  01 01 01 01  ................                                                 
  29.3        32  IN     55 33 56 54  00 00 20 00  78 0f 00 00  00 00 00 00  U3VT.. .x.......   20us  2017/07/18  15:11:34.605  ntoskrnl      
                         00 00 00 00  00 00 14 00  00 00 00 00  00 04 00 00  ................                                                 
  29.3        52  IN     55 33 56 4c  00 00 34 00  79 0f 00 00  00 00 00 00  U3VL..4.y.......   22us  2017/07/18  15:11:34.605  ntoskrnl      
                         00 00 01 00  4e 98 6c 27  0d 00 00 00  09 00 08 01  ....N.l'........                                                 
                         00 05 00 00  00 04 00 00  00 00 00 00  00 00 00 00  ................                                                 
                         00 00 00 00                                         ....                                                             
  29.3   1048576  IN     01 01 01 01  00 00 00 00  00 00 00 00  00 01 00 01  ................  8.6ms  2017/07/18  15:11:34.613  ntoskrnl      
                         00 00 00 01  00 00 00 00  00 00 01 01  00 00 00 00  ................                                                 
                         00 00 01 01  00 00 00 00  00 00 00 01  00 00 00 00  ................                                                 
                         00 01 00 01  00 00 00 01  00 01 00 00  00 00 00 00  ................                                                 
  29.3    262144  IN     01 01 01 01  02 02 01 01  01 01 01 00  01 01 01 00  ................  2.0ms  2017/07/18  15:11:34.616  ntoskrnl      
                         01 01 01 01  01 01 01 01  01 01 01 01  01 01 00 01  ................                                                 
                         00 01 01 02  01 02 01 01  01 01 01 01  01 01 01 01  ................                                                 
                         02 01 01 02  01 01 01 01  01 01 01 01  01 01 02 01  ................                                                 
  29.3        32  IN     55 33 56 54  00 00 20 00  79 0f 00 00  00 00 00 00  U3VT.. .y.......   45us  2017/07/18  15:11:34.616  ntoskrnl      
                         00 00 00 00  00 00 14 00  00 00 00 00  00 04 00 00  ................                                                 
  29.3        52  IN     55 33 56 4c  00 00 34 00  7a 0f 00 00  00 00 00 00  U3VL..4.z.......   32us  2017/07/18  15:11:34.616  ntoskrnl      
                         00 00 01 00  58 9e 10 28  0d 00 00 00  09 00 08 01  ....X..(........                                                 
                         00 05 00 00  00 04 00 00  00 00 00 00  00 00 00 00  ................                                                 
                         00 00 00 00                                         ....                                                             
  29.3   1048576  IN     00 00 00 00  00 01 01 00  00 00 01 00  01 00 00 01  ................  8.5ms  2017/07/18  15:11:34.624  ntoskrnl      
                         00 01 00 00  01 00 01 00  00 00 00 00  00 00 00 01  ................                                                 
                         00 00 00 00  01 00 01 00  01 00 00 01  00 00 00 00  ................                                                 
                         00 01 00 00  00 00 01 00  01 00 00 01  00 01 00 00  ................                                                 
  29.3    262144  IN     01 01 01 01  01 01 01 01  02 01 01 01  01 01 01 01  ................  2.0ms  2017/07/18  15:11:34.626  ntoskrnl      
                         01 02 01 01  01 01 01 01  01 01 01 01  01 01 01 01  ................                                                 
                         00 01 01 02  01 02 01 01  01 01 01 01  01 01 02 01  ................                                                 
                         02 01 01 01  02 01 01 01  01 01 01 01  02 01 01 01  ................                                                 
  29.3        32  IN     55 33 56 54  00 00 20 00  7a 0f 00 00  00 00 00 00  U3VT.. .z.......   17us  2017/07/18  15:11:34.626  ntoskrnl      
                         00 00 00 00  00 00 14 00  00 00 00 00  00 04 00 00  ................                                                 
  29.3        52  IN     55 33 56 4c  00 00 34 00  7b 0f 00 00  00 00 00 00  U3VL..4.........   22us  2017/07/18  15:11:34.626  ntoskrnl      
                         00 00 01 00  49 a4 b4 28  0d 00 00 00  09 00 08 01  ....I..(........                                                 
                         00 05 00 00  00 04 00 00  00 00 00 00  00 00 00 00  ................                                                 
                         00 00 00 00                                         ....                                                             
  29.3   1048576  IN     00 00 00 01  00 01 00 00  00 00 00 00  00 00 00 01  ................  8.6ms  2017/07/18  15:11:34.635  ntoskrnl      
                         00 00 00 00  00 00 00 00  00 00 00 00  00 00 00 00  ................                                                 
                         01 00 01 01  01 00 00 00  00 01 01 00  00 00 00 00  ................                                                 
                         00 01 00 00  00 00 00 00  01 00 00 01  00 01 01 00  ................                                                 
  29.3    262144  IN     02 01 01 01  02 01 01 01  01 01 01 01  01 01 00 01  ................  2.0ms  2017/07/18  15:11:34.637  ntoskrnl      
                         01 02 01 01  01 02 01 01  01 01 00 00  00 01 01 00  ................                                                 
                         00 01 01 02  01 02 01 01  01 01 01 01  01 01 02 01  ................                                                 
                         02 01 01 01  02 01 01 01  01 01 01 01  01 01 02 01  ................                                                 
  29.3        32  IN     55 33 56 54  00 00 20 00  7b 0f 00 00  00 00 00 00  U3VT.. .........   27us  2017/07/18  15:11:34.637  ntoskrnl      
                         00 00 00 00  00 00 14 00  00 00 00 00  00 04 00 00  ................                                                 
  29.3        52  IN     55 33 56 4c  00 00 34 00  7c 0f 00 00  00 00 00 00  U3VL..4.........   14us  2017/07/18  15:11:34.637  ntoskrnl      
                         00 00 01 00  62 82 58 29  0d 00 00 00  09 00 08 01  ....b.X)........                                                 
                         00 05 00 00  00 04 00 00  00 00 00 00  00 00 00 00  ................                                                 
                         00 00 00 00                                         ....                                                             
  29.3   1048576  IN     00 00 00 01  00 00 00 00  01 00 00 00  00 00 00 01  ................  8.6ms  2017/07/18  15:11:34.646  ntoskrnl      
                         01 01 00 01  01 01 00 00  00 00 00 01  00 00 00 01  ................                                                 
                         00 00 01 00  00 01 00 00  00 00 01 01  00 00 00 01  ................                                                 
                         01 01 00 00  00 00 00 01  01 00 01 00  00 00 00 00  ................                                                 
  29.3    262144  IN     01 02 01 02  02 01 01 01  02 01 02 01  01 01 01 01  ................  2.0ms  2017/07/18  15:11:34.648  ntoskrnl      
                         02 01 01 02  01 01 01 01  01 02 01 01  01 02 01 01  ................                                                 
                         01 01 02 02  01 02 01 01  01 01 01 01  01 01 02 01  ................                                                 
                         02 01 01 02  02 02 02 01  01 01 01 01  01 02 01 01  ................                                                 
  29.3        32  IN     55 33 56 54  00 00 20 00  7c 0f 00 00  00 00 00 00  U3VT.. .........   29us  2017/07/18  15:11:34.648  ntoskrnl      
                         00 00 00 00  00 00 14 00  00 00 00 00  00 04 00 00  ................                                                 
  29.3        52  IN     55 33 56 4c  00 00 34 00  7d 0f 00 00  00 00 00 00  U3VL..4.........   15us  2017/07/18  15:11:34.648  ntoskrnl      
                         00 00 01 00  6c 88 fc 29  0d 00 00 00  09 00 08 01  ....l..)........                                                 
                         00 05 00 00  00 04 00 00  00 00 00 00  00 00 00 00  ................                                                 
                         00 00 00 00                                         ....                                                             
  29.3   1048576  IN     00 00 00 00  00 00 01 00  00 00 00 00  01 01 00 01  ................  8.6ms  2017/07/18  15:11:34.656  ntoskrnl      
                         00 00 00 00  00 00 00 00  00 00 00 00  00 00 01 00  ................                                                 
                         01 00 01 00  00 00 00 00  00 00 01 01  00 00 00 00  ................                                                 
                         00 01 00 00  00 00 01 00  00 00 00 00  01 00 00 00  ................                                                 
  29.3    262144  IN     01 01 01 01  01 01 01 01  02 01 01 01  02 01 01 01  ................  2.0ms  2017/07/18  15:11:34.659  ntoskrnl      
                         01 01 01 02  01 01 01 01  01 02 01 01  01 02 01 01  ................                                                 
                         00 01 01 01  01 01 01 01  01 01 01 01  01 01 02 01  ................                                                 
                         02 01 01 01  02 02 02 02  01 01 01 01  02 01 01 01  ................                                                 
  29.3        32  IN     55 33 56 54  00 00 20 00  7d 0f 00 00  00 00 00 00  U3VT.. .........   22us  2017/07/18  15:11:34.659  ntoskrnl      
                         00 00 00 00  00 00 14 00  00 00 00 00  00 04 00 00  ................                                                 
  29.3        52  IN     55 33 56 4c  00 00 34 00  7e 0f 00 00  00 00 00 00  U3VL..4.........   10us  2017/07/18  15:11:34.659  ntoskrnl      
                         00 00 01 00  76 8e a0 2a  0d 00 00 00  09 00 08 01  ....v..*........                                                 
                         00 05 00 00  00 04 00 00  00 00 00 00  00 00 00 00  ................                                                 
                         00 00 00 00                                         ....                                                             
  29.3   1048576  IN     00 00 00 00  00 01 00 01  00 00 00 00  00 00 01 01  ................  8.7ms  2017/07/18  15:11:34.667  ntoskrnl      
                         01 01 00 00  00 00 00 00  00 00 00 01  00 01 01 00  ................                                                 
                         00 00 01 00  00 01 00 00  00 01 00 01  00 00 01 00  ................                                                 
                         00 00 00 00  00 00 01 01  01 00 00 00  00 00 01 00  ................                                                 
  29.3    262144  IN     02 02 01 02  01 01 01 01  02 01 01 01  01 01 00 01  ................  2.0ms  2017/07/18  15:11:34.669  ntoskrnl      
                         01 01 01 01  01 01 01 01  01 02 01 01  00 01 01 01  ................                                                 
                         00 01 02 01  01 02 01 01  01 01 01 01  01 01 02 01  ................                                                 
                         02 01 01 01  01 01 01 01  01 01 02 01  01 01 02 01  ................                                                 
  29.3        32  IN     55 33 56 54  00 00 20 00  7e 0f 00 00  00 00 00 00  U3VT.. .........   40us  2017/07/18  15:11:34.669  ntoskrnl      
                         00 00 00 00  00 00 14 00  00 00 00 00  00 04 00 00  ................                                                 
  29.3        52  IN     55 33 56 4c  00 00 34 00  7f 0f 00 00  00 00 00 00  U3VL..4.........   21us  2017/07/18  15:11:34.669  ntoskrnl      
                         00 00 01 00  80 94 44 2b  0d 00 00 00  09 00 08 01  ......D+........                                                 
                         00 05 00 00  00 04 00 00  00 00 00 00  00 00 00 00  ................                                                 
                         00 00 00 00                                         ....                                                             
  29.3   1048576  IN     00 00 00 01  01 00 00 00  01 00 01 00  00 00 00 01  ................  8.6ms  2017/07/18  15:11:34.678  ntoskrnl      
                         00 01 00 00  00 01 00 01  00 00 00 00  00 00 01 01  ................                                                 
                         00 00 01 00  00 00 00 00  00 00 00 00  00 00 00 00  ................                                                 
                         00 00 01 00  00 00 00 01  00 00 00 00  00 00 00 00  ................                                                 
  29.3    262144  IN     02 01 01 01  01 02 01 01  01 01 01 01  01 01 01 01  ................  2.0ms  2017/07/18  15:11:34.680  ntoskrnl      
                         01 01 01 01  01 01 01 01  01 01 01 01  01 01 00 01  ................                                                 
                         00 01 01 02  01 01 01 01  01 01 01 01  01 01 02 01  ................                                                 
                         02 01 01 01  01 01 01 01  01 01 01 01  01 01 01 01  ................                                                 
  29.3        32  IN     55 33 56 54  00 00 20 00  7f 0f 00 00  00 00 00 00  U3VT.. .........   34us  2017/07/18  15:11:34.680  ntoskrnl      
                         00 00 00 00  00 00 14 00  00 00 00 00  00 04 00 00  ................                                                 
  29.3        52  IN     55 33 56 4c  00 00 34 00  80 0f 00 00  00 00 00 00  U3VL..4.........   13us  2017/07/18  15:11:34.680  ntoskrnl      
                         00 00 01 00  71 9a e8 2b  0d 00 00 00  09 00 08 01  ....q..+........                                                 
                         00 05 00 00  00 04 00 00  00 00 00 00  00 00 00 00  ................                                                 
                         00 00 00 00                                         ....                                                             
  29.3   1048576  IN     01 00 00 01  00 00 00 00  00 00 00 00  01 00 00 01  ................  8.6ms  2017/07/18  15:11:34.689  ntoskrnl      
                         01 00 00 01  00 00 00 00  00 00 00 00  00 00 00 01  ................                                                 
                         01 00 01 01  00 00 00 00  00 00 01 01  01 00 00 00  ................                                                 
                         01 00 01 00  00 00 01 01  01 01 00 00  00 00 00 00  ................                                                 
  29.3    262144  IN     01 01 01 01  02 01 01 01  01 01 01 01  02 01 01 01  ................  2.0ms  2017/07/18  15:11:34.691  ntoskrnl      
                         01 02 01 01  01 01 01 01  01 02 01 01  01 02 01 01  ................                                                 
                         00 01 01 02  01 01 01 01  01 01 01 01  02 01 02 01  ................                                                 
                         01 01 01 01  01 02 01 01  01 01 01 01  01 01 01 02  ................                                                 
  29.3        32  IN     55 33 56 54  00 00 20 00  80 0f 00 00  00 00 00 00  U3VT.. .........   38us  2017/07/18  15:11:34.691  ntoskrnl      
                         00 00 00 00  00 00 14 00  00 00 00 00  00 04 00 00  ................                                                 
  29.3        52  IN     55 33 56 4c  00 00 34 00  81 0f 00 00  00 00 00 00  U3VL..4.........   14us  2017/07/18  15:11:34.691  ntoskrnl      
                         00 00 01 00  7b a0 8c 2c  0d 00 00 00  09 00 08 01  .......,........                                                 
                         00 05 00 00  00 04 00 00  00 00 00 00  00 00 00 00  ................                                                 
                         00 00 00 00                                         ....                                                             
  29.3   1048576  IN     01 00 00 00  00 00 00 00  00 00 00 00  01 01 00 01  ................  8.6ms  2017/07/18  15:11:34.700  ntoskrnl      
                         00 01 00 01  00 01 00 00  01 00 00 01  00 00 00 00  ................                                                 
                         01 00 01 00  00 00 01 00  00 00 01 00  00 00 00 00  ................                                                 
                         01 00 00 00  00 01 01 01  00 00 00 00  00 01 00 00  ................                                                 
  29.3    262144  IN     02 01 01 02  02 01 01 01  01 01 02 01  01 01 01 01  ................  2.0ms  2017/07/18  15:11:34.702  ntoskrnl      
                         01 01 01 02  02 01 01 01  01 01 01 01  01 02 01 01  ................                                                 
                         00 01 01 02  01 01 01 01  01 01 01 01  01 01 02 01  ................                                                 
                         02 01 01 02  01 02 01 01  01 01 01 01  02 01 02 01  ................                                                 
  29.3        32  IN     55 33 56 54  00 00 20 00  81 0f 00 00  00 00 00 00  U3VT.. .........   39us  2017/07/18  15:11:34.702  ntoskrnl      
                         00 00 00 00  00 00 14 00  00 00 00 00  00 04 00 00  ................                                                 
  29.3        52  IN     55 33 56 4c  00 00 34 00  82 0f 00 00  00 00 00 00  U3VL..4.........   22us  2017/07/18  15:11:34.702  ntoskrnl      
                         00 00 01 00  85 a6 30 2d  0d 00 00 00  09 00 08 01  ......0-........                                                 
                         00 05 00 00  00 04 00 00  00 00 00 00  00 00 00 00  ................                                                 
                         00 00 00 00                                         ....                                                             
  29.3   1048576  IN     00 00 00 00  01 01 01 00  00 00 01 00  00 01 00 01  ................  8.6ms  2017/07/18  15:11:34.710  ntoskrnl      
                         00 01 00 00  00 00 00 00  00 00 00 00  00 00 00 00  ................                                                 
                         00 00 00 00  00 00 00 00  00 00 01 01  00 00 00 00  ................                                                 
                         00 01 00 00  00 00 00 01  00 00 00 00  00 00 00 00  ................                                                 
  29.3    262144  IN     01 01 01 01  01 01 01 01  01 02 02 01  02 01 01 01  ................  2.0ms  2017/07/18  15:11:34.712  ntoskrnl      
                         02 01 01 01  01 01 01 01  01 02 01 00  00 01 01 01  ................                                                 
                         00 01 01 02  01 02 01 01  01 01 01 01  01 02 02 01  ................                                                 
                         02 01 01 01  01 02 01 01  01 01 02 02  02 01 01 01  ................                                                 
  29.3        32  IN     55 33 56 54  00 00 20 00  82 0f 00 00  00 00 00 00  U3VT.. .........   39us  2017/07/18  15:11:34.712  ntoskrnl      
                         00 00 00 00  00 00 14 00  00 00 00 00  00 04 00 00  ................                                                 
  29.3        52  IN     55 33 56 4c  00 00 34 00  83 0f 00 00  00 00 00 00  U3VL..4.........   28us  2017/07/18  15:11:34.712  ntoskrnl      
                         00 00 01 00  9e 84 d4 2d  0d 00 00 00  09 00 08 01  .......-........                                                 
                         00 05 00 00  00 04 00 00  00 00 00 00  00 00 00 00  ................                                                 
                         00 00 00 00                                         ....                                                             
  29.3   1048576  IN     00 00 00 00  01 00 01 00  00 00 00 00  00 00 00 01  ................  8.5ms  2017/07/18  15:11:34.721  ntoskrnl      
                         00 00 00 01  00 00 00 00  01 00 00 00  00 00 00 00  ................                                                 
                         01 00 01 00  00 00 00 00  00 00 00 01  00 00 00 00  ................                                                 
                         01 01 00 00  00 00 01 01  00 00 01 00  00 01 00 00  ................                                                 
  29.3    262144  IN     01 01 01 01  01 01 01 01  01 01 01 01  01 01 01 01  ................  2.0ms  2017/07/18  15:11:34.723  ntoskrnl      
                         01 01 01 01  01 01 01 01  01 02 01 01  01 01 00 01  ................                                                 
                         00 01 01 02  02 01 01 01  01 01 01 01  01 01 02 01  ................                                                 
                         02 01 01 01  02 02 02 01  01 01 01 01  01 01 01 01  ................                                                 
  29.3        32  IN     55 33 56 54  00 00 20 00  83 0f 00 00  00 00 00 00  U3VT.. .........   29us  2017/07/18  15:11:34.723  ntoskrnl      
                         00 00 00 00  00 00 14 00  00 00 00 00  00 04 00 00  ................                                                 
  29.3        52  IN     55 33 56 4c  00 00 34 00  84 0f 00 00  00 00 00 00  U3VL..4.........   13us  2017/07/18  15:11:34.723  ntoskrnl      
                         00 00 01 00  a8 8a 78 2e  0d 00 00 00  09 00 08 01  ......x.........                                                 
                         00 05 00 00  00 04 00 00  00 00 00 00  00 00 00 00  ................                                                 
                         00 00 00 00                                         ....                                                             
  29.3   1048576  IN     00 00 01 00  00 01 01 00  00 00 00 01  00 00 00 00  ................  8.6ms  2017/07/18  15:11:34.732  ntoskrnl      
                         00 01 00 00  00 01 00 01  00 00 00 01  00 00 00 00  ................                                                 
                         01 00 01 00  00 00 00 00  00 00 00 00  01 00 00 00  ................                                                 
                         01 00 00 00  00 00 00 01  00 01 00 01  00 01 00 00  ................                                                 
  29.3    262144  IN     01 02 01 01  01 01 01 01  01 02 01 01  01 01 01 01  ................  2.0ms  2017/07/18  15:11:34.734  ntoskrnl      
                         01 01 01 01  01 01 01 01  01 02 01 01  01 01 01 01  ................                                                 
                         00 01 01 02  01 01 01 01  01 01 01 01  01 01 02 01  ................                                                 
                         02 01 01 01  01 01 01 01  01 01 01 01  02 01 01 01  ................                                                 
  29.3        32  IN     55 33 56 54  00 00 20 00  84 0f 00 00  00 00 00 00  U3VT.. .........   75us  2017/07/18  15:11:34.734  ntoskrnl      
                         00 00 00 00  00 00 14 00  00 00 00 00  00 04 00 00  ................                                                 
  29.3        52  IN     55 33 56 4c  00 00 34 00  85 0f 00 00  00 00 00 00  U3VL..4.........   10us  2017/07/18  15:11:34.734  ntoskrnl      
                         00 00 01 00  99 90 1c 2f  0d 00 00 00  09 00 08 01  ......./........                                                 
                         00 05 00 00  00 04 00 00  00 00 00 00  00 00 00 00  ................                                                 
                         00 00 00 00                                         ....                                                             
  29.3   1048576  IN     00 00 00 01  00 00 00 00  00 00 00 00  00 00 00 01  ................  8.6ms  2017/07/18  15:11:34.743  ntoskrnl      
                         00 01 00 00  00 01 00 00  01 00 00 00  00 00 00 01  ................                                                 
                         00 00 00 00  00 00 00 00  00 00 00 00  00 00 00 00  ................                                                 
                         01 00 00 00  00 00 01 01  01 01 00 00  00 01 00 00  ................                                                 
  29.3    262144  IN     01 02 01 01  01 02 01 01  02 01 01 01  02 01 01 01  ................  2.0ms  2017/07/18  15:11:34.745  ntoskrnl      
                         01 02 01 01  01 01 01 01  02 02 01 01  01 01 01 01  ................                                                 
                         00 01 02 02  01 02 01 01  01 01 01 01  01 01 02 01  ................                                                 
                         02 01 01 02  01 02 02 01  01 01 01 01  01 02 02 01  ................                                                 
  29.3        32  IN     55 33 56 54  00 00 20 00  85 0f 00 00  00 00 00 00  U3VT.. .........   34us  2017/07/18  15:11:34.745  ntoskrnl      
                         00 00 00 00  00 00 14 00  00 00 00 00  00 04 00 00  ................                                                 
  29.3        52  IN     55 33 56 4c  00 00 34 00  86 0f 00 00  00 00 00 00  U3VL..4.........   15us  2017/07/18  15:11:34.745  ntoskrnl      
                         00 00 01 00  a3 96 c0 2f  0d 00 00 00  09 00 08 01  ......./........                                                 
                         00 05 00 00  00 04 00 00  00 00 00 00  00 00 00 00  ................                                                 
                         00 00 00 00                                         ....                                                             
  29.3   1048576  IN     00 00 00 00  00 01 00 00  00 00 00 00  00 00 00 00  ................  8.6ms  2017/07/18  15:11:34.753  ntoskrnl      
                         00 00 00 00  00 01 00 00  00 00 00 00  00 00 01 00  ................                                                 
                         00 00 00 01  00 00 00 00  01 00 00 00  00 00 01 00  ................                                                 
                         00 00 00 00  00 00 00 01  00 00 00 00  00 00 00 00  ................                                                 
  29.3    262144  IN     01 01 01 01  01 02 01 01  01 01 01 01  01 02 01 01  ................  2.0ms  2017/07/18  15:11:34.755  ntoskrnl      
                         01 02 01 02  01 02 01 01  01 01 01 01  01 01 01 01  ................                                                 
                         00 01 01 02  01 01 01 01  01 01 01 01  01 01 02 01  ................                                                 
                         02 01 00 02  02 01 01 01  01 01 02 01  01 01 01 01  ................                                                 
  29.3        32  IN     55 33 56 54  00 00 20 00  86 0f 00 00  00 00 00 00  U3VT.. .........   21us  2017/07/18  15:11:34.755  ntoskrnl      
                         00 00 00 00  00 00 14 00  00 00 00 00  00 04 00 00  ................                                                 
  29.3        52  IN     55 33 56 4c  00 00 34 00  87 0f 00 00  00 00 00 00  U3VL..4.........    6us  2017/07/18  15:11:34.755  ntoskrnl      
                         00 00 01 00  ad 9c 64 30  0d 00 00 00  09 00 08 01  ......d0........                                                 
                         00 05 00 00  00 04 00 00  00 00 00 00  00 00 00 00  ................                                                 
                         00 00 00 00                                         ....                                                             
  29.3   1048576  IN     00 00 00 00  00 00 00 00  00 00 00 00  00 00 00 01  ................  8.7ms  2017/07/18  15:11:34.764  ntoskrnl      
                         00 00 00 01  00 01 00 00  01 00 00 01  00 00 01 00  ................                                                 
                         00 00 00 01  00 00 01 00  00 00 00 01  00 00 01 00  ................                                                 
                         01 01 00 00  00 00 00 00  01 00 00 00  00 01 00 00  ................                                                 
  29.3    262144  IN     01 01 01 01  01 01 01 01  01 01 02 01  02 01 01 01  ................  2.0ms  2017/07/18  15:11:34.766  ntoskrnl      
                         01 02 01 01  01 01 01 01  01 01 01 01  01 01 01 01  ................                                                 
                         00 01 01 01  01 02 01 01  01 01 01 01  01 01 02 01  ................                                                 
                         02 01 01 01  02 02 02 01  01 01 02 01  01 01 01 01  ................                                                 
  29.3        32  IN     55 33 56 54  00 00 20 00  87 0f 00 00  00 00 00 00  U3VT.. .........   77us  2017/07/18  15:11:34.766  ntoskrnl      
                         00 00 00 00  00 00 14 00  00 00 00 00  00 04 00 00  ................                                                 
  29.3        52  IN     55 33 56 4c  00 00 34 00  88 0f 00 00  00 00 00 00  U3VL..4.........   46us  2017/07/18  15:11:34.766  ntoskrnl      
                         00 00 01 00  b7 a2 08 31  0d 00 00 00  09 00 08 01  .......1........                                                 
                         00 05 00 00  00 04 00 00  00 00 00 00  00 00 00 00  ................                                                 
                         00 00 00 00                                         ....                                                             
  29.3   1048576  IN     00 00 00 00  00 00 00 00  01 00 01 00  00 00 00 01  ................  8.6ms  2017/07/18  15:11:34.775  ntoskrnl      
                         00 01 00 00  00 00 00 01  00 00 00 00  00 00 00 00  ................                                                 
                         00 00 00 00  00 00 00 00  01 00 00 01  01 00 01 00  ................                                                 
                         01 00 00 00  00 00 01 01  01 00 01 00  00 00 00 00  ................                                                 
  29.3    262144  IN     02 01 01 01  02 01 01 01  01 01 01 01  01 01 01 01  ................  2.0ms  2017/07/18  15:11:34.777  ntoskrnl      
                         01 01 01 01  01 01 01 01  01 01 01 01  01 01 01 01  ................                                                 
                         00 01 01 02  01 01 01 01  01 01 02 01  01 01 02 01  ................                                                 
                         02 01 01 01  01 01 01 01  01 01 02 02  01 02 01 01  ................                                                 
  29.3        32  IN     55 33 56 54  00 00 20 00  88 0f 00 00  00 00 00 00  U3VT.. .........   41us  2017/07/18  15:11:34.777  ntoskrnl      
                         00 00 00 00  00 00 14 00  00 00 00 00  00 04 00 00  ................                                                 
  29.3        52  IN     55 33 56 4c  00 00 34 00  89 0f 00 00  00 00 00 00  U3VL..4.........   24us  2017/07/18  15:11:34.777  ntoskrnl      
                         00 00 01 00  a8 a8 ac 31  0d 00 00 00  09 00 08 01  .......1........                                                 
                         00 05 00 00  00 04 00 00  00 00 00 00  00 00 00 00  ................                                                 
                         00 00 00 00                                         ....                                                             
  29.3   1048576  IN     00 00 00 00  00 00 00 00  00 00 01 00  00 00 00 01  ................  8.6ms  2017/07/18  15:11:34.785  ntoskrnl      
                         00 00 00 00  00 01 00 00  01 00 00 00  00 00 00 00  ................                                                 
                         00 00 00 00  00 00 00 00  00 00 00 01  01 00 01 00  ................                                                 
                         00 00 00 00  00 00 00 01  00 00 01 00  01 00 00 00  ................                                                 
  29.3    262144  IN     01 02 01 01  01 02 01 01  01 01 01 01  01 01 01 01  ................  2.0ms  2017/07/18  15:11:34.787  ntoskrnl      
                         01 01 01 01  01 01 01 01  01 02 01 01  00 01 00 01  ................                                                 
                         00 01 01 01  01 01 01 01  01 01 02 01  01 02 02 00  ................                                                 
                         02 01 01 01  01 02 01 01  01 01 01 01  01 01 01 01  ................                                                 
  29.3        32  IN     55 33 56 54  00 00 20 00  89 0f 00 00  00 00 00 00  U3VT.. .........   21us  2017/07/18  15:11:34.788  ntoskrnl      
                         00 00 00 00  00 00 14 00  00 00 00 00  00 04 00 00  ................                                                 
  29.3        52  IN     55 33 56 4c  00 00 34 00  8a 0f 00 00  00 00 00 00  U3VL..4.........   23us  2017/07/18  15:11:34.788  ntoskrnl      
                         00 00 01 00  c1 86 50 32  0d 00 00 00  09 00 08 01  ......P2........                                                 
                         00 05 00 00  00 04 00 00  00 00 00 00  00 00 00 00  ................                                                 
                         00 00 00 00                                         ....                                                             
  29.3   1048576  IN     00 01 00 00  00 00 01 00  00 00 00 00  00 00 00 01  ................  8.6ms  2017/07/18  15:11:34.796  ntoskrnl      
                         00 01 00 00  00 00 00 00  00 00 00 00  00 01 00 00  ................                                                 
                         00 00 00 00  00 00 00 00  00 01 01 00  00 00 00 00  ................                                                 
                         00 01 00 00  00 00 00 01  01 00 00 00  00 00 00 00  ................                                                 
  29.3    262144  IN     01 01 01 01  01 01 01 01  01 01 01 01  02 01 01 01  ................  2.0ms  2017/07/18  15:11:34.798  ntoskrnl      
                         02 02 01 02  01 01 01 01  01 01 01 01  01 01 01 01  ................                                                 
                         00 01 01 02  01 01 01 01  01 02 01 01  01 01 02 01  ................                                                 
                         02 01 01 02  02 02 01 01  01 01 02 01  01 01 01 01  ................                                                 
  29.3        32  IN     55 33 56 54  00 00 20 00  8a 0f 00 00  00 00 00 00  U3VT.. .........   22us  2017/07/18  15:11:34.798  ntoskrnl      
                         00 00 00 00  00 00 14 00  00 00 00 00  00 04 00 00  ................                                                 
  29.3        52  IN     55 33 56 4c  00 00 34 00  8b 0f 00 00  00 00 00 00  U3VL..4.........   13us  2017/07/18  15:11:34.798  ntoskrnl      
                         00 00 01 00  cb 8c f4 32  0d 00 00 00  09 00 08 01  .......2........                                                 
                         00 05 00 00  00 04 00 00  00 00 00 00  00 00 00 00  ................                                                 
                         00 00 00 00                                         ....                                                             
  29.3   1048576  IN     01 00 00 00  00 00 01 00  00 00 00 00  00 00 00 01  ................  8.6ms  2017/07/18  15:11:34.807  ntoskrnl      
                         00 00 00 00  00 00 00 00  00 00 00 00  00 00 00 00  ................                                                 
                         01 00 01 00  00 00 01 00  00 00 00 01  00 00 00 00  ................                                                 
                         00 00 01 00  00 00 00 01  01 01 00 00  00 00 00 00  ................                                                 
  29.3    262144  IN     01 02 01 02  01 01 01 01  01 01 01 01  02 01 01 01  ................  2.0ms  2017/07/18  15:11:34.809  ntoskrnl      
                         01 02 01 01  01 02 01 01  00 02 01 01  00 01 00 01  ................                                                 
                         00 01 01 01  01 02 01 01  01 01 01 01  01 02 02 01  ................                                                 
                         02 02 01 01  01 01 02 01  01 01 01 01  01 02 01 01  ................                                                 
  29.3        32  IN     55 33 56 54  00 00 20 00  8b 0f 00 00  00 00 00 00  U3VT.. .........   24us  2017/07/18  15:11:34.809  ntoskrnl      
                         00 00 00 00  00 00 14 00  00 00 00 00  00 04 00 00  ................                                                 
  29.3        52  IN     55 33 56 4c  00 00 34 00  8c 0f 00 00  00 00 00 00  U3VL..4.........   11us  2017/07/18  15:11:34.809  ntoskrnl      
                         00 00 01 00  d5 92 98 33  0d 00 00 00  09 00 08 01  .......3........                                                 
                         00 05 00 00  00 04 00 00  00 00 00 00  00 00 00 00  ................                                                 
                         00 00 00 00                                         ....                                                             
  29.3   1048576  IN     01 00 00 00  00 00 01 00  00 00 01 00  00 00 00 01  ................  8.6ms  2017/07/18  15:11:34.818  ntoskrnl      
                         00 00 00 01  00 00 01 00  00 00 01 00  00 00 00 00  ................                                                 
                         00 00 01 01  00 00 00 00  00 00 00 01  00 00 00 00  ................                                                 
                         00 00 00 00  00 00 00 00  01 00 01 00  01 00 00 00  ................                                                 
  29.3    262144  IN     02 02 01 01  01 02 01 01  01 01 02 01  01 01 02 01  ................  2.0ms  2017/07/18  15:11:34.820  ntoskrnl      
                         01 02 01 01  01 01 00 01  01 02 01 01  01 01 00 01  ................                                                 
                         00 02 01 02  01 02 01 02  01 02 02 01  01 01 02 01  ................                                                 
                         02 01 01 02  02 01 01 02  00 01 01 01  01 01 02 01  ................                                                 
  29.3        32  IN     55 33 56 54  00 00 20 00  8c 0f 00 00  00 00 00 00  U3VT.. .........   30us  2017/07/18  15:11:34.820  ntoskrnl      
                         00 00 00 00  00 00 14 00  00 00 00 00  00 04 00 00  ................                                                 
  29.3        52  IN     55 33 56 4c  00 00 34 00  8d 0f 00 00  00 00 00 00  U3VL..4.........   21us  2017/07/18  15:11:34.820  ntoskrnl      
                         00 00 01 00  df 98 3c 34  0d 00 00 00  09 00 08 01  ......<4........                                                 
                         00 05 00 00  00 04 00 00  00 00 00 00  00 00 00 00  ................                                                 
                         00 00 00 00                                         ....                                                             
  29.3   1048576  IN     00 00 00 00  00 00 00 00  00 00 00 00  00 00 00 01  ................  8.6ms  2017/07/18  15:11:34.828  ntoskrnl      
                         00 00 00 00  01 00 00 00  00 00 00 01  00 00 00 00  ................                                                 
                         00 01 00 01  00 00 00 00  00 00 01 01  00 00 00 00  ................                                                 
                         00 00 00 00  00 00 00 01  00 00 00 00  01 01 00 00  ................                                                 
  29.3    262144  IN     01 01 02 01  01 01 01 01  02 01 01 01  01 01 01 01  ................  2.0ms  2017/07/18  15:11:34.830  ntoskrnl      
                         01 01 02 01  01 01 01 01  01 02 01 01  01 01 01 01  ................                                                 
                         00 01 01 02  01 01 01 01  01 01 01 01  01 01 02 01  ................                                                 
                         02 01 01 01  01 01 01 01  01 01 01 01  01 02 01 01  ................                                                 
  29.3        32  IN     55 33 56 54  00 00 20 00  8d 0f 00 00  00 00 00 00  U3VT.. .........   32us  2017/07/18  15:11:34.831  ntoskrnl      
                         00 00 00 00  00 00 14 00  00 00 00 00  00 04 00 00  ................                                                 
  29.3        52  IN     55 33 56 4c  00 00 34 00  8e 0f 00 00  00 00 00 00  U3VL..4.........   14us  2017/07/18  15:11:34.831  ntoskrnl      
                         00 00 01 00  d0 9e e0 34  0d 00 00 00  09 00 08 01  .......4........                                                 
                         00 05 00 00  00 04 00 00  00 00 00 00  00 00 00 00  ................                                                 
                         00 00 00 00                                         ....                                                             
  29.3   1048576  IN     00 00 01 01  01 00 00 00  01 00 01 00  00 00 00 01  ................  8.6ms  2017/07/18  15:11:34.839  ntoskrnl      
                         00 00 00 00  01 00 00 00  00 00 00 00  00 00 00 01  ................                                                 
                         00 00 00 01  00 00 00 00  00 00 01 00  01 00 00 00  ................                                                 
                         01 01 01 00  00 00 00 01  00 01 01 00  00 00 00 00  ................                                                 
  29.3    262144  IN     01 02 01 01  02 01 01 01  01 01 01 01  01 02 01 01  ................  2.0ms  2017/07/18  15:11:34.841  ntoskrnl      
                         01 02 01 01  01 02 01 01  01 01 01 01  01 01 00 01  ................                                                 
                         00 01 01 01  02 01 01 01  01 01 01 01  01 02 02 01  ................                                                 
                         01 02 01 01  01 01 01 01  01 01 02 01  01 01 01 01  ................                                                 
  29.3        32  IN     55 33 56 54  00 00 20 00  8e 0f 00 00  00 00 00 00  U3VT.. .........   44us  2017/07/18  15:11:34.841  ntoskrnl      
                         00 00 00 00  00 00 14 00  00 00 00 00  00 04 00 00  ................                                                 
  29.3        52  IN     55 33 56 4c  00 00 34 00  8f 0f 00 00  00 00 00 00  U3VL..4.........   32us  2017/07/18  15:11:34.841  ntoskrnl      
                         00 00 01 00  da a4 84 35  0d 00 00 00  09 00 08 01  .......5........                                                 
                         00 05 00 00  00 04 00 00  00 00 00 00  00 00 00 00  ................                                                 
                         00 00 00 00                                         ....                                                             
  29.3   1048576  IN     00 00 00 00  00 00 00 00  00 00 00 00  00 00 00 01  ................  8.6ms  2017/07/18  15:11:34.850  ntoskrnl      
                         00 00 00 00  00 00 00 00  01 00 00 00  00 00 00 01  ................                                                 
                         00 01 00 01  00 00 00 00  00 01 01 00  00 00 00 00  ................                                                 
                         01 01 00 01  00 00 00 00  01 01 00 00  01 01 00 00  ................                                                 
  29.3    262144  IN     01 01 01 01  01 01 01 01  01 01 01 01  01 01 00 01  ................  2.0ms  2017/07/18  15:11:34.852  ntoskrnl      
                         01 02 01 01  01 01 01 01  01 01 01 01  01 01 00 00  ................                                                 
                         00 01 01 01  01 01 00 01  01 01 01 01  01 01 02 01  ................                                                 
                         02 01 01 02  01 01 01 01  01 01 02 01  01 01 01 01  ................                                                 
  29.3        32  IN     55 33 56 54  00 00 20 00  8f 0f 00 00  00 00 00 00  U3VT.. .........   23us  2017/07/18  15:11:34.852  ntoskrnl      
                         00 00 00 00  00 00 14 00  00 00 00 00  00 04 00 00  ................                                                 
  29.3        52  IN     55 33 56 4c  00 00 34 00  90 0f 00 00  00 00 00 00  U3VL..4.........   19us  2017/07/18  15:11:34.852  ntoskrnl      
                         00 00 01 00  e4 aa 28 36  0d 00 00 00  09 00 08 01  ......(6........                                                 
                         00 05 00 00  00 04 00 00  00 00 00 00  00 00 00 00  ................                                                 
                         00 00 00 00                                         ....                                                             
  29.3   1048576  IN     01 00 01 00  00 00 00 00  00 00 00 00  00 00 00 01  ................  8.6ms  2017/07/18  15:11:34.861  ntoskrnl      
                         00 00 00 00  00 00 00 00  00 00 00 00  00 00 00 01  ................                                                 
                         00 00 00 00  00 00 00 00  00 00 01 00  00 00 00 00  ................                                                 
                         00 00 00 00  00 00 01 00  00 00 00 00  00 01 00 00  ................                                                 
  29.3    262144  IN     01 01 00 01  01 01 01 01  01 01 01 01  01 01 00 01  ................  2.0ms  2017/07/18  15:11:34.863  ntoskrnl      
                         01 01 01 01  01 01 01 01  01 01 01 01  01 01 00 01  ................                                                 
                         00 00 01 01  01 02 01 01  01 01 01 01  01 02 02 01  ................                                                 
                         02 01 01 02  01 01 01 01  01 01 01 01  01 01 01 01  ................                                                 
  29.3        32  IN     55 33 56 54  00 00 20 00  90 0f 00 00  00 00 00 00  U3VT.. .........   28us  2017/07/18  15:11:34.863  ntoskrnl      
                         00 00 00 00  00 00 14 00  00 00 00 00  00 04 00 00  ................                                                 
  29.3        52  IN     55 33 56 4c  00 00 34 00  91 0f 00 00  00 00 00 00  U3VL..4.........   13us  2017/07/18  15:11:34.863  ntoskrnl      
                         00 00 01 00  fd 88 cc 36  0d 00 00 00  09 00 08 01  .......6........                                                 
                         00 05 00 00  00 04 00 00  00 00 00 00  00 00 00 00  ................                                                 
                         00 00 00 00                                         ....                                                             
  29.3   1048576  IN     00 00 00 01  00 01 01 00  00 00 00 00  00 00 00 01  ................  8.6ms  2017/07/18  15:11:34.871  ntoskrnl      
                         00 00 00 00  00 00 00 00  00 00 00 01  00 00 01 01  ................                                                 
                         00 00 00 00  00 00 01 00  00 01 00 00  01 00 00 00  ................                                                 
                         01 01 00 00  00 00 01 01  00 00 01 00  01 00 00 00  ................                                                 
  29.3    262144  IN     01 01 01 01  02 02 01 02  01 01 01 01  01 01 01 01  ................  2.0ms  2017/07/18  15:11:34.873  ntoskrnl      
                         01 01 01 02  01 01 01 01  01 02 01 01  01 02 01 01  ................                                                 
                         00 01 01 01  01 01 01 01  01 01 01 01  01 01 03 01  ................                                                 
                         02 01 01 01  02 01 01 01  01 01 01 01  01 02 01 01  ................                                                 
  29.3        32  IN     55 33 56 54  00 00 20 00  91 0f 00 00  00 00 00 00  U3VT.. .........   43us  2017/07/18  15:11:34.874  ntoskrnl      
                         00 00 00 00  00 00 14 00  00 00 00 00  00 04 00 00  ................                                                 
  29.3        52  IN     55 33 56 4c  00 00 34 00  92 0f 00 00  00 00 00 00  U3VL..4.........   11us  2017/07/18  15:11:34.874  ntoskrnl      
                         00 00 01 00  07 8f 70 37  0d 00 00 00  09 00 08 01  ......p7........                                                 
                         00 05 00 00  00 04 00 00  00 00 00 00  00 00 00 00  ................                                                 
                         00 00 00 00                                         ....                                                             
  29.3   1048576  IN     00 00 00 00  00 01 00 00  00 00 01 01  00 00 00 01  ................  8.6ms  2017/07/18  15:11:34.882  ntoskrnl      
                         00 00 01 01  00 01 00 00  01 01 00 01  00 00 00 00  ................                                                 
                         00 00 00 00  00 01 00 00  00 00 01 00  00 00 01 00  ................                                                 
                         00 01 00 00  00 00 00 01  01 00 00 00  00 00 00 00  ................                                                 
  29.3    262144  IN     01 02 01 01  01 02 01 01  02 01 02 01  02 01 01 01  ................  2.0ms  2017/07/18  15:11:34.884  ntoskrnl      
                         01 02 01 01  02 01 01 01  02 02 01 01  01 02 01 01  ................                                                 
                         00 02 02 02  01 02 01 01  01 01 01 01  01 01 02 01  ................                                                 
                         02 01 01 02  01 02 01 01  01 01 01 01  01 01 01 01  ................                                                 
  29.3        32  IN     55 33 56 54  00 00 20 00  92 0f 00 00  00 00 00 00  U3VT.. .........   25us  2017/07/18  15:11:34.884  ntoskrnl      
                         00 00 00 00  00 00 14 00  00 00 00 00  00 04 00 00  ................                                                 
  29.3        52  IN     55 33 56 4c  00 00 34 00  93 0f 00 00  00 00 00 00  U3VL..4.........   10us  2017/07/18  15:11:34.884  ntoskrnl      
                         00 00 01 00  f8 94 14 38  0d 00 00 00  09 00 08 01  .......8........                                                 
                         00 05 00 00  00 04 00 00  00 00 00 00  00 00 00 00  ................                                                 
                         00 00 00 00                                         ....                                                             
  29.3   1048576  IN     00 00 00 00  00 01 01 00  01 00 00 00  01 00 00 01  ................  8.6ms  2017/07/18  15:11:34.893  ntoskrnl      
                         00 00 00 00  01 00 00 00  01 00 00 01  00 00 00 00  ................                                                 
                         00 00 01 01  00 00 01 00  00 00 00 01  00 01 01 00  ................                                                 
                         01 00 00 00  00 00 01 01  01 00 00 00  00 01 00 00  ................                                                 
  29.3    262144  IN     01 01 01 02  01 01 02 01  02 01 02 01  02 01 01 01  ................  2.0ms  2017/07/18  15:11:34.895  ntoskrnl      
                         01 01 01 02  01 02 01 01  02 01 01 01  01 01 01 01  ................                                                 
                         00 01 01 02  01 01 01 01  01 01 01 01  01 01 02 01  ................                                                 
                         02 01 01 02  01 01 02 01  01 01 01 01  02 02 01 01  ................                                                 
  29.3        32  IN     55 33 56 54  00 00 20 00  93 0f 00 00  00 00 00 00  U3VT.. .........   38us  2017/07/18  15:11:34.895  ntoskrnl      
                         00 00 00 00  00 00 14 00  00 00 00 00  00 04 00 00  ................                                                 
  29.3        52  IN     55 33 56 4c  00 00 34 00  94 0f 00 00  00 00 00 00  U3VL..4.........   55us  2017/07/18  15:11:34.895  ntoskrnl      
                         00 00 01 00  02 9b b8 38  0d 00 00 00  09 00 08 01  .......8........                                                 
                         00 05 00 00  00 04 00 00  00 00 00 00  00 00 00 00  ................                                                 
                         00 00 00 00                                         ....                                                             
  29.3   1048576  IN     00 00 00 01  00 01 01 00  00 00 01 00  00 00 00 01  ................  8.6ms  2017/07/18  15:11:34.904  ntoskrnl      
                         00 00 00 00  00 00 00 01  00 00 00 00  00 00 00 00  ................                                                 
                         00 00 01 00  00 00 01 00  01 01 00 00  00 00 00 00  ................                                                 
                         00 00 00 00  00 00 00 00  01 00 00 00  00 00 00 00  ................                                                 
  29.3    262144  IN     01 01 01 01  01 01 01 01  01 01 01 01  01 01 01 01  ................  2.0ms  2017/07/18  15:11:34.906  ntoskrnl      
                         01 02 01 01  01 02 01 02  01 02 01 01  00 01 01 00  ................                                                 
                         01 01 01 02  01 01 01 01  01 01 01 01  01 01 02 00  ................                                                 
                         01 01 01 01  01 02 01 01  01 01 01 01  01 01 01 01  ................                                                 
  29.3        32  IN     55 33 56 54  00 00 20 00  94 0f 00 00  00 00 00 00  U3VT.. .........   17us  2017/07/18  15:11:34.906  ntoskrnl      
                         00 00 00 00  00 00 14 00  00 00 00 00  00 04 00 00  ................                                                 
  29.3        52  IN     55 33 56 4c  00 00 34 00  95 0f 00 00  00 00 00 00  U3VL..4.........   20us  2017/07/18  15:11:34.906  ntoskrnl      
                         00 00 01 00  0c a1 5c 39  0d 00 00 00  09 00 08 01  ......\9........                                                 
                         00 05 00 00  00 04 00 00  00 00 00 00  00 00 00 00  ................                                                 
                         00 00 00 00                                         ....                                                             
  29.3   1048576  IN     00 00 01 00  00 00 01 00  00 00 01 00  00 00 00 01  ................  8.7ms  2017/07/18  15:11:34.914  ntoskrnl      
                         00 00 00 00  00 00 00 00  00 00 00 00  00 00 00 00  ................                                                 
                         00 00 00 00  00 00 01 00  00 00 01 01  00 00 01 00  ................                                                 
                         00 00 00 00  00 00 00 00  00 00 00 00  00 00 00 01  ................                                                 
  29.3    262144  IN     01 01 01 01  02 01 01 01  01 01 01 01  02 01 01 01  ................  1.9ms  2017/07/18  15:11:34.916  ntoskrnl      
                         01 02 01 02  01 01 01 01  01 01 01 01  00 01 01 01  ................                                                 
                         00 01 01 02  01 01 01 01  01 01 01 01  01 02 02 01  ................                                                 
                         02 01 01 02  01 02 01 01  01 01 01 01  01 01 01 01  ................                                                 
  29.3        32  IN     55 33 56 54  00 00 20 00  95 0f 00 00  00 00 00 00  U3VT.. .........   22us  2017/07/18  15:11:34.916  ntoskrnl      
                         00 00 00 00  00 00 14 00  00 00 00 00  00 04 00 00  ................                                                 
  29.3        52  IN     55 33 56 4c  00 00 34 00  96 0f 00 00  00 00 00 00  U3VL..4.........   26us  2017/07/18  15:11:34.916  ntoskrnl      
                         00 00 01 00  16 a7 00 3a  0d 00 00 00  09 00 08 01  .......:........                                                 
                         00 05 00 00  00 04 00 00  00 00 00 00  00 00 00 00  ................                                                 
                         00 00 00 00                                         ....                                                             
  29.3   1048576  IN     00 01 00 00  00 00 01 00  00 00 00 00  00 00 00 01  ................  8.6ms  2017/07/18  15:11:34.925  ntoskrnl      
                         00 00 00 00  00 00 01 00  00 00 00 00  00 00 00 00  ................                                                 
                         01 00 00 00  00 01 00 00  00 00 00 01  00 00 00 00  ................                                                 
                         01 00 00 01  00 00 00 01  00 00 00 00  00 00 00 00  ................                                                 
  29.3    262144  IN     01 01 01 02  02 01 01 01  02 02 02 01  01 01 01 01  ................  2.0ms  2017/07/18  15:11:34.927  ntoskrnl      
                         02 01 01 02  02 01 01 01  01 02 01 01  00 01 01 01  ................                                                 
                         00 01 01 02  02 01 01 01  01 01 01 02  01 01 02 01  ................                                                 
                         02 01 01 02  01 02 02 01  01 01 02 01  02 01 01 01  ................                                                 
  29.3        32  IN     55 33 56 54  00 00 20 00  96 0f 00 00  00 00 00 00  U3VT.. .........   41us  2017/07/18  15:11:34.927  ntoskrnl      
                         00 00 00 00  00 00 14 00  00 00 00 00  00 04 00 00  ................                                                 
  29.3        52  IN     55 33 56 4c  00 00 34 00  97 0f 00 00  00 00 00 00  U3VL..4.........   14us  2017/07/18  15:11:34.927  ntoskrnl      
                         00 00 01 00  20 ad a4 3a  0d 00 00 00  09 00 08 01  .... ..:........                                                 
                         00 05 00 00  00 04 00 00  00 00 00 00  00 00 00 00  ................                                                 
                         00 00 00 00                                         ....                                                             
  29.3   1048576  IN     00 00 00 00  00 00 00 00  01 00 00 00  00 00 00 01  ................  8.6ms  2017/07/18  15:11:34.936  ntoskrnl      
                         00 00 00 00  00 00 00 00  00 00 00 00  00 00 00 00  ................                                                 
                         00 00 00 00  00 00 00 00  00 00 00 00  00 00 00 00  ................                                                 
                         00 01 00 01  00 00 01 00  01 00 00 00  00 00 00 00  ................                                                 
  29.3    262144  IN     01 01 01 02  02 01 01 00  02 01 01 01  02 01 01 01  ................  2.0ms  2017/07/18  15:11:34.938  ntoskrnl      
                         01 02 01 01  01 01 01 01  01 01 01 01  01 02 00 01  ................                                                 
                         00 01 01 02  02 02 01 01  01 01 01 01  01 01 02 01  ................                                                 
                         02 01 01 01  01 02 02 01  01 01 01 01  01 01 01 01  ................                                                 
  29.3        32  IN     55 33 56 54  00 00 20 00  97 0f 00 00  00 00 00 00  U3VT.. .........   17us  2017/07/18  15:11:34.938  ntoskrnl      
                         00 00 00 00  00 00 14 00  00 00 00 00  00 04 00 00  ................                                                 
  29.3        52  IN     55 33 56 4c  00 00 34 00  98 0f 00 00  00 00 00 00  U3VL..4.........    8us  2017/07/18  15:11:34.938  ntoskrnl      
                         00 00 01 00  20 8b 48 3b  0d 00 00 00  09 00 08 01  .... .H;........                                                 
                         00 05 00 00  00 04 00 00  00 00 00 00  00 00 00 00  ................                                                 
                         00 00 00 00                                         ....                                                             
  29.3   1048576  IN     00 00 00 00  00 00 00 00  00 00 00 00  00 00 00 01  ................  8.6ms  2017/07/18  15:11:34.947  ntoskrnl      
                         00 00 00 00  00 00 00 00  00 00 00 00  00 00 00 00  ................                                                 
                         00 00 00 00  00 00 01 00  00 00 00 00  00 00 00 00  ................                                                 
                         00 00 00 00  00 00 00 00  00 00 00 00  00 00 00 00  ................                                                 
  29.3    262144  IN     01 02 01 01  01 02 01 01  01 01 01 01  01 01 01 01  ................  2.0ms  2017/07/18  15:11:34.949  ntoskrnl      
                         01 01 01 01  01 01 01 01  01 02 00 01  01 02 01 01  ................                                                 
                         00 01 02 02  01 01 01 01  01 01 01 01  01 01 02 01  ................                                                 
                         02 01 01 01  01 01 01 01  00 01 01 01  01 02 01 01  ................                                                 
  29.3        32  IN     55 33 56 54  00 00 20 00  98 0f 00 00  00 00 00 00  U3VT.. .........   26us  2017/07/18  15:11:34.949  ntoskrnl      
                         00 00 00 00  00 00 14 00  00 00 00 00  00 04 00 00  ................                                                 
  29.3        52  IN     55 33 56 4c  00 00 34 00  99 0f 00 00  00 00 00 00  U3VL..4.........   18us  2017/07/18  15:11:34.949  ntoskrnl      
                         00 00 01 00  2a 91 ec 3b  0d 00 00 00  09 00 08 01  ....*..;........                                                 
                         00 05 00 00  00 04 00 00  00 00 00 00  00 00 00 00  ................                                                 
                         00 00 00 00                                         ....                                                             
  29.3   1048576  IN     00 00 00 00  00 00 00 00  00 00 00 00  00 00 00 01  ................  8.6ms  2017/07/18  15:11:34.957  ntoskrnl      
                         00 01 00 00  00 00 00 00  00 00 00 00  00 00 00 01  ................                                                 
                         00 00 00 00  00 00 00 00  01 00 00 01  00 01 00 01  ................                                                 
                         00 00 00 00  00 00 00 00  00 00 00 00  00 00 00 01  ................                                                 
  29.3    262144  IN     01 01 01 01  01 01 01 01  01 01 02 01  02 01 01 01  ................  2.0ms  2017/07/18  15:11:34.959  ntoskrnl      
                         01 01 01 01  01 01 01 01  01 02 01 01  00 01 01 01  ................                                                 
                         00 01 01 02  01 01 01 01  01 01 01 01  01 01 02 01  ................                                                 
                         01 01 01 02  01 01 02 01  01 01 01 01  01 01 01 01  ................                                                 
  29.3        32  IN     55 33 56 54  00 00 20 00  99 0f 00 00  00 00 00 00  U3VT.. .........   77us  2017/07/18  15:11:34.960  ntoskrnl      
                         00 00 00 00  00 00 14 00  00 00 00 00  00 04 00 00  ................                                                 
  29.3        52  IN     55 33 56 4c  00 00 34 00  9a 0f 00 00  00 00 00 00  U3VL..4.........   20us  2017/07/18  15:11:34.960  ntoskrnl      
                         00 00 01 00  34 97 90 3c  0d 00 00 00  09 00 08 01  ....4..<........                                                 
                         00 05 00 00  00 04 00 00  00 00 00 00  00 00 00 00  ................                                                 
                         00 00 00 00                                         ....                                                             
  29.3   1048576  IN     00 01 00 00  00 00 00 00  00 00 00 00  00 00 00 01  ................  8.5ms  2017/07/18  15:11:34.968  ntoskrnl      
                         00 00 00 00  00 00 00 00  00 00 00 00  00 00 00 00  ................                                                 
                         00 00 00 00  00 00 00 00  00 00 00 01  00 00 00 00  ................                                                 
                         01 01 00 00  01 00 00 01  01 00 00 00  00 00 00 00  ................                                                 
  29.3    262144  IN     01 01 01 01  02 01 01 01  02 01 02 01  02 01 01 01  ................  2.0ms  2017/07/18  15:11:34.970  ntoskrnl      
                         01 02 01 01  01 02 01 01  01 02 01 01  00 01 01 01  ................                                                 
                         00 02 02 02  02 01 01 01  01 01 01 01  01 01 02 01  ................                                                 
                         02 01 01 01  02 01 01 01  01 01 01 01  01 01 01 01  ................                                                 
  29.3        32  IN     55 33 56 54  00 00 20 00  9a 0f 00 00  00 00 00 00  U3VT.. .........   24us  2017/07/18  15:11:34.970  ntoskrnl      
                         00 00 00 00  00 00 14 00  00 00 00 00  00 04 00 00  ................                                                 
  29.3        52  IN     55 33 56 4c  00 00 34 00  9b 0f 00 00  00 00 00 00  U3VL..4.........   10us  2017/07/18  15:11:34.970  ntoskrnl      
                         00 00 01 00  3e 9d 34 3d  0d 00 00 00  09 00 08 01  ....>.4=........                                                 
                         00 05 00 00  00 04 00 00  00 00 00 00  00 00 00 00  ................                                                 
                         00 00 00 00                                         ....                                                             
  29.3   1048576  IN     00 00 00 00  00 00 01 01  00 00 00 00  00 01 00 01  ................  8.6ms  2017/07/18  15:11:34.979  ntoskrnl      
                         00 00 00 00  00 01 00 00  01 00 00 00  00 00 00 00  ................                                                 
                         00 00 00 00  01 00 00 00  00 00 00 00  00 00 00 00  ................                                                 
                         01 00 01 00  00 00 00 00  00 00 00 00  01 00 00 00  ................                                                 
  29.3    262144  IN     01 01 02 01  02 02 01 01  01 01 02 01  02 01 01 01  ................  2.0ms  2017/07/18  15:11:34.981  ntoskrnl      
                         01 02 01 01  01 02 01 01  01 02 01 01  01 01 01 00  ................                                                 
                         00 01 02 02  01 01 01 01  01 01 01 02  01 02 02 01  ................                                                 
                         02 01 01 01  01 01 01 01  01 01 01 01  02 01 01 01  ................                                                 
  29.3        32  IN     55 33 56 54  00 00 20 00  9b 0f 00 00  00 00 00 00  U3VT.. .........   30us  2017/07/18  15:11:34.981  ntoskrnl      
                         00 00 00 00  00 00 14 00  00 00 00 00  00 04 00 00  ................                                                 
  29.3        52  IN     55 33 56 4c  00 00 34 00  9c 0f 00 00  00 00 00 00  U3VL..4.........   19us  2017/07/18  15:11:34.981  ntoskrnl      
                         00 00 01 00  48 a3 d8 3d  0d 00 00 00  09 00 08 01  ....H..=........                                                 
                         00 05 00 00  00 04 00 00  00 00 00 00  00 00 00 00  ................                                                 
                         00 00 00 00                                         ....                                                             
  29.3   1048576  IN     00 01 00 00  01 00 01 00  00 00 00 00  00 01 00 01  ................  8.6ms  2017/07/18  15:11:34.990  ntoskrnl      
                         00 01 00 00  00 01 00 00  01 00 00 01  00 00 00 01  ................                                                 
                         00 00 00 00  00 01 00 00  00 00 00 00  00 00 00 00  ................                                                 
                         01 00 00 00  00 00 00 01  01 01 00 00  00 00 00 00  ................                                                 
  29.3    262144  IN     02 01 01 01  01 01 01 01  01 01 01 01  01 01 01 01  ................  2.0ms  2017/07/18  15:11:34.992  ntoskrnl      
                         01 02 01 01  01 01 01 01  01 01 01 01  01 01 01 01  ................                                                 
                         00 01 01 02  02 01 01 01  01 01 01 01  01 01 02 01  ................                                                 
                         01 01 01 01  01 01 01 01  01 01 01 01  01 02 01 01  ................                                                 
  29.3        32  IN     55 33 56 54  00 00 20 00  9c 0f 00 00  00 00 00 00  U3VT.. .........   36us  2017/07/18  15:11:34.992  ntoskrnl      
                         00 00 00 00  00 00 14 00  00 00 00 00  00 04 00 00  ................                                                 
  29.3        52  IN     55 33 56 4c  00 00 34 00  9d 0f 00 00  00 00 00 00  U3VL..4.........   28us  2017/07/18  15:11:34.992  ntoskrnl      
                         00 00 01 00  39 a9 7c 3e  0d 00 00 00  09 00 08 01  ....9..>........                                                 
                         00 05 00 00  00 04 00 00  00 00 00 00  00 00 00 00  ................                                                 
                         00 00 00 00                                         ....                                                             
  29.3   1048576  IN     00 00 00 01  00 00 01 00  00 00 00 00  00 00 01 00  ................  8.6ms  2017/07/18  15:11:35.000  ntoskrnl      
                         00 00 00 00  01 01 00 01  01 00 00 01  00 00 00 01  ................                                                 
                         00 00 00 00  00 00 01 00  00 00 00 01  01 00 01 00  ................                                                 
                         00 01 00 00  00 00 00 00  01 00 00 00  00 00 00 01  ................                                                 
  29.3    262144  IN     01 00 01 01  02 01 01 01  02 01 01 01  01 01 01 01  ................  2.0ms  2017/07/18  15:11:35.002  ntoskrnl      
                         01 02 01 01  00 01 01 01  01 01 00 01  01 01 01 00  ................                                                 
                         00 01 01 02  01 01 01 01  01 01 01 01  01 01 02 01  ................                                                 
                         02 01 01 01  01 01 01 01  01 01 01 01  01 02 01 01  ................                                                 
  29.3        32  IN     55 33 56 54  00 00 20 00  9d 0f 00 00  00 00 00 00  U3VT.. .........   22us  2017/07/18  15:11:35.002  ntoskrnl      
                         00 00 00 00  00 00 14 00  00 00 00 00  00 04 00 00  ................                                                 
  29.3        52  IN     55 33 56 4c  00 00 34 00  9e 0f 00 00  00 00 00 00  U3VL..4.........   12us  2017/07/18  15:11:35.002  ntoskrnl      
                         00 00 01 00  43 af 20 3f  0d 00 00 00  09 00 08 01  ....C. ?........                                                 
                         00 05 00 00  00 04 00 00  00 00 00 00  00 00 00 00  ................                                                 
                         00 00 00 00                                         ....                                                             
  29.3   1048576  IN     00 00 00 00  00 00 00 00  00 00 00 00  00 00 00 01  ................  8.7ms  2017/07/18  15:11:35.011  ntoskrnl      
                         00 00 00 00  00 01 00 00  01 00 00 01  00 00 00 00  ................                                                 
                         00 00 00 00  00 00 01 00  01 01 00 00  00 00 00 00  ................                                                 
                         00 01 00 00  00 00 00 00  01 00 00 00  00 01 00 00  ................                                                 
  29.3    262144  IN     02 01 01 01  01 01 01 01  02 01 01 01  01 01 01 01  ................  2.0ms  2017/07/18  15:11:35.013  ntoskrnl      
                         01 01 01 01  01 01 01 01  01 01 01 01  01 01 00 01  ................                                                 
                         00 01 01 01  01 01 01 01  01 01 01 01  01 01 02 01  ................                                                 
                         02 01 01 02  01 01 01 01  01 01 01 01  01 01 01 01  ................                                                 
  29.3        32  IN     55 33 56 54  00 00 20 00  9e 0f 00 00  00 00 00 00  U3VT.. .........   37us  2017/07/18  15:11:35.013  ntoskrnl      
                         00 00 00 00  00 00 14 00  00 00 00 00  00 04 00 00  ................                                                 
  29.3        52  IN     55 33 56 4c  00 00 34 00  9f 0f 00 00  00 00 00 00  U3VL..4.........   17us  2017/07/18  15:11:35.013  ntoskrnl      
                         00 00 01 00  5c 8d c4 3f  0d 00 00 00  09 00 08 01  ....\..?........                                                 
                         00 05 00 00  00 04 00 00  00 00 00 00  00 00 00 00  ................                                                 
                         00 00 00 00                                         ....                                                             
  29.3   1048576  IN     00 01 00 00  00 00 01 00  01 00 01 00  00 01 00 01  ................  8.6ms  2017/07/18  15:11:35.022  ntoskrnl      
                         00 00 00 00  00 00 00 00  01 00 00 00  00 00 00 00  ................                                                 
                         00 00 00 00  00 01 00 00  00 00 00 01  00 00 00 00  ................                                                 
                         01 01 00 00  01 01 00 01  01 00 01 00  01 01 00 00  ................                                                 
  29.3    262144  IN     01 01 01 01  01 02 01 01  02 01 02 01  01 01 01 01  ................  2.0ms  2017/07/18  15:11:35.024  ntoskrnl      
                         01 01 01 01  01 01 02 01  01 01 01 01  00 02 00 01  ................                                                 
                         00 01 01 02  01 01 01 01  01 01 01 01  02 01 03 01  ................                                                 
                         02 01 01 01  01 02 01 01  01 01 01 01  02 02 01 01  ................                                                 
  29.3        32  IN     55 33 56 54  00 00 20 00  9f 0f 00 00  00 00 00 00  U3VT.. .........   43us  2017/07/18  15:11:35.024  ntoskrnl      
                         00 00 00 00  00 00 14 00  00 00 00 00  00 04 00 00  ................                                                 
  29.3        52  IN     55 33 56 4c  00 00 34 00  a0 0f 00 00  00 00 00 00  U3VL..4.........   25us  2017/07/18  15:11:35.024  ntoskrnl      
                         00 00 01 00  66 93 68 40  0d 00 00 00  09 00 08 01  ....f.h@........                                                 
                         00 05 00 00  00 04 00 00  00 00 00 00  00 00 00 00  ................                                                 
                         00 00 00 00                                         ....                                                             
  29.3   1048576  IN     00 01 01 01  00 00 01 00  00 00 00 00  00 00 00 01  ................  8.5ms  2017/07/18  15:11:35.033  ntoskrnl      
                         00 00 00 00  00 00 00 00  00 00 00 00  00 00 00 00  ................                                                 
                         00 00 01 00  00 00 00 00  00 00 00 00  00 00 00 00  ................                                                 
                         01 00 01 00  00 00 01 01  01 00 00 00  00 01 00 00  ................                                                 
  29.3    262144  IN     01 01 01 01  02 02 01 01  02 01 02 01  02 02 02 01  ................  2.0ms  2017/07/18  15:11:35.035  ntoskrnl      
                         01 01 01 01  01 01 01 02  01 01 01 01  01 02 02 00  ................                                                 
                         01 01 01 02  01 01 01 01  01 01 01 01  01 01 02 01  ................                                                 
                         02 01 01 02  01 01 02 01  01 01 01 01  01 01 02 02  ................                                                 
  29.3        32  IN     55 33 56 54  00 00 20 00  a0 0f 00 00  00 00 00 00  U3VT.. .........   36us  2017/07/18  15:11:35.035  ntoskrnl      
                         00 00 00 00  00 00 14 00  00 00 00 00  00 04 00 00  ................                                                 
  29.3        52  IN     55 33 56 4c  00 00 34 00  a1 0f 00 00  00 00 00 00  U3VL..4.........   17us  2017/07/18  15:11:35.035  ntoskrnl      
                         00 00 01 00  70 99 0c 41  0d 00 00 00  09 00 08 01  ....p..A........                                                 
                         00 05 00 00  00 04 00 00  00 00 00 00  00 00 00 00  ................                                                 
                         00 00 00 00                                         ....                                                             
  29.3   1048576  IN     00 01 00 01  01 01 01 00  00 00 00 00  00 01 01 01  ................  8.6ms  2017/07/18  15:11:35.043  ntoskrnl      
                         00 01 00 01  00 00 00 00  00 00 00 01  00 00 00 00  ................                                                 
                         00 00 00 00  00 00 00 00  00 00 01 01  00 00 00 00  ................                                                 
                         00 01 00 01  00 01 01 01  00 00 00 00  01 00 01 00  ................                                                 
  29.3    262144  IN     02 01 01 01  02 02 01 01  01 01 01 01  01 02 01 01  ................  2.0ms  2017/07/18  15:11:35.045  ntoskrnl      
                         01 02 01 01  01 01 01 01  01 02 01 01  01 01 01 01  ................                                                 
                         00 01 02 02  02 01 01 01  01 01 01 01  01 01 02 01  ................                                                 
                         02 01 01 01  01 01 01 01  01 01 01 01  02 01 01 01  ................                                                 
  29.3        32  IN     55 33 56 54  00 00 20 00  a1 0f 00 00  00 00 00 00  U3VT.. .........   35us  2017/07/18  15:11:35.046  ntoskrnl      
                         00 00 00 00  00 00 14 00  00 00 00 00  00 04 00 00  ................                                                 
  29.3        52  IN     55 33 56 4c  00 00 34 00  a2 0f 00 00  00 00 00 00  U3VL..4.........   20us  2017/07/18  15:11:35.046  ntoskrnl      
                         00 00 01 00  61 9f b0 41  0d 00 00 00  09 00 08 01  ....a..A........                                                 
                         00 05 00 00  00 04 00 00  00 00 00 00  00 00 00 00  ................                                                 
                         00 00 00 00                                         ....                                                             
  29.3   1048576  IN     00 00 00 00  00 00 00 00  01 00 00 00  00 00 00 01  ................  8.6ms  2017/07/18  15:11:35.054  ntoskrnl      
                         00 00 00 01  00 00 00 00  00 00 00 00  00 01 00 01  ................                                                 
                         01 00 00 01  00 00 01 00  00 00 00 01  00 00 00 00  ................                                                 
                         00 00 00 00  00 00 00 01  01 00 00 00  00 01 01 00  ................                                                 
  29.3    262144  IN     01 01 01 01  01 01 01 01  01 01 02 01  01 01 01 01  ................  2.0ms  2017/07/18  15:11:35.056  ntoskrnl      
                         01 01 01 01  01 01 01 01  01 01 01 01  00 02 01 01  ................                                                 
                         00 00 01 01  01 01 01 01  01 01 01 01  01 01 02 01  ................                                                 
                         01 01 01 01  01 02 01 01  01 00 01 01  01 01 01 02  ................                                                 
  29.3        32  IN     55 33 56 54  00 00 20 00  a2 0f 00 00  00 00 00 00  U3VT.. .........   20us  2017/07/18  15:11:35.056  ntoskrnl      
                         00 00 00 00  00 00 14 00  00 00 00 00  00 04 00 00  ................                                                 
  29.3        52  IN     55 33 56 4c  00 00 34 00  a3 0f 00 00  00 00 00 00  U3VL..4.........   19us  2017/07/18  15:11:35.056  ntoskrnl      
                         00 00 01 00  6b a5 54 42  0d 00 00 00  09 00 08 01  ....k.TB........                                                 
                         00 05 00 00  00 04 00 00  00 00 00 00  00 00 00 00  ................                                                 
                         00 00 00 00                                         ....                                                             
  29.3   1048576  IN     00 00 01 00  00 00 00 00  00 00 00 00  00 00 00 01  ................  8.6ms  2017/07/18  15:11:35.065  ntoskrnl      
                         00 00 00 00  00 00 00 00  00 00 00 01  00 00 00 00  ................                                                 
                         00 00 00 00  00 00 01 00  00 00 00 01  00 00 00 00  ................                                                 
                         00 01 01 00  00 00 00 01  01 00 00 00  00 01 00 00  ................                                                 
  29.3    262144  IN     01 01 01 01  02 01 01 01  01 01 01 01  01 01 01 01  ................  2.0ms  2017/07/18  15:11:35.067  ntoskrnl      
                         01 01 01 01  01 01 01 01  01 02 01 01  01 01 01 00  ................                                                 
                         00 01 01 02  01 01 01 01  01 01 01 01  01 01 02 01  ................                                                 
                         01 01 01 02  01 01 01 01  01 01 01 01  01 01 01 01  ................                                                 
  29.3        32  IN     55 33 56 54  00 00 20 00  a3 0f 00 00  00 00 00 00  U3VT.. .........   19us  2017/07/18  15:11:35.067  ntoskrnl      
                         00 00 00 00  00 00 14 00  00 00 00 00  00 04 00 00  ................                                                 
  29.3        52  IN     55 33 56 4c  00 00 34 00  a4 0f 00 00  00 00 00 00  U3VL..4.........   15us  2017/07/18  15:11:35.067  ntoskrnl      
                         00 00 01 00  75 ab f8 42  0d 00 00 00  09 00 08 01  ....u..B........                                                 
                         00 05 00 00  00 04 00 00  00 00 00 00  00 00 00 00  ................                                                 
                         00 00 00 00                                         ....                                                             
  29.3   1048576  IN     00 01 01 00  00 00 00 00  00 00 00 00  00 00 00 01  ................  8.6ms  2017/07/18  15:11:35.076  ntoskrnl      
                         00 00 00 00  00 00 00 00  00 00 00 00  00 00 00 00  ................                                                 
                         00 00 01 00  00 00 01 00  00 00 00 00  00 00 00 00  ................                                                 
                         00 01 00 01  00 00 00 01  01 01 00 00  00 00 00 00  ................                                                 
  29.3    262144  IN     01 01 01 01  01 01 01 01  02 02 02 01  01 01 01 01  ................  2.0ms  2017/07/18  15:11:35.078  ntoskrnl      
                         01 02 01 01  01 01 01 01  01 01 01 01  01 01 01 01  ................                                                 
                         00 01 01 02  01 01 01 01  01 01 01 01  01 01 02 01  ................                                                 
                         02 01 01 02  01 01 02 01  01 01 02 02  01 01 01 01  ................                                                 
  29.3        32  IN     55 33 56 54  00 00 20 00  a4 0f 00 00  00 00 00 00  U3VT.. .........   18us  2017/07/18  15:11:35.078  ntoskrnl      
                         00 00 00 00  00 00 14 00  00 00 00 00  00 04 00 00  ................                                                 
  29.3        52  IN     55 33 56 4c  00 00 34 00  a5 0f 00 00  00 00 00 00  U3VL..4.........    8us  2017/07/18  15:11:35.078  ntoskrnl      
                         00 00 01 00  7f b1 9c 43  0d 00 00 00  09 00 08 01  .......C........                                                 
                         00 05 00 00  00 04 00 00  00 00 00 00  00 00 00 00  ................                                                 
                         00 00 00 00                                         ....                                                             
  29.3   1048576  IN     00 01 00 00  00 00 01 00  00 00 01 01  00 00 00 01  ................  8.7ms  2017/07/18  15:11:35.086  ntoskrnl      
                         00 00 00 01  00 00 01 01  00 00 00 01  00 00 01 01  ................                                                 
                         00 00 00 01  01 00 01 00  00 00 01 01  00 00 01 00  ................                                                 
                         01 01 01 01  00 01 01 01  01 01 00 00  00 00 00 00  ................                                                 
  29.3    262144  IN     02 01 01 01  02 01 01 01  01 02 01 01  01 01 01 01  ................  2.0ms  2017/07/18  15:11:35.088  ntoskrnl      
                         02 02 02 01  01 01 02 01  01 01 01 01  00 01 00 01  ................                                                 
                         00 01 01 02  01 02 01 01  01 01 01 01  01 01 02 01  ................                                                 
                         02 01 01 02  01 02 01 01  01 01 02 02  01 01 01 02  ................                                                 
  29.3        32  IN     55 33 56 54  00 00 20 00  a5 0f 00 00  00 00 00 00  U3VT.. .........   36us  2017/07/18  15:11:35.089  ntoskrnl      
                         00 00 00 00  00 00 14 00  00 00 00 00  00 04 00 00  ................                                                 
  29.3        52  IN     55 33 56 4c  00 00 34 00  a6 0f 00 00  00 00 00 00  U3VL..4.........   19us  2017/07/18  15:11:35.089  ntoskrnl      
                         00 00 01 00  98 8f 40 44  0d 00 00 00  09 00 08 01  ......@D........                                                 
                         00 05 00 00  00 04 00 00  00 00 00 00  00 00 00 00  ................                                                 
                         00 00 00 00                                         ....                                                             
  29.3   1048576  IN     01 01 00 00  00 01 01 00  00 00 00 00  00 00 00 01  ................  8.6ms  2017/07/18  15:11:35.097  ntoskrnl      
                         00 01 00 00  00 00 00 00  00 00 00 00  00 01 00 01  ................                                                 
                         00 00 01 01  00 00 00 00  00 00 00 01  00 01 00 00  ................                                                 
                         01 00 00 01  00 00 00 00  01 00 00 00  00 01 00 00  ................                                                 
  29.3    262144  IN     01 01 01 01  02 01 01 01  01 01 02 01  01 01 01 01  ................  2.0ms  2017/07/18  15:11:35.099  ntoskrnl      
                         01 02 01 02  01 01 01 01  01 02 00 01  01 01 00 01  ................                                                 
                         00 01 02 02  01 01 02 01  01 01 01 01  01 01 01 01  ................                                                 
                         01 01 01 02  01 02 01 01  01 00 01 01  01 01 01 01  ................                                                 
  29.3        32  IN     55 33 56 54  00 00 20 00  a6 0f 00 00  00 00 00 00  U3VT.. .........   41us  2017/07/18  15:11:35.099  ntoskrnl      
                         00 00 00 00  00 00 14 00  00 00 00 00  00 04 00 00  ................                                                 
  29.3        52  IN     55 33 56 4c  00 00 34 00  a7 0f 00 00  00 00 00 00  U3VL..4.........   23us  2017/07/18  15:11:35.099  ntoskrnl      
                         00 00 01 00  89 95 e4 44  0d 00 00 00  09 00 08 01  .......D........                                                 
                         00 05 00 00  00 04 00 00  00 00 00 00  00 00 00 00  ................                                                 
                         00 00 00 00                                         ....                                                             
  29.3   1048576  IN     00 00 00 00  00 00 00 00  00 00 00 00  00 00 00 01  ................  8.5ms  2017/07/18  15:11:35.108  ntoskrnl      
                         00 00 00 00  00 00 00 00  00 00 00 01  00 00 00 01  ................                                                 
                         00 00 01 00  01 00 01 00  00 00 00 01  01 00 00 00  ................                                                 
                         01 01 01 00  00 00 00 00  01 01 00 00  01 01 00 00  ................                                                 
  29.3    262144  IN     02 01 01 01  01 02 01 01  02 02 01 01  02 01 01 01  ................  2.0ms  2017/07/18  15:11:35.110  ntoskrnl      
                         01 01 02 02  01 02 02 01  02 01 01 01  01 01 01 01  ................                                                 
                         01 01 01 01  02 02 01 01  01 01 01 02  01 01 02 01  ................                                                 
                         02 01 01 02  01 02 01 01  01 01 02 01  02 01 02 02  ................                                                 
  29.3        32  IN     55 33 56 54  00 00 20 00  a7 0f 00 00  00 00 00 00  U3VT.. .........   37us  2017/07/18  15:11:35.110  ntoskrnl      
                         00 00 00 00  00 00 14 00  00 00 00 00  00 04 00 00  ................                                                 
  29.3        52  IN     55 33 56 4c  00 00 34 00  a8 0f 00 00  00 00 00 00  U3VL..4.........   13us  2017/07/18  15:11:35.110  ntoskrnl      
                         00 00 01 00  93 9b 88 45  0d 00 00 00  09 00 08 01  .......E........                                                 
                         00 05 00 00  00 04 00 00  00 00 00 00  00 00 00 00  ................                                                 
                         00 00 00 00                                         ....                                                             
  29.3   1048576  IN     00 00 01 00  00 00 00 00  00 00 01 00  00 01 00 01  ................  8.6ms  2017/07/18  15:11:35.119  ntoskrnl      
                         00 01 00 00  00 00 00 00  00 00 00 00  00 00 01 01  ................                                                 
                         00 00 00 00  00 00 00 00  00 00 00 01  00 00 00 00  ................                                                 
                         01 01 00 01  00 00 00 00  01 01 01 01  00 01 00 00  ................                                                 
  29.3    262144  IN     01 01 01 02  01 01 01 01  01 01 01 00  02 01 01 02  ................  2.0ms  2017/07/18  15:11:35.121  ntoskrnl      
                         01 01 01 01  01 01 01 01  01 01 01 01  00 01 01 01  ................                                                 
                         00 01 01 02  01 01 01 01  01 01 01 01  01 01 02 01  ................                                                 
                         02 01 01 02  01 01 01 02  01 01 02 01  02 02 02 02  ................                                                 
  29.3        32  IN     55 33 56 54  00 00 20 00  a8 0f 00 00  00 00 00 00  U3VT.. .........   26us  2017/07/18  15:11:35.121  ntoskrnl      
                         00 00 00 00  00 00 14 00  00 00 00 00  00 04 00 00  ................                                                 
  29.3        52  IN     55 33 56 4c  00 00 34 00  a9 0f 00 00  00 00 00 00  U3VL..4.........   12us  2017/07/18  15:11:35.121  ntoskrnl      
                         00 00 01 00  9d a1 2c 46  0d 00 00 00  09 00 08 01  ......,F........                                                 
                         00 05 00 00  00 04 00 00  00 00 00 00  00 00 00 00  ................                                                 
                         00 00 00 00                                         ....                                                             
  29.3   1048576  IN     00 00 00 00  00 00 01 00  01 00 00 00  00 00 00 01  ................  8.6ms  2017/07/18  15:11:35.129  ntoskrnl      
                         00 00 00 00  00 00 01 00  00 00 00 01  00 00 00 00  ................                                                 
                         01 00 01 01  01 00 00 00  00 00 00 00  00 00 00 00  ................                                                 
                         01 00 00 00  00 00 00 01  01 01 00 00  01 01 01 01  ................                                                 
  29.3    262144  IN     01 02 01 02  02 01 01 01  02 01 01 01  01 01 01 01  ................  2.0ms  2017/07/18  15:11:35.131  ntoskrnl      
                         01 01 01 02  01 01 01 01  02 01 01 01  01 01 01 01  ................                                                 
                         00 01 01 02  01 01 01 01  01 01 01 01  01 01 02 01  ................                                                 
                         02 01 01 01  01 01 01 01  01 01 02 01  02 01 01 01  ................                                                 
  29.3        32  IN     55 33 56 54  00 00 20 00  a9 0f 00 00  00 00 00 00  U3VT.. .........   22us  2017/07/18  15:11:35.131  ntoskrnl      
                         00 00 00 00  00 00 14 00  00 00 00 00  00 04 00 00  ................                                                 
  29.3        52  IN     55 33 56 4c  00 00 34 00  aa 0f 00 00  00 00 00 00  U3VL..4.........    8us  2017/07/18  15:11:35.131  ntoskrnl      
                         00 00 01 00  a7 a7 d0 46  0d 00 00 00  09 00 08 01  .......F........                                                 
                         00 05 00 00  00 04 00 00  00 00 00 00  00 00 00 00  ................                                                 
                         00 00 00 00                                         ....                                                             
  29.3   1048576  IN     00 01 00 00  01 00 01 00  01 00 00 01  00 00 00 01  ................  8.7ms  2017/07/18  15:11:35.140  ntoskrnl      
                         00 00 00 00  00 00 00 00  00 00 00 00  00 01 00 00  ................                                                 
                         00 00 00 00  00 01 01 00  00 00 01 01  00 00 01 00  ................                                                 
                         00 00 01 00  00 00 01 01  01 00 00 00  00 01 00 00  ................                                                 
  29.3    262144  IN     01 01 01 01  02 01 01 01  02 01 01 01  02 01 01 01  ................  2.0ms  2017/07/18  15:11:35.142  ntoskrnl      
                         01 01 01 01  01 01 01 01  01 01 01 01  00 01 01 01  ................                                                 
                         00 01 01 02  01 01 01 01  01 01 01 01  01 01 02 01  ................                                                 
                         02 01 01 01  01 01 01 01  01 01 01 01  01 01 01 01  ................                                                 
  29.3        32  IN     55 33 56 54  00 00 20 00  aa 0f 00 00  00 00 00 00  U3VT.. .........   33us  2017/07/18  15:11:35.142  ntoskrnl      
                         00 00 00 00  00 00 14 00  00 00 00 00  00 04 00 00  ................                                                 
  29.3        52  IN     55 33 56 4c  00 00 34 00  ab 0f 00 00  00 00 00 00  U3VL..4.........   38us  2017/07/18  15:11:35.142  ntoskrnl      
                         00 00 01 00  98 ad 74 47  0d 00 00 00  09 00 08 01  ......tG........                                                 
                         00 05 00 00  00 04 00 00  00 00 00 00  00 00 00 00  ................                                                 
                         00 00 00 00                                         ....                                                             
  29.3   1048576  IN     00 00 00 00  00 00 00 00  00 00 00 00  00 00 00 01  ................  8.6ms  2017/07/18  15:11:35.151  ntoskrnl      
                         00 00 00 00  00 00 00 00  01 00 00 00  00 00 01 00  ................                                                 
                         00 00 00 00  00 00 00 00  00 00 00 00  00 00 00 00  ................                                                 
                         00 00 00 00  00 00 00 00  01 00 00 00  00 00 00 00  ................                                                 
  29.3    262144  IN     01 01 01 01  01 01 01 01  01 01 01 01  02 01 01 01  ................  2.0ms  2017/07/18  15:11:35.153  ntoskrnl      
                         01 01 01 01  01 01 01 01  01 01 01 01  01 01 01 01  ................                                                 
                         00 01 01 02  01 01 01 01  01 01 01 01  01 01 02 01  ................                                                 
                         01 01 01 02  02 01 01 01  01 00 01 01  01 01 01 01  ................                                                 
  29.3        32  IN     55 33 56 54  00 00 20 00  ab 0f 00 00  00 00 00 00  U3VT.. .........   44us  2017/07/18  15:11:35.153  ntoskrnl      
                         00 00 00 00  00 00 14 00  00 00 00 00  00 04 00 00  ................                                                 
  29.3        52  IN     55 33 56 4c  00 00 34 00  ac 0f 00 00  00 00 00 00  U3VL..4.........   21us  2017/07/18  15:11:35.153  ntoskrnl      
                         00 00 01 00  a2 b3 18 48  0d 00 00 00  09 00 08 01  .......H........                                                 
                         00 05 00 00  00 04 00 00  00 00 00 00  00 00 00 00  ................                                                 
                         00 00 00 00                                         ....                                                             
  29.3   1048576  IN     01 00 00 01  01 00 00 00  00 00 00 01  00 01 00 00  ................  8.6ms  2017/07/18  15:11:35.162  ntoskrnl      
                         00 00 00 00  00 01 00 00  00 00 00 01  00 00 00 00  ................                                                 
                         01 00 00 00  01 00 01 00  00 00 00 01  00 00 00 00  ................                                                 
                         01 01 00 01  00 00 01 01  01 00 01 00  00 01 00 00  ................                                                 
  29.3    262144  IN     01 01 01 01  01 01 01 00  01 01 02 01  01 01 01 01  ................  2.0ms  2017/07/18  15:11:35.164  ntoskrnl      
                         01 01 01 01  01 01 01 01  01 01 01 01  01 01 00 00  ................                                                 
                         00 02 01 02  01 02 01 00  01 01 01 01  01 01 02 01  ................                                                 
                         02 02 01 01  01 01 01 01  01 01 01 01  01 01 01 01  ................                                                 
  29.3        32  IN     55 33 56 54  00 00 20 00  ac 0f 00 00  00 00 00 00  U3VT.. .........   20us  2017/07/18  15:11:35.164  ntoskrnl      
                         00 00 00 00  00 00 14 00  00 00 00 00  00 04 00 00  ................                                                 
  29.3        52  IN     55 33 56 4c  00 00 34 00  ad 0f 00 00  00 00 00 00  U3VL..4.........    7us  2017/07/18  15:11:35.164  ntoskrnl      
                         00 00 01 00  bb 91 bc 48  0d 00 00 00  09 00 08 01  .......H........                                                 
                         00 05 00 00  00 04 00 00  00 00 00 00  00 00 00 00  ................                                                 
                         00 00 00 00                                         ....                                                             
  29.3   1048576  IN     00 00 00 00  00 01 01 00  00 00 00 00  00 00 00 01  ................  8.6ms  2017/07/18  15:11:35.172  ntoskrnl      
                         00 01 00 00  00 00 00 00  00 00 00 01  00 01 00 00  ................                                                 
                         00 00 00 00  00 00 00 00  00 00 01 01  00 00 01 00  ................                                                 
                         00 00 00 00  00 00 00 00  01 01 00 00  01 00 00 00  ................                                                 
  29.3    262144  IN     01 01 01 02  02 02 01 01  01 01 02 01  01 02 01 01  ................  2.0ms  2017/07/18  15:11:35.174  ntoskrnl      
                         01 01 01 01  01 01 01 01  01 01 01 01  01 01 01 01  ................                                                 
                         00 01 01 01  01 01 01 01  01 02 01 02  01 01 02 01  ................                                                 
                         02 01 01 02  01 01 01 01  01 01 01 01  01 01 01 01  ................                                                 
  29.3        32  IN     55 33 56 54  00 00 20 00  ad 0f 00 00  00 00 00 00  U3VT.. .........   31us  2017/07/18  15:11:35.174  ntoskrnl      
                         00 00 00 00  00 00 14 00  00 00 00 00  00 04 00 00  ................                                                 
  29.3        52  IN     55 33 56 4c  00 00 34 00  ae 0f 00 00  00 00 00 00  U3VL..4.........   17us  2017/07/18  15:11:35.174  ntoskrnl      
                         00 00 01 00  c5 97 60 49  0d 00 00 00  09 00 08 01  ......`I........                                                 
                         00 05 00 00  00 04 00 00  00 00 00 00  00 00 00 00  ................                                                 
                         00 00 00 00                                         ....                                                             
  29.3   1048576  IN     00 00 00 00  00 00 00 00  00 00 00 00  01 01 00 01  ................  8.6ms  2017/07/18  15:11:35.183  ntoskrnl      
                         00 01 00 00  00 00 00 00  00 00 00 00  00 00 00 00  ................                                                 
                         00 00 01 00  00 00 00 00  00 00 00 00  00 00 00 00  ................                                                 
                         00 00 00 00  00 00 00 00  01 00 00 00  00 00 00 00  ................                                                 
  29.3    262144  IN     01 01 01 01  01 01 01 01  01 01 01 01  01 01 01 01  ................  2.0ms  2017/07/18  15:11:35.185  ntoskrnl      
                         01 02 01 01  01 01 01 01  01 01 01 01  01 01 01 00  ................                                                 
                         00 01 01 01  01 01 01 01  01 01 01 01  01 01 01 01  ................                                                 
                         02 01 01 01  01 01 01 01  01 01 01 01  01 01 01 01  ................                                                 
  29.3        32  IN     55 33 56 54  00 00 20 00  ae 0f 00 00  00 00 00 00  U3VT.. .........   24us  2017/07/18  15:11:35.185  ntoskrnl      
                         00 00 00 00  00 00 14 00  00 00 00 00  00 04 00 00  ................                                                 
  29.3        52  IN     55 33 56 4c  00 00 34 00  af 0f 00 00  00 00 00 00  U3VL..4.........   33us  2017/07/18  15:11:35.185  ntoskrnl      
                         00 00 01 00  cf 9d 04 4a  0d 00 00 00  09 00 08 01  .......J........                                                 
                         00 05 00 00  00 04 00 00  00 00 00 00  00 00 00 00  ................                                                 
                         00 00 00 00                                         ....                                                             
  29.3   1048576  IN     00 00 00 00  00 00 00 00  01 00 00 00  00 00 00 00  ................  8.6ms  2017/07/18  15:11:35.194  ntoskrnl      
                         00 00 00 01  00 00 00 00  00 00 00 00  00 00 00 00  ................                                                 
                         00 00 01 01  00 00 00 00  00 00 00 00  00 00 00 00  ................                                                 
                         00 00 00 00  00 00 00 01  00 00 00 00  01 01 00 00  ................                                                 
  29.3    262144  IN     02 01 02 01  01 01 01 01  02 01 02 01  02 01 01 01  ................  2.0ms  2017/07/18  15:11:35.196  ntoskrnl      
                         01 02 02 01  01 01 01 01  01 01 01 01  01 01 01 00  ................                                                 
                         00 01 01 02  02 01 01 01  01 01 01 01  01 01 01 01  ................                                                 
                         02 01 01 01  02 01 01 01  00 01 01 01  01 01 01 01  ................                                                 
  29.3        32  IN     55 33 56 54  00 00 20 00  af 0f 00 00  00 00 00 00  U3VT.. .........   20us  2017/07/18  15:11:35.196  ntoskrnl      
                         00 00 00 00  00 00 14 00  00 00 00 00  00 04 00 00  ................                                                 
  29.3        52  IN     55 33 56 4c  00 00 34 00  b0 0f 00 00  00 00 00 00  U3VL..4.........   23us  2017/07/18  15:11:35.196  ntoskrnl      
                         00 00 01 00  c0 a3 a8 4a  0d 00 00 00  09 00 08 01  .......J........                                                 
                         00 05 00 00  00 04 00 00  00 00 00 00  00 00 00 00  ................                                                 
                         00 00 00 00                                         ....                                                             
  29.3   1048576  IN     00 00 00 00  00 00 00 00  00 00 00 00  00 00 00 01  ................  8.6ms  2017/07/18  15:11:35.205  ntoskrnl      
                         00 00 00 00  00 00 00 00  00 00 00 01  00 00 00 00  ................                                                 
                         00 00 00 01  00 00 01 00  00 00 00 01  00 00 00 00  ................                                                 
                         01 01 01 00  00 00 00 00  01 00 00 00  00 00 00 00  ................                                                 
  29.3    262144  IN     01 01 02 01  01 02 01 01  02 01 02 01  01 01 01 01  ................  2.0ms  2017/07/18  15:11:35.207  ntoskrnl      
                         01 02 01 01  01 01 01 02  01 02 01 01  01 01 01 01  ................                                                 
                         01 01 01 02  01 02 01 01  00 01 01 02  01 01 02 02  ................                                                 
                         02 01 01 02  01 02 02 01  01 02 02 01  02 02 01 01  ................                                                 
  29.3        32  IN     55 33 56 54  00 00 20 00  b0 0f 00 00  00 00 00 00  U3VT.. .........   19us  2017/07/18  15:11:35.207  ntoskrnl      
                         00 00 00 00  00 00 14 00  00 00 00 00  00 04 00 00  ................                                                 
  29.3        52  IN     55 33 56 4c  00 00 34 00  b1 0f 00 00  00 00 00 00  U3VL..4.........   15us  2017/07/18  15:11:35.207  ntoskrnl      
                         00 00 01 00  ca a9 4c 4b  0d 00 00 00  09 00 08 01  ......LK........                                                 
                         00 05 00 00  00 04 00 00  00 00 00 00  00 00 00 00  ................                                                 
                         00 00 00 00                                         ....                                                             
  29.3   1048576  IN     00 00 00 00  00 00 01 00  01 00 00 00  00 01 00 00  ................  8.7ms  2017/07/18  15:11:35.215  ntoskrnl      
                         00 00 00 01  00 00 00 00  01 00 00 00  00 00 00 00  ................                                                 
                         00 00 00 00  00 00 00 00  00 01 01 00  00 00 00 00  ................                                                 
                         00 01 00 00  00 00 00 01  00 00 00 00  00 01 00 00  ................                                                 
  29.3    262144  IN     01 01 01 01  01 01 01 01  01 02 02 01  02 01 01 01  ................  2.0ms  2017/07/18  15:11:35.217  ntoskrnl      
                         01 01 01 01  01 01 01 02  01 02 01 01  01 02 00 00  ................                                                 
                         00 01 01 01  01 01 01 01  00 01 01 01  02 01 02 01  ................                                                 
                         02 01 01 02  02 01 01 01  01 01 02 01  02 02 01 01  ................                                                 
  29.3        32  IN     55 33 56 54  00 00 20 00  b1 0f 00 00  00 00 00 00  U3VT.. .........   23us  2017/07/18  15:11:35.217  ntoskrnl      
                         00 00 00 00  00 00 14 00  00 00 00 00  00 04 00 00  ................                                                 
  29.3        52  IN     55 33 56 4c  00 00 34 00  b2 0f 00 00  00 00 00 00  U3VL..4.........   10us  2017/07/18  15:11:35.217  ntoskrnl      
                         00 00 01 00  d4 af f0 4b  0d 00 00 00  09 00 08 01  .......K........                                                 
                         00 05 00 00  00 04 00 00  00 00 00 00  00 00 00 00  ................                                                 
                         00 00 00 00                                         ....                                                             
  29.3   1048576  IN     00 00 00 00  00 00 00 00  00 00 00 00  00 00 00 01  ................  8.6ms  2017/07/18  15:11:35.226  ntoskrnl      
                         00 00 00 00  00 01 00 00  00 00 00 01  00 00 01 01  ................                                                 
                         00 00 00 01  00 00 00 00  00 00 01 00  00 00 00 00  ................                                                 
                         01 01 00 00  00 00 00 00  00 01 00 00  00 00 00 00  ................                                                 
  29.3    262144  IN     02 02 01 01  02 01 01 01  01 01 01 01  01 01 01 01  ................  2.0ms  2017/07/18  15:11:35.228  ntoskrnl      
                         01 01 02 01  01 01 01 01  01 02 01 01  00 01 00 01  ................                                                 
                         01 01 02 01  01 02 01 01  01 01 01 01  01 01 02 01  ................                                                 
                         02 02 01 01  01 02 01 01  01 01 01 01  01 01 01 01  ................                                                 
  29.3        32  IN     55 33 56 54  00 00 20 00  b2 0f 00 00  00 00 00 00  U3VT.. .........   22us  2017/07/18  15:11:35.228  ntoskrnl      
                         00 00 00 00  00 00 14 00  00 00 00 00  00 04 00 00  ................                                                 
  29.3        52  IN     55 33 56 4c  00 00 34 00  b3 0f 00 00  00 00 00 00  U3VL..4.........    8us  2017/07/18  15:11:35.228  ntoskrnl      
                         00 00 01 00  de b5 94 4c  0d 00 00 00  09 00 08 01  .......L........                                                 
                         00 05 00 00  00 04 00 00  00 00 00 00  00 00 00 00  ................                                                 
                         00 00 00 00                                         ....                                                             
  29.3   1048576  IN     00 00 00 00  00 00 01 00  00 00 00 00  00 00 00 01  ................  8.7ms  2017/07/18  15:11:35.237  ntoskrnl      
                         00 01 00 01  00 00 00 00  00 00 00 00  00 00 00 00  ................                                                 
                         00 00 00 00  00 00 01 00  00 00 00 00  00 00 00 00  ................                                                 
                         00 00 00 00  00 00 00 01  01 00 00 00  01 00 00 00  ................                                                 
  29.3    262144  IN     01 01 01 01  01 01 01 02  02 01 02 01  01 01 01 01  ................  2.0ms  2017/07/18  15:11:35.239  ntoskrnl      
                         01 01 01 01  01 01 01 01  01 01 01 01  00 01 01 01  ................                                                 
                         00 01 01 02  01 02 01 01  01 01 01 01  01 01 02 01  ................                                                 
                         02 02 01 02  01 01 01 01  00 01 01 01  01 01 01 01  ................                                                 
  29.3        32  IN     55 33 56 54  00 00 20 00  b3 0f 00 00  00 00 00 00  U3VT.. .........   33us  2017/07/18  15:11:35.239  ntoskrnl      
                         00 00 00 00  00 00 14 00  00 00 00 00  00 04 00 00  ................                                                 
  29.3        52  IN     55 33 56 4c  00 00 34 00  b4 0f 00 00  00 00 00 00  U3VL..4.........   16us  2017/07/18  15:11:35.239  ntoskrnl      
                         00 00 01 00  f7 93 38 4d  0d 00 00 00  09 00 08 01  ......8M........                                                 
                         00 05 00 00  00 04 00 00  00 00 00 00  00 00 00 00  ................                                                 
                         00 00 00 00                                         ....                                                             
  29.3   1048576  IN     00 00 01 00  00 00 00 00  00 00 00 00  00 00 00 01  ................  8.6ms  2017/07/18  15:11:35.248  ntoskrnl      
                         00 00 00 00  00 00 00 00  00 00 00 01  00 00 00 00  ................                                                 
                         00 00 01 00  00 01 00 00  00 00 01 00  00 00 00 00  ................                                                 
                         00 00 01 00  00 00 00 01  01 00 00 00  01 01 00 00  ................                                                 
  29.3    262144  IN     01 01 01 01  01 01 01 01  02 01 01 01  01 01 01 01  ................  2.0ms  2017/07/18  15:11:35.250  ntoskrnl      
                         01 01 01 01  01 02 01 01  01 01 01 01  00 01 01 01  ................                                                 
                         01 01 02 01  01 01 01 01  01 01 01 01  01 01 02 01  ................                                                 
                         02 01 01 00  01 01 01 01  01 01 01 01  01 01 01 01  ................                                                 
  29.3        32  IN     55 33 56 54  00 00 20 00  b4 0f 00 00  00 00 00 00  U3VT.. .........   20us  2017/07/18  15:11:35.250  ntoskrnl      
                         00 00 00 00  00 00 14 00  00 00 00 00  00 04 00 00  ................                                                 
  29.3        52  IN     55 33 56 4c  00 00 34 00  b5 0f 00 00  00 00 00 00  U3VL..4.........   30us  2017/07/18  15:11:35.250  ntoskrnl      
                         00 00 01 00  e8 99 dc 4d  0d 00 00 00  09 00 08 01  .......M........                                                 
                         00 05 00 00  00 04 00 00  00 00 00 00  00 00 00 00  ................                                                 
                         00 00 00 00                                         ....                                                             
  29.3   1048576  IN     01 00 00 00  01 00 01 00  00 00 00 00  00 00 00 01  ................  8.6ms  2017/07/18  15:11:35.258  ntoskrnl      
                         00 00 00 00  00 01 00 00  00 00 00 01  00 00 00 01  ................                                                 
                         00 00 01 00  00 00 01 00  00 00 01 01  00 00 00 00  ................                                                 
                         01 00 00 00  00 00 00 01  00 00 00 00  00 00 00 00  ................                                                 
  29.3    262144  IN     02 01 01 01  01 01 01 00  01 02 01 01  01 01 01 01  ................  2.0ms  2017/07/18  15:11:35.260  ntoskrnl      
                         02 01 01 01  01 01 01 01  01 01 01 01  00 01 01 01  ................                                                 
                         00 01 01 02  01 01 01 01  01 01 01 01  01 01 02 01  ................                                                 
                         02 01 01 01  01 01 01 01  01 01 01 01  02 01 02 01  ................                                                 
  29.3        32  IN     55 33 56 54  00 00 20 00  b5 0f 00 00  00 00 00 00  U3VT.. .........   22us  2017/07/18  15:11:35.260  ntoskrnl      
                         00 00 00 00  00 00 14 00  00 00 00 00  00 04 00 00  ................                                                 
  29.3        52  IN     55 33 56 4c  00 00 34 00  b6 0f 00 00  00 00 00 00  U3VL..4.........   11us  2017/07/18  15:11:35.260  ntoskrnl      
                         00 00 01 00  f2 9f 80 4e  0d 00 00 00  09 00 08 01  .......N........                                                 
                         00 05 00 00  00 04 00 00  00 00 00 00  00 00 00 00  ................                                                 
                         00 00 00 00                                         ....                                                             
  29.3   1048576  IN     01 01 00 00  01 00 00 00  00 00 00 00  01 01 00 01  ................  8.6ms  2017/07/18  15:11:35.269  ntoskrnl      
                         00 00 00 00  00 00 00 01  00 00 00 01  00 00 00 00  ................                                                 
                         00 00 01 00  00 00 00 00  00 00 00 00  00 01 00 00  ................                                                 
                         00 00 00 01  00 00 01 01  01 00 00 00  00 00 00 00  ................                                                 
  29.3    262144  IN     01 02 01 01  02 01 01 01  01 02 01 01  02 02 01 01  ................  2.0ms  2017/07/18  15:11:35.271  ntoskrnl      
                         02 02 02 02  01 01 01 01  01 01 01 01  01 01 01 00  ................                                                 
                         00 01 01 01  01 01 01 01  01 01 02 01  01 01 03 01  ................                                                 
                         02 01 01 01  02 01 01 02  00 01 01 01  01 01 01 01  ................                                                 
  29.3        32  IN     55 33 56 54  00 00 20 00  b6 0f 00 00  00 00 00 00  U3VT.. .........   32us  2017/07/18  15:11:35.271  ntoskrnl      
                         00 00 00 00  00 00 14 00  00 00 00 00  00 04 00 00  ................                                                 
  29.3        52  IN     55 33 56 4c  00 00 34 00  b7 0f 00 00  00 00 00 00  U3VL..4.........   16us  2017/07/18  15:11:35.271  ntoskrnl      
                         00 00 01 00  fc a5 24 4f  0d 00 00 00  09 00 08 01  ......$O........                                                 
                         00 05 00 00  00 04 00 00  00 00 00 00  00 00 00 00  ................                                                 
                         00 00 00 00                                         ....                                                             
  29.3   1048576  IN     01 00 00 00  00 00 00 00  00 00 01 00  00 00 01 01  ................  8.5ms  2017/07/18  15:11:35.280  ntoskrnl      
                         00 01 00 00  00 00 00 00  00 00 00 00  00 00 00 01  ................                                                 
                         00 01 00 01  00 00 01 00  00 00 00 00  00 00 00 00  ................                                                 
                         00 00 00 00  00 00 01 00  00 00 00 00  00 00 00 00  ................                                                 
  29.3    262144  IN     02 01 01 01  01 01 01 01  01 01 01 01  02 01 01 01  ................  2.0ms  2017/07/18  15:11:35.282  ntoskrnl      
                         01 01 01 01  01 01 01 01  01 01 01 01  01 01 00 00  ................                                                 
                         00 01 01 02  01 02 01 01  01 01 01 01  01 01 02 01  ................                                                 
                         02 01 01 02  01 01 01 01  01 01 01 01  02 02 01 02  ................                                                 
  29.3        32  IN     55 33 56 54  00 00 20 00  b7 0f 00 00  00 00 00 00  U3VT.. .........   21us  2017/07/18  15:11:35.282  ntoskrnl      
                         00 00 00 00  00 00 14 00  00 00 00 00  00 04 00 00  ................                                                 
  29.3        52  IN     55 33 56 4c  00 00 34 00  b8 0f 00 00  00 00 00 00  U3VL..4.........   27us  2017/07/18  15:11:35.282  ntoskrnl      
                         00 00 01 00  06 ac c8 4f  0d 00 00 00  09 00 08 01  .......O........                                                 
                         00 05 00 00  00 04 00 00  00 00 00 00  00 00 00 00  ................                                                 
                         00 00 00 00                                         ....                                                             
  29.3   1048576  IN     00 01 01 00  00 00 00 00  00 00 00 00  00 00 00 01  ................  8.6ms  2017/07/18  15:11:35.291  ntoskrnl      
                         00 00 00 00  00 00 00 00  00 00 00 00  00 00 00 00  ................                                                 
                         00 00 01 00  00 00 00 00  00 00 00 00  00 00 00 00  ................                                                 
                         00 00 00 00  00 00 00 01  00 00 00 00  00 01 00 00  ................                                                 
  29.3    262144  IN     01 01 01 01  02 01 01 01  01 01 02 00  01 01 01 01  ................  2.0ms  2017/07/18  15:11:35.293  ntoskrnl      
                         01 01 01 01  01 01 01 01  01 02 01 01  01 01 01 01  ................                                                 
                         00 01 01 02  02 01 01 01  01 01 01 01  01 01 02 01  ................                                                 
                         02 02 01 01  01 01 01 01  01 01 01 01  01 02 01 01  ................                                                 
  29.3        32  IN     55 33 56 54  00 00 20 00  b8 0f 00 00  00 00 00 00  U3VT.. .........   20us  2017/07/18  15:11:35.293  ntoskrnl      
                         00 00 00 00  00 00 14 00  00 00 00 00  00 04 00 00  ................                                                 
  29.3        52  IN     55 33 56 4c  00 00 34 00  b9 0f 00 00  00 00 00 00  U3VL..4.........   23us  2017/07/18  15:11:35.293  ntoskrnl      
                         00 00 01 00  10 b2 6c 50  0d 00 00 00  09 00 08 01  ......lP........                                                 
                         00 05 00 00  00 04 00 00  00 00 00 00  00 00 00 00  ................                                                 
                         00 00 00 00                                         ....                                                             
  29.3   1048576  IN     01 00 00 00  00 00 01 00  01 00 00 00  00 00 00 01  ................  8.6ms  2017/07/18  15:11:35.301  ntoskrnl      
                         00 01 00 01  00 00 00 00  00 00 00 01  00 00 00 00  ................                                                 
                         00 01 00 01  00 00 01 00  00 00 00 00  00 00 00 00  ................                                                 
                         00 01 01 00  00 00 00 01  01 00 00 00  00 00 00 00  ................                                                 
  29.3    262144  IN     01 01 01 01  01 01 01 01  01 01 01 01  02 01 01 01  ................  2.0ms  2017/07/18  15:11:35.303  ntoskrnl      
                         01 02 01 02  01 01 01 01  01 01 01 01  01 02 01 00  ................                                                 
                         01 01 02 02  01 01 01 01  01 01 02 01  01 01 02 01  ................                                                 
                         02 01 01 02  01 01 01 01  01 00 01 01  01 01 01 01  ................                                                 
  29.3        32  IN     55 33 56 54  00 00 20 00  b9 0f 00 00  00 00 00 00  U3VT.. .........   38us  2017/07/18  15:11:35.303  ntoskrnl      
                         00 00 00 00  00 00 14 00  00 00 00 00  00 04 00 00  ................                                                 
  29.3        52  IN     55 33 56 4c  00 00 34 00  ba 0f 00 00  00 00 00 00  U3VL..4.........   20us  2017/07/18  15:11:35.303  ntoskrnl      
                         00 00 01 00  01 b8 10 51  0d 00 00 00  09 00 08 01  .......Q........                                                 
                         00 05 00 00  00 04 00 00  00 00 00 00  00 00 00 00  ................                                                 
                         00 00 00 00                                         ....                                                             
  29.3   1048576  IN     00 00 00 00  00 01 00 00  00 00 00 00  00 00 00 01  ................  8.6ms  2017/07/18  15:11:35.312  ntoskrnl      
                         00 00 00 00  00 00 00 01  00 00 00 00  00 01 00 00  ................                                                 
                         00 00 00 01  00 00 00 00  00 00 00 01  00 00 00 00  ................                                                 
                         01 01 00 00  00 00 01 00  01 00 01 00  00 00 00 00  ................                                                 
  29.3    262144  IN     01 01 01 01  01 01 01 01  01 01 01 01  02 01 01 02  ................  2.0ms  2017/07/18  15:11:35.314  ntoskrnl      
                         01 01 01 01  01 01 01 02  01 02 01 01  01 01 01 00  ................                                                 
                         00 01 01 01  01 01 01 01  01 01 01 01  01 01 02 01  ................                                                 
                         02 01 01 01  01 01 01 01  01 01 01 01  01 01 01 01  ................                                                 
  29.3        32  IN     55 33 56 54  00 00 20 00  ba 0f 00 00  00 00 00 00  U3VT.. .........   23us  2017/07/18  15:11:35.314  ntoskrnl      
                         00 00 00 00  00 00 14 00  00 00 00 00  00 04 00 00  ................                                                 
  29.3        52  IN     55 33 56 4c  00 00 34 00  bb 0f 00 00  00 00 00 00  U3VL..4.........   17us  2017/07/18  15:11:35.314  ntoskrnl      
                         00 00 01 00  1a 96 b4 51  0d 00 00 00  09 00 08 01  .......Q........                                                 
                         00 05 00 00  00 04 00 00  00 00 00 00  00 00 00 00  ................                                                 
                         00 00 00 00                                         ....                                                             
  29.3   1048576  IN     00 00 00 00  00 00 01 00  00 00 00 01  00 01 00 01  ................  8.6ms  2017/07/18  15:11:35.323  ntoskrnl      
                         00 00 00 00  00 00 00 00  01 00 00 00  00 00 00 00  ................                                                 
                         01 00 00 00  00 01 01 00  00 00 01 01  00 00 00 00  ................                                                 
                         01 00 00 00  00 00 01 01  00 00 01 00  00 00 00 00  ................                                                 
  29.3    262144  IN     02 02 01 01  01 01 01 01  02 01 01 01  02 02 01 01  ................  2.0ms  2017/07/18  15:11:35.325  ntoskrnl      
                         02 01 02 02  01 01 01 01  01 01 01 01  01 01 01 01  ................                                                 
                         00 02 01 02  01 02 02 01  01 01 01 01  01 01 02 01  ................                                                 
                         02 01 01 01  01 01 01 01  01 01 01 01  01 01 02 01  ................                                                 
  29.3        32  IN     55 33 56 54  00 00 20 00  bb 0f 00 00  00 00 00 00  U3VT.. .........   29us  2017/07/18  15:11:35.325  ntoskrnl      
                         00 00 00 00  00 00 14 00  00 00 00 00  00 04 00 00  ................                                                 
  29.3        52  IN     55 33 56 4c  00 00 34 00  bc 0f 00 00  00 00 00 00  U3VL..4.........   10us  2017/07/18  15:11:35.325  ntoskrnl      
                         00 00 01 00  24 9c 58 52  0d 00 00 00  09 00 08 01  ....$.XR........                                                 
                         00 05 00 00  00 04 00 00  00 00 00 00  00 00 00 00  ................                                                 
                         00 00 00 00                                         ....                                                             
  29.3   1048576  IN     00 00 00 00  00 00 00 00  01 00 00 00  00 00 00 00  ................  8.6ms  2017/07/18  15:11:35.334  ntoskrnl      
                         00 00 00 00  01 00 00 00  00 00 00 00  00 00 00 00  ................                                                 
                         00 00 00 00  00 00 00 00  00 00 00 00  00 00 00 00  ................                                                 
                         00 00 00 00  00 00 00 00  01 00 00 00  00 00 00 01  ................                                                 
  29.3    262144  IN     02 01 01 01  02 01 01 01  01 01 01 01  02 01 01 01  ................  2.0ms  2017/07/18  15:11:35.336  ntoskrnl      
                         01 01 01 01  01 01 01 01  01 01 01 01  01 01 01 00  ................                                                 
                         00 02 01 02  02 01 01 01  01 01 01 01  01 01 02 01  ................                                                 
                         02 01 01 02  01 01 01 01  01 01 01 01  01 01 01 01  ................                                                 
  29.3        32  IN     55 33 56 54  00 00 20 00  bc 0f 00 00  00 00 00 00  U3VT.. .........   39us  2017/07/18  15:11:35.336  ntoskrnl      
                         00 00 00 00  00 00 14 00  00 00 00 00  00 04 00 00  ................                                                 
  29.3        52  IN     55 33 56 4c  00 00 34 00  bd 0f 00 00  00 00 00 00  U3VL..4.........   12us  2017/07/18  15:11:35.336  ntoskrnl      
                         00 00 01 00  2e a2 fc 52  0d 00 00 00  09 00 08 01  .......R........                                                 
                         00 05 00 00  00 04 00 00  00 00 00 00  00 00 00 00  ................                                                 
                         00 00 00 00                                         ....                                                             
  29.3   1048576  IN     00 00 00 00  00 00 01 00  00 00 01 01  00 00 00 01  ................  8.6ms  2017/07/18  15:11:35.344  ntoskrnl      
                         00 01 00 00  00 01 00 00  00 00 00 00  00 00 01 00  ................                                                 
                         00 00 00 00  00 00 00 00  00 00 00 01  00 00 00 00  ................                                                 
                         00 01 00 00  00 00 00 01  00 01 00 00  00 01 00 01  ................                                                 
  29.3    262144  IN     02 01 01 01  02 02 01 01  01 01 01 01  02 01 01 01  ................  2.0ms  2017/07/18  15:11:35.346  ntoskrnl      
                         01 02 02 02  01 01 01 01  02 01 02 01  01 01 01 00  ................                                                 
                         00 01 01 02  01 01 01 01  01 02 01 01  01 01 02 01  ................                                                 
                         02 01 01 01  01 01 01 01  01 01 01 01  01 01 01 01  ................                                                 
  29.3        32  IN     55 33 56 54  00 00 20 00  bd 0f 00 00  00 00 00 00  U3VT.. .........   41us  2017/07/18  15:11:35.346  ntoskrnl      
                         00 00 00 00  00 00 14 00  00 00 00 00  00 04 00 00  ................                                                 
  29.3        52  IN     55 33 56 4c  00 00 34 00  be 0f 00 00  00 00 00 00  U3VL..4.........   45us  2017/07/18  15:11:35.346  ntoskrnl      
                         00 00 01 00  38 a8 a0 53  0d 00 00 00  09 00 08 01  ....8..S........                                                 
                         00 05 00 00  00 04 00 00  00 00 00 00  00 00 00 00  ................                                                 
                         00 00 00 00                                         ....                                                             
  29.3   1048576  IN     00 00 00 01  00 00 00 00  00 00 00 00  00 00 00 01  ................  8.5ms  2017/07/18  15:11:35.355  ntoskrnl      
                         00 00 00 00  00 00 00 00  00 00 00 00  00 01 00 00  ................                                                 
                         00 00 00 00  00 00 00 00  00 00 00 00  00 00 00 00  ................                                                 
                         01 00 00 00  00 00 00 01  00 01 00 00  01 00 00 00  ................                                                 
  29.3    262144  IN     01 01 01 01  01 01 01 01  02 01 02 01  01 01 01 01  ................  2.0ms  2017/07/18  15:11:35.357  ntoskrnl      
                         01 01 01 01  01 01 01 01  01 01 01 01  00 01 01 00  ................                                                 
                         00 01 01 02  01 02 01 01  01 01 01 01  01 02 02 01  ................                                                 
                         02 01 00 01  01 01 01 01  01 01 01 01  02 01 01 01  ................                                                 
  29.3        32  IN     55 33 56 54  00 00 20 00  be 0f 00 00  00 00 00 00  U3VT.. .........   28us  2017/07/18  15:11:35.357  ntoskrnl      
                         00 00 00 00  00 00 14 00  00 00 00 00  00 04 00 00  ................                                                 
  29.3        52  IN     55 33 56 4c  00 00 34 00  bf 0f 00 00  00 00 00 00  U3VL..4.........   34us  2017/07/18  15:11:35.357  ntoskrnl      
                         00 00 01 00  29 ae 44 54  0d 00 00 00  09 00 08 01  ....).DT........                                                 
                         00 05 00 00  00 04 00 00  00 00 00 00  00 00 00 00  ................                                                 
                         00 00 00 00                                         ....                                                             
  29.3   1048576  IN     00 00 01 01  00 00 00 00  00 00 00 00  00 00 00 01  ................  8.6ms  2017/07/18  15:11:35.366  ntoskrnl      
                         00 01 00 01  00 00 00 01  00 00 00 01  00 00 00 00  ................                                                 
                         00 00 01 00  00 00 01 00  00 00 00 01  00 00 00 00  ................                                                 
                         01 01 01 00  00 00 01 01  01 00 00 00  00 01 00 00  ................                                                 
  29.3    262144  IN     01 01 01 01  02 02 01 01  01 01 01 01  02 01 01 00  ................  2.0ms  2017/07/18  15:11:35.368  ntoskrnl      
                         01 02 02 02  01 01 01 01  01 02 01 01  01 01 01 01  ................                                                 
                         00 01 01 01  01 01 01 01  01 01 01 01  01 01 02 01  ................                                                 
                         02 01 01 01  01 01 01 01  01 01 01 01  01 01 02 01  ................                                                 
  29.3        32  IN     55 33 56 54  00 00 20 00  bf 0f 00 00  00 00 00 00  U3VT.. .........   33us  2017/07/18  15:11:35.368  ntoskrnl      
                         00 00 00 00  00 00 14 00  00 00 00 00  00 04 00 00  ................                                                 
  29.3        52  IN     55 33 56 4c  00 00 34 00  c0 0f 00 00  00 00 00 00  U3VL..4.........   48us  2017/07/18  15:11:35.368  ntoskrnl      
                         00 00 01 00  33 b4 e8 54  0d 00 00 00  09 00 08 01  ....3..T........                                                 
                         00 05 00 00  00 04 00 00  00 00 00 00  00 00 00 00  ................                                                 
                         00 00 00 00                                         ....                                                             
  29.3   1048576  IN     00 00 00 00  00 00 00 00  00 00 00 00  00 00 00 01  ................  8.6ms  2017/07/18  15:11:35.377  ntoskrnl      
                         00 01 00 01  00 00 00 00  00 00 00 01  00 00 00 01  ................                                                 
                         00 00 00 00  00 00 01 00  00 00 01 01  00 00 00 00  ................                                                 
                         00 00 00 00  00 00 00 01  00 00 00 00  00 01 00 00  ................                                                 
  29.3    262144  IN     02 01 01 02  02 02 01 01  02 01 02 01  02 01 01 01  ................  2.0ms  2017/07/18  15:11:35.379  ntoskrnl      
                         01 01 01 01  01 01 01 01  01 01 01 01  01 01 01 01  ................                                                 
                         00 01 01 01  01 02 01 01  01 01 01 01  01 01 02 01  ................                                                 
                         02 02 00 01  02 01 01 01  01 01 01 01  02 01 02 01  ................                                                 
  29.3        32  IN     55 33 56 54  00 00 20 00  c0 0f 00 00  00 00 00 00  U3VT.. .........   21us  2017/07/18  15:11:35.379  ntoskrnl      
                         00 00 00 00  00 00 14 00  00 00 00 00  00 04 00 00  ................                                                 
  29.3        52  IN     55 33 56 4c  00 00 34 00  c1 0f 00 00  00 00 00 00  U3VL..4.........   17us  2017/07/18  15:11:35.379  ntoskrnl      
                         00 00 01 00  3d ba 8c 55  0d 00 00 00  09 00 08 01  ....=..U........                                                 
                         00 05 00 00  00 04 00 00  00 00 00 00  00 00 00 00  ................                                                 
                         00 00 00 00                                         ....                                                             
  29.3   1048576  IN     00 00 00 00  00 00 00 00  00 00 00 00  00 00 00 01  ................  8.6ms  2017/07/18  15:11:35.387  ntoskrnl      
                         00 00 00 00  00 00 00 00  00 00 00 00  00 00 00 00  ................                                                 
                         00 00 00 00  00 00 00 00  00 00 00 00  00 00 00 00  ................                                                 
                         00 00 00 00  00 00 00 00  01 00 00 00  00 00 00 00  ................                                                 
  29.3    262144  IN     01 02 01 02  01 01 01 01  01 02 01 01  01 01 00 01  ................  2.0ms  2017/07/18  15:11:35.389  ntoskrnl      
                         01 01 01 02  01 01 01 01  01 02 01 01  01 01 00 01  ................                                                 
                         00 01 01 01  01 02 01 01  01 01 01 01  01 01 02 01  ................                                                 
                         01 01 01 01  01 01 01 01  01 01 01 01  02 01 02 01  ................                                                 
  29.3        32  IN     55 33 56 54  00 00 20 00  c1 0f 00 00  00 00 00 00  U3VT.. .........   20us  2017/07/18  15:11:35.389  ntoskrnl      
                         00 00 00 00  00 00 14 00  00 00 00 00  00 04 00 00  ................                                                 
  29.3        52  IN     55 33 56 4c  00 00 34 00  c2 0f 00 00  00 00 00 00  U3VL..4.........   16us  2017/07/18  15:11:35.389  ntoskrnl      
                         00 00 01 00  56 98 30 56  0d 00 00 00  09 00 08 01  ....V.0V........                                                 
                         00 05 00 00  00 04 00 00  00 00 00 00  00 00 00 00  ................                                                 
                         00 00 00 00                                         ....                                                             
  29.3   1048576  IN     00 01 00 00  00 01 00 00  01 00 00 00  00 00 00 01  ................  8.6ms  2017/07/18  15:11:35.398  ntoskrnl      
                         00 00 00 00  00 01 00 00  00 00 00 01  00 00 01 00  ................                                                 
                         00 00 00 01  00 01 01 00  00 00 00 00  01 00 00 01  ................                                                 
                         00 01 00 00  00 00 01 00  00 01 00 00  01 00 00 00  ................                                                 
  29.3    262144  IN     02 01 01 01  01 02 01 01  01 02 01 01  01 01 01 01  ................  2.0ms  2017/07/18  15:11:35.400  ntoskrnl      
                         01 01 01 01  01 01 01 01  02 01 01 01  01 02 00 01  ................                                                 
                         00 01 01 02  01 01 01 01  01 01 01 01  01 01 02 01  ................                                                 
                         01 01 01 02  01 02 01 01  01 01 01 01  02 01 01 02  ................                                                 
  29.3        32  IN     55 33 56 54  00 00 20 00  c2 0f 00 00  00 00 00 00  U3VT.. .........   35us  2017/07/18  15:11:35.400  ntoskrnl      
                         00 00 00 00  00 00 14 00  00 00 00 00  00 04 00 00  ................                                                 
  29.3        52  IN     55 33 56 4c  00 00 34 00  c3 0f 00 00  00 00 00 00  U3VL..4.........   17us  2017/07/18  15:11:35.400  ntoskrnl      
                         00 00 01 00  60 9e d4 56  0d 00 00 00  09 00 08 01  ....`..V........                                                 
                         00 05 00 00  00 04 00 00  00 00 00 00  00 00 00 00  ................                                                 
                         00 00 00 00                                         ....                                                             
  29.3   1048576  IN     00 00 00 00  00 00 00 00  00 00 01 00  00 00 00 01  ................  8.6ms  2017/07/18  15:11:35.409  ntoskrnl      
                         00 00 00 00  00 00 00 00  01 00 00 00  00 00 00 00  ................                                                 
                         00 00 01 01  00 00 00 00  00 00 00 01  00 00 00 00  ................                                                 
                         00 00 00 00  00 00 01 00  01 00 00 00  00 01 00 00  ................                                                 
  29.3    262144  IN     02 01 01 01  02 01 01 01  02 02 01 01  01 01 01 01  ................  2.0ms  2017/07/18  15:11:35.411  ntoskrnl      
                         01 01 01 01  01 01 01 01  01 02 00 01  01 01 01 01  ................                                                 
                         00 01 01 02  01 01 01 01  01 01 01 01  01 01 02 02  ................                                                 
                         02 01 01 01  02 02 02 01  01 01 01 01  02 02 01 01  ................                                                 
  29.3        32  IN     55 33 56 54  00 00 20 00  c3 0f 00 00  00 00 00 00  U3VT.. .........   32us  2017/07/18  15:11:35.411  ntoskrnl      
                         00 00 00 00  00 00 14 00  00 00 00 00  00 04 00 00  ................                                                 
  29.3        52  IN     55 33 56 4c  00 00 34 00  c4 0f 00 00  00 00 00 00  U3VL..4.........   18us  2017/07/18  15:11:35.411  ntoskrnl      
                         00 00 01 00  51 a4 78 57  0d 00 00 00  09 00 08 01  ....Q.xW........                                                 
                         00 05 00 00  00 04 00 00  00 00 00 00  00 00 00 00  ................                                                 
                         00 00 00 00                                         ....                                                             
  29.3   1048576  IN     01 00 01 01  00 00 01 00  01 00 00 00  00 00 00 00  ................  8.6ms  2017/07/18  15:11:35.420  ntoskrnl      
                         00 00 00 00  00 00 00 00  00 00 00 00  00 00 01 00  ................                                                 
                         01 00 00 00  00 00 00 00  00 00 00 00  00 00 00 00  ................                                                 
                         00 01 00 00  00 00 00 00  01 01 00 00  00 00 00 00  ................                                                 
  29.3    262144  IN     02 01 01 01  01 01 01 01  01 01 01 01  01 01 01 01  ................  2.0ms  2017/07/18  15:11:35.422  ntoskrnl      
                         01 01 01 01  01 01 01 01  01 01 01 01  00 01 01 01  ................                                                 
                         00 01 01 01  01 01 01 01  01 01 01 02  01 01 02 01  ................                                                 
                         02 01 01 02  01 02 01 01  01 01 02 01  01 01 01 01  ................                                                 
  29.3        32  IN     55 33 56 54  00 00 20 00  c4 0f 00 00  00 00 00 00  U3VT.. .........   17us  2017/07/18  15:11:35.422  ntoskrnl      
                         00 00 00 00  00 00 14 00  00 00 00 00  00 04 00 00  ................                                                 
  29.3        52  IN     55 33 56 4c  00 00 34 00  c5 0f 00 00  00 00 00 00  U3VL..4.........   15us  2017/07/18  15:11:35.422  ntoskrnl      
                         00 00 01 00  5b aa 1c 58  0d 00 00 00  09 00 08 01  ....[..X........                                                 
                         00 05 00 00  00 04 00 00  00 00 00 00  00 00 00 00  ................                                                 
                         00 00 00 00                                         ....                                                             
  29.3   1048576  IN     00 00 00 00  00 00 00 00  00 00 00 00  01 00 00 01  ................  8.7ms  2017/07/18  15:11:35.430  ntoskrnl      
                         00 00 00 00  00 00 00 00  00 00 00 01  00 00 00 00  ................                                                 
                         00 00 01 00  00 00 00 00  00 00 00 00  01 00 00 00  ................                                                 
                         00 00 00 00  00 00 00 01  01 00 00 00  01 00 00 00  ................                                                 
  29.3    262144  IN     01 01 01 01  01 02 01 01  01 01 02 01  01 01 01 01  ................  2.0ms  2017/07/18  15:11:35.432  ntoskrnl      
                         01 02 01 02  01 02 01 01  01 02 00 01  01 01 01 01  ................                                                 
                         00 01 01 01  01 01 01 00  01 01 01 01  01 01 02 00  ................                                                 
                         01 01 01 02  01 01 01 01  01 01 01 01  01 01 01 01  ................                                                 
  29.3        32  IN     55 33 56 54  00 00 20 00  c5 0f 00 00  00 00 00 00  U3VT.. .........   37us  2017/07/18  15:11:35.432  ntoskrnl      
                         00 00 00 00  00 00 14 00  00 00 00 00  00 04 00 00  ................                                                 
  29.3        52  IN     55 33 56 4c  00 00 34 00  c6 0f 00 00  00 00 00 00  U3VL..4.........   25us  2017/07/18  15:11:35.432  ntoskrnl      
                         00 00 01 00  65 b0 c0 58  0d 00 00 00  09 00 08 01  ....e..X........                                                 
                         00 05 00 00  00 04 00 00  00 00 00 00  00 00 00 00  ................                                                 
                         00 00 00 00                                         ....                                                             
  29.3   1048576  IN     00 00 00 00  00 00 00 00  00 00 00 00  00 00 00 01  ................  8.5ms  2017/07/18  15:11:35.441  ntoskrnl      
                         00 00 00 00  00 00 00 00  00 00 00 00  00 00 00 00  ................                                                 
                         00 00 01 01  00 00 01 00  00 00 00 01  00 00 01 00  ................                                                 
                         01 00 00 00  00 01 01 00  00 01 00 01  01 01 00 00  ................                                                 
  29.3    262144  IN     01 01 02 01  02 02 01 01  01 01 02 01  01 01 01 01  ................  2.0ms  2017/07/18  15:11:35.443  ntoskrnl      
                         01 02 01 01  01 01 01 01  01 02 01 01  01 01 01 01  ................                                                 
                         00 01 01 02  02 01 00 01  01 01 01 01  02 01 02 01  ................                                                 
                         02 01 02 01  01 01 01 01  01 01 01 01  01 01 01 01  ................                                                 
  29.3        32  IN     55 33 56 54  00 00 20 00  c6 0f 00 00  00 00 00 00  U3VT.. .........   37us  2017/07/18  15:11:35.443  ntoskrnl      
                         00 00 00 00  00 00 14 00  00 00 00 00  00 04 00 00  ................                                                 
  29.3        52  IN     55 33 56 4c  00 00 34 00  c7 0f 00 00  00 00 00 00  U3VL..4.........   21us  2017/07/18  15:11:35.443  ntoskrnl      
                         00 00 01 00  6f b6 64 59  0d 00 00 00  09 00 08 01  ....o.dY........                                                 
                         00 05 00 00  00 04 00 00  00 00 00 00  00 00 00 00  ................                                                 
                         00 00 00 00                                         ....                                                             
  29.3   1048576  IN     00 00 00 00  01 00 01 00  00 00 01 00  00 00 00 01  ................  8.5ms  2017/07/18  15:11:35.452  ntoskrnl      
                         00 00 00 00  00 00 00 00  00 00 00 01  00 01 00 01  ................                                                 
                         00 00 00 00  00 00 01 00  00 00 00 00  01 00 00 00  ................                                                 
                         01 00 01 00  00 00 00 00  01 00 00 00  00 00 00 00  ................                                                 
  29.3    262144  IN     02 01 01 01  01 01 01 00  01 01 01 01  01 01 01 01  ................  2.0ms  2017/07/18  15:11:35.454  ntoskrnl      
                         01 01 01 01  01 01 01 01  01 01 01 01  00 01 01 01  ................                                                 
                         00 00 01 01  01 01 01 01  01 01 01 01  01 01 02 01  ................                                                 
                         02 01 01 01  01 01 01 01  01 01 01 01  01 01 01 01  ................                                                 
  29.3        32  IN     55 33 56 54  00 00 20 00  c7 0f 00 00  00 00 00 00  U3VT.. .........   33us  2017/07/18  15:11:35.454  ntoskrnl      
                         00 00 00 00  00 00 14 00  00 00 00 00  00 04 00 00  ................                                                 
  29.3        52  IN     55 33 56 4c  00 00 34 00  c8 0f 00 00  00 00 00 00  U3VL..4.........   24us  2017/07/18  15:11:35.454  ntoskrnl      
                         00 00 01 00  60 bc 08 5a  0d 00 00 00  09 00 08 01  ....`..Z........                                                 
                         00 05 00 00  00 04 00 00  00 00 00 00  00 00 00 00  ................                                                 
                         00 00 00 00                                         ....                                                             
  29.3   1048576  IN     00 00 01 00  01 01 01 00  00 00 00 00  01 00 00 01  ................  8.6ms  2017/07/18  15:11:35.463  ntoskrnl      
                         00 00 00 01  00 00 00 00  00 00 00 00  00 00 01 00  ................                                                 
                         00 00 00 01  00 00 00 00  00 00 00 01  00 00 00 00  ................                                                 
                         00 00 00 01  00 00 01 01  01 01 00 00  00 01 00 00  ................                                                 
  29.3    262144  IN     01 01 01 01  02 01 01 01  01 01 01 01  01 01 01 01  ................  2.0ms  2017/07/18  15:11:35.465  ntoskrnl      
                         01 01 01 02  01 01 01 01  01 01 01 01  01 01 00 01  ................                                                 
                         00 01 01 01  02 01 01 01  01 01 01 01  01 01 02 01  ................                                                 
                         02 01 01 02  01 01 01 01  01 01 02 01  02 01 01 02  ................                                                 
  29.3        32  IN     55 33 56 54  00 00 20 00  c8 0f 00 00  00 00 00 00  U3VT.. .........   31us  2017/07/18  15:11:35.465  ntoskrnl      
                         00 00 00 00  00 00 14 00  00 00 00 00  00 04 00 00  ................                                                 
  29.3        52  IN     55 33 56 4c  00 00 34 00  c9 0f 00 00  00 00 00 00  U3VL..4.........   51us  2017/07/18  15:11:35.465  ntoskrnl      
                         00 00 01 00  79 9a ac 5a  0d 00 00 00  09 00 08 01  ....y..Z........                                                 
                         00 05 00 00  00 04 00 00  00 00 00 00  00 00 00 00  ................                                                 
                         00 00 00 00                                         ....                                                             
  29.3   1048576  IN     00 00 00 00  00 00 01 00  00 00 01 00  00 00 00 01  ................  8.5ms  2017/07/18  15:11:35.473  ntoskrnl      
                         00 00 00 00  00 00 01 00  00 00 00 01  00 00 00 00  ................                                                 
                         00 00 01 00  00 00 00 00  00 00 00 00  01 00 00 00  ................                                                 
                         00 00 00 00  00 00 00 01  01 00 00 01  00 01 01 00  ................                                                 
  29.3    262144  IN     01 02 01 01  01 02 02 01  02 01 01 01  01 01 01 01  ................  2.0ms  2017/07/18  15:11:35.475  ntoskrnl      
                         01 01 02 02  01 02 01 02  01 01 01 01  01 01 01 00  ................                                                 
                         00 01 01 02  01 02 01 01  02 01 01 01  02 01 02 01  ................                                                 
                         02 01 01 01  01 01 02 01  01 01 02 01  02 01 01 01  ................                                                 
  29.3        32  IN     55 33 56 54  00 00 20 00  c9 0f 00 00  00 00 00 00  U3VT.. .........   43us  2017/07/18  15:11:35.475  ntoskrnl      
                         00 00 00 00  00 00 14 00  00 00 00 00  00 04 00 00  ................                                                 
  29.3        52  IN     55 33 56 4c  00 00 34 00  ca 0f 00 00  00 00 00 00  U3VL..4.........   24us  2017/07/18  15:11:35.475  ntoskrnl      
                         00 00 01 00  83 a0 50 5b  0d 00 00 00  09 00 08 01  ......P[........                                                 
                         00 05 00 00  00 04 00 00  00 00 00 00  00 00 00 00  ................                                                 
                         00 00 00 00                                         ....                                                             
  29.3   1048576  IN     00 00 00 00  00 00 00 00  00 00 00 00  00 00 01 01  ................  8.5ms  2017/07/18  15:11:35.484  ntoskrnl      
                         00 00 00 00  00 00 00 00  00 00 00 01  00 01 00 01  ................                                                 
                         00 00 01 00  00 01 00 00  00 00 00 00  00 00 00 00  ................                                                 
                         00 00 01 00  00 00 00 01  01 01 01 00  00 01 00 00  ................                                                 
  29.3    262144  IN     01 02 01 01  02 01 01 01  01 01 01 01  01 02 01 01  ................  2.0ms  2017/07/18  15:11:35.486  ntoskrnl      
                         01 02 01 02  01 01 01 01  01 01 01 01  01 01 01 01  ................                                                 
                         00 02 02 02  02 01 01 01  01 01 01 01  01 01 02 01  ................                                                 
                         02 01 01 01  01 02 02 01  01 01 01 01  01 01 02 01  ................                                                 
  29.3        32  IN     55 33 56 54  00 00 20 00  ca 0f 00 00  00 00 00 00  U3VT.. .........   24us  2017/07/18  15:11:35.486  ntoskrnl      
                         00 00 00 00  00 00 14 00  00 00 00 00  00 04 00 00  ................                                                 
  29.3        52  IN     55 33 56 4c  00 00 34 00  cb 0f 00 00  00 00 00 00  U3VL..4.........   10us  2017/07/18  15:11:35.486  ntoskrnl      
                         00 00 01 00  8d a6 f4 5b  0d 00 00 00  09 00 08 01  .......[........                                                 
                         00 05 00 00  00 04 00 00  00 00 00 00  00 00 00 00  ................                                                 
                         00 00 00 00                                         ....                                                             
  29.3   1048576  IN     00 00 00 00  00 00 00 00  00 00 00 00  00 01 00 00  ................  8.6ms  2017/07/18  15:11:35.495  ntoskrnl      
                         00 01 00 00  01 00 00 00  00 00 00 00  00 00 00 01  ................                                                 
                         00 00 00 00  00 00 01 00  00 00 00 01  00 00 00 00  ................                                                 
                         00 01 01 00  00 00 00 01  00 01 00 00  00 00 00 00  ................                                                 
  29.3    262144  IN     01 02 01 01  02 01 01 01  01 01 01 01  02 01 01 01  ................  2.0ms  2017/07/18  15:11:35.497  ntoskrnl      
                         01 01 01 01  01 01 01 01  01 01 01 01  01 02 01 01  ................                                                 
                         00 01 01 02  01 02 01 01  01 01 01 01  01 01 02 01  ................                                                 
                         02 02 01 01  01 01 01 01  01 01 01 01  01 02 01 01  ................                                                 
  29.3        32  IN     55 33 56 54  00 00 20 00  cb 0f 00 00  00 00 00 00  U3VT.. .........   46us  2017/07/18  15:11:35.497  ntoskrnl      
                         00 00 00 00  00 00 14 00  00 00 00 00  00 04 00 00  ................                                                 
  29.3        52  IN     55 33 56 4c  00 00 34 00  cc 0f 00 00  00 00 00 00  U3VL..4.........   16us  2017/07/18  15:11:35.497  ntoskrnl      
                         00 00 01 00  97 ac 98 5c  0d 00 00 00  09 00 08 01  .......\........                                                 
                         00 05 00 00  00 04 00 00  00 00 00 00  00 00 00 00  ................                                                 
                         00 00 00 00                                         ....                                                             
  29.3   1048576  IN     01 00 01 00  00 00 00 00  00 00 00 00  00 01 00 01  ................  8.6ms  2017/07/18  15:11:35.506  ntoskrnl      
                         00 00 00 00  01 00 00 00  00 00 00 00  00 01 00 00  ................                                                 
                         01 00 00 00  00 00 00 00  00 00 00 00  00 00 00 00  ................                                                 
                         01 00 00 00  00 00 00 01  01 01 00 00  00 00 00 00  ................                                                 
  29.3    262144  IN     02 01 01 01  01 01 01 01  02 01 02 01  02 01 01 01  ................  2.0ms  2017/07/18  15:11:35.508  ntoskrnl      
                         01 01 01 01  00 01 01 01  01 01 01 01  01 01 00 01  ................                                                 
                         00 01 01 02  01 02 01 01  01 01 01 01  01 01 02 01  ................                                                 
                         02 02 01 01  01 01 01 01  01 01 01 01  01 01 02 01  ................                                                 
  29.3        32  IN     55 33 56 54  00 00 20 00  cc 0f 00 00  00 00 00 00  U3VT.. .........   43us  2017/07/18  15:11:35.508  ntoskrnl      
                         00 00 00 00  00 00 14 00  00 00 00 00  00 04 00 00  ................                                                 
  29.3        52  IN     55 33 56 4c  00 00 34 00  cd 0f 00 00  00 00 00 00  U3VL..4.........   27us  2017/07/18  15:11:35.508  ntoskrnl      
                         00 00 01 00  88 b2 3c 5d  0d 00 00 00  09 00 08 01  ......<]........                                                 
                         00 05 00 00  00 04 00 00  00 00 00 00  00 00 00 00  ................                                                 
                         00 00 00 00                                         ....                                                             
  29.3   1048576  IN     00 00 01 00  00 01 00 00  00 00 00 00  00 00 00 00  ................  8.5ms  2017/07/18  15:11:35.516  ntoskrnl      
                         00 00 00 00  00 00 00 00  00 00 00 00  00 00 00 00  ................                                                 
                         00 00 01 01  00 00 00 00  00 01 00 00  00 00 00 00  ................                                                 
                         01 00 00 00  00 00 00 00  01 00 00 00  00 01 01 00  ................                                                 
  29.3    262144  IN     01 01 01 01  01 01 01 01  01 01 01 01  01 01 01 00  ................  2.0ms  2017/07/18  15:11:35.518  ntoskrnl      
                         01 01 01 02  01 01 01 01  01 01 01 01  00 01 00 01  ................                                                 
                         00 01 01 02  01 01 01 01  01 01 01 02  01 01 02 01  ................                                                 
                         02 01 01 02  01 01 01 01  00 01 01 00  01 01 01 01  ................                                                 
  29.3        32  IN     55 33 56 54  00 00 20 00  cd 0f 00 00  00 00 00 00  U3VT.. .........   18us  2017/07/18  15:11:35.518  ntoskrnl      
                         00 00 00 00  00 00 14 00  00 00 00 00  00 04 00 00  ................                                                 
  29.3        52  IN     55 33 56 4c  00 00 34 00  ce 0f 00 00  00 00 00 00  U3VL..4.........   16us  2017/07/18  15:11:35.518  ntoskrnl      
                         00 00 01 00  92 b8 e0 5d  0d 00 00 00  09 00 08 01  .......]........                                                 
                         00 05 00 00  00 04 00 00  00 00 00 00  00 00 00 00  ................                                                 
                         00 00 00 00                                         ....                                                             
  29.3   1048576  IN     00 00 01 00  00 01 00 00  00 00 00 00  00 00 00 01  ................  8.6ms  2017/07/18  15:11:35.527  ntoskrnl      
                         00 01 00 00  01 00 00 00  00 00 00 01  00 00 00 00  ................                                                 
                         01 00 00 00  00 01 00 00  00 00 00 01  00 00 00 00  ................                                                 
                         00 01 00 00  00 00 01 00  01 01 00 00  00 00 00 00  ................                                                 
  29.3    262144  IN     01 02 01 01  01 01 01 01  01 01 02 01  01 02 01 01  ................  2.0ms  2017/07/18  15:11:35.529  ntoskrnl      
                         01 02 02 01  01 01 00 01  01 01 01 01  01 01 01 01  ................                                                 
                         00 01 02 02  01 02 01 01  01 01 02 01  01 01 02 01  ................                                                 
                         02 01 01 01  02 01 02 01  01 01 02 01  01 01 01 01  ................                                                 
  29.3        32  IN     55 33 56 54  00 00 20 00  ce 0f 00 00  00 00 00 00  U3VT.. .........   40us  2017/07/18  15:11:35.529  ntoskrnl      
                         00 00 00 00  00 00 14 00  00 00 00 00  00 04 00 00  ................                                                 
  29.3        52  IN     55 33 56 4c  00 00 34 00  cf 0f 00 00  00 00 00 00  U3VL..4.........   31us  2017/07/18  15:11:35.529  ntoskrnl      
                         00 00 01 00  9c be 84 5e  0d 00 00 00  09 00 08 01  .......^........                                                 
                         00 05 00 00  00 04 00 00  00 00 00 00  00 00 00 00  ................                                                 
                         00 00 00 00                                         ....                                                             
  29.3   1048576  IN     00 00 00 00  00 00 00 00  00 00 00 00  00 00 00 01  ................  8.6ms  2017/07/18  15:11:35.538  ntoskrnl      
                         00 00 00 01  00 01 00 00  00 00 00 00  00 00 00 00  ................                                                 
                         00 00 00 00  00 00 00 00  00 00 01 01  00 00 00 00  ................                                                 
                         00 01 00 00  00 00 00 01  01 00 00 00  00 00 00 00  ................                                                 
  29.3    262144  IN     01 01 01 01  01 01 01 01  01 01 01 01  01 01 00 01  ................  2.0ms  2017/07/18  15:11:35.540  ntoskrnl      
                         01 02 01 01  01 00 01 01  01 02 01 01  00 01 01 01  ................                                                 
                         00 01 01 01  01 01 01 01  00 01 01 01  01 01 02 01  ................                                                 
                         02 01 01 02  01 01 01 01  00 01 01 01  01 01 01 01  ................                                                 
  29.3        32  IN     55 33 56 54  00 00 20 00  cf 0f 00 00  00 00 00 00  U3VT.. .........   25us  2017/07/18  15:11:35.540  ntoskrnl      
                         00 00 00 00  00 00 14 00  00 00 00 00  00 04 00 00  ................                                                 
  29.3        52  IN     55 33 56 4c  00 00 34 00  d0 0f 00 00  00 00 00 00  U3VL..4.........   12us  2017/07/18  15:11:35.540  ntoskrnl      
                         00 00 01 00  a6 c4 28 5f  0d 00 00 00  09 00 08 01  ......(_........                                                 
                         00 05 00 00  00 04 00 00  00 00 00 00  00 00 00 00  ................                                                 
                         00 00 00 00                                         ....                                                             
  29.3   1048576  IN     00 00 00 00  00 00 00 00  01 00 00 00  00 00 00 01  ................  8.6ms  2017/07/18  15:11:35.549  ntoskrnl      
                         00 01 00 00  00 00 00 00  00 00 00 01  00 00 00 00  ................                                                 
                         00 00 01 00  00 00 01 00  00 01 00 00  01 00 00 00  ................                                                 
                         00 00 00 00  00 00 00 00  01 00 00 00  00 01 01 00  ................                                                 
  29.3    262144  IN     01 01 01 01  01 01 01 01  02 01 01 01  01 01 01 01  ................  2.0ms  2017/07/18  15:11:35.551  ntoskrnl      
                         01 01 02 01  01 01 01 01  01 01 01 01  01 01 01 01  ................                                                 
                         00 01 01 02  01 02 01 01  01 01 01 01  01 01 02 01  ................                                                 
                         01 01 01 01  01 01 01 01  01 01 02 01  01 01 01 01  ................                                                 
  29.3        32  IN     55 33 56 54  00 00 20 00  d0 0f 00 00  00 00 00 00  U3VT.. .........   21us  2017/07/18  15:11:35.551  ntoskrnl      
                         00 00 00 00  00 00 14 00  00 00 00 00  00 04 00 00  ................                                                 
  29.3        52  IN     55 33 56 4c  00 00 34 00  d1 0f 00 00  00 00 00 00  U3VL..4.........   17us  2017/07/18  15:11:35.551  ntoskrnl      
                         00 00 01 00  bf a2 cc 5f  0d 00 00 00  09 00 08 01  ......._........                                                 
                         00 05 00 00  00 04 00 00  00 00 00 00  00 00 00 00  ................                                                 
                         00 00 00 00                                         ....                                                             
  29.3   1048576  IN     00 01 00 01  00 00 00 00  00 00 00 00  00 01 00 01  ................  8.6ms  2017/07/18  15:11:35.559  ntoskrnl      
                         00 00 00 00  00 00 00 00  00 00 00 00  00 00 00 00  ................                                                 
                         00 00 00 00  00 00 00 00  01 00 00 00  00 00 00 00  ................                                                 
                         01 00 00 00  00 00 00 01  00 00 00 00  01 00 01 00  ................                                                 
  29.3    262144  IN     01 01 01 01  02 02 02 01  02 01 02 01  01 01 01 01  ................  2.0ms  2017/07/18  15:11:35.561  ntoskrnl      
                         01 02 02 02  01 01 01 01  01 02 01 01  01 01 01 01  ................                                                 
                         00 01 01 02  01 01 01 01  01 01 01 01  01 02 02 01  ................                                                 
                         02 01 01 01  02 01 02 02  01 01 01 01  01 01 01 01  ................                                                 
  29.3        32  IN     55 33 56 54  00 00 20 00  d1 0f 00 00  00 00 00 00  U3VT.. .........   18us  2017/07/18  15:11:35.561  ntoskrnl      
                         00 00 00 00  00 00 14 00  00 00 00 00  00 04 00 00  ................                                                 
  29.3        52  IN     55 33 56 4c  00 00 34 00  d2 0f 00 00  00 00 00 00  U3VL..4.........   15us  2017/07/18  15:11:35.561  ntoskrnl      
                         00 00 01 00  b0 a8 70 60  0d 00 00 00  09 00 08 01  ......p`........                                                 
                         00 05 00 00  00 04 00 00  00 00 00 00  00 00 00 00  ................                                                 
                         00 00 00 00                                         ....                                                             
  29.3   1048576  IN     00 00 00 00  00 00 00 00  00 00 01 00  00 00 00 01  ................  8.6ms  2017/07/18  15:11:35.570  ntoskrnl      
                         00 00 00 00  00 00 00 00  00 00 00 00  00 00 00 01  ................                                                 
                         00 00 01 00  00 00 01 00  00 00 01 00  01 00 00 00  ................                                                 
                         00 00 00 01  00 00 00 01  00 00 00 00  00 00 00 00  ................                                                 
  29.3    262144  IN     01 02 01 01  02 01 01 01  01 01 02 01  02 02 01 01  ................  2.0ms  2017/07/18  15:11:35.572  ntoskrnl      
                         01 02 01 01  01 01 01 02  01 01 00 01  01 01 01 00  ................                                                 
                         00 01 01 02  01 02 01 01  01 01 01 01  01 01 02 01  ................                                                 
                         02 01 01 01  01 01 01 01  01 01 01 01  02 01 01 01  ................                                                 
  29.3        32  IN     55 33 56 54  00 00 20 00  d2 0f 00 00  00 00 00 00  U3VT.. .........   43us  2017/07/18  15:11:35.572  ntoskrnl      
                         00 00 00 00  00 00 14 00  00 00 00 00  00 04 00 00  ................                                                 
  29.3        52  IN     55 33 56 4c  00 00 34 00  d3 0f 00 00  00 00 00 00  U3VL..4.........   34us  2017/07/18  15:11:35.572  ntoskrnl      
                         00 00 01 00  ba ae 14 61  0d 00 00 00  09 00 08 01  .......a........                                                 
                         00 05 00 00  00 04 00 00  00 00 00 00  00 00 00 00  ................                                                 
                         00 00 00 00                                         ....                                                             
  29.3   1048576  IN     00 00 00 00  00 00 00 00  00 00 01 00  00 00 00 01  ................  8.5ms  2017/07/18  15:11:35.581  ntoskrnl      
                         00 01 00 00  00 00 00 00  01 00 00 01  00 00 00 00  ................                                                 
                         00 00 00 00  00 00 01 00  00 00 01 00  00 01 00 00  ................                                                 
                         00 01 01 00  00 00 00 01  01 00 00 00  00 01 00 00  ................                                                 
  29.3    262144  IN     01 01 01 01  01 01 01 01  01 01 01 01  01 01 01 01  ................  2.0ms  2017/07/18  15:11:35.583  ntoskrnl      
                         02 01 01 01  02 01 01 01  01 01 01 01  01 01 01 01  ................                                                 
                         00 01 01 02  01 01 01 01  01 01 01 01  01 01 02 01  ................                                                 
                         02 01 01 02  01 01 01 01  01 01 01 01  01 01 01 01  ................                                                 
  29.3        32  IN     55 33 56 54  00 00 20 00  d3 0f 00 00  00 00 00 00  U3VT.. .........   20us  2017/07/18  15:11:35.583  ntoskrnl      
                         00 00 00 00  00 00 14 00  00 00 00 00  00 04 00 00  ................                                                 
  29.3        52  IN     55 33 56 4c  00 00 34 00  d4 0f 00 00  00 00 00 00  U3VL..4.........   19us  2017/07/18  15:11:35.583  ntoskrnl      
                         00 00 01 00  c4 b4 b8 61  0d 00 00 00  09 00 08 01  .......a........                                                 
                         00 05 00 00  00 04 00 00  00 00 00 00  00 00 00 00  ................                                                 
                         00 00 00 00                                         ....                                                             
  29.3   1048576  IN     01 01 01 00  00 01 00 00  01 00 00 00  00 00 00 01  ................  8.6ms  2017/07/18  15:11:35.591  ntoskrnl      
                         00 00 00 00  00 00 00 00  00 00 00 01  00 00 00 01  ................                                                 
                         00 00 00 00  00 00 00 00  00 00 01 00  00 00 00 00  ................                                                 
                         01 01 00 00  00 00 00 01  01 00 00 00  00 00 00 00  ................                                                 
  29.3    262144  IN     01 01 01 02  01 02 01 01  01 01 01 01  01 01 01 01  ................  2.0ms  2017/07/18  15:11:35.594  ntoskrnl      
                         01 02 01 01  01 01 01 01  01 01 01 01  01 01 01 01  ................                                                 
                         00 01 01 02  01 02 01 01  01 01 01 01  01 01 02 01  ................                                                 
                         02 02 01 01  02 01 01 01  01 01 01 01  02 01 01 02  ................                                                 
  29.3        32  IN     55 33 56 54  00 00 20 00  d4 0f 00 00  00 00 00 00  U3VT.. .........   25us  2017/07/18  15:11:35.594  ntoskrnl      
                         00 00 00 00  00 00 14 00  00 00 00 00  00 04 00 00  ................                                                 
  29.3        52  IN     55 33 56 4c  00 00 34 00  d5 0f 00 00  00 00 00 00  U3VL..4.........   11us  2017/07/18  15:11:35.594  ntoskrnl      
                         00 00 01 00  ce ba 5c 62  0d 00 00 00  09 00 08 01  ......\b........                                                 
                         00 05 00 00  00 04 00 00  00 00 00 00  00 00 00 00  ................                                                 
                         00 00 00 00                                         ....                                                             
  29.3   1048576  IN     00 00 00 00  00 00 01 00  00 00 00 00  00 00 00 01  ................  8.7ms  2017/07/18  15:11:35.602  ntoskrnl      
                         00 01 00 00  00 01 00 01  00 00 00 00  00 00 00 01  ................                                                 
                         00 00 00 00  00 01 00 00  00 00 00 00  00 00 00 00  ................                                                 
                         00 00 00 00  00 00 00 01  01 00 01 00  00 01 00 00  ................                                                 
  29.3    262144  IN     01 02 01 01  01 01 01 01  01 01 01 01  01 01 01 01  ................  2.0ms  2017/07/18  15:11:35.604  ntoskrnl      
                         01 02 01 01  01 01 01 02  02 02 01 01  00 01 00 01  ................                                                 
                         00 01 02 02  01 01 01 01  01 01 01 01  01 01 02 01  ................                                                 
                         02 01 01 01  01 02 01 01  01 01 02 01  02 01 01 01  ................                                                 
  29.3        32  IN     55 33 56 54  00 00 20 00  d5 0f 00 00  00 00 00 00  U3VT.. .........   42us  2017/07/18  15:11:35.604  ntoskrnl      
                         00 00 00 00  00 00 14 00  00 00 00 00  00 04 00 00  ................                                                 
  29.3        52  IN     55 33 56 4c  00 00 34 00  d6 0f 00 00  00 00 00 00  U3VL..4.........   34us  2017/07/18  15:11:35.604  ntoskrnl      
                         00 00 01 00  d8 c0 00 63  0d 00 00 00  09 00 08 01  .......c........                                                 
                         00 05 00 00  00 04 00 00  00 00 00 00  00 00 00 00  ................                                                 
                         00 00 00 00                                         ....                                                             
  29.3   1048576  IN     01 00 00 00  01 01 00 00  00 00 00 01  00 00 00 01  ................  8.5ms  2017/07/18  15:11:35.613  ntoskrnl      
                         00 00 00 00  00 00 00 00  00 00 00 00  00 00 00 00  ................                                                 
                         00 00 00 00  00 01 00 00  00 00 00 00  00 00 00 00  ................                                                 
                         01 00 00 00  00 00 00 00  00 00 00 00  00 00 00 00  ................                                                 
  29.3    262144  IN     01 01 01 01  01 01 01 01  01 01 01 00  01 01 01 01  ................  2.0ms  2017/07/18  15:11:35.615  ntoskrnl      
                         01 01 01 01  01 01 01 01  01 01 01 01  01 01 00 01  ................                                                 
                         00 00 01 02  01 00 01 00  01 01 01 01  01 01 01 01  ................                                                 
                         01 01 01 02  01 01 02 01  01 00 02 01  02 01 01 01  ................                                                 
  29.3        32  IN     55 33 56 54  00 00 20 00  d6 0f 00 00  00 00 00 00  U3VT.. .........   19us  2017/07/18  15:11:35.615  ntoskrnl      
                         00 00 00 00  00 00 14 00  00 00 00 00  00 04 00 00  ................                                                 
  29.3        52  IN     55 33 56 4c  00 00 34 00  d7 0f 00 00  00 00 00 00  U3VL..4.........   22us  2017/07/18  15:11:35.615  ntoskrnl      
                         00 00 01 00  c9 c6 a4 63  0d 00 00 00  09 00 08 01  .......c........                                                 
                         00 05 00 00  00 04 00 00  00 00 00 00  00 00 00 00  ................                                                 
                         00 00 00 00                                         ....                                                             
  29.3   1048576  IN     00 00 00 00  00 01 01 00  00 00 00 00  00 00 00 01  ................  8.6ms  2017/07/18  15:11:35.624  ntoskrnl      
                         00 01 00 00  00 00 00 00  01 00 00 01  00 00 00 01  ................                                                 
                         01 00 00 00  00 00 01 00  00 01 01 00  00 00 00 01  ................                                                 
                         00 01 00 00  00 00 00 00  00 01 01 00  00 01 00 00  ................                                                 
  29.3    262144  IN     01 02 01 01  02 01 01 01  01 01 01 01  02 01 01 00  ................  2.0ms  2017/07/18  15:11:35.626  ntoskrnl      
                         01 02 01 01  01 01 01 01  01 02 00 01  01 01 01 01  ................                                                 
                         00 01 01 01  01 01 01 01  01 01 01 01  01 01 02 01  ................                                                 
                         01 01 01 01  01 02 01 01  01 01 02 01  01 01 01 01  ................                                                 
  29.3        32  IN     55 33 56 54  00 00 20 00  d7 0f 00 00  00 00 00 00  U3VT.. .........   21us  2017/07/18  15:11:35.626  ntoskrnl      
                         00 00 00 00  00 00 14 00  00 00 00 00  00 04 00 00  ................                                                 
  29.3        52  IN     55 33 56 4c  00 00 34 00  d8 0f 00 00  00 00 00 00  U3VL..4.........   10us  2017/07/18  15:11:35.626  ntoskrnl      
                         00 00 01 00  e2 a4 48 64  0d 00 00 00  09 00 08 01  ......Hd........                                                 
                         00 05 00 00  00 04 00 00  00 00 00 00  00 00 00 00  ................                                                 
                         00 00 00 00                                         ....                                                             
  29.3   1048576  IN     00 00 00 00  00 00 00 00  00 00 00 00  00 00 00 01  ................  8.7ms  2017/07/18  15:11:35.635  ntoskrnl      
                         00 00 00 00  00 00 00 00  00 00 00 00  00 00 00 00  ................                                                 
                         00 00 00 00  00 00 00 00  00 00 00 01  00 00 00 00  ................                                                 
                         00 00 00 00  00 00 00 00  01 00 00 00  00 00 00 00  ................                                                 
  29.3    262144  IN     01 01 01 01  01 02 01 01  01 02 01 01  02 01 01 01  ................  2.0ms  2017/07/18  15:11:35.637  ntoskrnl      
                         01 02 01 02  01 01 01 01  01 02 01 01  01 01 01 01  ................                                                 
                         00 01 01 01  02 01 01 01  01 01 01 01  01 01 02 01  ................                                                 
                         02 01 01 02  01 01 01 01  01 01 01 01  01 01 01 01  ................                                                 
  29.3        32  IN     55 33 56 54  00 00 20 00  d8 0f 00 00  00 00 00 00  U3VT.. .........   45us  2017/07/18  15:11:35.637  ntoskrnl      
                         00 00 00 00  00 00 14 00  00 00 00 00  00 04 00 00  ................                                                 
  29.3        52  IN     55 33 56 4c  00 00 34 00  d9 0f 00 00  00 00 00 00  U3VL..4.........   16us  2017/07/18  15:11:35.637  ntoskrnl      
                         00 00 01 00  ec aa ec 64  0d 00 00 00  09 00 08 01  .......d........                                                 
                         00 05 00 00  00 04 00 00  00 00 00 00  00 00 00 00  ................                                                 
                         00 00 00 00                                         ....                                                             
  29.3   1048576  IN     00 00 00 01  00 01 00 00  00 00 01 00  00 00 00 01  ................  8.6ms  2017/07/18  15:11:35.645  ntoskrnl      
                         00 01 00 00  00 00 00 00  00 00 00 00  00 00 00 01  ................                                                 
                         00 00 00 00  00 00 00 00  00 00 00 00  00 00 00 00  ................                                                 
                         00 00 00 00  00 00 00 00  01 00 00 00  00 01 00 00  ................                                                 
  29.3    262144  IN     01 01 01 01  01 02 01 01  02 01 01 01  01 01 01 01  ................  2.0ms  2017/07/18  15:11:35.647  ntoskrnl      
                         01 01 01 01  01 01 01 01  01 02 01 01  01 02 01 01  ................                                                 
                         00 01 01 02  02 01 01 01  01 01 01 01  01 01 02 01  ................                                                 
                         01 01 01 02  01 01 01 01  00 01 01 01  01 01 01 01  ................                                                 
  29.3        32  IN     55 33 56 54  00 00 20 00  d9 0f 00 00  00 00 00 00  U3VT.. .........   33us  2017/07/18  15:11:35.647  ntoskrnl      
                         00 00 00 00  00 00 14 00  00 00 00 00  00 04 00 00  ................                                                 
  29.3        52  IN     55 33 56 4c  00 00 34 00  da 0f 00 00  00 00 00 00  U3VL..4.........   15us  2017/07/18  15:11:35.647  ntoskrnl      
                         00 00 01 00  f6 b0 90 65  0d 00 00 00  09 00 08 01  .......e........                                                 
                         00 05 00 00  00 04 00 00  00 00 00 00  00 00 00 00  ................                                                 
                         00 00 00 00                                         ....                                                             
  29.3   1048576  IN     01 00 00 00  00 00 01 00  00 00 01 00  00 00 00 01  ................  8.5ms  2017/07/18  15:11:35.656  ntoskrnl      
                         00 00 00 00  00 00 00 00  01 00 00 00  00 01 00 00  ................                                                 
                         00 00 01 00  00 00 00 00  00 00 00 01  00 00 00 00  ................                                                 
                         00 01 01 01  00 00 01 01  01 00 00 00  00 01 00 00  ................                                                 
  29.3    262144  IN     01 01 01 01  01 01 01 01  01 01 01 01  01 01 01 01  ................  2.0ms  2017/07/18  15:11:35.658  ntoskrnl      
                         01 01 01 01  01 01 01 01  01 01 01 01  01 01 01 00  ................                                                 
                         00 01 02 02  01 01 01 01  01 01 02 01  01 01 02 01  ................                                                 
                         02 01 01 01  01 01 01 02  00 01 01 01  01 01 01 01  ................                                                 
  29.3        32  IN     55 33 56 54  00 00 20 00  da 0f 00 00  00 00 00 00  U3VT.. .........   73us  2017/07/18  15:11:35.658  ntoskrnl      
                         00 00 00 00  00 00 14 00  00 00 00 00  00 04 00 00  ................                                                 
  29.3        52  IN     55 33 56 4c  00 00 34 00  db 0f 00 00  00 00 00 00  U3VL..4.........   38us  2017/07/18  15:11:35.658  ntoskrnl      
                         00 00 01 00  00 b7 34 66  0d 00 00 00  09 00 08 01  ......4f........                                                 
                         00 05 00 00  00 04 00 00  00 00 00 00  00 00 00 00  ................                                                 
                         00 00 00 00                                         ....                                                             
  29.3   1048576  IN     00 00 01 00  00 00 00 00  00 00 00 00  00 00 00 00  ................  8.5ms  2017/07/18  15:11:35.667  ntoskrnl      
                         00 01 00 01  01 00 00 00  00 00 00 00  00 00 00 00  ................                                                 
                         00 01 01 00  00 00 01 00  01 00 01 00  00 00 00 00  ................                                                 
                         00 00 00 00  00 00 00 01  00 00 00 00  00 00 00 00  ................                                                 
  29.3    262144  IN     01 01 01 01  01 02 01 01  01 01 01 01  02 01 01 01  ................  2.0ms  2017/07/18  15:11:35.669  ntoskrnl      
                         01 01 01 02  01 01 01 01  01 02 01 01  00 01 01 01  ................                                                 
                         00 01 01 02  02 01 01 01  01 01 01 01  01 01 02 01  ................                                                 
                         02 01 01 02  01 02 01 01  01 01 01 01  01 01 01 01  ................                                                 
  29.3        32  IN     55 33 56 54  00 00 20 00  db 0f 00 00  00 00 00 00  U3VT.. .........   78us  2017/07/18  15:11:35.669  ntoskrnl      
                         00 00 00 00  00 00 14 00  00 00 00 00  00 04 00 00  ................                                                 
  29.3        52  IN     55 33 56 4c  00 00 34 00  dc 0f 00 00  00 00 00 00  U3VL..4.........   36us  2017/07/18  15:11:35.669  ntoskrnl      
                         00 00 01 00  f1 bc d8 66  0d 00 00 00  09 00 08 01  .......f........                                                 
                         00 05 00 00  00 04 00 00  00 00 00 00  00 00 00 00  ................                                                 
                         00 00 00 00                                         ....                                                             
  29.3   1048576  IN     00 00 00 00  00 00 00 00  00 00 00 00  00 00 00 01  ................  8.6ms  2017/07/18  15:11:35.678  ntoskrnl      
                         00 00 00 00  00 00 00 00  00 00 00 00  00 00 00 00  ................                                                 
                         00 00 00 00  00 01 00 00  00 00 00 00  00 00 00 00  ................                                                 
                         01 00 00 00  00 00 00 00  01 00 00 00  00 00 00 00  ................                                                 
  29.3    262144  IN     01 00 01 01  01 01 02 01  01 01 01 01  02 01 01 01  ................  2.0ms  2017/07/18  15:11:35.680  ntoskrnl      
                         01 01 02 01  01 01 01 01  01 01 00 01  01 01 01 00  ................                                                 
                         00 01 01 02  01 02 01 01  01 01 01 01  02 01 02 01  ................                                                 
                         02 02 01 01  01 01 01 01  00 01 02 01  02 02 01 01  ................                                                 
  29.3        32  IN     55 33 56 54  00 00 20 00  dc 0f 00 00  00 00 00 00  U3VT.. .........   40us  2017/07/18  15:11:35.680  ntoskrnl      
                         00 00 00 00  00 00 14 00  00 00 00 00  00 04 00 00  ................                                                 
  29.3        52  IN     55 33 56 4c  00 00 34 00  dd 0f 00 00  00 00 00 00  U3VL..4.........   28us  2017/07/18  15:11:35.680  ntoskrnl      
                         00 00 01 00  fb c2 7c 67  0d 00 00 00  09 00 08 01  .......g........                                                 
                         00 05 00 00  00 04 00 00  00 00 00 00  00 00 00 00  ................                                                 
                         00 00 00 00                                         ....                                                             
  29.3   1048576  IN     00 00 00 00  00 00 00 00  00 00 01 00  00 00 00 01  ................  8.5ms  2017/07/18  15:11:35.688  ntoskrnl      
                         00 00 00 01  00 00 00 00  00 00 00 00  00 00 00 00  ................                                                 
                         00 00 01 00  00 00 01 00  00 00 01 01  01 00 00 00  ................                                                 
                         00 00 00 00  00 00 00 01  00 00 00 00  00 00 01 00  ................                                                 
  29.3    262144  IN     01 00 01 01  01 01 01 01  01 01 01 01  01 01 01 01  ................  2.0ms  2017/07/18  15:11:35.690  ntoskrnl      
                         01 01 01 01  01 01 01 01  01 01 00 00  01 01 00 01  ................                                                 
                         00 01 01 02  01 01 01 01  01 01 01 01  01 01 02 01  ................                                                 
                         02 01 01 01  01 01 01 01  01 01 01 01  02 01 01 02  ................                                                 
  29.3        32  IN     55 33 56 54  00 00 20 00  dd 0f 00 00  00 00 00 00  U3VT.. .........   44us  2017/07/18  15:11:35.690  ntoskrnl      
                         00 00 00 00  00 00 14 00  00 00 00 00  00 04 00 00  ................                                                 
  29.3        52  IN     55 33 56 4c  00 00 34 00  de 0f 00 00  00 00 00 00  U3VL..4.........   18us  2017/07/18  15:11:35.690  ntoskrnl      
                         00 00 01 00  05 c9 20 68  0d 00 00 00  09 00 08 01  ...... h........                                                 
                         00 05 00 00  00 04 00 00  00 00 00 00  00 00 00 00  ................                                                 
                         00 00 00 00                                         ....                                                             
  29.3   1048576  IN     00 01 00 00  01 00 01 00  00 00 01 00  00 00 00 01  ................  8.6ms  2017/07/18  15:11:35.699  ntoskrnl      
                         01 00 00 00  00 01 00 00  00 00 00 00  00 00 00 01  ................                                                 
                         00 00 00 00  01 00 00 00  00 00 01 00  00 00 00 01  ................                                                 
                         00 01 00 00  00 00 01 00  01 01 00 00  01 01 00 00  ................                                                 
  29.3    262144  IN     01 01 01 02  02 01 01 01  01 01 01 01  02 01 01 01  ................  2.0ms  2017/07/18  15:11:35.701  ntoskrnl      
                         02 02 01 01  01 01 01 01  01 02 01 01  01 01 01 01  ................                                                 
                         00 01 01 02  01 02 01 01  01 01 01 02  01 01 02 01  ................                                                 
                         02 01 01 02  02 01 01 01  01 01 02 01  02 01 01 02  ................                                                 
  29.3        32  IN     55 33 56 54  00 00 20 00  de 0f 00 00  00 00 00 00  U3VT.. .........   35us  2017/07/18  15:11:35.701  ntoskrnl      
                         00 00 00 00  00 00 14 00  00 00 00 00  00 04 00 00  ................                                                 
  29.3        52  IN     55 33 56 4c  00 00 34 00  df 0f 00 00  00 00 00 00  U3VL..4.........   17us  2017/07/18  15:11:35.701  ntoskrnl      
                         00 00 01 00  1e a7 c4 68  0d 00 00 00  09 00 08 01  .......h........                                                 
                         00 05 00 00  00 04 00 00  00 00 00 00  00 00 00 00  ................                                                 
                         00 00 00 00                                         ....                                                             
  29.3   1048576  IN     01 01 00 00  00 01 01 00  00 00 00 00  00 01 00 01  ................  8.6ms  2017/07/18  15:11:35.710  ntoskrnl      
                         00 00 00 01  00 01 00 00  00 00 00 00  00 01 00 00  ................                                                 
                         00 00 00 00  00 00 00 00  00 00 00 00  01 00 00 00  ................                                                 
                         01 01 00 00  00 00 01 01  01 01 00 00  00 01 00 00  ................                                                 
  29.3    262144  IN     02 01 01 01  01 02 01 01  02 02 01 01  02 01 01 01  ................  2.0ms  2017/07/18  15:11:35.712  ntoskrnl      
                         02 02 01 02  01 01 01 01  01 02 01 01  00 02 01 01  ................                                                 
                         01 01 02 02  01 02 01 01  01 01 01 01  02 01 03 01  ................                                                 
                         02 01 01 02  02 01 01 01  01 02 02 01  02 02 01 01  ................                                                 
  29.3        32  IN     55 33 56 54  00 00 20 00  df 0f 00 00  00 00 00 00  U3VT.. .........   27us  2017/07/18  15:11:35.712  ntoskrnl      
                         00 00 00 00  00 00 14 00  00 00 00 00  00 04 00 00  ................                                                 
  29.3        52  IN     55 33 56 4c  00 00 34 00  e0 0f 00 00  00 00 00 00  U3VL..4.........   12us  2017/07/18  15:11:35.712  ntoskrnl      
                         00 00 01 00  28 ad 68 69  0d 00 00 00  09 00 08 01  ....(.hi........                                                 
                         00 05 00 00  00 04 00 00  00 00 00 00  00 00 00 00  ................                                                 
                         00 00 00 00                                         ....                                                             
  29.3   1048576  IN     00 00 00 00  00 00 00 00  00 00 01 00  00 00 01 00  ................  8.6ms  2017/07/18  15:11:35.720  ntoskrnl      
                         01 00 00 00  00 00 00 00  00 00 00 01  00 00 00 00  ................                                                 
                         00 00 00 00  00 00 01 00  00 00 00 01  00 00 00 00  ................                                                 
                         00 00 00 00  00 00 01 01  00 00 00 00  00 01 00 00  ................                                                 
  29.3    262144  IN     01 01 01 01  02 01 01 01  01 01 01 01  01 02 01 01  ................  2.0ms  2017/07/18  15:11:35.723  ntoskrnl      
                         01 01 01 02  01 01 01 01  01 01 01 01  01 01 01 00  ................                                                 
                         00 01 01 01  02 01 01 01  01 01 01 01  01 01 02 01  ................                                                 
                         02 01 01 02  01 02 01 01  01 01 01 01  01 01 01 01  ................                                                 
  29.3        32  IN     55 33 56 54  00 00 20 00  e0 0f 00 00  00 00 00 00  U3VT.. .........   48us  2017/07/18  15:11:35.723  ntoskrnl      
                         00 00 00 00  00 00 14 00  00 00 00 00  00 04 00 00  ................                                                 
  29.3        52  IN     55 33 56 4c  00 00 34 00  e1 0f 00 00  00 00 00 00  U3VL..4.........   18us  2017/07/18  15:11:35.723  ntoskrnl      
                         00 00 01 00  19 b3 0c 6a  0d 00 00 00  09 00 08 01  .......j........                                                 
                         00 05 00 00  00 04 00 00  00 00 00 00  00 00 00 00  ................                                                 
                         00 00 00 00                                         ....                                                             
  29.3   1048576  IN     01 00 00 00  00 00 00 00  00 00 00 00  00 00 00 01  ................  8.6ms  2017/07/18  15:11:35.731  ntoskrnl      
                         00 00 00 00  00 00 00 00  00 00 00 01  00 00 00 01  ................                                                 
                         00 00 00 00  00 01 00 00  00 00 00 01  00 00 00 00  ................                                                 
                         00 01 00 00  00 00 01 00  01 00 00 00  00 01 00 00  ................                                                 
  29.3    262144  IN     02 01 01 01  02 01 01 01  01 01 01 02  02 02 01 01  ................  2.0ms  2017/07/18  15:11:35.733  ntoskrnl      
                         01 02 01 01  01 01 01 01  01 01 01 01  01 01 00 01  ................                                                 
                         00 01 01 02  01 01 01 01  01 02 01 01  01 01 02 01  ................                                                 
                         02 02 01 01  02 02 01 01  01 01 02 01  01 02 02 01  ................                                                 
  29.3        32  IN     55 33 56 54  00 00 20 00  e1 0f 00 00  00 00 00 00  U3VT.. .........   27us  2017/07/18  15:11:35.733  ntoskrnl      
                         00 00 00 00  00 00 14 00  00 00 00 00  00 04 00 00  ................                                                 
  29.3        52  IN     55 33 56 4c  00 00 34 00  e2 0f 00 00  00 00 00 00  U3VL..4.........   12us  2017/07/18  15:11:35.733  ntoskrnl      
                         00 00 01 00  23 b9 b0 6a  0d 00 00 00  09 00 08 01  ....#..j........                                                 
                         00 05 00 00  00 04 00 00  00 00 00 00  00 00 00 00  ................                                                 
                         00 00 00 00                                         ....                                                             
  29.3   1048576  IN     00 00 00 00  00 00 00 00  00 00 00 00  01 01 00 01  ................  8.7ms  2017/07/18  15:11:35.742  ntoskrnl      
                         00 01 00 00  00 00 00 00  00 00 00 00  00 00 00 00  ................                                                 
                         00 00 00 00  00 00 01 00  00 00 00 01  00 00 00 00  ................                                                 
                         00 01 01 00  00 00 00 01  00 01 00 00  00 00 01 00  ................                                                 
  29.3    262144  IN     01 01 01 01  01 02 01 01  02 02 01 01  01 02 01 01  ................  2.0ms  2017/07/18  15:11:35.744  ntoskrnl      
                         01 02 01 01  01 01 01 01  01 02 01 01  00 01 00 01  ................                                                 
                         00 01 01 02  01 02 01 01  01 01 01 01  01 01 02 01  ................                                                 
                         02 01 01 01  01 01 01 01  01 01 01 01  02 01 01 01  ................                                                 
  29.3        32  IN     55 33 56 54  00 00 20 00  e2 0f 00 00  00 00 00 00  U3VT.. .........   21us  2017/07/18  15:11:35.744  ntoskrnl      
                         00 00 00 00  00 00 14 00  00 00 00 00  00 04 00 00  ................                                                 
  29.3        52  IN     55 33 56 4c  00 00 34 00  e3 0f 00 00  00 00 00 00  U3VL..4.........   10us  2017/07/18  15:11:35.744  ntoskrnl      
                         00 00 01 00  2d bf 54 6b  0d 00 00 00  09 00 08 01  ....-.Tk........                                                 
                         00 05 00 00  00 04 00 00  00 00 00 00  00 00 00 00  ................                                                 
                         00 00 00 00                                         ....                                                             
  29.3   1048576  IN     00 00 00 00  00 00 00 00  00 00 00 00  00 00 00 01  ................  8.6ms  2017/07/18  15:11:35.753  ntoskrnl      
                         00 00 00 00  00 00 00 00  00 00 00 00  00 01 00 00  ................                                                 
                         00 00 00 00  00 00 00 00  00 00 00 00  00 00 00 00  ................                                                 
                         00 00 01 00  00 00 00 00  00 00 00 00  00 00 00 00  ................                                                 
  29.3    262144  IN     01 01 01 02  02 01 01 02  01 01 01 01  02 01 01 01  ................  2.0ms  2017/07/18  15:11:35.755  ntoskrnl      
                         01 02 01 02  01 01 01 01  01 02 01 01  01 01 01 01  ................                                                 
                         00 01 02 02  02 01 01 01  02 01 02 01  01 01 02 01  ................                                                 
                         02 01 01 02  01 02 02 01  01 01 01 01  01 01 01 02  ................                                                 
  29.3        32  IN     55 33 56 54  00 00 20 00  e3 0f 00 00  00 00 00 00  U3VT.. .........   24us  2017/07/18  15:11:35.755  ntoskrnl      
                         00 00 00 00  00 00 14 00  00 00 00 00  00 04 00 00  ................                                                 
  29.3        52  IN     55 33 56 4c  00 00 34 00  e4 0f 00 00  00 00 00 00  U3VL..4.........   13us  2017/07/18  15:11:35.755  ntoskrnl      
                         00 00 01 00  37 c5 f8 6b  0d 00 00 00  09 00 08 01  ....7..k........                                                 
                         00 05 00 00  00 04 00 00  00 00 00 00  00 00 00 00  ................                                                 
                         00 00 00 00                                         ....                                                             
  29.3   1048576  IN     00 00 01 00  00 00 00 00  00 00 00 00  00 01 00 01  ................  8.6ms  2017/07/18  15:11:35.763  ntoskrnl      
                         00 01 00 00  00 00 00 00  00 00 00 00  00 00 00 00  ................                                                 
                         00 00 01 00  00 00 00 00  00 01 00 00  01 00 00 00  ................                                                 
                         00 01 01 00  00 00 00 00  01 00 00 00  00 01 00 00  ................                                                 
  29.3    262144  IN     01 02 01 01  02 02 01 01  01 01 01 01  01 01 01 01  ................  2.0ms  2017/07/18  15:11:35.766  ntoskrnl      
                         01 01 01 02  01 01 01 01  01 01 01 01  00 01 00 01  ................                                                 
                         00 01 01 02  01 01 01 01  00 01 01 01  01 01 02 01  ................                                                 
                         02 01 00 01  01 01 01 01  01 01 01 01  01 02 01 01  ................                                                 
  29.3        32  IN     55 33 56 54  00 00 20 00  e4 0f 00 00  00 00 00 00  U3VT.. .........   22us  2017/07/18  15:11:35.766  ntoskrnl      
                         00 00 00 00  00 00 14 00  00 00 00 00  00 04 00 00  ................                                                 
  29.3        52  IN     55 33 56 4c  00 00 34 00  e5 0f 00 00  00 00 00 00  U3VL..4.........   10us  2017/07/18  15:11:35.766  ntoskrnl      
                         00 00 01 00  28 cb 9c 6c  0d 00 00 00  09 00 08 01  ....(..l........                                                 
                         00 05 00 00  00 04 00 00  00 00 00 00  00 00 00 00  ................                                                 
                         00 00 00 00                                         ....                                                             
  29.3   1048576  IN     00 00 00 00  00 00 00 00  00 00 00 00  00 00 00 01  ................  8.6ms  2017/07/18  15:11:35.774  ntoskrnl      
                         00 00 00 00  01 00 00 00  00 00 00 01  00 00 00 00  ................                                                 
                         01 00 00 00  00 00 01 00  00 01 00 01  00 00 00 01  ................                                                 
                         01 01 00 00  00 00 01 00  01 00 00 00  00 00 00 00  ................                                                 
  29.3    262144  IN     01 01 01 01  02 01 01 01  01 01 01 01  02 01 01 01  ................  2.0ms  2017/07/18  15:11:35.776  ntoskrnl      
                         01 01 01 01  01 01 01 01  01 02 01 01  00 01 01 01  ................                                                 
                         00 01 01 02  01 02 01 01  01 01 01 01  01 01 02 01  ................                                                 
                         02 01 01 02  01 01 01 01  01 01 01 01  02 01 01 01  ................                                                 
  29.3        32  IN     55 33 56 54  00 00 20 00  e5 0f 00 00  00 00 00 00  U3VT.. .........   25us  2017/07/18  15:11:35.776  ntoskrnl      
                         00 00 00 00  00 00 14 00  00 00 00 00  00 04 00 00  ................                                                 
  29.3        52  IN     55 33 56 4c  00 00 34 00  e6 0f 00 00  00 00 00 00  U3VL..4.........   17us  2017/07/18  15:11:35.776  ntoskrnl      
                         00 00 01 00  41 a9 40 6d  0d 00 00 00  09 00 08 01  ....A.@m........                                                 
                         00 05 00 00  00 04 00 00  00 00 00 00  00 00 00 00  ................                                                 
                         00 00 00 00                                         ....                                                             
  29.3   1048576  IN     00 01 01 00  00 01 00 00  00 00 00 00  00 00 00 01  ................  8.6ms  2017/07/18  15:11:35.785  ntoskrnl      
                         00 00 00 01  00 00 00 00  00 00 00 00  00 00 01 00  ................                                                 
                         00 00 01 00  00 01 01 00  00 00 00 00  01 00 01 00  ................                                                 
                         00 00 01 00  00 00 00 01  01 01 01 00  00 01 00 00  ................                                                 
  29.3    262144  IN     01 01 02 02  02 01 01 01  02 02 02 01  01 02 01 01  ................  2.0ms  2017/07/18  15:11:35.787  ntoskrnl      
                         02 02 01 01  01 01 01 02  01 01 01 01  01 02 01 01  ................                                                 
                         00 01 01 01  01 01 01 01  01 01 01 01  01 01 02 01  ................                                                 
                         02 01 01 01  02 01 01 01  01 01 01 01  01 02 01 01  ................                                                 
  29.3        32  IN     55 33 56 54  00 00 20 00  e6 0f 00 00  00 00 00 00  U3VT.. .........   20us  2017/07/18  15:11:35.787  ntoskrnl      
                         00 00 00 00  00 00 14 00  00 00 00 00  00 04 00 00  ................                                                 
  29.3        52  IN     55 33 56 4c  00 00 34 00  e7 0f 00 00  00 00 00 00  U3VL..4.........   13us  2017/07/18  15:11:35.787  ntoskrnl      
                         00 00 01 00  4b af e4 6d  0d 00 00 00  09 00 08 01  ....K..m........                                                 
                         00 05 00 00  00 04 00 00  00 00 00 00  00 00 00 00  ................                                                 
                         00 00 00 00                                         ....                                                             
  29.3   1048576  IN     00 00 01 00  00 01 00 00  00 00 00 00  00 00 01 01  ................  8.6ms  2017/07/18  15:11:35.796  ntoskrnl      
                         00 00 00 00  00 01 01 00  00 00 00 00  00 00 00 00  ................                                                 
                         00 00 01 00  00 01 00 00  00 00 01 01  00 00 00 00  ................                                                 
                         01 01 00 01  00 00 00 00  01 01 01 00  00 01 01 00  ................                                                 
  29.3    262144  IN     01 01 01 01  02 01 01 02  02 01 01 01  01 01 01 01  ................  2.0ms  2017/07/18  15:11:35.798  ntoskrnl      
                         01 02 02 02  01 02 01 01  01 01 01 01  01 01 01 01  ................                                                 
                         00 01 01 02  02 01 01 00  01 01 01 01  02 01 02 01  ................                                                 
                         01 01 01 02  01 01 01 01  01 01 02 01  02 01 01 01  ................                                                 
  29.3        32  IN     55 33 56 54  00 00 20 00  e7 0f 00 00  00 00 00 00  U3VT.. .........   20us  2017/07/18  15:11:35.798  ntoskrnl      
                         00 00 00 00  00 00 14 00  00 00 00 00  00 04 00 00  ................                                                 
  29.3        52  IN     55 33 56 4c  00 00 34 00  e8 0f 00 00  00 00 00 00  U3VL..4.........   35us  2017/07/18  15:11:35.798  ntoskrnl      
                         00 00 01 00  55 b5 88 6e  0d 00 00 00  09 00 08 01  ....U..n........                                                 
                         00 05 00 00  00 04 00 00  00 00 00 00  00 00 00 00  ................                                                 
                         00 00 00 00                                         ....                                                             
  29.3   1048576  IN     00 00 01 00  00 01 00 01  01 00 00 00  00 00 00 01  ................  8.6ms  2017/07/18  15:11:35.806  ntoskrnl      
                         00 01 00 00  00 00 00 00  00 00 00 00  00 00 00 01  ................                                                 
                         00 00 01 00  00 01 00 00  00 00 01 00  01 00 01 00  ................                                                 
                         00 00 00 00  00 00 01 00  01 00 00 00  00 00 01 00  ................                                                 
  29.3    262144  IN     01 01 02 01  01 02 01 01  01 01 01 01  01 02 01 01  ................  2.1ms  2017/07/18  15:11:35.809  ntoskrnl      
                         01 02 01 02  01 02 01 01  01 02 01 01  01 02 01 01  ................                                                 
                         00 01 01 02  02 01 01 01  01 01 01 02  01 01 02 01  ................                                                 
                         02 01 01 01  01 01 02 01  01 01 01 01  02 01 01 01  ................                                                 
  29.3        32  IN     55 33 56 54  00 00 20 00  e8 0f 00 00  00 00 00 00  U3VT.. .........   40us  2017/07/18  15:11:35.809  ntoskrnl      
                         00 00 00 00  00 00 14 00  00 00 00 00  00 04 00 00  ................                                                 
  29.3        52  IN     55 33 56 4c  00 00 34 00  e9 0f 00 00  00 00 00 00  U3VL..4.........   33us  2017/07/18  15:11:35.809  ntoskrnl      
                         00 00 01 00  5f bb 2c 6f  0d 00 00 00  09 00 08 01  ...._.,o........                                                 
                         00 05 00 00  00 04 00 00  00 00 00 00  00 00 00 00  ................                                                 
                         00 00 00 00                                         ....                                                             
  29.3   1048576  IN     00 00 00 00  00 00 00 00  00 00 00 01  00 00 00 01  ................  8.6ms  2017/07/18  15:11:35.817  ntoskrnl      
                         00 00 00 00  00 00 00 00  00 00 00 01  00 00 00 00  ................                                                 
                         01 00 00 00  00 00 00 00  00 00 00 00  00 00 00 00  ................                                                 
                         00 00 00 00  00 00 00 00  00 00 00 00  00 00 00 00  ................                                                 
  29.3    262144  IN     01 01 01 01  02 01 01 01  02 01 02 01  01 01 01 01  ................  2.0ms  2017/07/18  15:11:35.819  ntoskrnl      
                         01 02 01 01  01 01 01 01  01 01 00 01  01 01 01 01  ................                                                 
                         00 01 01 02  01 02 01 01  01 01 01 01  01 01 02 01  ................                                                 
                         02 01 01 02  02 01 01 01  01 01 01 01  02 02 01 01  ................                                                 
  29.3        32  IN     55 33 56 54  00 00 20 00  e9 0f 00 00  00 00 00 00  U3VT.. .........   31us  2017/07/18  15:11:35.819  ntoskrnl      
                         00 00 00 00  00 00 14 00  00 00 00 00  00 04 00 00  ................                                                 
  29.3        52  IN     55 33 56 4c  00 00 34 00  ea 0f 00 00  00 00 00 00  U3VL..4.........    9us  2017/07/18  15:11:35.819  ntoskrnl      
                         00 00 01 00  50 c1 d0 6f  0d 00 00 00  09 00 08 01  ....P..o........                                                 
                         00 05 00 00  00 04 00 00  00 00 00 00  00 00 00 00  ................                                                 
                         00 00 00 00                                         ....                                                             
  29.3   1048576  IN     00 00 00 00  00 00 00 00  01 00 01 00  00 01 00 01  ................  8.5ms  2017/07/18  15:11:35.828  ntoskrnl      
                         00 01 00 00  00 00 00 00  00 00 01 00  00 00 00 00  ................                                                 
                         00 00 00 00  00 00 00 00  00 00 00 00  00 00 00 00  ................                                                 
                         00 01 00 00  00 00 00 01  01 00 00 00  01 01 00 00  ................                                                 
  29.3    262144  IN     01 01 01 01  01 01 01 01  02 01 01 01  01 01 01 01  ................  2.0ms  2017/07/18  15:11:35.830  ntoskrnl      
                         01 02 02 01  01 01 01 01  01 01 01 01  01 01 01 00  ................                                                 
                         00 01 01 01  01 01 01 01  01 01 01 01  01 01 02 01  ................                                                 
                         01 01 01 01  01 01 01 01  01 01 01 02  01 01 00 01  ................                                                 
  29.3        32  IN     55 33 56 54  00 00 20 00  ea 0f 00 00  00 00 00 00  U3VT.. .........   19us  2017/07/18  15:11:35.830  ntoskrnl      
                         00 00 00 00  00 00 14 00  00 00 00 00  00 04 00 00  ................                                                 
  29.3        52  IN     55 33 56 4c  00 00 34 00  eb 0f 00 00  00 00 00 00  U3VL..4.........   11us  2017/07/18  15:11:35.830  ntoskrnl      
                         00 00 01 00  5a c7 74 70  0d 00 00 00  09 00 08 01  ....Z.tp........                                                 
                         00 05 00 00  00 04 00 00  00 00 00 00  00 00 00 00  ................                                                 
                         00 00 00 00                                         ....                                                             
  29.3   1048576  IN     00 00 00 00  00 00 00 00  00 00 01 00  00 00 00 01  ................  8.6ms  2017/07/18  15:11:35.839  ntoskrnl      
                         00 00 00 00  00 00 00 01  00 00 00 00  00 00 00 00  ................                                                 
                         00 00 00 01  00 00 01 00  00 00 01 00  01 00 01 00  ................                                                 
                         00 00 00 01  00 00 01 00  01 01 00 00  01 00 00 00  ................                                                 
  29.3    262144  IN     02 02 01 02  02 02 02 01  02 02 01 01  02 01 01 01  ................  2.0ms  2017/07/18  15:11:35.841  ntoskrnl      
                         01 02 02 02  01 01 01 01  02 01 01 01  01 01 01 01  ................                                                 
                         00 01 01 02  01 01 01 01  01 02 02 02  02 01 02 01  ................                                                 
                         02 01 01 01  01 01 02 01  01 01 01 02  01 02 01 01  ................                                                 
  29.3        32  IN     55 33 56 54  00 00 20 00  eb 0f 00 00  00 00 00 00  U3VT.. .........   21us  2017/07/18  15:11:35.841  ntoskrnl      
                         00 00 00 00  00 00 14 00  00 00 00 00  00 04 00 00  ................                                                 
  29.3        52  IN     55 33 56 4c  00 00 34 00  ec 0f 00 00  00 00 00 00  U3VL..4.........    9us  2017/07/18  15:11:35.841  ntoskrnl      
                         00 00 01 00  64 cd 18 71  0d 00 00 00  09 00 08 01  ....d..q........                                                 
                         00 05 00 00  00 04 00 00  00 00 00 00  00 00 00 00  ................                                                 
                         00 00 00 00                                         ....                                                             
