Bus Hound 6.01 capture on Windows Vista Service Pack 1 (x64). Complements of www.perisoft.net

  Device - Device ID (followed by the endpoint for USB devices)
            (24) HID Keyboard Device
            (29) USB3 Vision Digital Camera
  Length - Total transfer length
  Phase  - Phase Type
            IN    Data in transfer           
  Data   - Hex dump of the data transferred
  Descr  - Description of the phase
  Delta  - Elapsed time from the previous phase to the current phase
  Date   - Date the phase occurred in year/month/day form
  Time   - Time the phase occurred in hour:minute:second.millisec form
  Driver - Driver that submitted the command
            ntoskrnl     : NT Kernel & System 6.1.7601.17514 (win7sp1_rtm.101119-1850)


Device  Length    Phase  Data                                                Description       Delta  Date        Time          Driver      
------  --------  -----  --------------------------------------------------  ----------------  -----  ----------  ------------  ------------
  29.3   1048576  IN     00 00 00 00  00 00 00 00  00 00 00 00  00 00 00 00  ................  926us  2017/07/18  15:11:34.495  ntoskrnl      
                         00 00 00 00  00 00 00 00  00 00 00 00  00 00 00 00  ................                                                 
                         00 00 01 00  00 00 00 00  00 01 00 01  00 00 00 00  ................                                                 
                         01 00 00 01  00 00 00 01  01 00 00 00  00 00 00 00  ................                                                 
  29.3    262144  IN     00 01 01 01  01 02 01 01  01 02 01 01  02 01 01 01  ................  2.0ms  2017/07/18  15:11:34.497  ntoskrnl      
                         02 02 01 01  01 01 01 01  01 02 01 01  01 01 00 01  ................                                                 
                         00 01 01 02  01 02 01 01  01 02 01 01  01 01 03 01  ................                                                 
                         02 01 01 01  02 01 01 01  01 01 01 01  01 01 01 01  ................                                                 
  29.3        32  IN     55 33 56 54  00 00 20 00  6e 0f 00 00  00 00 00 00  U3VT.. .n.......   17us  2017/07/18  15:11:34.497  ntoskrnl      	# trailer_size is 0x20(32). block is 0xf6e(3950). status is 0x0000. valid_payload_size is 0x140000(1310720). trailer_size_y is 0x400(1024).
                         00 00 00 00  00 00 14 00  00 00 00 00  00 04 00 00  ................                                                 
  29.3        52  IN     55 33 56 4c  00 00 34 00  6f 0f 00 00  00 00 00 00  U3VL..4.o.......   25us  2017/07/18  15:11:34.497  ntoskrnl      	# block is 0xf6f(3951) chunk_mode_active is 0. timestamp is 0xd2104840d(56388518925) pixel_format is 0x01080009(BayerRG8). size_x is 0x500(1280). size_y is 0x400(1024). offset_x is 0x0(0). offset_y is 0x0(0).
                         00 00 01 00  0d 84 04 21  0d 00 00 00  09 00 08 01  .......!........                                                 
                         00 05 00 00  00 04 00 00  00 00 00 00  00 00 00 00  ................                                                 
                         00 00 00 00                                         ....                                                             
  29.3   1048576  IN     00 00 00 00  00 00 01 00  00 00 00 00  00 01 00 01  ................  8.6ms  2017/07/18  15:11:34.506  ntoskrnl      
                         00 00 00 00  00 00 00 00  00 00 00 00  00 00 00 00  ................                                                 
                         00 00 00 01  00 00 01 00  00 00 00 01  00 00 00 00  ................                                                 
                         00 01 00 00  00 00 00 00  01 00 00 00  01 00 00 00  ................                                                 
  29.3    262144  IN     02 01 01 01  01 01 02 01  02 01 01 01  01 01 01 01  ................  2.0ms  2017/07/18  15:11:34.508  ntoskrnl      
                         01 02 01 01  01 01 01 01  01 01 01 01  01 02 01 01  ................                                                 
                         00 01 01 01  01 01 01 01  01 01 01 01  01 01 02 01  ................                                                 
                         02 01 01 02  01 02 01 01  01 01 02 01  02 02 01 01  ................                                                 
  29.3        32  IN     55 33 56 54  00 00 20 00  6f 0f 00 00  00 00 00 00  U3VT.. .o.......   40us  2017/07/18  15:11:34.508  ntoskrnl      	# trailer_size is 0x20(32). block is 0xf6f(3951). status is 0x0000. valid_payload_size is 0x140000(1310720). trailer_size_y is 0x400(1024).
                         00 00 00 00  00 00 14 00  00 00 00 00  00 04 00 00  ................                                                 
  29.3        52  IN     55 33 56 4c  00 00 34 00  70 0f 00 00  00 00 00 00  U3VL..4.p.......   24us  2017/07/18  15:11:34.508  ntoskrnl      	# block is 0xf70(3952) chunk_mode_active is 0. timestamp is 0xd21a88a17(56399268375) pixel_format is 0x01080009(BayerRG8). size_x is 0x500(1280). size_y is 0x400(1024). offset_x is 0x0(0). offset_y is 0x0(0).
                         00 00 01 00  17 8a a8 21  0d 00 00 00  09 00 08 01  .......!........                                                 
                         00 05 00 00  00 04 00 00  00 00 00 00  00 00 00 00  ................                                                 
                         00 00 00 00                                         ....                                                             
  29.3   1048576  IN     00 00 00 00  01 00 00 00  00 00 00 00  00 00 00 01  ................  8.5ms  2017/07/18  15:11:34.517  ntoskrnl      
                         00 00 00 01  00 00 00 00  00 00 00 01  00 00 01 01  ................                                                 
                         00 00 01 00  00 00 01 00  00 01 00 00  00 00 00 00  ................                                                 
                         00 00 00 00  00 00 00 01  01 00 00 00  00 01 00 00  ................                                                 
  29.3    262144  IN     02 02 01 01  01 01 01 01  01 01 01 01  01 01 01 01  ................  2.0ms  2017/07/18  15:11:34.519  ntoskrnl      
                         01 02 02 01  01 01 01 01  01 01 01 01  01 01 01 01  ................                                                 
                         00 01 01 02  02 02 01 01  01 01 01 01  01 01 02 01  ................                                                 
                         02 01 01 01  01 01 01 01  01 01 01 01  02 01 02 01  ................                                                 
  29.3        32  IN     55 33 56 54  00 00 20 00  70 0f 00 00  00 00 00 00  U3VT.. .p.......   26us  2017/07/18  15:11:34.519  ntoskrnl      	# trailer_size is 0x20(32). block is 0xf70(3952). status is 0x0000. valid_payload_size is 0x140000(1310720). trailer_size_y is 0x400(1024).
                         00 00 00 00  00 00 14 00  00 00 00 00  00 04 00 00  ................                                                 
  29.3        52  IN     55 33 56 4c  00 00 34 00  71 0f 00 00  00 00 00 00  U3VL..4.q.......   12us  2017/07/18  15:11:34.519  ntoskrnl      	# block is 0xf71(3953) chunk_mode_active is 0. timestamp is 0xd224c9008(56410017800) pixel_format is 0x01080009(BayerRG8). size_x is 0x500(1280). size_y is 0x400(1024). offset_x is 0x0(0). offset_y is 0x0(0).
                         00 00 01 00  08 90 4c 22  0d 00 00 00  09 00 08 01  ......L"........                                                 
                         00 05 00 00  00 04 00 00  00 00 00 00  00 00 00 00  ................                                                 
                         00 00 00 00                                         ....                                                             
  29.3   1048576  IN     00 00 00 00  00 01 01 00  00 00 00 00  01 00 00 01  ................  8.6ms  2017/07/18  15:11:34.527  ntoskrnl      
                         00 01 00 00  00 00 00 00  00 00 00 00  00 00 00 00  ................                                                 
                         00 01 00 00  00 01 00 00  00 00 00 00  01 00 00 00  ................                                                 
                         01 01 00 00  00 00 00 01  01 00 00 00  00 00 00 00  ................                                                 
  29.3    262144  IN     01 01 01 01  01 01 01 01  01 01 01 01  01 01 01 01  ................  2.0ms  2017/07/18  15:11:34.530  ntoskrnl      
                         00 01 01 01  00 01 01 01  01 01 01 01  00 01 01 00  ................                                                 
                         00 01 01 01  01 01 01 01  00 01 01 01  01 01 02 01  ................                                                 
                         02 01 01 01  01 01 01 01  01 01 01 01  01 01 01 01  ................                                                 
  29.3        32  IN     55 33 56 54  00 00 20 00  71 0f 00 00  00 00 00 00  U3VT.. .q.......   40us  2017/07/18  15:11:34.530  ntoskrnl      	# trailer_size is 0x20(32). block is 0xf71(3953). status is 0x0000. valid_payload_size is 0x140000(1310720). trailer_size_y is 0x400(1024).
                         00 00 00 00  00 00 14 00  00 00 00 00  00 04 00 00  ................                                                 
  29.3        52  IN     55 33 56 4c  00 00 34 00  72 0f 00 00  00 00 00 00  U3VL..4.r.......   17us  2017/07/18  15:11:34.530  ntoskrnl      	# block is 0xf72(3954) chunk_mode_active is 0. timestamp is 0xd22f09612(56420767250) pixel_format is 0x01080009(BayerRG8). size_x is 0x500(1280). size_y is 0x400(1024). offset_x is 0x0(0). offset_y is 0x0(0).
                         00 00 01 00  12 96 f0 22  0d 00 00 00  09 00 08 01  ......."........                                                 
                         00 05 00 00  00 04 00 00  00 00 00 00  00 00 00 00  ................                                                 
                         00 00 00 00                                         ....                                                             
  29.3   1048576  IN     00 00 00 00  00 00 00 00  00 00 01 00  00 00 00 01  ................  8.5ms  2017/07/18  15:11:34.538  ntoskrnl      
                         00 01 00 00  00 00 00 00  00 00 00 00  00 00 00 00  ................                                                 
                         00 00 01 00  00 00 01 00  00 00 00 00  00 00 00 00  ................                                                 
                         00 00 00 00  00 00 01 00  01 00 00 00  00 00 00 00  ................                                                 
  29.3    262144  IN     01 01 01 01  01 02 02 01  01 02 02 01  02 01 01 01  ................  2.0ms  2017/07/18  15:11:34.540  ntoskrnl      
                         01 01 01 01  01 02 01 01  01 02 01 01  01 02 01 01  ................                                                 
                         00 01 01 02  02 02 01 01  01 01 02 02  01 01 02 01  ................                                                 
                         02 01 01 02  02 02 02 01  01 02 02 01  02 01 01 01  ................                                                 
  29.3        32  IN     55 33 56 54  00 00 20 00  72 0f 00 00  00 00 00 00  U3VT.. .r.......   22us  2017/07/18  15:11:34.540  ntoskrnl      	# trailer_size is 0x20(32). block is 0xf72(3954). status is 0x0000. valid_payload_size is 0x140000(1310720). trailer_size_y is 0x400(1024).
                         00 00 00 00  00 00 14 00  00 00 00 00  00 04 00 00  ................                                                 
  29.3        52  IN     55 33 56 4c  00 00 34 00  73 0f 00 00  00 00 00 00  U3VL..4.s.......   19us  2017/07/18  15:11:34.540  ntoskrnl      	# block is 0xf73(3955) chunk_mode_active is 0. timestamp is 0xd23949c1c(56431516700) pixel_format is 0x01080009(BayerRG8). size_x is 0x500(1280). size_y is 0x400(1024). offset_x is 0x0(0). offset_y is 0x0(0).
                         00 00 01 00  1c 9c 94 23  0d 00 00 00  09 00 08 01  .......#........                                                 
                         00 05 00 00  00 04 00 00  00 00 00 00  00 00 00 00  ................                                                 
                         00 00 00 00                                         ....                                                             
  29.3   1048576  IN     00 00 00 00  00 00 01 00  00 00 00 00  00 00 00 01  ................  8.6ms  2017/07/18  15:11:34.549  ntoskrnl      
                         00 00 00 01  00 00 00 00  00 01 01 00  00 00 00 00  ................                                                 
                         00 00 00 00  00 00 01 00  00 00 00 00  00 00 00 00  ................                                                 
                         00 00 01 00  00 00 01 00  01 00 00 00  00 01 00 00  ................                                                 
  29.3    262144  IN     01 01 01 01  01 01 01 02  01 01 02 01  01 01 01 01  ................  2.0ms  2017/07/18  15:11:34.551  ntoskrnl      
                         01 01 01 01  01 02 01 01  01 01 01 00  01 00 01 01  ................                                                 
                         00 01 01 02  02 02 01 01  01 01 01 01  01 02 02 01  ................                                                 
                         02 01 01 02  01 02 01 01  01 01 01 01  02 01 01 01  ................                                                 
  29.3        32  IN     55 33 56 54  00 00 20 00  73 0f 00 00  00 00 00 00  U3VT.. .s.......   25us  2017/07/18  15:11:34.551  ntoskrnl      	# trailer_size is 0x20(32). block is 0xf73(3955). status is 0x0000. valid_payload_size is 0x140000(1310720). trailer_size_y is 0x400(1024).
                         00 00 00 00  00 00 14 00  00 00 00 00  00 04 00 00  ................                                                 
  29.3        52  IN     55 33 56 4c  00 00 34 00  74 0f 00 00  00 00 00 00  U3VL..4.t.......   18us  2017/07/18  15:11:34.551  ntoskrnl      	# block is 0xf74(3956) chunk_mode_active is 0. timestamp is 0xd2438a226(56442266150) pixel_format is 0x01080009(BayerRG8). size_x is 0x500(1280). size_y is 0x400(1024). offset_x is 0x0(0). offset_y is 0x0(0).
                         00 00 01 00  26 a2 38 24  0d 00 00 00  09 00 08 01  ....&.8$........                                                 
                         00 05 00 00  00 04 00 00  00 00 00 00  00 00 00 00  ................                                                 
                         00 00 00 00                                         ....                                                             
  29.3   1048576  IN     00 01 01 01  01 00 01 00  00 00 00 00  00 01 00 01  ................  8.6ms  2017/07/18  15:11:34.560  ntoskrnl      
                         00 00 01 00  01 00 01 00  00 00 00 01  00 00 00 00  ................                                                 
                         00 00 01 01  00 01 00 00  00 00 00 01  01 00 01 00  ................                                                 
                         00 01 00 01  00 00 01 01  00 00 00 00  01 01 00 00  ................                                                 
  29.3    262144  IN     02 01 01 01  02 02 01 01  01 01 02 01  01 01 01 01  ................  2.0ms  2017/07/18  15:11:34.562  ntoskrnl      
                         01 01 01 01  01 01 01 01  01 01 01 01  01 02 00 01  ................                                                 
                         00 01 01 01  01 01 01 01  01 01 01 01  01 01 02 01  ................                                                 
                         02 01 01 02  01 01 01 01  01 01 01 01  02 02 01 01  ................                                                 
  29.3        32  IN     55 33 56 54  00 00 20 00  74 0f 00 00  00 00 00 00  U3VT.. .t.......   27us  2017/07/18  15:11:34.562  ntoskrnl      	# trailer_size is 0x20(32). block is 0xf74(3956). status is 0x0000. valid_payload_size is 0x140000(1310720). trailer_size_y is 0x400(1024).
                         00 00 00 00  00 00 14 00  00 00 00 00  00 04 00 00  ................                                                 
  29.3        52  IN     55 33 56 4c  00 00 34 00  75 0f 00 00  00 00 00 00  U3VL..4.u.......    9us  2017/07/18  15:11:34.562  ntoskrnl      	# block is 0xf75(3957) chunk_mode_active is 0. timestamp is 0xd24dc803f(56453005375) pixel_format is 0x01080009(BayerRG8). size_x is 0x500(1280). size_y is 0x400(1024). offset_x is 0x0(0). offset_y is 0x0(0).
                         00 00 01 00  3f 80 dc 24  0d 00 00 00  09 00 08 01  ....?..$........                                                 
                         00 05 00 00  00 04 00 00  00 00 00 00  00 00 00 00  ................                                                 
                         00 00 00 00                                         ....                                                             
  29.3   1048576  IN     01 01 01 00  01 00 00 00  00 00 00 00  00 00 01 01  ................  8.6ms  2017/07/18  15:11:34.571  ntoskrnl      
                         00 00 00 00  00 00 01 00  00 00 00 01  01 00 01 00  ................                                                 
                         01 00 01 00  01 00 01 00  00 00 01 01  01 00 01 00  ................                                                 
                         00 00 00 00  00 00 01 01  00 01 00 01  01 01 00 01  ................                                                 
  29.3    262144  IN     01 01 01 01  02 01 01 01  01 01 02 01  01 01 01 01  ................  2.0ms  2017/07/18  15:11:34.573  ntoskrnl      
                         01 02 02 02  01 01 01 02  01 01 01 02  01 01 01 01  ................                                                 
                         00 01 01 02  01 02 01 01  01 01 01 01  01 02 02 01  ................                                                 
                         02 01 01 01  01 02 02 01  00 02 01 01  02 01 01 02  ................                                                 
  29.3        32  IN     55 33 56 54  00 00 20 00  75 0f 00 00  00 00 00 00  U3VT.. .u.......   36us  2017/07/18  15:11:34.573  ntoskrnl      	# trailer_size is 0x20(32). block is 0xf75(3957). status is 0x0000. valid_payload_size is 0x140000(1310720). trailer_size_y is 0x400(1024).
                         00 00 00 00  00 00 14 00  00 00 00 00  00 04 00 00  ................                                                 
  29.3        52  IN     55 33 56 4c  00 00 34 00  76 0f 00 00  00 00 00 00  U3VL..4.v.......   25us  2017/07/18  15:11:34.573  ntoskrnl      	# block is 0xf76(3958) chunk_mode_active is 0. timestamp is 0xd25808630(56463754800) pixel_format is 0x01080009(BayerRG8). size_x is 0x500(1280). size_y is 0x400(1024). offset_x is 0x0(0). offset_y is 0x0(0).
                         00 00 01 00  30 86 80 25  0d 00 00 00  09 00 08 01  ....0..%........                                                 
                         00 05 00 00  00 04 00 00  00 00 00 00  00 00 00 00  ................                                                 
                         00 00 00 00                                         ....                                                             
  29.3   1048576  IN     00 00 00 00  00 01 00 00  00 00 00 00  00 00 00 01  ................  8.6ms  2017/07/18  15:11:34.581  ntoskrnl      
                         00 01 00 00  00 00 00 00  00 00 00 01  00 00 00 00  ................                                                 
                         00 00 00 00  00 00 00 00  00 00 00 00  00 00 01 00  ................                                                 
                         00 00 00 00  00 00 00 00  01 01 00 00  00 00 00 00  ................                                                 
  29.3    262144  IN     01 01 01 01  02 02 01 01  02 01 02 01  01 01 01 01  ................  2.0ms  2017/07/18  15:11:34.583  ntoskrnl      
                         02 02 01 02  01 01 01 01  01 01 01 01  01 01 01 01  ................                                                 
                         00 01 02 02  02 02 01 01  01 02 01 01  01 01 02 01  ................                                                 
                         02 01 02 02  01 01 01 01  01 01 02 01  01 01 01 01  ................                                                 
  29.3        32  IN     55 33 56 54  00 00 20 00  76 0f 00 00  00 00 00 00  U3VT.. .v.......   44us  2017/07/18  15:11:34.583  ntoskrnl      	# trailer_size is 0x20(32). block is 0xf76(3958). status is 0x0000. valid_payload_size is 0x140000(1310720). trailer_size_y is 0x400(1024).
                         00 00 00 00  00 00 14 00  00 00 00 00  00 04 00 00  ................                                                 
  29.3        52  IN     55 33 56 4c  00 00 34 00  77 0f 00 00  00 00 00 00  U3VL..4.w.......   32us  2017/07/18  15:11:34.583  ntoskrnl      	# block is 0xf77(3959) chunk_mode_active is 0. timestamp is 0xd26248c3a(56474504250) pixel_format is 0x01080009(BayerRG8). size_x is 0x500(1280). size_y is 0x400(1024). offset_x is 0x0(0). offset_y is 0x0(0).
                         00 00 01 00  3a 8c 24 26  0d 00 00 00  09 00 08 01  ....:.$&........                                                 
                         00 05 00 00  00 04 00 00  00 00 00 00  00 00 00 00  ................                                                 
                         00 00 00 00                                         ....                                                             
  29.3   1048576  IN     00 01 00 00  00 00 00 00  00 00 00 00  00 00 00 01  ................  8.5ms  2017/07/18  15:11:34.592  ntoskrnl      
                         00 00 00 00  00 00 01 00  01 00 00 01  00 01 00 00  ................                                                 
                         00 00 01 01  00 01 00 00  00 00 00 00  00 00 00 00  ................                                                 
                         01 00 00 00  00 00 01 01  01 00 00 00  00 01 00 00  ................                                                 
  29.3    262144  IN     02 01 01 01  01 01 01 01  02 01 02 01  01 01 01 01  ................  2.0ms  2017/07/18  15:11:34.594  ntoskrnl      
                         01 01 01 01  01 01 01 01  01 02 00 01  01 01 01 00  ................                                                 
                         00 01 01 02  02 01 01 01  01 01 01 01  01 01 02 01  ................                                                 
                         02 01 01 02  02 02 02 02  01 01 01 01  02 02 01 01  ................                                                 
  29.3        32  IN     55 33 56 54  00 00 20 00  77 0f 00 00  00 00 00 00  U3VT.. .w.......   14us  2017/07/18  15:11:34.594  ntoskrnl      	# trailer_size is 0x20(32). block is 0xf77(3959). status is 0x0000. valid_payload_size is 0x140000(1310720). trailer_size_y is 0x400(1024).
                         00 00 00 00  00 00 14 00  00 00 00 00  00 04 00 00  ................                                                 
  29.3        52  IN     55 33 56 4c  00 00 34 00  78 0f 00 00  00 00 00 00  U3VL..4.x.......   22us  2017/07/18  15:11:34.594  ntoskrnl      	# block is 0xf78(3960) chunk_mode_active is 0. timestamp is 0xd26c89244(56485253700) pixel_format is 0x01080009(BayerRG8). size_x is 0x500(1280). size_y is 0x400(1024). offset_x is 0x0(0). offset_y is 0x0(0).
                         00 00 01 00  44 92 c8 26  0d 00 00 00  09 00 08 01  ....D..&........                                                 
                         00 05 00 00  00 04 00 00  00 00 00 00  00 00 00 00  ................                                                 
                         00 00 00 00                                         ....                                                             
  29.3   1048576  IN     00 00 00 00  01 00 00 00  00 00 00 00  00 00 00 01  ................  8.6ms  2017/07/18  15:11:34.603  ntoskrnl      
                         00 01 00 00  00 00 00 01  00 00 00 00  00 00 00 01  ................                                                 
                         00 00 00 01  00 00 01 00  00 00 00 00  00 00 00 01  ................                                                 
                         00 01 00 00  00 00 00 00  00 00 00 01  00 00 00 00  ................                                                 
  29.3    262144  IN     01 01 01 01  02 01 01 01  01 01 01 01  01 01 01 01  ................  2.0ms  2017/07/18  15:11:34.605  ntoskrnl      
                         02 01 01 01  01 01 01 01  01 01 00 01  00 01 01 01  ................                                                 
                         00 01 01 02  01 01 01 00  01 01 01 01  01 01 02 01  ................                                                 
                         02 01 01 01  01 01 01 01  01 01 01 01  01 01 01 01  ................                                                 
  29.3        32  IN     55 33 56 54  00 00 20 00  78 0f 00 00  00 00 00 00  U3VT.. .x.......   20us  2017/07/18  15:11:34.605  ntoskrnl      	# trailer_size is 0x20(32). block is 0xf78(3960). status is 0x0000. valid_payload_size is 0x140000(1310720). trailer_size_y is 0x400(1024).
                         00 00 00 00  00 00 14 00  00 00 00 00  00 04 00 00  ................                                                 
  29.3        52  IN     55 33 56 4c  00 00 34 00  79 0f 00 00  00 00 00 00  U3VL..4.y.......   22us  2017/07/18  15:11:34.605  ntoskrnl      	# block is 0xf79(3961) chunk_mode_active is 0. timestamp is 0xd276c984e(56496003150) pixel_format is 0x01080009(BayerRG8). size_x is 0x500(1280). size_y is 0x400(1024). offset_x is 0x0(0). offset_y is 0x0(0).
                         00 00 01 00  4e 98 6c 27  0d 00 00 00  09 00 08 01  ....N.l'........                                                 
                         00 05 00 00  00 04 00 00  00 00 00 00  00 00 00 00  ................                                                 
                         00 00 00 00                                         ....                                                             
  29.3   1048576  IN     01 01 01 01  00 00 00 00  00 00 00 00  00 01 00 01  ................  8.6ms  2017/07/18  15:11:34.613  ntoskrnl      
                         00 00 00 01  00 00 00 00  00 00 01 01  00 00 00 00  ................                                                 
                         00 00 01 01  00 00 00 00  00 00 00 01  00 00 00 00  ................                                                 
                         00 01 00 01  00 00 00 01  00 01 00 00  00 00 00 00  ................                                                 
  29.3    262144  IN     01 01 01 01  02 02 01 01  01 01 01 00  01 01 01 00  ................  2.0ms  2017/07/18  15:11:34.616  ntoskrnl      
                         01 01 01 01  01 01 01 01  01 01 01 01  01 01 00 01  ................                                                 
                         00 01 01 02  01 02 01 01  01 01 01 01  01 01 01 01  ................                                                 
                         02 01 01 02  01 01 01 01  01 01 01 01  01 01 02 01  ................                                                 
  29.3        32  IN     55 33 56 54  00 00 20 00  79 0f 00 00  00 00 00 00  U3VT.. .y.......   45us  2017/07/18  15:11:34.616  ntoskrnl      	# trailer_size is 0x20(32). block is 0xf79(3961). status is 0x0000. valid_payload_size is 0x140000(1310720). trailer_size_y is 0x400(1024).
                         00 00 00 00  00 00 14 00  00 00 00 00  00 04 00 00  ................                                                 
  29.3        52  IN     55 33 56 4c  00 00 34 00  7a 0f 00 00  00 00 00 00  U3VL..4.z.......   32us  2017/07/18  15:11:34.616  ntoskrnl      	# block is 0xf7a(3962) chunk_mode_active is 0. timestamp is 0xd28109e58(56506752600) pixel_format is 0x01080009(BayerRG8). size_x is 0x500(1280). size_y is 0x400(1024). offset_x is 0x0(0). offset_y is 0x0(0).
                         00 00 01 00  58 9e 10 28  0d 00 00 00  09 00 08 01  ....X..(........                                                 
                         00 05 00 00  00 04 00 00  00 00 00 00  00 00 00 00  ................                                                 
                         00 00 00 00                                         ....                                                             
  29.3   1048576  IN     00 00 00 00  00 01 01 00  00 00 01 00  01 00 00 01  ................  8.5ms  2017/07/18  15:11:34.624  ntoskrnl      
                         00 01 00 00  01 00 01 00  00 00 00 00  00 00 00 01  ................                                                 
                         00 00 00 00  01 00 01 00  01 00 00 01  00 00 00 00  ................                                                 
                         00 01 00 00  00 00 01 00  01 00 00 01  00 01 00 00  ................                                                 
  29.3    262144  IN     01 01 01 01  01 01 01 01  02 01 01 01  01 01 01 01  ................  2.0ms  2017/07/18  15:11:34.626  ntoskrnl      
                         01 02 01 01  01 01 01 01  01 01 01 01  01 01 01 01  ................                                                 
                         00 01 01 02  01 02 01 01  01 01 01 01  01 01 02 01  ................                                                 
                         02 01 01 01  02 01 01 01  01 01 01 01  02 01 01 01  ................                                                 
  29.3        32  IN     55 33 56 54  00 00 20 00  7a 0f 00 00  00 00 00 00  U3VT.. .z.......   17us  2017/07/18  15:11:34.626  ntoskrnl      	# trailer_size is 0x20(32). block is 0xf7a(3962). status is 0x0000. valid_payload_size is 0x140000(1310720). trailer_size_y is 0x400(1024).
                         00 00 00 00  00 00 14 00  00 00 00 00  00 04 00 00  ................                                                 
  29.3        52  IN     55 33 56 4c  00 00 34 00  7b 0f 00 00  00 00 00 00  U3VL..4.........   22us  2017/07/18  15:11:34.626  ntoskrnl      	# block is 0xf7b(3963) chunk_mode_active is 0. timestamp is 0xd28b4a449(56517502025) pixel_format is 0x01080009(BayerRG8). size_x is 0x500(1280). size_y is 0x400(1024). offset_x is 0x0(0). offset_y is 0x0(0).
                         00 00 01 00  49 a4 b4 28  0d 00 00 00  09 00 08 01  ....I..(........                                                 
                         00 05 00 00  00 04 00 00  00 00 00 00  00 00 00 00  ................                                                 
                         00 00 00 00                                         ....                                                             
  29.3   1048576  IN     00 00 00 01  00 01 00 00  00 00 00 00  00 00 00 01  ................  8.6ms  2017/07/18  15:11:34.635  ntoskrnl      
                         00 00 00 00  00 00 00 00  00 00 00 00  00 00 00 00  ................                                                 
                         01 00 01 01  01 00 00 00  00 01 01 00  00 00 00 00  ................                                                 
                         00 01 00 00  00 00 00 00  01 00 00 01  00 01 01 00  ................                                                 
  29.3    262144  IN     02 01 01 01  02 01 01 01  01 01 01 01  01 01 00 01  ................  2.0ms  2017/07/18  15:11:34.637  ntoskrnl      
                         01 02 01 01  01 02 01 01  01 01 00 00  00 01 01 00  ................                                                 
                         00 01 01 02  01 02 01 01  01 01 01 01  01 01 02 01  ................                                                 
                         02 01 01 01  02 01 01 01  01 01 01 01  01 01 02 01  ................                                                 
  29.3        32  IN     55 33 56 54  00 00 20 00  7b 0f 00 00  00 00 00 00  U3VT.. .........   27us  2017/07/18  15:11:34.637  ntoskrnl      	# trailer_size is 0x20(32). block is 0xf7b(3963). status is 0x0000. valid_payload_size is 0x140000(1310720). trailer_size_y is 0x400(1024).
                         00 00 00 00  00 00 14 00  00 00 00 00  00 04 00 00  ................                                                 
  29.3        52  IN     55 33 56 4c  00 00 34 00  7c 0f 00 00  00 00 00 00  U3VL..4.........   14us  2017/07/18  15:11:34.637  ntoskrnl      	# block is 0xf7c(3964) chunk_mode_active is 0. timestamp is 0xd29588262(56528241250) pixel_format is 0x01080009(BayerRG8). size_x is 0x500(1280). size_y is 0x400(1024). offset_x is 0x0(0). offset_y is 0x0(0).
                         00 00 01 00  62 82 58 29  0d 00 00 00  09 00 08 01  ....b.X)........                                                 
                         00 05 00 00  00 04 00 00  00 00 00 00  00 00 00 00  ................                                                 
                         00 00 00 00                                         ....                                                             
  29.3   1048576  IN     00 00 00 01  00 00 00 00  01 00 00 00  00 00 00 01  ................  8.6ms  2017/07/18  15:11:34.646  ntoskrnl      
                         01 01 00 01  01 01 00 00  00 00 00 01  00 00 00 01  ................                                                 
                         00 00 01 00  00 01 00 00  00 00 01 01  00 00 00 01  ................                                                 
                         01 01 00 00  00 00 00 01  01 00 01 00  00 00 00 00  ................                                                 
  29.3    262144  IN     01 02 01 02  02 01 01 01  02 01 02 01  01 01 01 01  ................  2.0ms  2017/07/18  15:11:34.648  ntoskrnl      
                         02 01 01 02  01 01 01 01  01 02 01 01  01 02 01 01  ................                                                 
                         01 01 02 02  01 02 01 01  01 01 01 01  01 01 02 01  ................                                                 
                         02 01 01 02  02 02 02 01  01 01 01 01  01 02 01 01  ................                                                 
  29.3        32  IN     55 33 56 54  00 00 20 00  7c 0f 00 00  00 00 00 00  U3VT.. .........   29us  2017/07/18  15:11:34.648  ntoskrnl      	# trailer_size is 0x20(32). block is 0xf7c(3964). status is 0x0000. valid_payload_size is 0x140000(1310720). trailer_size_y is 0x400(1024).
                         00 00 00 00  00 00 14 00  00 00 00 00  00 04 00 00  ................                                                 
  29.3        52  IN     55 33 56 4c  00 00 34 00  7d 0f 00 00  00 00 00 00  U3VL..4.........   15us  2017/07/18  15:11:34.648  ntoskrnl      	# block is 0xf7d(3965) chunk_mode_active is 0. timestamp is 0xd29fc886c(56538990700) pixel_format is 0x01080009(BayerRG8). size_x is 0x500(1280). size_y is 0x400(1024). offset_x is 0x0(0). offset_y is 0x0(0).
                         00 00 01 00  6c 88 fc 29  0d 00 00 00  09 00 08 01  ....l..)........                                                 
                         00 05 00 00  00 04 00 00  00 00 00 00  00 00 00 00  ................                                                 
                         00 00 00 00                                         ....                                                             
  29.3   1048576  IN     00 00 00 00  00 00 01 00  00 00 00 00  01 01 00 01  ................  8.6ms  2017/07/18  15:11:34.656  ntoskrnl      
                         00 00 00 00  00 00 00 00  00 00 00 00  00 00 01 00  ................                                                 
                         01 00 01 00  00 00 00 00  00 00 01 01  00 00 00 00  ................                                                 
                         00 01 00 00  00 00 01 00  00 00 00 00  01 00 00 00  ................                                                 
  29.3    262144  IN     01 01 01 01  01 01 01 01  02 01 01 01  02 01 01 01  ................  2.0ms  2017/07/18  15:11:34.659  ntoskrnl      
                         01 01 01 02  01 01 01 01  01 02 01 01  01 02 01 01  ................                                                 
                         00 01 01 01  01 01 01 01  01 01 01 01  01 01 02 01  ................                                                 
                         02 01 01 01  02 02 02 02  01 01 01 01  02 01 01 01  ................                                                 
  29.3        32  IN     55 33 56 54  00 00 20 00  7d 0f 00 00  00 00 00 00  U3VT.. .........   22us  2017/07/18  15:11:34.659  ntoskrnl      	# trailer_size is 0x20(32). block is 0xf7d(3965). status is 0x0000. valid_payload_size is 0x140000(1310720). trailer_size_y is 0x400(1024).
                         00 00 00 00  00 00 14 00  00 00 00 00  00 04 00 00  ................                                                 
  29.3        52  IN     55 33 56 4c  00 00 34 00  7e 0f 00 00  00 00 00 00  U3VL..4.........   10us  2017/07/18  15:11:34.659  ntoskrnl      	# block is 0xf7e(3966) chunk_mode_active is 0. timestamp is 0xd2aa08e76(56549740150) pixel_format is 0x01080009(BayerRG8). size_x is 0x500(1280). size_y is 0x400(1024). offset_x is 0x0(0). offset_y is 0x0(0).
                         00 00 01 00  76 8e a0 2a  0d 00 00 00  09 00 08 01  ....v..*........                                                 
                         00 05 00 00  00 04 00 00  00 00 00 00  00 00 00 00  ................                                                 
                         00 00 00 00                                         ....                                                             
  29.3   1048576  IN     00 00 00 00  00 01 00 01  00 00 00 00  00 00 01 01  ................  8.7ms  2017/07/18  15:11:34.667  ntoskrnl      
                         01 01 00 00  00 00 00 00  00 00 00 01  00 01 01 00  ................                                                 
                         00 00 01 00  00 01 00 00  00 01 00 01  00 00 01 00  ................                                                 
                         00 00 00 00  00 00 01 01  01 00 00 00  00 00 01 00  ................                                                 
  29.3    262144  IN     02 02 01 02  01 01 01 01  02 01 01 01  01 01 00 01  ................  2.0ms  2017/07/18  15:11:34.669  ntoskrnl      
                         01 01 01 01  01 01 01 01  01 02 01 01  00 01 01 01  ................                                                 
                         00 01 02 01  01 02 01 01  01 01 01 01  01 01 02 01  ................                                                 
                         02 01 01 01  01 01 01 01  01 01 02 01  01 01 02 01  ................                                                 
  29.3        32  IN     55 33 56 54  00 00 20 00  7e 0f 00 00  00 00 00 00  U3VT.. .........   40us  2017/07/18  15:11:34.669  ntoskrnl      	# trailer_size is 0x20(32). block is 0xf7e(3966). status is 0x0000. valid_payload_size is 0x140000(1310720). trailer_size_y is 0x400(1024).
                         00 00 00 00  00 00 14 00  00 00 00 00  00 04 00 00  ................                                                 
  29.3        52  IN     55 33 56 4c  00 00 34 00  7f 0f 00 00  00 00 00 00  U3VL..4.........   21us  2017/07/18  15:11:34.669  ntoskrnl      	# block is 0xf7f(3967) chunk_mode_active is 0. timestamp is 0xd2b449480(56560489600) pixel_format is 0x01080009(BayerRG8). size_x is 0x500(1280). size_y is 0x400(1024). offset_x is 0x0(0). offset_y is 0x0(0).
                         00 00 01 00  80 94 44 2b  0d 00 00 00  09 00 08 01  ......D+........                                                 
                         00 05 00 00  00 04 00 00  00 00 00 00  00 00 00 00  ................                                                 
                         00 00 00 00                                         ....                                                             
  29.3   1048576  IN     00 00 00 01  01 00 00 00  01 00 01 00  00 00 00 01  ................  8.6ms  2017/07/18  15:11:34.678  ntoskrnl      
                         00 01 00 00  00 01 00 01  00 00 00 00  00 00 01 01  ................                                                 
                         00 00 01 00  00 00 00 00  00 00 00 00  00 00 00 00  ................                                                 
                         00 00 01 00  00 00 00 01  00 00 00 00  00 00 00 00  ................                                                 
  29.3    262144  IN     02 01 01 01  01 02 01 01  01 01 01 01  01 01 01 01  ................  2.0ms  2017/07/18  15:11:34.680  ntoskrnl      
                         01 01 01 01  01 01 01 01  01 01 01 01  01 01 00 01  ................                                                 
                         00 01 01 02  01 01 01 01  01 01 01 01  01 01 02 01  ................                                                 
                         02 01 01 01  01 01 01 01  01 01 01 01  01 01 01 01  ................                                                 
  29.3        32  IN     55 33 56 54  00 00 20 00  7f 0f 00 00  00 00 00 00  U3VT.. .........   34us  2017/07/18  15:11:34.680  ntoskrnl      	# trailer_size is 0x20(32). block is 0xf7f(3967). status is 0x0000. valid_payload_size is 0x140000(1310720). trailer_size_y is 0x400(1024).
                         00 00 00 00  00 00 14 00  00 00 00 00  00 04 00 00  ................                                                 
  29.3        52  IN     55 33 56 4c  00 00 34 00  80 0f 00 00  00 00 00 00  U3VL..4.........   13us  2017/07/18  15:11:34.680  ntoskrnl      	# block is 0xf80(3968) chunk_mode_active is 0. timestamp is 0xd2be89a71(56571239025) pixel_format is 0x01080009(BayerRG8). size_x is 0x500(1280). size_y is 0x400(1024). offset_x is 0x0(0). offset_y is 0x0(0).
                         00 00 01 00  71 9a e8 2b  0d 00 00 00  09 00 08 01  ....q..+........                                                 
                         00 05 00 00  00 04 00 00  00 00 00 00  00 00 00 00  ................                                                 
                         00 00 00 00                                         ....                                                             
  29.3   1048576  IN     01 00 00 01  00 00 00 00  00 00 00 00  01 00 00 01  ................  8.6ms  2017/07/18  15:11:34.689  ntoskrnl      
                         01 00 00 01  00 00 00 00  00 00 00 00  00 00 00 01  ................                                                 
                         01 00 01 01  00 00 00 00  00 00 01 01  01 00 00 00  ................                                                 
                         01 00 01 00  00 00 01 01  01 01 00 00  00 00 00 00  ................                                                 
  29.3    262144  IN     01 01 01 01  02 01 01 01  01 01 01 01  02 01 01 01  ................  2.0ms  2017/07/18  15:11:34.691  ntoskrnl      
                         01 02 01 01  01 01 01 01  01 02 01 01  01 02 01 01  ................                                                 
                         00 01 01 02  01 01 01 01  01 01 01 01  02 01 02 01  ................                                                 
                         01 01 01 01  01 02 01 01  01 01 01 01  01 01 01 02  ................                                                 
  29.3        32  IN     55 33 56 54  00 00 20 00  80 0f 00 00  00 00 00 00  U3VT.. .........   38us  2017/07/18  15:11:34.691  ntoskrnl      	# trailer_size is 0x20(32). block is 0xf80(3968). status is 0x0000. valid_payload_size is 0x140000(1310720). trailer_size_y is 0x400(1024).
                         00 00 00 00  00 00 14 00  00 00 00 00  00 04 00 00  ................                                                 
  29.3        52  IN     55 33 56 4c  00 00 34 00  81 0f 00 00  00 00 00 00  U3VL..4.........   14us  2017/07/18  15:11:34.691  ntoskrnl      	# block is 0xf81(3969) chunk_mode_active is 0. timestamp is 0xd2c8ca07b(56581988475) pixel_format is 0x01080009(BayerRG8). size_x is 0x500(1280). size_y is 0x400(1024). offset_x is 0x0(0). offset_y is 0x0(0).
                         00 00 01 00  7b a0 8c 2c  0d 00 00 00  09 00 08 01  .......,........                                                 
                         00 05 00 00  00 04 00 00  00 00 00 00  00 00 00 00  ................                                                 
                         00 00 00 00                                         ....                                                             
  29.3   1048576  IN     01 00 00 00  00 00 00 00  00 00 00 00  01 01 00 01  ................  8.6ms  2017/07/18  15:11:34.700  ntoskrnl      
                         00 01 00 01  00 01 00 00  01 00 00 01  00 00 00 00  ................                                                 
                         01 00 01 00  00 00 01 00  00 00 01 00  00 00 00 00  ................                                                 
                         01 00 00 00  00 01 01 01  00 00 00 00  00 01 00 00  ................                                                 
  29.3    262144  IN     02 01 01 02  02 01 01 01  01 01 02 01  01 01 01 01  ................  2.0ms  2017/07/18  15:11:34.702  ntoskrnl      
                         01 01 01 02  02 01 01 01  01 01 01 01  01 02 01 01  ................                                                 
                         00 01 01 02  01 01 01 01  01 01 01 01  01 01 02 01  ................                                                 
                         02 01 01 02  01 02 01 01  01 01 01 01  02 01 02 01  ................                                                 
  29.3        32  IN     55 33 56 54  00 00 20 00  81 0f 00 00  00 00 00 00  U3VT.. .........   39us  2017/07/18  15:11:34.702  ntoskrnl      	# trailer_size is 0x20(32). block is 0xf81(3969). status is 0x0000. valid_payload_size is 0x140000(1310720). trailer_size_y is 0x400(1024).
                         00 00 00 00  00 00 14 00  00 00 00 00  00 04 00 00  ................                                                 
  29.3        52  IN     55 33 56 4c  00 00 34 00  82 0f 00 00  00 00 00 00  U3VL..4.........   22us  2017/07/18  15:11:34.702  ntoskrnl      	# block is 0xf82(3970) chunk_mode_active is 0. timestamp is 0xd2d30a685(56592737925) pixel_format is 0x01080009(BayerRG8). size_x is 0x500(1280). size_y is 0x400(1024). offset_x is 0x0(0). offset_y is 0x0(0).
                         00 00 01 00  85 a6 30 2d  0d 00 00 00  09 00 08 01  ......0-........                                                 
                         00 05 00 00  00 04 00 00  00 00 00 00  00 00 00 00  ................                                                 
                         00 00 00 00                                         ....                                                             
  29.3   1048576  IN     00 00 00 00  01 01 01 00  00 00 01 00  00 01 00 01  ................  8.6ms  2017/07/18  15:11:34.710  ntoskrnl      
                         00 01 00 00  00 00 00 00  00 00 00 00  00 00 00 00  ................                                                 
                         00 00 00 00  00 00 00 00  00 00 01 01  00 00 00 00  ................                                                 
                         00 01 00 00  00 00 00 01  00 00 00 00  00 00 00 00  ................                                                 
  29.3    262144  IN     01 01 01 01  01 01 01 01  01 02 02 01  02 01 01 01  ................  2.0ms  2017/07/18  15:11:34.712  ntoskrnl      
                         02 01 01 01  01 01 01 01  01 02 01 00  00 01 01 01  ................                                                 
                         00 01 01 02  01 02 01 01  01 01 01 01  01 02 02 01  ................                                                 
                         02 01 01 01  01 02 01 01  01 01 02 02  02 01 01 01  ................                                                 
  29.3        32  IN     55 33 56 54  00 00 20 00  82 0f 00 00  00 00 00 00  U3VT.. .........   39us  2017/07/18  15:11:34.712  ntoskrnl      	# trailer_size is 0x20(32). block is 0xf82(3970). status is 0x0000. valid_payload_size is 0x140000(1310720). trailer_size_y is 0x400(1024).
                         00 00 00 00  00 00 14 00  00 00 00 00  00 04 00 00  ................                                                 
  29.3        52  IN     55 33 56 4c  00 00 34 00  83 0f 00 00  00 00 00 00  U3VL..4.........   28us  2017/07/18  15:11:34.712  ntoskrnl      	# block is 0xf83(3971) chunk_mode_active is 0. timestamp is 0xd2dd4849e(56603477150) pixel_format is 0x01080009(BayerRG8). size_x is 0x500(1280). size_y is 0x400(1024). offset_x is 0x0(0). offset_y is 0x0(0).
                         00 00 01 00  9e 84 d4 2d  0d 00 00 00  09 00 08 01  .......-........                                                 
                         00 05 00 00  00 04 00 00  00 00 00 00  00 00 00 00  ................                                                 
                         00 00 00 00                                         ....                                                             
  29.3   1048576  IN     00 00 00 00  01 00 01 00  00 00 00 00  00 00 00 01  ................  8.5ms  2017/07/18  15:11:34.721  ntoskrnl      
                         00 00 00 01  00 00 00 00  01 00 00 00  00 00 00 00  ................                                                 
                         01 00 01 00  00 00 00 00  00 00 00 01  00 00 00 00  ................                                                 
                         01 01 00 00  00 00 01 01  00 00 01 00  00 01 00 00  ................                                                 
  29.3    262144  IN     01 01 01 01  01 01 01 01  01 01 01 01  01 01 01 01  ................  2.0ms  2017/07/18  15:11:34.723  ntoskrnl      
                         01 01 01 01  01 01 01 01  01 02 01 01  01 01 00 01  ................                                                 
                         00 01 01 02  02 01 01 01  01 01 01 01  01 01 02 01  ................                                                 
                         02 01 01 01  02 02 02 01  01 01 01 01  01 01 01 01  ................                                                 
  29.3        32  IN     55 33 56 54  00 00 20 00  83 0f 00 00  00 00 00 00  U3VT.. .........   29us  2017/07/18  15:11:34.723  ntoskrnl      	# trailer_size is 0x20(32). block is 0xf83(3971). status is 0x0000. valid_payload_size is 0x140000(1310720). trailer_size_y is 0x400(1024).
                         00 00 00 00  00 00 14 00  00 00 00 00  00 04 00 00  ................                                                 
  29.3        52  IN     55 33 56 4c  00 00 34 00  84 0f 00 00  00 00 00 00  U3VL..4.........   13us  2017/07/18  15:11:34.723  ntoskrnl      	# block is 0xf84(3972) chunk_mode_active is 0. timestamp is 0xd2e788aa8(56614226600) pixel_format is 0x01080009(BayerRG8). size_x is 0x500(1280). size_y is 0x400(1024). offset_x is 0x0(0). offset_y is 0x0(0).
                         00 00 01 00  a8 8a 78 2e  0d 00 00 00  09 00 08 01  ......x.........                                                 
                         00 05 00 00  00 04 00 00  00 00 00 00  00 00 00 00  ................                                                 
                         00 00 00 00                                         ....                                                             
  29.3   1048576  IN     00 00 01 00  00 01 01 00  00 00 00 01  00 00 00 00  ................  8.6ms  2017/07/18  15:11:34.732  ntoskrnl      
                         00 01 00 00  00 01 00 01  00 00 00 01  00 00 00 00  ................                                                 
                         01 00 01 00  00 00 00 00  00 00 00 00  01 00 00 00  ................                                                 
                         01 00 00 00  00 00 00 01  00 01 00 01  00 01 00 00  ................                                                 
  29.3    262144  IN     01 02 01 01  01 01 01 01  01 02 01 01  01 01 01 01  ................  2.0ms  2017/07/18  15:11:34.734  ntoskrnl      
                         01 01 01 01  01 01 01 01  01 02 01 01  01 01 01 01  ................                                                 
                         00 01 01 02  01 01 01 01  01 01 01 01  01 01 02 01  ................                                                 
                         02 01 01 01  01 01 01 01  01 01 01 01  02 01 01 01  ................                                                 
  29.3        32  IN     55 33 56 54  00 00 20 00  84 0f 00 00  00 00 00 00  U3VT.. .........   75us  2017/07/18  15:11:34.734  ntoskrnl      	# trailer_size is 0x20(32). block is 0xf84(3972). status is 0x0000. valid_payload_size is 0x140000(1310720). trailer_size_y is 0x400(1024).
                         00 00 00 00  00 00 14 00  00 00 00 00  00 04 00 00  ................                                                 
  29.3        52  IN     55 33 56 4c  00 00 34 00  85 0f 00 00  00 00 00 00  U3VL..4.........   10us  2017/07/18  15:11:34.734  ntoskrnl      	# block is 0xf85(3973) chunk_mode_active is 0. timestamp is 0xd2f1c9099(56624976025) pixel_format is 0x01080009(BayerRG8). size_x is 0x500(1280). size_y is 0x400(1024). offset_x is 0x0(0). offset_y is 0x0(0).
                         00 00 01 00  99 90 1c 2f  0d 00 00 00  09 00 08 01  ......./........                                                 
                         00 05 00 00  00 04 00 00  00 00 00 00  00 00 00 00  ................                                                 
                         00 00 00 00                                         ....                                                             
  29.3   1048576  IN     00 00 00 01  00 00 00 00  00 00 00 00  00 00 00 01  ................  8.6ms  2017/07/18  15:11:34.743  ntoskrnl      
                         00 01 00 00  00 01 00 00  01 00 00 00  00 00 00 01  ................                                                 
                         00 00 00 00  00 00 00 00  00 00 00 00  00 00 00 00  ................                                                 
                         01 00 00 00  00 00 01 01  01 01 00 00  00 01 00 00  ................                                                 
  29.3    262144  IN     01 02 01 01  01 02 01 01  02 01 01 01  02 01 01 01  ................  2.0ms  2017/07/18  15:11:34.745  ntoskrnl      
                         01 02 01 01  01 01 01 01  02 02 01 01  01 01 01 01  ................                                                 
                         00 01 02 02  01 02 01 01  01 01 01 01  01 01 02 01  ................                                                 
                         02 01 01 02  01 02 02 01  01 01 01 01  01 02 02 01  ................                                                 
  29.3        32  IN     55 33 56 54  00 00 20 00  85 0f 00 00  00 00 00 00  U3VT.. .........   34us  2017/07/18  15:11:34.745  ntoskrnl      	# trailer_size is 0x20(32). block is 0xf85(3973). status is 0x0000. valid_payload_size is 0x140000(1310720). trailer_size_y is 0x400(1024).
                         00 00 00 00  00 00 14 00  00 00 00 00  00 04 00 00  ................                                                 
  29.3        52  IN     55 33 56 4c  00 00 34 00  86 0f 00 00  00 00 00 00  U3VL..4.........   15us  2017/07/18  15:11:34.745  ntoskrnl      	# block is 0xf86(3974) chunk_mode_active is 0. timestamp is 0xd2fc096a3(56635725475) pixel_format is 0x01080009(BayerRG8). size_x is 0x500(1280). size_y is 0x400(1024). offset_x is 0x0(0). offset_y is 0x0(0).
                         00 00 01 00  a3 96 c0 2f  0d 00 00 00  09 00 08 01  ......./........                                                 
                         00 05 00 00  00 04 00 00  00 00 00 00  00 00 00 00  ................                                                 
                         00 00 00 00                                         ....                                                             
  29.3   1048576  IN     00 00 00 00  00 01 00 00  00 00 00 00  00 00 00 00  ................  8.6ms  2017/07/18  15:11:34.753  ntoskrnl      
                         00 00 00 00  00 01 00 00  00 00 00 00  00 00 01 00  ................                                                 
                         00 00 00 01  00 00 00 00  01 00 00 00  00 00 01 00  ................                                                 
                         00 00 00 00  00 00 00 01  00 00 00 00  00 00 00 00  ................                                                 
  29.3    262144  IN     01 01 01 01  01 02 01 01  01 01 01 01  01 02 01 01  ................  2.0ms  2017/07/18  15:11:34.755  ntoskrnl      
                         01 02 01 02  01 02 01 01  01 01 01 01  01 01 01 01  ................                                                 
                         00 01 01 02  01 01 01 01  01 01 01 01  01 01 02 01  ................                                                 
                         02 01 00 02  02 01 01 01  01 01 02 01  01 01 01 01  ................                                                 
  29.3        32  IN     55 33 56 54  00 00 20 00  86 0f 00 00  00 00 00 00  U3VT.. .........   21us  2017/07/18  15:11:34.755  ntoskrnl      	# trailer_size is 0x20(32). block is 0xf86(3974). status is 0x0000. valid_payload_size is 0x140000(1310720). trailer_size_y is 0x400(1024).
                         00 00 00 00  00 00 14 00  00 00 00 00  00 04 00 00  ................                                                 
  29.3        52  IN     55 33 56 4c  00 00 34 00  87 0f 00 00  00 00 00 00  U3VL..4.........    6us  2017/07/18  15:11:34.755  ntoskrnl      	# block is 0xf87(3975) chunk_mode_active is 0. timestamp is 0xd30649cad(56646474925) pixel_format is 0x01080009(BayerRG8). size_x is 0x500(1280). size_y is 0x400(1024). offset_x is 0x0(0). offset_y is 0x0(0).
                         00 00 01 00  ad 9c 64 30  0d 00 00 00  09 00 08 01  ......d0........                                                 
                         00 05 00 00  00 04 00 00  00 00 00 00  00 00 00 00  ................                                                 
                         00 00 00 00                                         ....                                                             
  29.3   1048576  IN     00 00 00 00  00 00 00 00  00 00 00 00  00 00 00 01  ................  8.7ms  2017/07/18  15:11:34.764  ntoskrnl      
                         00 00 00 01  00 01 00 00  01 00 00 01  00 00 01 00  ................                                                 
                         00 00 00 01  00 00 01 00  00 00 00 01  00 00 01 00  ................                                                 
                         01 01 00 00  00 00 00 00  01 00 00 00  00 01 00 00  ................                                                 
  29.3    262144  IN     01 01 01 01  01 01 01 01  01 01 02 01  02 01 01 01  ................  2.0ms  2017/07/18  15:11:34.766  ntoskrnl      
                         01 02 01 01  01 01 01 01  01 01 01 01  01 01 01 01  ................                                                 
                         00 01 01 01  01 02 01 01  01 01 01 01  01 01 02 01  ................                                                 
                         02 01 01 01  02 02 02 01  01 01 02 01  01 01 01 01  ................                                                 
  29.3        32  IN     55 33 56 54  00 00 20 00  87 0f 00 00  00 00 00 00  U3VT.. .........   77us  2017/07/18  15:11:34.766  ntoskrnl      	# trailer_size is 0x20(32). block is 0xf87(3975). status is 0x0000. valid_payload_size is 0x140000(1310720). trailer_size_y is 0x400(1024).
                         00 00 00 00  00 00 14 00  00 00 00 00  00 04 00 00  ................                                                 
  29.3        52  IN     55 33 56 4c  00 00 34 00  88 0f 00 00  00 00 00 00  U3VL..4.........   46us  2017/07/18  15:11:34.766  ntoskrnl      	# block is 0xf88(3976) chunk_mode_active is 0. timestamp is 0xd3108a2b7(56657224375) pixel_format is 0x01080009(BayerRG8). size_x is 0x500(1280). size_y is 0x400(1024). offset_x is 0x0(0). offset_y is 0x0(0).
                         00 00 01 00  b7 a2 08 31  0d 00 00 00  09 00 08 01  .......1........                                                 
                         00 05 00 00  00 04 00 00  00 00 00 00  00 00 00 00  ................                                                 
                         00 00 00 00                                         ....                                                             
  29.3   1048576  IN     00 00 00 00  00 00 00 00  01 00 01 00  00 00 00 01  ................  8.6ms  2017/07/18  15:11:34.775  ntoskrnl      
                         00 01 00 00  00 00 00 01  00 00 00 00  00 00 00 00  ................                                                 
                         00 00 00 00  00 00 00 00  01 00 00 01  01 00 01 00  ................                                                 
                         01 00 00 00  00 00 01 01  01 00 01 00  00 00 00 00  ................                                                 
  29.3    262144  IN     02 01 01 01  02 01 01 01  01 01 01 01  01 01 01 01  ................  2.0ms  2017/07/18  15:11:34.777  ntoskrnl      
                         01 01 01 01  01 01 01 01  01 01 01 01  01 01 01 01  ................                                                 
                         00 01 01 02  01 01 01 01  01 01 02 01  01 01 02 01  ................                                                 
                         02 01 01 01  01 01 01 01  01 01 02 02  01 02 01 01  ................                                                 
  29.3        32  IN     55 33 56 54  00 00 20 00  88 0f 00 00  00 00 00 00  U3VT.. .........   41us  2017/07/18  15:11:34.777  ntoskrnl      	# trailer_size is 0x20(32). block is 0xf88(3976). status is 0x0000. valid_payload_size is 0x140000(1310720). trailer_size_y is 0x400(1024).
                         00 00 00 00  00 00 14 00  00 00 00 00  00 04 00 00  ................                                                 
  29.3        52  IN     55 33 56 4c  00 00 34 00  89 0f 00 00  00 00 00 00  U3VL..4.........   24us  2017/07/18  15:11:34.777  ntoskrnl      	# block is 0xf89(3977) chunk_mode_active is 0. timestamp is 0xd31aca8a8(56667973800) pixel_format is 0x01080009(BayerRG8). size_x is 0x500(1280). size_y is 0x400(1024). offset_x is 0x0(0). offset_y is 0x0(0).
                         00 00 01 00  a8 a8 ac 31  0d 00 00 00  09 00 08 01  .......1........                                                 
                         00 05 00 00  00 04 00 00  00 00 00 00  00 00 00 00  ................                                                 
                         00 00 00 00                                         ....                                                             
  29.3   1048576  IN     00 00 00 00  00 00 00 00  00 00 01 00  00 00 00 01  ................  8.6ms  2017/07/18  15:11:34.785  ntoskrnl      
                         00 00 00 00  00 01 00 00  01 00 00 00  00 00 00 00  ................                                                 
                         00 00 00 00  00 00 00 00  00 00 00 01  01 00 01 00  ................                                                 
                         00 00 00 00  00 00 00 01  00 00 01 00  01 00 00 00  ................                                                 
  29.3    262144  IN     01 02 01 01  01 02 01 01  01 01 01 01  01 01 01 01  ................  2.0ms  2017/07/18  15:11:34.787  ntoskrnl      
                         01 01 01 01  01 01 01 01  01 02 01 01  00 01 00 01  ................                                                 
                         00 01 01 01  01 01 01 01  01 01 02 01  01 02 02 00  ................                                                 
                         02 01 01 01  01 02 01 01  01 01 01 01  01 01 01 01  ................                                                 
  29.3        32  IN     55 33 56 54  00 00 20 00  89 0f 00 00  00 00 00 00  U3VT.. .........   21us  2017/07/18  15:11:34.788  ntoskrnl      	# trailer_size is 0x20(32). block is 0xf89(3977). status is 0x0000. valid_payload_size is 0x140000(1310720). trailer_size_y is 0x400(1024).
                         00 00 00 00  00 00 14 00  00 00 00 00  00 04 00 00  ................                                                 
  29.3        52  IN     55 33 56 4c  00 00 34 00  8a 0f 00 00  00 00 00 00  U3VL..4.........   23us  2017/07/18  15:11:34.788  ntoskrnl      	# block is 0xf8a(3978) chunk_mode_active is 0. timestamp is 0xd325086c1(56678713025) pixel_format is 0x01080009(BayerRG8). size_x is 0x500(1280). size_y is 0x400(1024). offset_x is 0x0(0). offset_y is 0x0(0).
                         00 00 01 00  c1 86 50 32  0d 00 00 00  09 00 08 01  ......P2........                                                 
                         00 05 00 00  00 04 00 00  00 00 00 00  00 00 00 00  ................                                                 
                         00 00 00 00                                         ....                                                             
  29.3   1048576  IN     00 01 00 00  00 00 01 00  00 00 00 00  00 00 00 01  ................  8.6ms  2017/07/18  15:11:34.796  ntoskrnl      
                         00 01 00 00  00 00 00 00  00 00 00 00  00 01 00 00  ................                                                 
                         00 00 00 00  00 00 00 00  00 01 01 00  00 00 00 00  ................                                                 
                         00 01 00 00  00 00 00 01  01 00 00 00  00 00 00 00  ................                                                 
  29.3    262144  IN     01 01 01 01  01 01 01 01  01 01 01 01  02 01 01 01  ................  2.0ms  2017/07/18  15:11:34.798  ntoskrnl      
                         02 02 01 02  01 01 01 01  01 01 01 01  01 01 01 01  ................                                                 
                         00 01 01 02  01 01 01 01  01 02 01 01  01 01 02 01  ................                                                 
                         02 01 01 02  02 02 01 01  01 01 02 01  01 01 01 01  ................                                                 
  29.3        32  IN     55 33 56 54  00 00 20 00  8a 0f 00 00  00 00 00 00  U3VT.. .........   22us  2017/07/18  15:11:34.798  ntoskrnl      	# trailer_size is 0x20(32). block is 0xf8a(3978). status is 0x0000. valid_payload_size is 0x140000(1310720). trailer_size_y is 0x400(1024).
                         00 00 00 00  00 00 14 00  00 00 00 00  00 04 00 00  ................                                                 
  29.3        52  IN     55 33 56 4c  00 00 34 00  8b 0f 00 00  00 00 00 00  U3VL..4.........   13us  2017/07/18  15:11:34.798  ntoskrnl      	# block is 0xf8b(3979) chunk_mode_active is 0. timestamp is 0xd32f48ccb(56689462475) pixel_format is 0x01080009(BayerRG8). size_x is 0x500(1280). size_y is 0x400(1024). offset_x is 0x0(0). offset_y is 0x0(0).
                         00 00 01 00  cb 8c f4 32  0d 00 00 00  09 00 08 01  .......2........                                                 
                         00 05 00 00  00 04 00 00  00 00 00 00  00 00 00 00  ................                                                 
                         00 00 00 00                                         ....                                                             
  29.3   1048576  IN     01 00 00 00  00 00 01 00  00 00 00 00  00 00 00 01  ................  8.6ms  2017/07/18  15:11:34.807  ntoskrnl      
                         00 00 00 00  00 00 00 00  00 00 00 00  00 00 00 00  ................                                                 
                         01 00 01 00  00 00 01 00  00 00 00 01  00 00 00 00  ................                                                 
                         00 00 01 00  00 00 00 01  01 01 00 00  00 00 00 00  ................                                                 
  29.3    262144  IN     01 02 01 02  01 01 01 01  01 01 01 01  02 01 01 01  ................  2.0ms  2017/07/18  15:11:34.809  ntoskrnl      
                         01 02 01 01  01 02 01 01  00 02 01 01  00 01 00 01  ................                                                 
                         00 01 01 01  01 02 01 01  01 01 01 01  01 02 02 01  ................                                                 
                         02 02 01 01  01 01 02 01  01 01 01 01  01 02 01 01  ................                                                 
  29.3        32  IN     55 33 56 54  00 00 20 00  8b 0f 00 00  00 00 00 00  U3VT.. .........   24us  2017/07/18  15:11:34.809  ntoskrnl      	# trailer_size is 0x20(32). block is 0xf8b(3979). status is 0x0000. valid_payload_size is 0x140000(1310720). trailer_size_y is 0x400(1024).
                         00 00 00 00  00 00 14 00  00 00 00 00  00 04 00 00  ................                                                 
  29.3        52  IN     55 33 56 4c  00 00 34 00  8c 0f 00 00  00 00 00 00  U3VL..4.........   11us  2017/07/18  15:11:34.809  ntoskrnl      	# block is 0xf8c(3980) chunk_mode_active is 0. timestamp is 0xd339892d5(56700211925) pixel_format is 0x01080009(BayerRG8). size_x is 0x500(1280). size_y is 0x400(1024). offset_x is 0x0(0). offset_y is 0x0(0).
                         00 00 01 00  d5 92 98 33  0d 00 00 00  09 00 08 01  .......3........                                                 
                         00 05 00 00  00 04 00 00  00 00 00 00  00 00 00 00  ................                                                 
                         00 00 00 00                                         ....                                                             
  29.3   1048576  IN     01 00 00 00  00 00 01 00  00 00 01 00  00 00 00 01  ................  8.6ms  2017/07/18  15:11:34.818  ntoskrnl      
                         00 00 00 01  00 00 01 00  00 00 01 00  00 00 00 00  ................                                                 
                         00 00 01 01  00 00 00 00  00 00 00 01  00 00 00 00  ................                                                 
                         00 00 00 00  00 00 00 00  01 00 01 00  01 00 00 00  ................                                                 
  29.3    262144  IN     02 02 01 01  01 02 01 01  01 01 02 01  01 01 02 01  ................  2.0ms  2017/07/18  15:11:34.820  ntoskrnl      
                         01 02 01 01  01 01 00 01  01 02 01 01  01 01 00 01  ................                                                 
                         00 02 01 02  01 02 01 02  01 02 02 01  01 01 02 01  ................                                                 
                         02 01 01 02  02 01 01 02  00 01 01 01  01 01 02 01  ................                                                 
  29.3        32  IN     55 33 56 54  00 00 20 00  8c 0f 00 00  00 00 00 00  U3VT.. .........   30us  2017/07/18  15:11:34.820  ntoskrnl      	# trailer_size is 0x20(32). block is 0xf8c(3980). status is 0x0000. valid_payload_size is 0x140000(1310720). trailer_size_y is 0x400(1024).
                         00 00 00 00  00 00 14 00  00 00 00 00  00 04 00 00  ................                                                 
  29.3        52  IN     55 33 56 4c  00 00 34 00  8d 0f 00 00  00 00 00 00  U3VL..4.........   21us  2017/07/18  15:11:34.820  ntoskrnl      	# block is 0xf8d(3981) chunk_mode_active is 0. timestamp is 0xd343c98df(56710961375) pixel_format is 0x01080009(BayerRG8). size_x is 0x500(1280). size_y is 0x400(1024). offset_x is 0x0(0). offset_y is 0x0(0).
                         00 00 01 00  df 98 3c 34  0d 00 00 00  09 00 08 01  ......<4........                                                 
                         00 05 00 00  00 04 00 00  00 00 00 00  00 00 00 00  ................                                                 
                         00 00 00 00                                         ....                                                             
  29.3   1048576  IN     00 00 00 00  00 00 00 00  00 00 00 00  00 00 00 01  ................  8.6ms  2017/07/18  15:11:34.828  ntoskrnl      
                         00 00 00 00  01 00 00 00  00 00 00 01  00 00 00 00  ................                                                 
                         00 01 00 01  00 00 00 00  00 00 01 01  00 00 00 00  ................                                                 
                         00 00 00 00  00 00 00 01  00 00 00 00  01 01 00 00  ................                                                 
  29.3    262144  IN     01 01 02 01  01 01 01 01  02 01 01 01  01 01 01 01  ................  2.0ms  2017/07/18  15:11:34.830  ntoskrnl      
                         01 01 02 01  01 01 01 01  01 02 01 01  01 01 01 01  ................                                                 
                         00 01 01 02  01 01 01 01  01 01 01 01  01 01 02 01  ................                                                 
                         02 01 01 01  01 01 01 01  01 01 01 01  01 02 01 01  ................                                                 
  29.3        32  IN     55 33 56 54  00 00 20 00  8d 0f 00 00  00 00 00 00  U3VT.. .........   32us  2017/07/18  15:11:34.831  ntoskrnl      	# trailer_size is 0x20(32). block is 0xf8d(3981). status is 0x0000. valid_payload_size is 0x140000(1310720). trailer_size_y is 0x400(1024).
                         00 00 00 00  00 00 14 00  00 00 00 00  00 04 00 00  ................                                                 
  29.3        52  IN     55 33 56 4c  00 00 34 00  8e 0f 00 00  00 00 00 00  U3VL..4.........   14us  2017/07/18  15:11:34.831  ntoskrnl      	# block is 0xf8e(3982) chunk_mode_active is 0. timestamp is 0xd34e09ed0(56721710800) pixel_format is 0x01080009(BayerRG8). size_x is 0x500(1280). size_y is 0x400(1024). offset_x is 0x0(0). offset_y is 0x0(0).
                         00 00 01 00  d0 9e e0 34  0d 00 00 00  09 00 08 01  .......4........                                                 
                         00 05 00 00  00 04 00 00  00 00 00 00  00 00 00 00  ................                                                 
                         00 00 00 00                                         ....                                                             
  29.3   1048576  IN     00 00 01 01  01 00 00 00  01 00 01 00  00 00 00 01  ................  8.6ms  2017/07/18  15:11:34.839  ntoskrnl      
                         00 00 00 00  01 00 00 00  00 00 00 00  00 00 00 01  ................                                                 
                         00 00 00 01  00 00 00 00  00 00 01 00  01 00 00 00  ................                                                 
                         01 01 01 00  00 00 00 01  00 01 01 00  00 00 00 00  ................                                                 
  29.3    262144  IN     01 02 01 01  02 01 01 01  01 01 01 01  01 02 01 01  ................  2.0ms  2017/07/18  15:11:34.841  ntoskrnl      
                         01 02 01 01  01 02 01 01  01 01 01 01  01 01 00 01  ................                                                 
                         00 01 01 01  02 01 01 01  01 01 01 01  01 02 02 01  ................                                                 
                         01 02 01 01  01 01 01 01  01 01 02 01  01 01 01 01  ................                                                 
  29.3        32  IN     55 33 56 54  00 00 20 00  8e 0f 00 00  00 00 00 00  U3VT.. .........   44us  2017/07/18  15:11:34.841  ntoskrnl      	# trailer_size is 0x20(32). block is 0xf8e(3982). status is 0x0000. valid_payload_size is 0x140000(1310720). trailer_size_y is 0x400(1024).
                         00 00 00 00  00 00 14 00  00 00 00 00  00 04 00 00  ................                                                 
  29.3        52  IN     55 33 56 4c  00 00 34 00  8f 0f 00 00  00 00 00 00  U3VL..4.........   32us  2017/07/18  15:11:34.841  ntoskrnl      	# block is 0xf8f(3983) chunk_mode_active is 0. timestamp is 0xd3584a4da(56732460250) pixel_format is 0x01080009(BayerRG8). size_x is 0x500(1280). size_y is 0x400(1024). offset_x is 0x0(0). offset_y is 0x0(0).
                         00 00 01 00  da a4 84 35  0d 00 00 00  09 00 08 01  .......5........                                                 
                         00 05 00 00  00 04 00 00  00 00 00 00  00 00 00 00  ................                                                 
                         00 00 00 00                                         ....                                                             
  29.3   1048576  IN     00 00 00 00  00 00 00 00  00 00 00 00  00 00 00 01  ................  8.6ms  2017/07/18  15:11:34.850  ntoskrnl      
                         00 00 00 00  00 00 00 00  01 00 00 00  00 00 00 01  ................                                                 
                         00 01 00 01  00 00 00 00  00 01 01 00  00 00 00 00  ................                                                 
                         01 01 00 01  00 00 00 00  01 01 00 00  01 01 00 00  ................                                                 
  29.3    262144  IN     01 01 01 01  01 01 01 01  01 01 01 01  01 01 00 01  ................  2.0ms  2017/07/18  15:11:34.852  ntoskrnl      
                         01 02 01 01  01 01 01 01  01 01 01 01  01 01 00 00  ................                                                 
                         00 01 01 01  01 01 00 01  01 01 01 01  01 01 02 01  ................                                                 
                         02 01 01 02  01 01 01 01  01 01 02 01  01 01 01 01  ................                                                 
  29.3        32  IN     55 33 56 54  00 00 20 00  8f 0f 00 00  00 00 00 00  U3VT.. .........   23us  2017/07/18  15:11:34.852  ntoskrnl      	# trailer_size is 0x20(32). block is 0xf8f(3983). status is 0x0000. valid_payload_size is 0x140000(1310720). trailer_size_y is 0x400(1024).
                         00 00 00 00  00 00 14 00  00 00 00 00  00 04 00 00  ................                                                 
  29.3        52  IN     55 33 56 4c  00 00 34 00  90 0f 00 00  00 00 00 00  U3VL..4.........   19us  2017/07/18  15:11:34.852  ntoskrnl      	# block is 0xf90(3984) chunk_mode_active is 0. timestamp is 0xd3628aae4(56743209700) pixel_format is 0x01080009(BayerRG8). size_x is 0x500(1280). size_y is 0x400(1024). offset_x is 0x0(0). offset_y is 0x0(0).
                         00 00 01 00  e4 aa 28 36  0d 00 00 00  09 00 08 01  ......(6........                                                 
                         00 05 00 00  00 04 00 00  00 00 00 00  00 00 00 00  ................                                                 
                         00 00 00 00                                         ....                                                             
  29.3   1048576  IN     01 00 01 00  00 00 00 00  00 00 00 00  00 00 00 01  ................  8.6ms  2017/07/18  15:11:34.861  ntoskrnl      
                         00 00 00 00  00 00 00 00  00 00 00 00  00 00 00 01  ................                                                 
                         00 00 00 00  00 00 00 00  00 00 01 00  00 00 00 00  ................                                                 
                         00 00 00 00  00 00 01 00  00 00 00 00  00 01 00 00  ................                                                 
  29.3    262144  IN     01 01 00 01  01 01 01 01  01 01 01 01  01 01 00 01  ................  2.0ms  2017/07/18  15:11:34.863  ntoskrnl      
                         01 01 01 01  01 01 01 01  01 01 01 01  01 01 00 01  ................                                                 
                         00 00 01 01  01 02 01 01  01 01 01 01  01 02 02 01  ................                                                 
                         02 01 01 02  01 01 01 01  01 01 01 01  01 01 01 01  ................                                                 
  29.3        32  IN     55 33 56 54  00 00 20 00  90 0f 00 00  00 00 00 00  U3VT.. .........   28us  2017/07/18  15:11:34.863  ntoskrnl      	# trailer_size is 0x20(32). block is 0xf90(3984). status is 0x0000. valid_payload_size is 0x140000(1310720). trailer_size_y is 0x400(1024).
                         00 00 00 00  00 00 14 00  00 00 00 00  00 04 00 00  ................                                                 
  29.3        52  IN     55 33 56 4c  00 00 34 00  91 0f 00 00  00 00 00 00  U3VL..4.........   13us  2017/07/18  15:11:34.863  ntoskrnl      	# block is 0xf91(3985) chunk_mode_active is 0. timestamp is 0xd36cc88fd(56753948925) pixel_format is 0x01080009(BayerRG8). size_x is 0x500(1280). size_y is 0x400(1024). offset_x is 0x0(0). offset_y is 0x0(0).
                         00 00 01 00  fd 88 cc 36  0d 00 00 00  09 00 08 01  .......6........                                                 
                         00 05 00 00  00 04 00 00  00 00 00 00  00 00 00 00  ................                                                 
                         00 00 00 00                                         ....                                                             
  29.3   1048576  IN     00 00 00 01  00 01 01 00  00 00 00 00  00 00 00 01  ................  8.6ms  2017/07/18  15:11:34.871  ntoskrnl      
                         00 00 00 00  00 00 00 00  00 00 00 01  00 00 01 01  ................                                                 
                         00 00 00 00  00 00 01 00  00 01 00 00  01 00 00 00  ................                                                 
                         01 01 00 00  00 00 01 01  00 00 01 00  01 00 00 00  ................                                                 
  29.3    262144  IN     01 01 01 01  02 02 01 02  01 01 01 01  01 01 01 01  ................  2.0ms  2017/07/18  15:11:34.873  ntoskrnl      
                         01 01 01 02  01 01 01 01  01 02 01 01  01 02 01 01  ................                                                 
                         00 01 01 01  01 01 01 01  01 01 01 01  01 01 03 01  ................                                                 
                         02 01 01 01  02 01 01 01  01 01 01 01  01 02 01 01  ................                                                 
  29.3        32  IN     55 33 56 54  00 00 20 00  91 0f 00 00  00 00 00 00  U3VT.. .........   43us  2017/07/18  15:11:34.874  ntoskrnl      	# trailer_size is 0x20(32). block is 0xf91(3985). status is 0x0000. valid_payload_size is 0x140000(1310720). trailer_size_y is 0x400(1024).
                         00 00 00 00  00 00 14 00  00 00 00 00  00 04 00 00  ................                                                 
  29.3        52  IN     55 33 56 4c  00 00 34 00  92 0f 00 00  00 00 00 00  U3VL..4.........   11us  2017/07/18  15:11:34.874  ntoskrnl      	# block is 0xf92(3986) chunk_mode_active is 0. timestamp is 0xd37708f07(56764698375) pixel_format is 0x01080009(BayerRG8). size_x is 0x500(1280). size_y is 0x400(1024). offset_x is 0x0(0). offset_y is 0x0(0).
                         00 00 01 00  07 8f 70 37  0d 00 00 00  09 00 08 01  ......p7........                                                 
                         00 05 00 00  00 04 00 00  00 00 00 00  00 00 00 00  ................                                                 
                         00 00 00 00                                         ....                                                             
  29.3   1048576  IN     00 00 00 00  00 01 00 00  00 00 01 01  00 00 00 01  ................  8.6ms  2017/07/18  15:11:34.882  ntoskrnl      
                         00 00 01 01  00 01 00 00  01 01 00 01  00 00 00 00  ................                                                 
                         00 00 00 00  00 01 00 00  00 00 01 00  00 00 01 00  ................                                                 
                         00 01 00 00  00 00 00 01  01 00 00 00  00 00 00 00  ................                                                 
  29.3    262144  IN     01 02 01 01  01 02 01 01  02 01 02 01  02 01 01 01  ................  2.0ms  2017/07/18  15:11:34.884  ntoskrnl      
                         01 02 01 01  02 01 01 01  02 02 01 01  01 02 01 01  ................                                                 
                         00 02 02 02  01 02 01 01  01 01 01 01  01 01 02 01  ................                                                 
                         02 01 01 02  01 02 01 01  01 01 01 01  01 01 01 01  ................                                                 
  29.3        32  IN     55 33 56 54  00 00 20 00  92 0f 00 00  00 00 00 00  U3VT.. .........   25us  2017/07/18  15:11:34.884  ntoskrnl      	# trailer_size is 0x20(32). block is 0xf92(3986). status is 0x0000. valid_payload_size is 0x140000(1310720). trailer_size_y is 0x400(1024).
                         00 00 00 00  00 00 14 00  00 00 00 00  00 04 00 00  ................                                                 
  29.3        52  IN     55 33 56 4c  00 00 34 00  93 0f 00 00  00 00 00 00  U3VL..4.........   10us  2017/07/18  15:11:34.884  ntoskrnl      	# block is 0xf93(3987) chunk_mode_active is 0. timestamp is 0xd381494f8(56775447800) pixel_format is 0x01080009(BayerRG8). size_x is 0x500(1280). size_y is 0x400(1024). offset_x is 0x0(0). offset_y is 0x0(0).
                         00 00 01 00  f8 94 14 38  0d 00 00 00  09 00 08 01  .......8........                                                 
                         00 05 00 00  00 04 00 00  00 00 00 00  00 00 00 00  ................                                                 
                         00 00 00 00                                         ....                                                             
  29.3   1048576  IN     00 00 00 00  00 01 01 00  01 00 00 00  01 00 00 01  ................  8.6ms  2017/07/18  15:11:34.893  ntoskrnl      
                         00 00 00 00  01 00 00 00  01 00 00 01  00 00 00 00  ................                                                 
                         00 00 01 01  00 00 01 00  00 00 00 01  00 01 01 00  ................                                                 
                         01 00 00 00  00 00 01 01  01 00 00 00  00 01 00 00  ................                                                 
  29.3    262144  IN     01 01 01 02  01 01 02 01  02 01 02 01  02 01 01 01  ................  2.0ms  2017/07/18  15:11:34.895  ntoskrnl      
                         01 01 01 02  01 02 01 01  02 01 01 01  01 01 01 01  ................                                                 
                         00 01 01 02  01 01 01 01  01 01 01 01  01 01 02 01  ................                                                 
                         02 01 01 02  01 01 02 01  01 01 01 01  02 02 01 01  ................                                                 
  29.3        32  IN     55 33 56 54  00 00 20 00  93 0f 00 00  00 00 00 00  U3VT.. .........   38us  2017/07/18  15:11:34.895  ntoskrnl      	# trailer_size is 0x20(32). block is 0xf93(3987). status is 0x0000. valid_payload_size is 0x140000(1310720). trailer_size_y is 0x400(1024).
                         00 00 00 00  00 00 14 00  00 00 00 00  00 04 00 00  ................                                                 
  29.3        52  IN     55 33 56 4c  00 00 34 00  94 0f 00 00  00 00 00 00  U3VL..4.........   55us  2017/07/18  15:11:34.895  ntoskrnl      	# block is 0xf94(3988) chunk_mode_active is 0. timestamp is 0xd38b89b02(56786197250) pixel_format is 0x01080009(BayerRG8). size_x is 0x500(1280). size_y is 0x400(1024). offset_x is 0x0(0). offset_y is 0x0(0).
                         00 00 01 00  02 9b b8 38  0d 00 00 00  09 00 08 01  .......8........                                                 
                         00 05 00 00  00 04 00 00  00 00 00 00  00 00 00 00  ................                                                 
                         00 00 00 00                                         ....                                                             
  29.3   1048576  IN     00 00 00 01  00 01 01 00  00 00 01 00  00 00 00 01  ................  8.6ms  2017/07/18  15:11:34.904  ntoskrnl      
                         00 00 00 00  00 00 00 01  00 00 00 00  00 00 00 00  ................                                                 
                         00 00 01 00  00 00 01 00  01 01 00 00  00 00 00 00  ................                                                 
                         00 00 00 00  00 00 00 00  01 00 00 00  00 00 00 00  ................                                                 
  29.3    262144  IN     01 01 01 01  01 01 01 01  01 01 01 01  01 01 01 01  ................  2.0ms  2017/07/18  15:11:34.906  ntoskrnl      
                         01 02 01 01  01 02 01 02  01 02 01 01  00 01 01 00  ................                                                 
                         01 01 01 02  01 01 01 01  01 01 01 01  01 01 02 00  ................                                                 
                         01 01 01 01  01 02 01 01  01 01 01 01  01 01 01 01  ................                                                 
  29.3        32  IN     55 33 56 54  00 00 20 00  94 0f 00 00  00 00 00 00  U3VT.. .........   17us  2017/07/18  15:11:34.906  ntoskrnl      	# trailer_size is 0x20(32). block is 0xf94(3988). status is 0x0000. valid_payload_size is 0x140000(1310720). trailer_size_y is 0x400(1024).
                         00 00 00 00  00 00 14 00  00 00 00 00  00 04 00 00  ................                                                 
  29.3        52  IN     55 33 56 4c  00 00 34 00  95 0f 00 00  00 00 00 00  U3VL..4.........   20us  2017/07/18  15:11:34.906  ntoskrnl      	# block is 0xf95(3989) chunk_mode_active is 0. timestamp is 0xd395ca10c(56796946700) pixel_format is 0x01080009(BayerRG8). size_x is 0x500(1280). size_y is 0x400(1024). offset_x is 0x0(0). offset_y is 0x0(0).
                         00 00 01 00  0c a1 5c 39  0d 00 00 00  09 00 08 01  ......\9........                                                 
                         00 05 00 00  00 04 00 00  00 00 00 00  00 00 00 00  ................                                                 
                         00 00 00 00                                         ....                                                             
  29.3   1048576  IN     00 00 01 00  00 00 01 00  00 00 01 00  00 00 00 01  ................  8.7ms  2017/07/18  15:11:34.914  ntoskrnl      
                         00 00 00 00  00 00 00 00  00 00 00 00  00 00 00 00  ................                                                 
                         00 00 00 00  00 00 01 00  00 00 01 01  00 00 01 00  ................                                                 
                         00 00 00 00  00 00 00 00  00 00 00 00  00 00 00 01  ................                                                 
  29.3    262144  IN     01 01 01 01  02 01 01 01  01 01 01 01  02 01 01 01  ................  1.9ms  2017/07/18  15:11:34.916  ntoskrnl      
                         01 02 01 02  01 01 01 01  01 01 01 01  00 01 01 01  ................                                                 
                         00 01 01 02  01 01 01 01  01 01 01 01  01 02 02 01  ................                                                 
                         02 01 01 02  01 02 01 01  01 01 01 01  01 01 01 01  ................                                                 
  29.3        32  IN     55 33 56 54  00 00 20 00  95 0f 00 00  00 00 00 00  U3VT.. .........   22us  2017/07/18  15:11:34.916  ntoskrnl      	# trailer_size is 0x20(32). block is 0xf95(3989). status is 0x0000. valid_payload_size is 0x140000(1310720). trailer_size_y is 0x400(1024).
                         00 00 00 00  00 00 14 00  00 00 00 00  00 04 00 00  ................                                                 
  29.3        52  IN     55 33 56 4c  00 00 34 00  96 0f 00 00  00 00 00 00  U3VL..4.........   26us  2017/07/18  15:11:34.916  ntoskrnl      	# block is 0xf96(3990) chunk_mode_active is 0. timestamp is 0xd3a00a716(56807696150) pixel_format is 0x01080009(BayerRG8). size_x is 0x500(1280). size_y is 0x400(1024). offset_x is 0x0(0). offset_y is 0x0(0).
                         00 00 01 00  16 a7 00 3a  0d 00 00 00  09 00 08 01  .......:........                                                 
                         00 05 00 00  00 04 00 00  00 00 00 00  00 00 00 00  ................                                                 
                         00 00 00 00                                         ....                                                             
  29.3   1048576  IN     00 01 00 00  00 00 01 00  00 00 00 00  00 00 00 01  ................  8.6ms  2017/07/18  15:11:34.925  ntoskrnl      
                         00 00 00 00  00 00 01 00  00 00 00 00  00 00 00 00  ................                                                 
                         01 00 00 00  00 01 00 00  00 00 00 01  00 00 00 00  ................                                                 
                         01 00 00 01  00 00 00 01  00 00 00 00  00 00 00 00  ................                                                 
  29.3    262144  IN     01 01 01 02  02 01 01 01  02 02 02 01  01 01 01 01  ................  2.0ms  2017/07/18  15:11:34.927  ntoskrnl      
                         02 01 01 02  02 01 01 01  01 02 01 01  00 01 01 01  ................                                                 
                         00 01 01 02  02 01 01 01  01 01 01 02  01 01 02 01  ................                                                 
                         02 01 01 02  01 02 02 01  01 01 02 01  02 01 01 01  ................                                                 
  29.3        32  IN     55 33 56 54  00 00 20 00  96 0f 00 00  00 00 00 00  U3VT.. .........   41us  2017/07/18  15:11:34.927  ntoskrnl      	# trailer_size is 0x20(32). block is 0xf96(3990). status is 0x0000. valid_payload_size is 0x140000(1310720). trailer_size_y is 0x400(1024).
                         00 00 00 00  00 00 14 00  00 00 00 00  00 04 00 00  ................                                                 
  29.3        52  IN     55 33 56 4c  00 00 34 00  97 0f 00 00  00 00 00 00  U3VL..4.........   14us  2017/07/18  15:11:34.927  ntoskrnl      	# block is 0xf97(3991) chunk_mode_active is 0. timestamp is 0xd3aa4ad20(56818445600) pixel_format is 0x01080009(BayerRG8). size_x is 0x500(1280). size_y is 0x400(1024). offset_x is 0x0(0). offset_y is 0x0(0).
                         00 00 01 00  20 ad a4 3a  0d 00 00 00  09 00 08 01  .... ..:........                                                 
                         00 05 00 00  00 04 00 00  00 00 00 00  00 00 00 00  ................                                                 
                         00 00 00 00                                         ....                                                             
  29.3   1048576  IN     00 00 00 00  00 00 00 00  01 00 00 00  00 00 00 01  ................  8.6ms  2017/07/18  15:11:34.936  ntoskrnl      
                         00 00 00 00  00 00 00 00  00 00 00 00  00 00 00 00  ................                                                 
                         00 00 00 00  00 00 00 00  00 00 00 00  00 00 00 00  ................                                                 
                         00 01 00 01  00 00 01 00  01 00 00 00  00 00 00 00  ................                                                 
  29.3    262144  IN     01 01 01 02  02 01 01 00  02 01 01 01  02 01 01 01  ................  2.0ms  2017/07/18  15:11:34.938  ntoskrnl      
                         01 02 01 01  01 01 01 01  01 01 01 01  01 02 00 01  ................                                                 
                         00 01 01 02  02 02 01 01  01 01 01 01  01 01 02 01  ................                                                 
                         02 01 01 01  01 02 02 01  01 01 01 01  01 01 01 01  ................                                                 
  29.3        32  IN     55 33 56 54  00 00 20 00  97 0f 00 00  00 00 00 00  U3VT.. .........   17us  2017/07/18  15:11:34.938  ntoskrnl      	# trailer_size is 0x20(32). block is 0xf97(3991). status is 0x0000. valid_payload_size is 0x140000(1310720). trailer_size_y is 0x400(1024).
                         00 00 00 00  00 00 14 00  00 00 00 00  00 04 00 00  ................                                                 
  29.3        52  IN     55 33 56 4c  00 00 34 00  98 0f 00 00  00 00 00 00  U3VL..4.........    8us  2017/07/18  15:11:34.938  ntoskrnl      	# block is 0xf98(3992) chunk_mode_active is 0. timestamp is 0xd3b488b20(56829184800) pixel_format is 0x01080009(BayerRG8). size_x is 0x500(1280). size_y is 0x400(1024). offset_x is 0x0(0). offset_y is 0x0(0).
                         00 00 01 00  20 8b 48 3b  0d 00 00 00  09 00 08 01  .... .H;........                                                 
                         00 05 00 00  00 04 00 00  00 00 00 00  00 00 00 00  ................                                                 
                         00 00 00 00                                         ....                                                             
  29.3   1048576  IN     00 00 00 00  00 00 00 00  00 00 00 00  00 00 00 01  ................  8.6ms  2017/07/18  15:11:34.947  ntoskrnl      
                         00 00 00 00  00 00 00 00  00 00 00 00  00 00 00 00  ................                                                 
                         00 00 00 00  00 00 01 00  00 00 00 00  00 00 00 00  ................                                                 
                         00 00 00 00  00 00 00 00  00 00 00 00  00 00 00 00  ................                                                 
  29.3    262144  IN     01 02 01 01  01 02 01 01  01 01 01 01  01 01 01 01  ................  2.0ms  2017/07/18  15:11:34.949  ntoskrnl      
                         01 01 01 01  01 01 01 01  01 02 00 01  01 02 01 01  ................                                                 
                         00 01 02 02  01 01 01 01  01 01 01 01  01 01 02 01  ................                                                 
                         02 01 01 01  01 01 01 01  00 01 01 01  01 02 01 01  ................                                                 
  29.3        32  IN     55 33 56 54  00 00 20 00  98 0f 00 00  00 00 00 00  U3VT.. .........   26us  2017/07/18  15:11:34.949  ntoskrnl      	# trailer_size is 0x20(32). block is 0xf98(3992). status is 0x0000. valid_payload_size is 0x140000(1310720). trailer_size_y is 0x400(1024).
                         00 00 00 00  00 00 14 00  00 00 00 00  00 04 00 00  ................                                                 
  29.3        52  IN     55 33 56 4c  00 00 34 00  99 0f 00 00  00 00 00 00  U3VL..4.........   18us  2017/07/18  15:11:34.949  ntoskrnl      	# block is 0xf99(3993) chunk_mode_active is 0. timestamp is 0xd3bec912a(56839934250) pixel_format is 0x01080009(BayerRG8). size_x is 0x500(1280). size_y is 0x400(1024). offset_x is 0x0(0). offset_y is 0x0(0).
                         00 00 01 00  2a 91 ec 3b  0d 00 00 00  09 00 08 01  ....*..;........                                                 
                         00 05 00 00  00 04 00 00  00 00 00 00  00 00 00 00  ................                                                 
                         00 00 00 00                                         ....                                                             
  29.3   1048576  IN     00 00 00 00  00 00 00 00  00 00 00 00  00 00 00 01  ................  8.6ms  2017/07/18  15:11:34.957  ntoskrnl      
                         00 01 00 00  00 00 00 00  00 00 00 00  00 00 00 01  ................                                                 
                         00 00 00 00  00 00 00 00  01 00 00 01  00 01 00 01  ................                                                 
                         00 00 00 00  00 00 00 00  00 00 00 00  00 00 00 01  ................                                                 
  29.3    262144  IN     01 01 01 01  01 01 01 01  01 01 02 01  02 01 01 01  ................  2.0ms  2017/07/18  15:11:34.959  ntoskrnl      
                         01 01 01 01  01 01 01 01  01 02 01 01  00 01 01 01  ................                                                 
                         00 01 01 02  01 01 01 01  01 01 01 01  01 01 02 01  ................                                                 
                         01 01 01 02  01 01 02 01  01 01 01 01  01 01 01 01  ................                                                 
  29.3        32  IN     55 33 56 54  00 00 20 00  99 0f 00 00  00 00 00 00  U3VT.. .........   77us  2017/07/18  15:11:34.960  ntoskrnl      	# trailer_size is 0x20(32). block is 0xf99(3993). status is 0x0000. valid_payload_size is 0x140000(1310720). trailer_size_y is 0x400(1024).
                         00 00 00 00  00 00 14 00  00 00 00 00  00 04 00 00  ................                                                 
  29.3        52  IN     55 33 56 4c  00 00 34 00  9a 0f 00 00  00 00 00 00  U3VL..4.........   20us  2017/07/18  15:11:34.960  ntoskrnl      	# block is 0xf9a(3994) chunk_mode_active is 0. timestamp is 0xd3c909734(56850683700) pixel_format is 0x01080009(BayerRG8). size_x is 0x500(1280). size_y is 0x400(1024). offset_x is 0x0(0). offset_y is 0x0(0).
                         00 00 01 00  34 97 90 3c  0d 00 00 00  09 00 08 01  ....4..<........                                                 
                         00 05 00 00  00 04 00 00  00 00 00 00  00 00 00 00  ................                                                 
                         00 00 00 00                                         ....                                                             
  29.3   1048576  IN     00 01 00 00  00 00 00 00  00 00 00 00  00 00 00 01  ................  8.5ms  2017/07/18  15:11:34.968  ntoskrnl      
                         00 00 00 00  00 00 00 00  00 00 00 00  00 00 00 00  ................                                                 
                         00 00 00 00  00 00 00 00  00 00 00 01  00 00 00 00  ................                                                 
                         01 01 00 00  01 00 00 01  01 00 00 00  00 00 00 00  ................                                                 
  29.3    262144  IN     01 01 01 01  02 01 01 01  02 01 02 01  02 01 01 01  ................  2.0ms  2017/07/18  15:11:34.970  ntoskrnl      
                         01 02 01 01  01 02 01 01  01 02 01 01  00 01 01 01  ................                                                 
                         00 02 02 02  02 01 01 01  01 01 01 01  01 01 02 01  ................                                                 
                         02 01 01 01  02 01 01 01  01 01 01 01  01 01 01 01  ................                                                 
  29.3        32  IN     55 33 56 54  00 00 20 00  9a 0f 00 00  00 00 00 00  U3VT.. .........   24us  2017/07/18  15:11:34.970  ntoskrnl      	# trailer_size is 0x20(32). block is 0xf9a(3994). status is 0x0000. valid_payload_size is 0x140000(1310720). trailer_size_y is 0x400(1024).
                         00 00 00 00  00 00 14 00  00 00 00 00  00 04 00 00  ................                                                 
  29.3        52  IN     55 33 56 4c  00 00 34 00  9b 0f 00 00  00 00 00 00  U3VL..4.........   10us  2017/07/18  15:11:34.970  ntoskrnl      	# block is 0xf9b(3995) chunk_mode_active is 0. timestamp is 0xd3d349d3e(56861433150) pixel_format is 0x01080009(BayerRG8). size_x is 0x500(1280). size_y is 0x400(1024). offset_x is 0x0(0). offset_y is 0x0(0).
                         00 00 01 00  3e 9d 34 3d  0d 00 00 00  09 00 08 01  ....>.4=........                                                 
                         00 05 00 00  00 04 00 00  00 00 00 00  00 00 00 00  ................                                                 
                         00 00 00 00                                         ....                                                             
  29.3   1048576  IN     00 00 00 00  00 00 01 01  00 00 00 00  00 01 00 01  ................  8.6ms  2017/07/18  15:11:34.979  ntoskrnl      
                         00 00 00 00  00 01 00 00  01 00 00 00  00 00 00 00  ................                                                 
                         00 00 00 00  01 00 00 00  00 00 00 00  00 00 00 00  ................                                                 
                         01 00 01 00  00 00 00 00  00 00 00 00  01 00 00 00  ................                                                 
  29.3    262144  IN     01 01 02 01  02 02 01 01  01 01 02 01  02 01 01 01  ................  2.0ms  2017/07/18  15:11:34.981  ntoskrnl      
                         01 02 01 01  01 02 01 01  01 02 01 01  01 01 01 00  ................                                                 
                         00 01 02 02  01 01 01 01  01 01 01 02  01 02 02 01  ................                                                 
                         02 01 01 01  01 01 01 01  01 01 01 01  02 01 01 01  ................                                                 
  29.3        32  IN     55 33 56 54  00 00 20 00  9b 0f 00 00  00 00 00 00  U3VT.. .........   30us  2017/07/18  15:11:34.981  ntoskrnl      	# trailer_size is 0x20(32). block is 0xf9b(3995). status is 0x0000. valid_payload_size is 0x140000(1310720). trailer_size_y is 0x400(1024).
                         00 00 00 00  00 00 14 00  00 00 00 00  00 04 00 00  ................                                                 
  29.3        52  IN     55 33 56 4c  00 00 34 00  9c 0f 00 00  00 00 00 00  U3VL..4.........   19us  2017/07/18  15:11:34.981  ntoskrnl      	# block is 0xf9c(3996) chunk_mode_active is 0. timestamp is 0xd3dd8a348(56872182600) pixel_format is 0x01080009(BayerRG8). size_x is 0x500(1280). size_y is 0x400(1024). offset_x is 0x0(0). offset_y is 0x0(0).
                         00 00 01 00  48 a3 d8 3d  0d 00 00 00  09 00 08 01  ....H..=........                                                 
                         00 05 00 00  00 04 00 00  00 00 00 00  00 00 00 00  ................                                                 
                         00 00 00 00                                         ....                                                             
  29.3   1048576  IN     00 01 00 00  01 00 01 00  00 00 00 00  00 01 00 01  ................  8.6ms  2017/07/18  15:11:34.990  ntoskrnl      
                         00 01 00 00  00 01 00 00  01 00 00 01  00 00 00 01  ................                                                 
                         00 00 00 00  00 01 00 00  00 00 00 00  00 00 00 00  ................                                                 
                         01 00 00 00  00 00 00 01  01 01 00 00  00 00 00 00  ................                                                 
  29.3    262144  IN     02 01 01 01  01 01 01 01  01 01 01 01  01 01 01 01  ................  2.0ms  2017/07/18  15:11:34.992  ntoskrnl      
                         01 02 01 01  01 01 01 01  01 01 01 01  01 01 01 01  ................                                                 
                         00 01 01 02  02 01 01 01  01 01 01 01  01 01 02 01  ................                                                 
                         01 01 01 01  01 01 01 01  01 01 01 01  01 02 01 01  ................                                                 
  29.3        32  IN     55 33 56 54  00 00 20 00  9c 0f 00 00  00 00 00 00  U3VT.. .........   36us  2017/07/18  15:11:34.992  ntoskrnl      	# trailer_size is 0x20(32). block is 0xf9c(3996). status is 0x0000. valid_payload_size is 0x140000(1310720). trailer_size_y is 0x400(1024).
                         00 00 00 00  00 00 14 00  00 00 00 00  00 04 00 00  ................                                                 
  29.3        52  IN     55 33 56 4c  00 00 34 00  9d 0f 00 00  00 00 00 00  U3VL..4.........   28us  2017/07/18  15:11:34.992  ntoskrnl      	# block is 0xf9d(3997) chunk_mode_active is 0. timestamp is 0xd3e7ca939(56882932025) pixel_format is 0x01080009(BayerRG8). size_x is 0x500(1280). size_y is 0x400(1024). offset_x is 0x0(0). offset_y is 0x0(0).
                         00 00 01 00  39 a9 7c 3e  0d 00 00 00  09 00 08 01  ....9..>........                                                 
                         00 05 00 00  00 04 00 00  00 00 00 00  00 00 00 00  ................                                                 
                         00 00 00 00                                         ....                                                             
  29.3   1048576  IN     00 00 00 01  00 00 01 00  00 00 00 00  00 00 01 00  ................  8.6ms  2017/07/18  15:11:35.000  ntoskrnl      
                         00 00 00 00  01 01 00 01  01 00 00 01  00 00 00 01  ................                                                 
                         00 00 00 00  00 00 01 00  00 00 00 01  01 00 01 00  ................                                                 
                         00 01 00 00  00 00 00 00  01 00 00 00  00 00 00 01  ................                                                 
  29.3    262144  IN     01 00 01 01  02 01 01 01  02 01 01 01  01 01 01 01  ................  2.0ms  2017/07/18  15:11:35.002  ntoskrnl      
                         01 02 01 01  00 01 01 01  01 01 00 01  01 01 01 00  ................                                                 
                         00 01 01 02  01 01 01 01  01 01 01 01  01 01 02 01  ................                                                 
                         02 01 01 01  01 01 01 01  01 01 01 01  01 02 01 01  ................                                                 
  29.3        32  IN     55 33 56 54  00 00 20 00  9d 0f 00 00  00 00 00 00  U3VT.. .........   22us  2017/07/18  15:11:35.002  ntoskrnl      	# trailer_size is 0x20(32). block is 0xf9d(3997). status is 0x0000. valid_payload_size is 0x140000(1310720). trailer_size_y is 0x400(1024).
                         00 00 00 00  00 00 14 00  00 00 00 00  00 04 00 00  ................                                                 
  29.3        52  IN     55 33 56 4c  00 00 34 00  9e 0f 00 00  00 00 00 00  U3VL..4.........   12us  2017/07/18  15:11:35.002  ntoskrnl      	# block is 0xf9e(3998) chunk_mode_active is 0. timestamp is 0xd3f20af43(56893681475) pixel_format is 0x01080009(BayerRG8). size_x is 0x500(1280). size_y is 0x400(1024). offset_x is 0x0(0). offset_y is 0x0(0).
                         00 00 01 00  43 af 20 3f  0d 00 00 00  09 00 08 01  ....C. ?........                                                 
                         00 05 00 00  00 04 00 00  00 00 00 00  00 00 00 00  ................                                                 
                         00 00 00 00                                         ....                                                             
  29.3   1048576  IN     00 00 00 00  00 00 00 00  00 00 00 00  00 00 00 01  ................  8.7ms  2017/07/18  15:11:35.011  ntoskrnl      
                         00 00 00 00  00 01 00 00  01 00 00 01  00 00 00 00  ................                                                 
                         00 00 00 00  00 00 01 00  01 01 00 00  00 00 00 00  ................                                                 
                         00 01 00 00  00 00 00 00  01 00 00 00  00 01 00 00  ................                                                 
  29.3    262144  IN     02 01 01 01  01 01 01 01  02 01 01 01  01 01 01 01  ................  2.0ms  2017/07/18  15:11:35.013  ntoskrnl      
                         01 01 01 01  01 01 01 01  01 01 01 01  01 01 00 01  ................                                                 
                         00 01 01 01  01 01 01 01  01 01 01 01  01 01 02 01  ................                                                 
                         02 01 01 02  01 01 01 01  01 01 01 01  01 01 01 01  ................                                                 
  29.3        32  IN     55 33 56 54  00 00 20 00  9e 0f 00 00  00 00 00 00  U3VT.. .........   37us  2017/07/18  15:11:35.013  ntoskrnl      	# trailer_size is 0x20(32). block is 0xf9e(3998). status is 0x0000. valid_payload_size is 0x140000(1310720). trailer_size_y is 0x400(1024).
                         00 00 00 00  00 00 14 00  00 00 00 00  00 04 00 00  ................                                                 
  29.3        52  IN     55 33 56 4c  00 00 34 00  9f 0f 00 00  00 00 00 00  U3VL..4.........   17us  2017/07/18  15:11:35.013  ntoskrnl      	# block is 0xf9f(3999) chunk_mode_active is 0. timestamp is 0xd3fc48d5c(56904420700) pixel_format is 0x01080009(BayerRG8). size_x is 0x500(1280). size_y is 0x400(1024). offset_x is 0x0(0). offset_y is 0x0(0).
                         00 00 01 00  5c 8d c4 3f  0d 00 00 00  09 00 08 01  ....\..?........                                                 
                         00 05 00 00  00 04 00 00  00 00 00 00  00 00 00 00  ................                                                 
                         00 00 00 00                                         ....                                                             
  29.3   1048576  IN     00 01 00 00  00 00 01 00  01 00 01 00  00 01 00 01  ................  8.6ms  2017/07/18  15:11:35.022  ntoskrnl      
                         00 00 00 00  00 00 00 00  01 00 00 00  00 00 00 00  ................                                                 
                         00 00 00 00  00 01 00 00  00 00 00 01  00 00 00 00  ................                                                 
                         01 01 00 00  01 01 00 01  01 00 01 00  01 01 00 00  ................                                                 
  29.3    262144  IN     01 01 01 01  01 02 01 01  02 01 02 01  01 01 01 01  ................  2.0ms  2017/07/18  15:11:35.024  ntoskrnl      
                         01 01 01 01  01 01 02 01  01 01 01 01  00 02 00 01  ................                                                 
                         00 01 01 02  01 01 01 01  01 01 01 01  02 01 03 01  ................                                                 
                         02 01 01 01  01 02 01 01  01 01 01 01  02 02 01 01  ................                                                 
  29.3        32  IN     55 33 56 54  00 00 20 00  9f 0f 00 00  00 00 00 00  U3VT.. .........   43us  2017/07/18  15:11:35.024  ntoskrnl      	# trailer_size is 0x20(32). block is 0xf9f(3999). status is 0x0000. valid_payload_size is 0x140000(1310720). trailer_size_y is 0x400(1024).
                         00 00 00 00  00 00 14 00  00 00 00 00  00 04 00 00  ................                                                 
  29.3        52  IN     55 33 56 4c  00 00 34 00  a0 0f 00 00  00 00 00 00  U3VL..4.........   25us  2017/07/18  15:11:35.024  ntoskrnl      	# block is 0xfa0(4000) chunk_mode_active is 0. timestamp is 0xd40689366(56915170150) pixel_format is 0x01080009(BayerRG8). size_x is 0x500(1280). size_y is 0x400(1024). offset_x is 0x0(0). offset_y is 0x0(0).
                         00 00 01 00  66 93 68 40  0d 00 00 00  09 00 08 01  ....f.h@........                                                 
                         00 05 00 00  00 04 00 00  00 00 00 00  00 00 00 00  ................                                                 
                         00 00 00 00                                         ....                                                             
  29.3   1048576  IN     00 01 01 01  00 00 01 00  00 00 00 00  00 00 00 01  ................  8.5ms  2017/07/18  15:11:35.033  ntoskrnl      
                         00 00 00 00  00 00 00 00  00 00 00 00  00 00 00 00  ................                                                 
                         00 00 01 00  00 00 00 00  00 00 00 00  00 00 00 00  ................                                                 
                         01 00 01 00  00 00 01 01  01 00 00 00  00 01 00 00  ................                                                 
  29.3    262144  IN     01 01 01 01  02 02 01 01  02 01 02 01  02 02 02 01  ................  2.0ms  2017/07/18  15:11:35.035  ntoskrnl      
                         01 01 01 01  01 01 01 02  01 01 01 01  01 02 02 00  ................                                                 
                         01 01 01 02  01 01 01 01  01 01 01 01  01 01 02 01  ................                                                 
                         02 01 01 02  01 01 02 01  01 01 01 01  01 01 02 02  ................                                                 
  29.3        32  IN     55 33 56 54  00 00 20 00  a0 0f 00 00  00 00 00 00  U3VT.. .........   36us  2017/07/18  15:11:35.035  ntoskrnl      	# trailer_size is 0x20(32). block is 0xfa0(4000). status is 0x0000. valid_payload_size is 0x140000(1310720). trailer_size_y is 0x400(1024).
                         00 00 00 00  00 00 14 00  00 00 00 00  00 04 00 00  ................                                                 
  29.3        52  IN     55 33 56 4c  00 00 34 00  a1 0f 00 00  00 00 00 00  U3VL..4.........   17us  2017/07/18  15:11:35.035  ntoskrnl      	# block is 0xfa1(4001) chunk_mode_active is 0. timestamp is 0xd410c9970(56925919600) pixel_format is 0x01080009(BayerRG8). size_x is 0x500(1280). size_y is 0x400(1024). offset_x is 0x0(0). offset_y is 0x0(0).
                         00 00 01 00  70 99 0c 41  0d 00 00 00  09 00 08 01  ....p..A........                                                 
                         00 05 00 00  00 04 00 00  00 00 00 00  00 00 00 00  ................                                                 
                         00 00 00 00                                         ....                                                             
  29.3   1048576  IN     00 01 00 01  01 01 01 00  00 00 00 00  00 01 01 01  ................  8.6ms  2017/07/18  15:11:35.043  ntoskrnl      
                         00 01 00 01  00 00 00 00  00 00 00 01  00 00 00 00  ................                                                 
                         00 00 00 00  00 00 00 00  00 00 01 01  00 00 00 00  ................                                                 
                         00 01 00 01  00 01 01 01  00 00 00 00  01 00 01 00  ................                                                 
  29.3    262144  IN     02 01 01 01  02 02 01 01  01 01 01 01  01 02 01 01  ................  2.0ms  2017/07/18  15:11:35.045  ntoskrnl      
                         01 02 01 01  01 01 01 01  01 02 01 01  01 01 01 01  ................                                                 
                         00 01 02 02  02 01 01 01  01 01 01 01  01 01 02 01  ................                                                 
                         02 01 01 01  01 01 01 01  01 01 01 01  02 01 01 01  ................                                                 
  29.3        32  IN     55 33 56 54  00 00 20 00  a1 0f 00 00  00 00 00 00  U3VT.. .........   35us  2017/07/18  15:11:35.046  ntoskrnl      	# trailer_size is 0x20(32). block is 0xfa1(4001). status is 0x0000. valid_payload_size is 0x140000(1310720). trailer_size_y is 0x400(1024).
                         00 00 00 00  00 00 14 00  00 00 00 00  00 04 00 00  ................                                                 
  29.3        52  IN     55 33 56 4c  00 00 34 00  a2 0f 00 00  00 00 00 00  U3VL..4.........   20us  2017/07/18  15:11:35.046  ntoskrnl      	# block is 0xfa2(4002) chunk_mode_active is 0. timestamp is 0xd41b09f61(56936669025) pixel_format is 0x01080009(BayerRG8). size_x is 0x500(1280). size_y is 0x400(1024). offset_x is 0x0(0). offset_y is 0x0(0).
                         00 00 01 00  61 9f b0 41  0d 00 00 00  09 00 08 01  ....a..A........                                                 
                         00 05 00 00  00 04 00 00  00 00 00 00  00 00 00 00  ................                                                 
                         00 00 00 00                                         ....                                                             
  29.3   1048576  IN     00 00 00 00  00 00 00 00  01 00 00 00  00 00 00 01  ................  8.6ms  2017/07/18  15:11:35.054  ntoskrnl      
                         00 00 00 01  00 00 00 00  00 00 00 00  00 01 00 01  ................                                                 
                         01 00 00 01  00 00 01 00  00 00 00 01  00 00 00 00  ................                                                 
                         00 00 00 00  00 00 00 01  01 00 00 00  00 01 01 00  ................                                                 
  29.3    262144  IN     01 01 01 01  01 01 01 01  01 01 02 01  01 01 01 01  ................  2.0ms  2017/07/18  15:11:35.056  ntoskrnl      
                         01 01 01 01  01 01 01 01  01 01 01 01  00 02 01 01  ................                                                 
                         00 00 01 01  01 01 01 01  01 01 01 01  01 01 02 01  ................                                                 
                         01 01 01 01  01 02 01 01  01 00 01 01  01 01 01 02  ................                                                 
  29.3        32  IN     55 33 56 54  00 00 20 00  a2 0f 00 00  00 00 00 00  U3VT.. .........   20us  2017/07/18  15:11:35.056  ntoskrnl      	# trailer_size is 0x20(32). block is 0xfa2(4002). status is 0x0000. valid_payload_size is 0x140000(1310720). trailer_size_y is 0x400(1024).
                         00 00 00 00  00 00 14 00  00 00 00 00  00 04 00 00  ................                                                 
  29.3        52  IN     55 33 56 4c  00 00 34 00  a3 0f 00 00  00 00 00 00  U3VL..4.........   19us  2017/07/18  15:11:35.056  ntoskrnl      	# block is 0xfa3(4003) chunk_mode_active is 0. timestamp is 0xd4254a56b(56947418475) pixel_format is 0x01080009(BayerRG8). size_x is 0x500(1280). size_y is 0x400(1024). offset_x is 0x0(0). offset_y is 0x0(0).
                         00 00 01 00  6b a5 54 42  0d 00 00 00  09 00 08 01  ....k.TB........                                                 
                         00 05 00 00  00 04 00 00  00 00 00 00  00 00 00 00  ................                                                 
                         00 00 00 00                                         ....                                                             
  29.3   1048576  IN     00 00 01 00  00 00 00 00  00 00 00 00  00 00 00 01  ................  8.6ms  2017/07/18  15:11:35.065  ntoskrnl      
                         00 00 00 00  00 00 00 00  00 00 00 01  00 00 00 00  ................                                                 
                         00 00 00 00  00 00 01 00  00 00 00 01  00 00 00 00  ................                                                 
                         00 01 01 00  00 00 00 01  01 00 00 00  00 01 00 00  ................                                                 
  29.3    262144  IN     01 01 01 01  02 01 01 01  01 01 01 01  01 01 01 01  ................  2.0ms  2017/07/18  15:11:35.067  ntoskrnl      
                         01 01 01 01  01 01 01 01  01 02 01 01  01 01 01 00  ................                                                 
                         00 01 01 02  01 01 01 01  01 01 01 01  01 01 02 01  ................                                                 
                         01 01 01 02  01 01 01 01  01 01 01 01  01 01 01 01  ................                                                 
  29.3        32  IN     55 33 56 54  00 00 20 00  a3 0f 00 00  00 00 00 00  U3VT.. .........   19us  2017/07/18  15:11:35.067  ntoskrnl      	# trailer_size is 0x20(32). block is 0xfa3(4003). status is 0x0000. valid_payload_size is 0x140000(1310720). trailer_size_y is 0x400(1024).
                         00 00 00 00  00 00 14 00  00 00 00 00  00 04 00 00  ................                                                 
  29.3        52  IN     55 33 56 4c  00 00 34 00  a4 0f 00 00  00 00 00 00  U3VL..4.........   15us  2017/07/18  15:11:35.067  ntoskrnl      	# block is 0xfa4(4004) chunk_mode_active is 0. timestamp is 0xd42f8ab75(56958167925) pixel_format is 0x01080009(BayerRG8). size_x is 0x500(1280). size_y is 0x400(1024). offset_x is 0x0(0). offset_y is 0x0(0).
                         00 00 01 00  75 ab f8 42  0d 00 00 00  09 00 08 01  ....u..B........                                                 
                         00 05 00 00  00 04 00 00  00 00 00 00  00 00 00 00  ................                                                 
                         00 00 00 00                                         ....                                                             
  29.3   1048576  IN     00 01 01 00  00 00 00 00  00 00 00 00  00 00 00 01  ................  8.6ms  2017/07/18  15:11:35.076  ntoskrnl      
                         00 00 00 00  00 00 00 00  00 00 00 00  00 00 00 00  ................                                                 
                         00 00 01 00  00 00 01 00  00 00 00 00  00 00 00 00  ................                                                 
                         00 01 00 01  00 00 00 01  01 01 00 00  00 00 00 00  ................                                                 
  29.3    262144  IN     01 01 01 01  01 01 01 01  02 02 02 01  01 01 01 01  ................  2.0ms  2017/07/18  15:11:35.078  ntoskrnl      
                         01 02 01 01  01 01 01 01  01 01 01 01  01 01 01 01  ................                                                 
                         00 01 01 02  01 01 01 01  01 01 01 01  01 01 02 01  ................                                                 
                         02 01 01 02  01 01 02 01  01 01 02 02  01 01 01 01  ................                                                 
  29.3        32  IN     55 33 56 54  00 00 20 00  a4 0f 00 00  00 00 00 00  U3VT.. .........   18us  2017/07/18  15:11:35.078  ntoskrnl      	# trailer_size is 0x20(32). block is 0xfa4(4004). status is 0x0000. valid_payload_size is 0x140000(1310720). trailer_size_y is 0x400(1024).
                         00 00 00 00  00 00 14 00  00 00 00 00  00 04 00 00  ................                                                 
  29.3        52  IN     55 33 56 4c  00 00 34 00  a5 0f 00 00  00 00 00 00  U3VL..4.........    8us  2017/07/18  15:11:35.078  ntoskrnl      	# block is 0xfa5(4005) chunk_mode_active is 0. timestamp is 0xd439cb17f(56968917375) pixel_format is 0x01080009(BayerRG8). size_x is 0x500(1280). size_y is 0x400(1024). offset_x is 0x0(0). offset_y is 0x0(0).
                         00 00 01 00  7f b1 9c 43  0d 00 00 00  09 00 08 01  .......C........                                                 
                         00 05 00 00  00 04 00 00  00 00 00 00  00 00 00 00  ................                                                 
                         00 00 00 00                                         ....                                                             
  29.3   1048576  IN     00 01 00 00  00 00 01 00  00 00 01 01  00 00 00 01  ................  8.7ms  2017/07/18  15:11:35.086  ntoskrnl      
                         00 00 00 01  00 00 01 01  00 00 00 01  00 00 01 01  ................                                                 
                         00 00 00 01  01 00 01 00  00 00 01 01  00 00 01 00  ................                                                 
                         01 01 01 01  00 01 01 01  01 01 00 00  00 00 00 00  ................                                                 
  29.3    262144  IN     02 01 01 01  02 01 01 01  01 02 01 01  01 01 01 01  ................  2.0ms  2017/07/18  15:11:35.088  ntoskrnl      
                         02 02 02 01  01 01 02 01  01 01 01 01  00 01 00 01  ................                                                 
                         00 01 01 02  01 02 01 01  01 01 01 01  01 01 02 01  ................                                                 
                         02 01 01 02  01 02 01 01  01 01 02 02  01 01 01 02  ................                                                 
  29.3        32  IN     55 33 56 54  00 00 20 00  a5 0f 00 00  00 00 00 00  U3VT.. .........   36us  2017/07/18  15:11:35.089  ntoskrnl      	# trailer_size is 0x20(32). block is 0xfa5(4005). status is 0x0000. valid_payload_size is 0x140000(1310720). trailer_size_y is 0x400(1024).
                         00 00 00 00  00 00 14 00  00 00 00 00  00 04 00 00  ................                                                 
  29.3        52  IN     55 33 56 4c  00 00 34 00  a6 0f 00 00  00 00 00 00  U3VL..4.........   19us  2017/07/18  15:11:35.089  ntoskrnl      	# block is 0xfa6(4006) chunk_mode_active is 0. timestamp is 0xd44408f98(56979656600) pixel_format is 0x01080009(BayerRG8). size_x is 0x500(1280). size_y is 0x400(1024). offset_x is 0x0(0). offset_y is 0x0(0).
                         00 00 01 00  98 8f 40 44  0d 00 00 00  09 00 08 01  ......@D........                                                 
                         00 05 00 00  00 04 00 00  00 00 00 00  00 00 00 00  ................                                                 
                         00 00 00 00                                         ....                                                             
  29.3   1048576  IN     01 01 00 00  00 01 01 00  00 00 00 00  00 00 00 01  ................  8.6ms  2017/07/18  15:11:35.097  ntoskrnl      
                         00 01 00 00  00 00 00 00  00 00 00 00  00 01 00 01  ................                                                 
                         00 00 01 01  00 00 00 00  00 00 00 01  00 01 00 00  ................                                                 
                         01 00 00 01  00 00 00 00  01 00 00 00  00 01 00 00  ................                                                 
  29.3    262144  IN     01 01 01 01  02 01 01 01  01 01 02 01  01 01 01 01  ................  2.0ms  2017/07/18  15:11:35.099  ntoskrnl      
                         01 02 01 02  01 01 01 01  01 02 00 01  01 01 00 01  ................                                                 
                         00 01 02 02  01 01 02 01  01 01 01 01  01 01 01 01  ................                                                 
                         01 01 01 02  01 02 01 01  01 00 01 01  01 01 01 01  ................                                                 
  29.3        32  IN     55 33 56 54  00 00 20 00  a6 0f 00 00  00 00 00 00  U3VT.. .........   41us  2017/07/18  15:11:35.099  ntoskrnl      	# trailer_size is 0x20(32). block is 0xfa6(4006). status is 0x0000. valid_payload_size is 0x140000(1310720). trailer_size_y is 0x400(1024).
                         00 00 00 00  00 00 14 00  00 00 00 00  00 04 00 00  ................                                                 
  29.3        52  IN     55 33 56 4c  00 00 34 00  a7 0f 00 00  00 00 00 00  U3VL..4.........   23us  2017/07/18  15:11:35.099  ntoskrnl      	# block is 0xfa7(4007) chunk_mode_active is 0. timestamp is 0xd44e49589(56990406025) pixel_format is 0x01080009(BayerRG8). size_x is 0x500(1280). size_y is 0x400(1024). offset_x is 0x0(0). offset_y is 0x0(0).
                         00 00 01 00  89 95 e4 44  0d 00 00 00  09 00 08 01  .......D........                                                 
                         00 05 00 00  00 04 00 00  00 00 00 00  00 00 00 00  ................                                                 
                         00 00 00 00                                         ....                                                             
  29.3   1048576  IN     00 00 00 00  00 00 00 00  00 00 00 00  00 00 00 01  ................  8.5ms  2017/07/18  15:11:35.108  ntoskrnl      
                         00 00 00 00  00 00 00 00  00 00 00 01  00 00 00 01  ................                                                 
                         00 00 01 00  01 00 01 00  00 00 00 01  01 00 00 00  ................                                                 
                         01 01 01 00  00 00 00 00  01 01 00 00  01 01 00 00  ................                                                 
  29.3    262144  IN     02 01 01 01  01 02 01 01  02 02 01 01  02 01 01 01  ................  2.0ms  2017/07/18  15:11:35.110  ntoskrnl      
                         01 01 02 02  01 02 02 01  02 01 01 01  01 01 01 01  ................                                                 
                         01 01 01 01  02 02 01 01  01 01 01 02  01 01 02 01  ................                                                 
                         02 01 01 02  01 02 01 01  01 01 02 01  02 01 02 02  ................                                                 
  29.3        32  IN     55 33 56 54  00 00 20 00  a7 0f 00 00  00 00 00 00  U3VT.. .........   37us  2017/07/18  15:11:35.110  ntoskrnl      	# trailer_size is 0x20(32). block is 0xfa7(4007). status is 0x0000. valid_payload_size is 0x140000(1310720). trailer_size_y is 0x400(1024).
                         00 00 00 00  00 00 14 00  00 00 00 00  00 04 00 00  ................                                                 
  29.3        52  IN     55 33 56 4c  00 00 34 00  a8 0f 00 00  00 00 00 00  U3VL..4.........   13us  2017/07/18  15:11:35.110  ntoskrnl      	# block is 0xfa8(4008) chunk_mode_active is 0. timestamp is 0xd45889b93(57001155475) pixel_format is 0x01080009(BayerRG8). size_x is 0x500(1280). size_y is 0x400(1024). offset_x is 0x0(0). offset_y is 0x0(0).
                         00 00 01 00  93 9b 88 45  0d 00 00 00  09 00 08 01  .......E........                                                 
                         00 05 00 00  00 04 00 00  00 00 00 00  00 00 00 00  ................                                                 
                         00 00 00 00                                         ....                                                             
  29.3   1048576  IN     00 00 01 00  00 00 00 00  00 00 01 00  00 01 00 01  ................  8.6ms  2017/07/18  15:11:35.119  ntoskrnl      
                         00 01 00 00  00 00 00 00  00 00 00 00  00 00 01 01  ................                                                 
                         00 00 00 00  00 00 00 00  00 00 00 01  00 00 00 00  ................                                                 
                         01 01 00 01  00 00 00 00  01 01 01 01  00 01 00 00  ................                                                 
  29.3    262144  IN     01 01 01 02  01 01 01 01  01 01 01 00  02 01 01 02  ................  2.0ms  2017/07/18  15:11:35.121  ntoskrnl      
                         01 01 01 01  01 01 01 01  01 01 01 01  00 01 01 01  ................                                                 
                         00 01 01 02  01 01 01 01  01 01 01 01  01 01 02 01  ................                                                 
                         02 01 01 02  01 01 01 02  01 01 02 01  02 02 02 02  ................                                                 
  29.3        32  IN     55 33 56 54  00 00 20 00  a8 0f 00 00  00 00 00 00  U3VT.. .........   26us  2017/07/18  15:11:35.121  ntoskrnl      	# trailer_size is 0x20(32). block is 0xfa8(4008). status is 0x0000. valid_payload_size is 0x140000(1310720). trailer_size_y is 0x400(1024).
                         00 00 00 00  00 00 14 00  00 00 00 00  00 04 00 00  ................                                                 
  29.3        52  IN     55 33 56 4c  00 00 34 00  a9 0f 00 00  00 00 00 00  U3VL..4.........   12us  2017/07/18  15:11:35.121  ntoskrnl      	# block is 0xfa9(4009) chunk_mode_active is 0. timestamp is 0xd462ca19d(57011904925) pixel_format is 0x01080009(BayerRG8). size_x is 0x500(1280). size_y is 0x400(1024). offset_x is 0x0(0). offset_y is 0x0(0).
                         00 00 01 00  9d a1 2c 46  0d 00 00 00  09 00 08 01  ......,F........                                                 
                         00 05 00 00  00 04 00 00  00 00 00 00  00 00 00 00  ................                                                 
                         00 00 00 00                                         ....                                                             
  29.3   1048576  IN     00 00 00 00  00 00 01 00  01 00 00 00  00 00 00 01  ................  8.6ms  2017/07/18  15:11:35.129  ntoskrnl      
                         00 00 00 00  00 00 01 00  00 00 00 01  00 00 00 00  ................                                                 
                         01 00 01 01  01 00 00 00  00 00 00 00  00 00 00 00  ................                                                 
                         01 00 00 00  00 00 00 01  01 01 00 00  01 01 01 01  ................                                                 
  29.3    262144  IN     01 02 01 02  02 01 01 01  02 01 01 01  01 01 01 01  ................  2.0ms  2017/07/18  15:11:35.131  ntoskrnl      
                         01 01 01 02  01 01 01 01  02 01 01 01  01 01 01 01  ................                                                 
                         00 01 01 02  01 01 01 01  01 01 01 01  01 01 02 01  ................                                                 
                         02 01 01 01  01 01 01 01  01 01 02 01  02 01 01 01  ................                                                 
  29.3        32  IN     55 33 56 54  00 00 20 00  a9 0f 00 00  00 00 00 00  U3VT.. .........   22us  2017/07/18  15:11:35.131  ntoskrnl      	# trailer_size is 0x20(32). block is 0xfa9(4009). status is 0x0000. valid_payload_size is 0x140000(1310720). trailer_size_y is 0x400(1024).
                         00 00 00 00  00 00 14 00  00 00 00 00  00 04 00 00  ................                                                 
  29.3        52  IN     55 33 56 4c  00 00 34 00  aa 0f 00 00  00 00 00 00  U3VL..4.........    8us  2017/07/18  15:11:35.131  ntoskrnl      	# block is 0xfaa(4010) chunk_mode_active is 0. timestamp is 0xd46d0a7a7(57022654375) pixel_format is 0x01080009(BayerRG8). size_x is 0x500(1280). size_y is 0x400(1024). offset_x is 0x0(0). offset_y is 0x0(0).
                         00 00 01 00  a7 a7 d0 46  0d 00 00 00  09 00 08 01  .......F........                                                 
                         00 05 00 00  00 04 00 00  00 00 00 00  00 00 00 00  ................                                                 
                         00 00 00 00                                         ....                                                             
  29.3   1048576  IN     00 01 00 00  01 00 01 00  01 00 00 01  00 00 00 01  ................  8.7ms  2017/07/18  15:11:35.140  ntoskrnl      
                         00 00 00 00  00 00 00 00  00 00 00 00  00 01 00 00  ................                                                 
                         00 00 00 00  00 01 01 00  00 00 01 01  00 00 01 00  ................                                                 
                         00 00 01 00  00 00 01 01  01 00 00 00  00 01 00 00  ................                                                 
  29.3    262144  IN     01 01 01 01  02 01 01 01  02 01 01 01  02 01 01 01  ................  2.0ms  2017/07/18  15:11:35.142  ntoskrnl      
                         01 01 01 01  01 01 01 01  01 01 01 01  00 01 01 01  ................                                                 
                         00 01 01 02  01 01 01 01  01 01 01 01  01 01 02 01  ................                                                 
                         02 01 01 01  01 01 01 01  01 01 01 01  01 01 01 01  ................                                                 
  29.3        32  IN     55 33 56 54  00 00 20 00  aa 0f 00 00  00 00 00 00  U3VT.. .........   33us  2017/07/18  15:11:35.142  ntoskrnl      	# trailer_size is 0x20(32). block is 0xfaa(4010). status is 0x0000. valid_payload_size is 0x140000(1310720). trailer_size_y is 0x400(1024).
                         00 00 00 00  00 00 14 00  00 00 00 00  00 04 00 00  ................                                                 
  29.3        52  IN     55 33 56 4c  00 00 34 00  ab 0f 00 00  00 00 00 00  U3VL..4.........   38us  2017/07/18  15:11:35.142  ntoskrnl      	# block is 0xfab(4011) chunk_mode_active is 0. timestamp is 0xd4774ad98(57033403800) pixel_format is 0x01080009(BayerRG8). size_x is 0x500(1280). size_y is 0x400(1024). offset_x is 0x0(0). offset_y is 0x0(0).
                         00 00 01 00  98 ad 74 47  0d 00 00 00  09 00 08 01  ......tG........                                                 
                         00 05 00 00  00 04 00 00  00 00 00 00  00 00 00 00  ................                                                 
                         00 00 00 00                                         ....                                                             
  29.3   1048576  IN     00 00 00 00  00 00 00 00  00 00 00 00  00 00 00 01  ................  8.6ms  2017/07/18  15:11:35.151  ntoskrnl      
                         00 00 00 00  00 00 00 00  01 00 00 00  00 00 01 00  ................                                                 
                         00 00 00 00  00 00 00 00  00 00 00 00  00 00 00 00  ................                                                 
                         00 00 00 00  00 00 00 00  01 00 00 00  00 00 00 00  ................                                                 
  29.3    262144  IN     01 01 01 01  01 01 01 01  01 01 01 01  02 01 01 01  ................  2.0ms  2017/07/18  15:11:35.153  ntoskrnl      
                         01 01 01 01  01 01 01 01  01 01 01 01  01 01 01 01  ................                                                 
                         00 01 01 02  01 01 01 01  01 01 01 01  01 01 02 01  ................                                                 
                         01 01 01 02  02 01 01 01  01 00 01 01  01 01 01 01  ................                                                 
  29.3        32  IN     55 33 56 54  00 00 20 00  ab 0f 00 00  00 00 00 00  U3VT.. .........   44us  2017/07/18  15:11:35.153  ntoskrnl      	# trailer_size is 0x20(32). block is 0xfab(4011). status is 0x0000. valid_payload_size is 0x140000(1310720). trailer_size_y is 0x400(1024).
                         00 00 00 00  00 00 14 00  00 00 00 00  00 04 00 00  ................                                                 
  29.3        52  IN     55 33 56 4c  00 00 34 00  ac 0f 00 00  00 00 00 00  U3VL..4.........   21us  2017/07/18  15:11:35.153  ntoskrnl      	# block is 0xfac(4012) chunk_mode_active is 0. timestamp is 0xd4818b3a2(57044153250) pixel_format is 0x01080009(BayerRG8). size_x is 0x500(1280). size_y is 0x400(1024). offset_x is 0x0(0). offset_y is 0x0(0).
                         00 00 01 00  a2 b3 18 48  0d 00 00 00  09 00 08 01  .......H........                                                 
                         00 05 00 00  00 04 00 00  00 00 00 00  00 00 00 00  ................                                                 
                         00 00 00 00                                         ....                                                             
  29.3   1048576  IN     01 00 00 01  01 00 00 00  00 00 00 01  00 01 00 00  ................  8.6ms  2017/07/18  15:11:35.162  ntoskrnl      
                         00 00 00 00  00 01 00 00  00 00 00 01  00 00 00 00  ................                                                 
                         01 00 00 00  01 00 01 00  00 00 00 01  00 00 00 00  ................                                                 
                         01 01 00 01  00 00 01 01  01 00 01 00  00 01 00 00  ................                                                 
  29.3    262144  IN     01 01 01 01  01 01 01 00  01 01 02 01  01 01 01 01  ................  2.0ms  2017/07/18  15:11:35.164  ntoskrnl      
                         01 01 01 01  01 01 01 01  01 01 01 01  01 01 00 00  ................                                                 
                         00 02 01 02  01 02 01 00  01 01 01 01  01 01 02 01  ................                                                 
                         02 02 01 01  01 01 01 01  01 01 01 01  01 01 01 01  ................                                                 
  29.3        32  IN     55 33 56 54  00 00 20 00  ac 0f 00 00  00 00 00 00  U3VT.. .........   20us  2017/07/18  15:11:35.164  ntoskrnl      	# trailer_size is 0x20(32). block is 0xfac(4012). status is 0x0000. valid_payload_size is 0x140000(1310720). trailer_size_y is 0x400(1024).
                         00 00 00 00  00 00 14 00  00 00 00 00  00 04 00 00  ................                                                 
  29.3        52  IN     55 33 56 4c  00 00 34 00  ad 0f 00 00  00 00 00 00  U3VL..4.........    7us  2017/07/18  15:11:35.164  ntoskrnl      	# block is 0xfad(4013) chunk_mode_active is 0. timestamp is 0xd48bc91bb(57054892475) pixel_format is 0x01080009(BayerRG8). size_x is 0x500(1280). size_y is 0x400(1024). offset_x is 0x0(0). offset_y is 0x0(0).
                         00 00 01 00  bb 91 bc 48  0d 00 00 00  09 00 08 01  .......H........                                                 
                         00 05 00 00  00 04 00 00  00 00 00 00  00 00 00 00  ................                                                 
                         00 00 00 00                                         ....                                                             
  29.3   1048576  IN     00 00 00 00  00 01 01 00  00 00 00 00  00 00 00 01  ................  8.6ms  2017/07/18  15:11:35.172  ntoskrnl      
                         00 01 00 00  00 00 00 00  00 00 00 01  00 01 00 00  ................                                                 
                         00 00 00 00  00 00 00 00  00 00 01 01  00 00 01 00  ................                                                 
                         00 00 00 00  00 00 00 00  01 01 00 00  01 00 00 00  ................                                                 
  29.3    262144  IN     01 01 01 02  02 02 01 01  01 01 02 01  01 02 01 01  ................  2.0ms  2017/07/18  15:11:35.174  ntoskrnl      
                         01 01 01 01  01 01 01 01  01 01 01 01  01 01 01 01  ................                                                 
                         00 01 01 01  01 01 01 01  01 02 01 02  01 01 02 01  ................                                                 
                         02 01 01 02  01 01 01 01  01 01 01 01  01 01 01 01  ................                                                 
  29.3        32  IN     55 33 56 54  00 00 20 00  ad 0f 00 00  00 00 00 00  U3VT.. .........   31us  2017/07/18  15:11:35.174  ntoskrnl      	# trailer_size is 0x20(32). block is 0xfad(4013). status is 0x0000. valid_payload_size is 0x140000(1310720). trailer_size_y is 0x400(1024).
                         00 00 00 00  00 00 14 00  00 00 00 00  00 04 00 00  ................                                                 
  29.3        52  IN     55 33 56 4c  00 00 34 00  ae 0f 00 00  00 00 00 00  U3VL..4.........   17us  2017/07/18  15:11:35.174  ntoskrnl      	# block is 0xfae(4014) chunk_mode_active is 0. timestamp is 0xd496097c5(57065641925) pixel_format is 0x01080009(BayerRG8). size_x is 0x500(1280). size_y is 0x400(1024). offset_x is 0x0(0). offset_y is 0x0(0).
                         00 00 01 00  c5 97 60 49  0d 00 00 00  09 00 08 01  ......`I........                                                 
                         00 05 00 00  00 04 00 00  00 00 00 00  00 00 00 00  ................                                                 
                         00 00 00 00                                         ....                                                             
  29.3   1048576  IN     00 00 00 00  00 00 00 00  00 00 00 00  01 01 00 01  ................  8.6ms  2017/07/18  15:11:35.183  ntoskrnl      
                         00 01 00 00  00 00 00 00  00 00 00 00  00 00 00 00  ................                                                 
                         00 00 01 00  00 00 00 00  00 00 00 00  00 00 00 00  ................                                                 
                         00 00 00 00  00 00 00 00  01 00 00 00  00 00 00 00  ................                                                 
  29.3    262144  IN     01 01 01 01  01 01 01 01  01 01 01 01  01 01 01 01  ................  2.0ms  2017/07/18  15:11:35.185  ntoskrnl      
                         01 02 01 01  01 01 01 01  01 01 01 01  01 01 01 00  ................                                                 
                         00 01 01 01  01 01 01 01  01 01 01 01  01 01 01 01  ................                                                 
                         02 01 01 01  01 01 01 01  01 01 01 01  01 01 01 01  ................                                                 
  29.3        32  IN     55 33 56 54  00 00 20 00  ae 0f 00 00  00 00 00 00  U3VT.. .........   24us  2017/07/18  15:11:35.185  ntoskrnl      	# trailer_size is 0x20(32). block is 0xfae(4014). status is 0x0000. valid_payload_size is 0x140000(1310720). trailer_size_y is 0x400(1024).
                         00 00 00 00  00 00 14 00  00 00 00 00  00 04 00 00  ................                                                 
  29.3        52  IN     55 33 56 4c  00 00 34 00  af 0f 00 00  00 00 00 00  U3VL..4.........   33us  2017/07/18  15:11:35.185  ntoskrnl      	# block is 0xfaf(4015) chunk_mode_active is 0. timestamp is 0xd4a049dcf(57076391375) pixel_format is 0x01080009(BayerRG8). size_x is 0x500(1280). size_y is 0x400(1024). offset_x is 0x0(0). offset_y is 0x0(0).
                         00 00 01 00  cf 9d 04 4a  0d 00 00 00  09 00 08 01  .......J........                                                 
                         00 05 00 00  00 04 00 00  00 00 00 00  00 00 00 00  ................                                                 
                         00 00 00 00                                         ....                                                             
  29.3   1048576  IN     00 00 00 00  00 00 00 00  01 00 00 00  00 00 00 00  ................  8.6ms  2017/07/18  15:11:35.194  ntoskrnl      
                         00 00 00 01  00 00 00 00  00 00 00 00  00 00 00 00  ................                                                 
                         00 00 01 01  00 00 00 00  00 00 00 00  00 00 00 00  ................                                                 
                         00 00 00 00  00 00 00 01  00 00 00 00  01 01 00 00  ................                                                 
  29.3    262144  IN     02 01 02 01  01 01 01 01  02 01 02 01  02 01 01 01  ................  2.0ms  2017/07/18  15:11:35.196  ntoskrnl      
                         01 02 02 01  01 01 01 01  01 01 01 01  01 01 01 00  ................                                                 
                         00 01 01 02  02 01 01 01  01 01 01 01  01 01 01 01  ................                                                 
                         02 01 01 01  02 01 01 01  00 01 01 01  01 01 01 01  ................                                                 
  29.3        32  IN     55 33 56 54  00 00 20 00  af 0f 00 00  00 00 00 00  U3VT.. .........   20us  2017/07/18  15:11:35.196  ntoskrnl      	# trailer_size is 0x20(32). block is 0xfaf(4015). status is 0x0000. valid_payload_size is 0x140000(1310720). trailer_size_y is 0x400(1024).
                         00 00 00 00  00 00 14 00  00 00 00 00  00 04 00 00  ................                                                 
  29.3        52  IN     55 33 56 4c  00 00 34 00  b0 0f 00 00  00 00 00 00  U3VL..4.........   23us  2017/07/18  15:11:35.196  ntoskrnl      	# block is 0xfb0(4016) chunk_mode_active is 0. timestamp is 0xd4aa8a3c0(57087140800) pixel_format is 0x01080009(BayerRG8). size_x is 0x500(1280). size_y is 0x400(1024). offset_x is 0x0(0). offset_y is 0x0(0).
                         00 00 01 00  c0 a3 a8 4a  0d 00 00 00  09 00 08 01  .......J........                                                 
                         00 05 00 00  00 04 00 00  00 00 00 00  00 00 00 00  ................                                                 
                         00 00 00 00                                         ....                                                             
  29.3   1048576  IN     00 00 00 00  00 00 00 00  00 00 00 00  00 00 00 01  ................  8.6ms  2017/07/18  15:11:35.205  ntoskrnl      
                         00 00 00 00  00 00 00 00  00 00 00 01  00 00 00 00  ................                                                 
                         00 00 00 01  00 00 01 00  00 00 00 01  00 00 00 00  ................                                                 
                         01 01 01 00  00 00 00 00  01 00 00 00  00 00 00 00  ................                                                 
  29.3    262144  IN     01 01 02 01  01 02 01 01  02 01 02 01  01 01 01 01  ................  2.0ms  2017/07/18  15:11:35.207  ntoskrnl      
                         01 02 01 01  01 01 01 02  01 02 01 01  01 01 01 01  ................                                                 
                         01 01 01 02  01 02 01 01  00 01 01 02  01 01 02 02  ................                                                 
                         02 01 01 02  01 02 02 01  01 02 02 01  02 02 01 01  ................                                                 
  29.3        32  IN     55 33 56 54  00 00 20 00  b0 0f 00 00  00 00 00 00  U3VT.. .........   19us  2017/07/18  15:11:35.207  ntoskrnl      	# trailer_size is 0x20(32). block is 0xfb0(4016). status is 0x0000. valid_payload_size is 0x140000(1310720). trailer_size_y is 0x400(1024).
                         00 00 00 00  00 00 14 00  00 00 00 00  00 04 00 00  ................                                                 
  29.3        52  IN     55 33 56 4c  00 00 34 00  b1 0f 00 00  00 00 00 00  U3VL..4.........   15us  2017/07/18  15:11:35.207  ntoskrnl      	# block is 0xfb1(4017) chunk_mode_active is 0. timestamp is 0xd4b4ca9ca(57097890250) pixel_format is 0x01080009(BayerRG8). size_x is 0x500(1280). size_y is 0x400(1024). offset_x is 0x0(0). offset_y is 0x0(0).
                         00 00 01 00  ca a9 4c 4b  0d 00 00 00  09 00 08 01  ......LK........                                                 
                         00 05 00 00  00 04 00 00  00 00 00 00  00 00 00 00  ................                                                 
                         00 00 00 00                                         ....                                                             
  29.3   1048576  IN     00 00 00 00  00 00 01 00  01 00 00 00  00 01 00 00  ................  8.7ms  2017/07/18  15:11:35.215  ntoskrnl      
                         00 00 00 01  00 00 00 00  01 00 00 00  00 00 00 00  ................                                                 
                         00 00 00 00  00 00 00 00  00 01 01 00  00 00 00 00  ................                                                 
                         00 01 00 00  00 00 00 01  00 00 00 00  00 01 00 00  ................                                                 
  29.3    262144  IN     01 01 01 01  01 01 01 01  01 02 02 01  02 01 01 01  ................  2.0ms  2017/07/18  15:11:35.217  ntoskrnl      
                         01 01 01 01  01 01 01 02  01 02 01 01  01 02 00 00  ................                                                 
                         00 01 01 01  01 01 01 01  00 01 01 01  02 01 02 01  ................                                                 
                         02 01 01 02  02 01 01 01  01 01 02 01  02 02 01 01  ................                                                 
  29.3        32  IN     55 33 56 54  00 00 20 00  b1 0f 00 00  00 00 00 00  U3VT.. .........   23us  2017/07/18  15:11:35.217  ntoskrnl      	# trailer_size is 0x20(32). block is 0xfb1(4017). status is 0x0000. valid_payload_size is 0x140000(1310720). trailer_size_y is 0x400(1024).
                         00 00 00 00  00 00 14 00  00 00 00 00  00 04 00 00  ................                                                 
  29.3        52  IN     55 33 56 4c  00 00 34 00  b2 0f 00 00  00 00 00 00  U3VL..4.........   10us  2017/07/18  15:11:35.217  ntoskrnl      	# block is 0xfb2(4018) chunk_mode_active is 0. timestamp is 0xd4bf0afd4(57108639700) pixel_format is 0x01080009(BayerRG8). size_x is 0x500(1280). size_y is 0x400(1024). offset_x is 0x0(0). offset_y is 0x0(0).
                         00 00 01 00  d4 af f0 4b  0d 00 00 00  09 00 08 01  .......K........                                                 
                         00 05 00 00  00 04 00 00  00 00 00 00  00 00 00 00  ................                                                 
                         00 00 00 00                                         ....                                                             
  29.3   1048576  IN     00 00 00 00  00 00 00 00  00 00 00 00  00 00 00 01  ................  8.6ms  2017/07/18  15:11:35.226  ntoskrnl      
                         00 00 00 00  00 01 00 00  00 00 00 01  00 00 01 01  ................                                                 
                         00 00 00 01  00 00 00 00  00 00 01 00  00 00 00 00  ................                                                 
                         01 01 00 00  00 00 00 00  00 01 00 00  00 00 00 00  ................                                                 
  29.3    262144  IN     02 02 01 01  02 01 01 01  01 01 01 01  01 01 01 01  ................  2.0ms  2017/07/18  15:11:35.228  ntoskrnl      
                         01 01 02 01  01 01 01 01  01 02 01 01  00 01 00 01  ................                                                 
                         01 01 02 01  01 02 01 01  01 01 01 01  01 01 02 01  ................                                                 
                         02 02 01 01  01 02 01 01  01 01 01 01  01 01 01 01  ................                                                 
  29.3        32  IN     55 33 56 54  00 00 20 00  b2 0f 00 00  00 00 00 00  U3VT.. .........   22us  2017/07/18  15:11:35.228  ntoskrnl      	# trailer_size is 0x20(32). block is 0xfb2(4018). status is 0x0000. valid_payload_size is 0x140000(1310720). trailer_size_y is 0x400(1024).
                         00 00 00 00  00 00 14 00  00 00 00 00  00 04 00 00  ................                                                 
  29.3        52  IN     55 33 56 4c  00 00 34 00  b3 0f 00 00  00 00 00 00  U3VL..4.........    8us  2017/07/18  15:11:35.228  ntoskrnl      	# block is 0xfb3(4019) chunk_mode_active is 0. timestamp is 0xd4c94b5de(57119389150) pixel_format is 0x01080009(BayerRG8). size_x is 0x500(1280). size_y is 0x400(1024). offset_x is 0x0(0). offset_y is 0x0(0).
                         00 00 01 00  de b5 94 4c  0d 00 00 00  09 00 08 01  .......L........                                                 
                         00 05 00 00  00 04 00 00  00 00 00 00  00 00 00 00  ................                                                 
                         00 00 00 00                                         ....                                                             
  29.3   1048576  IN     00 00 00 00  00 00 01 00  00 00 00 00  00 00 00 01  ................  8.7ms  2017/07/18  15:11:35.237  ntoskrnl      
                         00 01 00 01  00 00 00 00  00 00 00 00  00 00 00 00  ................                                                 
                         00 00 00 00  00 00 01 00  00 00 00 00  00 00 00 00  ................                                                 
                         00 00 00 00  00 00 00 01  01 00 00 00  01 00 00 00  ................                                                 
  29.3    262144  IN     01 01 01 01  01 01 01 02  02 01 02 01  01 01 01 01  ................  2.0ms  2017/07/18  15:11:35.239  ntoskrnl      
                         01 01 01 01  01 01 01 01  01 01 01 01  00 01 01 01  ................                                                 
                         00 01 01 02  01 02 01 01  01 01 01 01  01 01 02 01  ................                                                 
                         02 02 01 02  01 01 01 01  00 01 01 01  01 01 01 01  ................                                                 
  29.3        32  IN     55 33 56 54  00 00 20 00  b3 0f 00 00  00 00 00 00  U3VT.. .........   33us  2017/07/18  15:11:35.239  ntoskrnl      	# trailer_size is 0x20(32). block is 0xfb3(4019). status is 0x0000. valid_payload_size is 0x140000(1310720). trailer_size_y is 0x400(1024).
                         00 00 00 00  00 00 14 00  00 00 00 00  00 04 00 00  ................                                                 
  29.3        52  IN     55 33 56 4c  00 00 34 00  b4 0f 00 00  00 00 00 00  U3VL..4.........   16us  2017/07/18  15:11:35.239  ntoskrnl      	# block is 0xfb4(4020) chunk_mode_active is 0. timestamp is 0xd4d3893f7(57130128375) pixel_format is 0x01080009(BayerRG8). size_x is 0x500(1280). size_y is 0x400(1024). offset_x is 0x0(0). offset_y is 0x0(0).
                         00 00 01 00  f7 93 38 4d  0d 00 00 00  09 00 08 01  ......8M........                                                 
                         00 05 00 00  00 04 00 00  00 00 00 00  00 00 00 00  ................                                                 
                         00 00 00 00                                         ....                                                             
  29.3   1048576  IN     00 00 01 00  00 00 00 00  00 00 00 00  00 00 00 01  ................  8.6ms  2017/07/18  15:11:35.248  ntoskrnl      
                         00 00 00 00  00 00 00 00  00 00 00 01  00 00 00 00  ................                                                 
                         00 00 01 00  00 01 00 00  00 00 01 00  00 00 00 00  ................                                                 
                         00 00 01 00  00 00 00 01  01 00 00 00  01 01 00 00  ................                                                 
  29.3    262144  IN     01 01 01 01  01 01 01 01  02 01 01 01  01 01 01 01  ................  2.0ms  2017/07/18  15:11:35.250  ntoskrnl      
                         01 01 01 01  01 02 01 01  01 01 01 01  00 01 01 01  ................                                                 
                         01 01 02 01  01 01 01 01  01 01 01 01  01 01 02 01  ................                                                 
                         02 01 01 00  01 01 01 01  01 01 01 01  01 01 01 01  ................                                                 
  29.3        32  IN     55 33 56 54  00 00 20 00  b4 0f 00 00  00 00 00 00  U3VT.. .........   20us  2017/07/18  15:11:35.250  ntoskrnl      	# trailer_size is 0x20(32). block is 0xfb4(4020). status is 0x0000. valid_payload_size is 0x140000(1310720). trailer_size_y is 0x400(1024).
                         00 00 00 00  00 00 14 00  00 00 00 00  00 04 00 00  ................                                                 
  29.3        52  IN     55 33 56 4c  00 00 34 00  b5 0f 00 00  00 00 00 00  U3VL..4.........   30us  2017/07/18  15:11:35.250  ntoskrnl      	# block is 0xfb5(4021) chunk_mode_active is 0. timestamp is 0xd4ddc99e8(57140877800) pixel_format is 0x01080009(BayerRG8). size_x is 0x500(1280). size_y is 0x400(1024). offset_x is 0x0(0). offset_y is 0x0(0).
                         00 00 01 00  e8 99 dc 4d  0d 00 00 00  09 00 08 01  .......M........                                                 
                         00 05 00 00  00 04 00 00  00 00 00 00  00 00 00 00  ................                                                 
                         00 00 00 00                                         ....                                                             
  29.3   1048576  IN     01 00 00 00  01 00 01 00  00 00 00 00  00 00 00 01  ................  8.6ms  2017/07/18  15:11:35.258  ntoskrnl      
                         00 00 00 00  00 01 00 00  00 00 00 01  00 00 00 01  ................                                                 
                         00 00 01 00  00 00 01 00  00 00 01 01  00 00 00 00  ................                                                 
                         01 00 00 00  00 00 00 01  00 00 00 00  00 00 00 00  ................                                                 
  29.3    262144  IN     02 01 01 01  01 01 01 00  01 02 01 01  01 01 01 01  ................  2.0ms  2017/07/18  15:11:35.260  ntoskrnl      
                         02 01 01 01  01 01 01 01  01 01 01 01  00 01 01 01  ................                                                 
                         00 01 01 02  01 01 01 01  01 01 01 01  01 01 02 01  ................                                                 
                         02 01 01 01  01 01 01 01  01 01 01 01  02 01 02 01  ................                                                 
  29.3        32  IN     55 33 56 54  00 00 20 00  b5 0f 00 00  00 00 00 00  U3VT.. .........   22us  2017/07/18  15:11:35.260  ntoskrnl      	# trailer_size is 0x20(32). block is 0xfb5(4021). status is 0x0000. valid_payload_size is 0x140000(1310720). trailer_size_y is 0x400(1024).
                         00 00 00 00  00 00 14 00  00 00 00 00  00 04 00 00  ................                                                 
  29.3        52  IN     55 33 56 4c  00 00 34 00  b6 0f 00 00  00 00 00 00  U3VL..4.........   11us  2017/07/18  15:11:35.260  ntoskrnl      	# block is 0xfb6(4022) chunk_mode_active is 0. timestamp is 0xd4e809ff2(57151627250) pixel_format is 0x01080009(BayerRG8). size_x is 0x500(1280). size_y is 0x400(1024). offset_x is 0x0(0). offset_y is 0x0(0).
                         00 00 01 00  f2 9f 80 4e  0d 00 00 00  09 00 08 01  .......N........                                                 
                         00 05 00 00  00 04 00 00  00 00 00 00  00 00 00 00  ................                                                 
                         00 00 00 00                                         ....                                                             
  29.3   1048576  IN     01 01 00 00  01 00 00 00  00 00 00 00  01 01 00 01  ................  8.6ms  2017/07/18  15:11:35.269  ntoskrnl      
                         00 00 00 00  00 00 00 01  00 00 00 01  00 00 00 00  ................                                                 
                         00 00 01 00  00 00 00 00  00 00 00 00  00 01 00 00  ................                                                 
                         00 00 00 01  00 00 01 01  01 00 00 00  00 00 00 00  ................                                                 
  29.3    262144  IN     01 02 01 01  02 01 01 01  01 02 01 01  02 02 01 01  ................  2.0ms  2017/07/18  15:11:35.271  ntoskrnl      
                         02 02 02 02  01 01 01 01  01 01 01 01  01 01 01 00  ................                                                 
                         00 01 01 01  01 01 01 01  01 01 02 01  01 01 03 01  ................                                                 
                         02 01 01 01  02 01 01 02  00 01 01 01  01 01 01 01  ................                                                 
  29.3        32  IN     55 33 56 54  00 00 20 00  b6 0f 00 00  00 00 00 00  U3VT.. .........   32us  2017/07/18  15:11:35.271  ntoskrnl      	# trailer_size is 0x20(32). block is 0xfb6(4022). status is 0x0000. valid_payload_size is 0x140000(1310720). trailer_size_y is 0x400(1024).
                         00 00 00 00  00 00 14 00  00 00 00 00  00 04 00 00  ................                                                 
  29.3        52  IN     55 33 56 4c  00 00 34 00  b7 0f 00 00  00 00 00 00  U3VL..4.........   16us  2017/07/18  15:11:35.271  ntoskrnl      	# block is 0xfb7(4023) chunk_mode_active is 0. timestamp is 0xd4f24a5fc(57162376700) pixel_format is 0x01080009(BayerRG8). size_x is 0x500(1280). size_y is 0x400(1024). offset_x is 0x0(0). offset_y is 0x0(0).
                         00 00 01 00  fc a5 24 4f  0d 00 00 00  09 00 08 01  ......$O........                                                 
                         00 05 00 00  00 04 00 00  00 00 00 00  00 00 00 00  ................                                                 
                         00 00 00 00                                         ....                                                             
  29.3   1048576  IN     01 00 00 00  00 00 00 00  00 00 01 00  00 00 01 01  ................  8.5ms  2017/07/18  15:11:35.280  ntoskrnl      
                         00 01 00 00  00 00 00 00  00 00 00 00  00 00 00 01  ................                                                 
                         00 01 00 01  00 00 01 00  00 00 00 00  00 00 00 00  ................                                                 
                         00 00 00 00  00 00 01 00  00 00 00 00  00 00 00 00  ................                                                 
  29.3    262144  IN     02 01 01 01  01 01 01 01  01 01 01 01  02 01 01 01  ................  2.0ms  2017/07/18  15:11:35.282  ntoskrnl      
                         01 01 01 01  01 01 01 01  01 01 01 01  01 01 00 00  ................                                                 
                         00 01 01 02  01 02 01 01  01 01 01 01  01 01 02 01  ................                                                 
                         02 01 01 02  01 01 01 01  01 01 01 01  02 02 01 02  ................                                                 
  29.3        32  IN     55 33 56 54  00 00 20 00  b7 0f 00 00  00 00 00 00  U3VT.. .........   21us  2017/07/18  15:11:35.282  ntoskrnl      	# trailer_size is 0x20(32). block is 0xfb7(4023). status is 0x0000. valid_payload_size is 0x140000(1310720). trailer_size_y is 0x400(1024).
                         00 00 00 00  00 00 14 00  00 00 00 00  00 04 00 00  ................                                                 
  29.3        52  IN     55 33 56 4c  00 00 34 00  b8 0f 00 00  00 00 00 00  U3VL..4.........   27us  2017/07/18  15:11:35.282  ntoskrnl      	# block is 0xfb8(4024) chunk_mode_active is 0. timestamp is 0xd4fc8ac06(57173126150) pixel_format is 0x01080009(BayerRG8). size_x is 0x500(1280). size_y is 0x400(1024). offset_x is 0x0(0). offset_y is 0x0(0).
                         00 00 01 00  06 ac c8 4f  0d 00 00 00  09 00 08 01  .......O........                                                 
                         00 05 00 00  00 04 00 00  00 00 00 00  00 00 00 00  ................                                                 
                         00 00 00 00                                         ....                                                             
  29.3   1048576  IN     00 01 01 00  00 00 00 00  00 00 00 00  00 00 00 01  ................  8.6ms  2017/07/18  15:11:35.291  ntoskrnl      
                         00 00 00 00  00 00 00 00  00 00 00 00  00 00 00 00  ................                                                 
                         00 00 01 00  00 00 00 00  00 00 00 00  00 00 00 00  ................                                                 
                         00 00 00 00  00 00 00 01  00 00 00 00  00 01 00 00  ................                                                 
  29.3    262144  IN     01 01 01 01  02 01 01 01  01 01 02 00  01 01 01 01  ................  2.0ms  2017/07/18  15:11:35.293  ntoskrnl      
                         01 01 01 01  01 01 01 01  01 02 01 01  01 01 01 01  ................                                                 
                         00 01 01 02  02 01 01 01  01 01 01 01  01 01 02 01  ................                                                 
                         02 02 01 01  01 01 01 01  01 01 01 01  01 02 01 01  ................                                                 
  29.3        32  IN     55 33 56 54  00 00 20 00  b8 0f 00 00  00 00 00 00  U3VT.. .........   20us  2017/07/18  15:11:35.293  ntoskrnl      	# trailer_size is 0x20(32). block is 0xfb8(4024). status is 0x0000. valid_payload_size is 0x140000(1310720). trailer_size_y is 0x400(1024).
                         00 00 00 00  00 00 14 00  00 00 00 00  00 04 00 00  ................                                                 
  29.3        52  IN     55 33 56 4c  00 00 34 00  b9 0f 00 00  00 00 00 00  U3VL..4.........   23us  2017/07/18  15:11:35.293  ntoskrnl      	# block is 0xfb9(4025) chunk_mode_active is 0. timestamp is 0xd506cb210(57183875600) pixel_format is 0x01080009(BayerRG8). size_x is 0x500(1280). size_y is 0x400(1024). offset_x is 0x0(0). offset_y is 0x0(0).
                         00 00 01 00  10 b2 6c 50  0d 00 00 00  09 00 08 01  ......lP........                                                 
                         00 05 00 00  00 04 00 00  00 00 00 00  00 00 00 00  ................                                                 
                         00 00 00 00                                         ....                                                             
  29.3   1048576  IN     01 00 00 00  00 00 01 00  01 00 00 00  00 00 00 01  ................  8.6ms  2017/07/18  15:11:35.301  ntoskrnl      
                         00 01 00 01  00 00 00 00  00 00 00 01  00 00 00 00  ................                                                 
                         00 01 00 01  00 00 01 00  00 00 00 00  00 00 00 00  ................                                                 
                         00 01 01 00  00 00 00 01  01 00 00 00  00 00 00 00  ................                                                 
  29.3    262144  IN     01 01 01 01  01 01 01 01  01 01 01 01  02 01 01 01  ................  2.0ms  2017/07/18  15:11:35.303  ntoskrnl      
                         01 02 01 02  01 01 01 01  01 01 01 01  01 02 01 00  ................                                                 
                         01 01 02 02  01 01 01 01  01 01 02 01  01 01 02 01  ................                                                 
                         02 01 01 02  01 01 01 01  01 00 01 01  01 01 01 01  ................                                                 
  29.3        32  IN     55 33 56 54  00 00 20 00  b9 0f 00 00  00 00 00 00  U3VT.. .........   38us  2017/07/18  15:11:35.303  ntoskrnl      	# trailer_size is 0x20(32). block is 0xfb9(4025). status is 0x0000. valid_payload_size is 0x140000(1310720). trailer_size_y is 0x400(1024).
                         00 00 00 00  00 00 14 00  00 00 00 00  00 04 00 00  ................                                                 
  29.3        52  IN     55 33 56 4c  00 00 34 00  ba 0f 00 00  00 00 00 00  U3VL..4.........   20us  2017/07/18  15:11:35.303  ntoskrnl      	# block is 0xfba(4026) chunk_mode_active is 0. timestamp is 0xd5110b801(57194625025) pixel_format is 0x01080009(BayerRG8). size_x is 0x500(1280). size_y is 0x400(1024). offset_x is 0x0(0). offset_y is 0x0(0).
                         00 00 01 00  01 b8 10 51  0d 00 00 00  09 00 08 01  .......Q........                                                 
                         00 05 00 00  00 04 00 00  00 00 00 00  00 00 00 00  ................                                                 
                         00 00 00 00                                         ....                                                             
  29.3   1048576  IN     00 00 00 00  00 01 00 00  00 00 00 00  00 00 00 01  ................  8.6ms  2017/07/18  15:11:35.312  ntoskrnl      
                         00 00 00 00  00 00 00 01  00 00 00 00  00 01 00 00  ................                                                 
                         00 00 00 01  00 00 00 00  00 00 00 01  00 00 00 00  ................                                                 
                         01 01 00 00  00 00 01 00  01 00 01 00  00 00 00 00  ................                                                 
  29.3    262144  IN     01 01 01 01  01 01 01 01  01 01 01 01  02 01 01 02  ................  2.0ms  2017/07/18  15:11:35.314  ntoskrnl      
                         01 01 01 01  01 01 01 02  01 02 01 01  01 01 01 00  ................                                                 
                         00 01 01 01  01 01 01 01  01 01 01 01  01 01 02 01  ................                                                 
                         02 01 01 01  01 01 01 01  01 01 01 01  01 01 01 01  ................                                                 
  29.3        32  IN     55 33 56 54  00 00 20 00  ba 0f 00 00  00 00 00 00  U3VT.. .........   23us  2017/07/18  15:11:35.314  ntoskrnl      	# trailer_size is 0x20(32). block is 0xfba(4026). status is 0x0000. valid_payload_size is 0x140000(1310720). trailer_size_y is 0x400(1024).
                         00 00 00 00  00 00 14 00  00 00 00 00  00 04 00 00  ................                                                 
  29.3        52  IN     55 33 56 4c  00 00 34 00  bb 0f 00 00  00 00 00 00  U3VL..4.........   17us  2017/07/18  15:11:35.314  ntoskrnl      	# block is 0xfbb(4027) chunk_mode_active is 0. timestamp is 0xd51b4961a(57205364250) pixel_format is 0x01080009(BayerRG8). size_x is 0x500(1280). size_y is 0x400(1024). offset_x is 0x0(0). offset_y is 0x0(0).
                         00 00 01 00  1a 96 b4 51  0d 00 00 00  09 00 08 01  .......Q........                                                 
                         00 05 00 00  00 04 00 00  00 00 00 00  00 00 00 00  ................                                                 
                         00 00 00 00                                         ....                                                             
  29.3   1048576  IN     00 00 00 00  00 00 01 00  00 00 00 01  00 01 00 01  ................  8.6ms  2017/07/18  15:11:35.323  ntoskrnl      
                         00 00 00 00  00 00 00 00  01 00 00 00  00 00 00 00  ................                                                 
                         01 00 00 00  00 01 01 00  00 00 01 01  00 00 00 00  ................                                                 
                         01 00 00 00  00 00 01 01  00 00 01 00  00 00 00 00  ................                                                 
  29.3    262144  IN     02 02 01 01  01 01 01 01  02 01 01 01  02 02 01 01  ................  2.0ms  2017/07/18  15:11:35.325  ntoskrnl      
                         02 01 02 02  01 01 01 01  01 01 01 01  01 01 01 01  ................                                                 
                         00 02 01 02  01 02 02 01  01 01 01 01  01 01 02 01  ................                                                 
                         02 01 01 01  01 01 01 01  01 01 01 01  01 01 02 01  ................                                                 
  29.3        32  IN     55 33 56 54  00 00 20 00  bb 0f 00 00  00 00 00 00  U3VT.. .........   29us  2017/07/18  15:11:35.325  ntoskrnl      	# trailer_size is 0x20(32). block is 0xfbb(4027). status is 0x0000. valid_payload_size is 0x140000(1310720). trailer_size_y is 0x400(1024).
                         00 00 00 00  00 00 14 00  00 00 00 00  00 04 00 00  ................                                                 
  29.3        52  IN     55 33 56 4c  00 00 34 00  bc 0f 00 00  00 00 00 00  U3VL..4.........   10us  2017/07/18  15:11:35.325  ntoskrnl      	# block is 0xfbc(4028) chunk_mode_active is 0. timestamp is 0xd52589c24(57216113700) pixel_format is 0x01080009(BayerRG8). size_x is 0x500(1280). size_y is 0x400(1024). offset_x is 0x0(0). offset_y is 0x0(0).
                         00 00 01 00  24 9c 58 52  0d 00 00 00  09 00 08 01  ....$.XR........                                                 
                         00 05 00 00  00 04 00 00  00 00 00 00  00 00 00 00  ................                                                 
                         00 00 00 00                                         ....                                                             
  29.3   1048576  IN     00 00 00 00  00 00 00 00  01 00 00 00  00 00 00 00  ................  8.6ms  2017/07/18  15:11:35.334  ntoskrnl      
                         00 00 00 00  01 00 00 00  00 00 00 00  00 00 00 00  ................                                                 
                         00 00 00 00  00 00 00 00  00 00 00 00  00 00 00 00  ................                                                 
                         00 00 00 00  00 00 00 00  01 00 00 00  00 00 00 01  ................                                                 
  29.3    262144  IN     02 01 01 01  02 01 01 01  01 01 01 01  02 01 01 01  ................  2.0ms  2017/07/18  15:11:35.336  ntoskrnl      
                         01 01 01 01  01 01 01 01  01 01 01 01  01 01 01 00  ................                                                 
                         00 02 01 02  02 01 01 01  01 01 01 01  01 01 02 01  ................                                                 
                         02 01 01 02  01 01 01 01  01 01 01 01  01 01 01 01  ................                                                 
  29.3        32  IN     55 33 56 54  00 00 20 00  bc 0f 00 00  00 00 00 00  U3VT.. .........   39us  2017/07/18  15:11:35.336  ntoskrnl      	# trailer_size is 0x20(32). block is 0xfbc(4028). status is 0x0000. valid_payload_size is 0x140000(1310720). trailer_size_y is 0x400(1024).
                         00 00 00 00  00 00 14 00  00 00 00 00  00 04 00 00  ................                                                 
  29.3        52  IN     55 33 56 4c  00 00 34 00  bd 0f 00 00  00 00 00 00  U3VL..4.........   12us  2017/07/18  15:11:35.336  ntoskrnl      	# block is 0xfbd(4029) chunk_mode_active is 0. timestamp is 0xd52fca22e(57226863150) pixel_format is 0x01080009(BayerRG8). size_x is 0x500(1280). size_y is 0x400(1024). offset_x is 0x0(0). offset_y is 0x0(0).
                         00 00 01 00  2e a2 fc 52  0d 00 00 00  09 00 08 01  .......R........                                                 
                         00 05 00 00  00 04 00 00  00 00 00 00  00 00 00 00  ................                                                 
                         00 00 00 00                                         ....                                                             
  29.3   1048576  IN     00 00 00 00  00 00 01 00  00 00 01 01  00 00 00 01  ................  8.6ms  2017/07/18  15:11:35.344  ntoskrnl      
                         00 01 00 00  00 01 00 00  00 00 00 00  00 00 01 00  ................                                                 
                         00 00 00 00  00 00 00 00  00 00 00 01  00 00 00 00  ................                                                 
                         00 01 00 00  00 00 00 01  00 01 00 00  00 01 00 01  ................                                                 
  29.3    262144  IN     02 01 01 01  02 02 01 01  01 01 01 01  02 01 01 01  ................  2.0ms  2017/07/18  15:11:35.346  ntoskrnl      
                         01 02 02 02  01 01 01 01  02 01 02 01  01 01 01 00  ................                                                 
                         00 01 01 02  01 01 01 01  01 02 01 01  01 01 02 01  ................                                                 
                         02 01 01 01  01 01 01 01  01 01 01 01  01 01 01 01  ................                                                 
  29.3        32  IN     55 33 56 54  00 00 20 00  bd 0f 00 00  00 00 00 00  U3VT.. .........   41us  2017/07/18  15:11:35.346  ntoskrnl      	# trailer_size is 0x20(32). block is 0xfbd(4029). status is 0x0000. valid_payload_size is 0x140000(1310720). trailer_size_y is 0x400(1024).
                         00 00 00 00  00 00 14 00  00 00 00 00  00 04 00 00  ................                                                 
  29.3        52  IN     55 33 56 4c  00 00 34 00  be 0f 00 00  00 00 00 00  U3VL..4.........   45us  2017/07/18  15:11:35.346  ntoskrnl      	# block is 0xfbe(4030) chunk_mode_active is 0. timestamp is 0xd53a0a838(57237612600) pixel_format is 0x01080009(BayerRG8). size_x is 0x500(1280). size_y is 0x400(1024). offset_x is 0x0(0). offset_y is 0x0(0).
                         00 00 01 00  38 a8 a0 53  0d 00 00 00  09 00 08 01  ....8..S........                                                 
                         00 05 00 00  00 04 00 00  00 00 00 00  00 00 00 00  ................                                                 
                         00 00 00 00                                         ....                                                             
  29.3   1048576  IN     00 00 00 01  00 00 00 00  00 00 00 00  00 00 00 01  ................  8.5ms  2017/07/18  15:11:35.355  ntoskrnl      
                         00 00 00 00  00 00 00 00  00 00 00 00  00 01 00 00  ................                                                 
                         00 00 00 00  00 00 00 00  00 00 00 00  00 00 00 00  ................                                                 
                         01 00 00 00  00 00 00 01  00 01 00 00  01 00 00 00  ................                                                 
  29.3    262144  IN     01 01 01 01  01 01 01 01  02 01 02 01  01 01 01 01  ................  2.0ms  2017/07/18  15:11:35.357  ntoskrnl      
                         01 01 01 01  01 01 01 01  01 01 01 01  00 01 01 00  ................                                                 
                         00 01 01 02  01 02 01 01  01 01 01 01  01 02 02 01  ................                                                 
                         02 01 00 01  01 01 01 01  01 01 01 01  02 01 01 01  ................                                                 
  29.3        32  IN     55 33 56 54  00 00 20 00  be 0f 00 00  00 00 00 00  U3VT.. .........   28us  2017/07/18  15:11:35.357  ntoskrnl      	# trailer_size is 0x20(32). block is 0xfbe(4030). status is 0x0000. valid_payload_size is 0x140000(1310720). trailer_size_y is 0x400(1024).
                         00 00 00 00  00 00 14 00  00 00 00 00  00 04 00 00  ................                                                 
  29.3        52  IN     55 33 56 4c  00 00 34 00  bf 0f 00 00  00 00 00 00  U3VL..4.........   34us  2017/07/18  15:11:35.357  ntoskrnl      	# block is 0xfbf(4031) chunk_mode_active is 0. timestamp is 0xd5444ae29(57248362025) pixel_format is 0x01080009(BayerRG8). size_x is 0x500(1280). size_y is 0x400(1024). offset_x is 0x0(0). offset_y is 0x0(0).
                         00 00 01 00  29 ae 44 54  0d 00 00 00  09 00 08 01  ....).DT........                                                 
                         00 05 00 00  00 04 00 00  00 00 00 00  00 00 00 00  ................                                                 
                         00 00 00 00                                         ....                                                             
  29.3   1048576  IN     00 00 01 01  00 00 00 00  00 00 00 00  00 00 00 01  ................  8.6ms  2017/07/18  15:11:35.366  ntoskrnl      
                         00 01 00 01  00 00 00 01  00 00 00 01  00 00 00 00  ................                                                 
                         00 00 01 00  00 00 01 00  00 00 00 01  00 00 00 00  ................                                                 
                         01 01 01 00  00 00 01 01  01 00 00 00  00 01 00 00  ................                                                 
  29.3    262144  IN     01 01 01 01  02 02 01 01  01 01 01 01  02 01 01 00  ................  2.0ms  2017/07/18  15:11:35.368  ntoskrnl      
                         01 02 02 02  01 01 01 01  01 02 01 01  01 01 01 01  ................                                                 
                         00 01 01 01  01 01 01 01  01 01 01 01  01 01 02 01  ................                                                 
                         02 01 01 01  01 01 01 01  01 01 01 01  01 01 02 01  ................                                                 
  29.3        32  IN     55 33 56 54  00 00 20 00  bf 0f 00 00  00 00 00 00  U3VT.. .........   33us  2017/07/18  15:11:35.368  ntoskrnl      	# trailer_size is 0x20(32). block is 0xfbf(4031). status is 0x0000. valid_payload_size is 0x140000(1310720). trailer_size_y is 0x400(1024).
                         00 00 00 00  00 00 14 00  00 00 00 00  00 04 00 00  ................                                                 
  29.3        52  IN     55 33 56 4c  00 00 34 00  c0 0f 00 00  00 00 00 00  U3VL..4.........   48us  2017/07/18  15:11:35.368  ntoskrnl      	# block is 0xfc0(4032) chunk_mode_active is 0. timestamp is 0xd54e8b433(57259111475) pixel_format is 0x01080009(BayerRG8). size_x is 0x500(1280). size_y is 0x400(1024). offset_x is 0x0(0). offset_y is 0x0(0).
                         00 00 01 00  33 b4 e8 54  0d 00 00 00  09 00 08 01  ....3..T........                                                 
                         00 05 00 00  00 04 00 00  00 00 00 00  00 00 00 00  ................                                                 
                         00 00 00 00                                         ....                                                             
  29.3   1048576  IN     00 00 00 00  00 00 00 00  00 00 00 00  00 00 00 01  ................  8.6ms  2017/07/18  15:11:35.377  ntoskrnl      
                         00 01 00 01  00 00 00 00  00 00 00 01  00 00 00 01  ................                                                 
                         00 00 00 00  00 00 01 00  00 00 01 01  00 00 00 00  ................                                                 
                         00 00 00 00  00 00 00 01  00 00 00 00  00 01 00 00  ................                                                 
  29.3    262144  IN     02 01 01 02  02 02 01 01  02 01 02 01  02 01 01 01  ................  2.0ms  2017/07/18  15:11:35.379  ntoskrnl      
                         01 01 01 01  01 01 01 01  01 01 01 01  01 01 01 01  ................                                                 
                         00 01 01 01  01 02 01 01  01 01 01 01  01 01 02 01  ................                                                 
                         02 02 00 01  02 01 01 01  01 01 01 01  02 01 02 01  ................                                                 
  29.3        32  IN     55 33 56 54  00 00 20 00  c0 0f 00 00  00 00 00 00  U3VT.. .........   21us  2017/07/18  15:11:35.379  ntoskrnl      	# trailer_size is 0x20(32). block is 0xfc0(4032). status is 0x0000. valid_payload_size is 0x140000(1310720). trailer_size_y is 0x400(1024).
                         00 00 00 00  00 00 14 00  00 00 00 00  00 04 00 00  ................                                                 
  29.3        52  IN     55 33 56 4c  00 00 34 00  c1 0f 00 00  00 00 00 00  U3VL..4.........   17us  2017/07/18  15:11:35.379  ntoskrnl      	# block is 0xfc1(4033) chunk_mode_active is 0. timestamp is 0xd558cba3d(57269860925) pixel_format is 0x01080009(BayerRG8). size_x is 0x500(1280). size_y is 0x400(1024). offset_x is 0x0(0). offset_y is 0x0(0).
                         00 00 01 00  3d ba 8c 55  0d 00 00 00  09 00 08 01  ....=..U........                                                 
                         00 05 00 00  00 04 00 00  00 00 00 00  00 00 00 00  ................                                                 
                         00 00 00 00                                         ....                                                             
  29.3   1048576  IN     00 00 00 00  00 00 00 00  00 00 00 00  00 00 00 01  ................  8.6ms  2017/07/18  15:11:35.387  ntoskrnl      
                         00 00 00 00  00 00 00 00  00 00 00 00  00 00 00 00  ................                                                 
                         00 00 00 00  00 00 00 00  00 00 00 00  00 00 00 00  ................                                                 
                         00 00 00 00  00 00 00 00  01 00 00 00  00 00 00 00  ................                                                 
  29.3    262144  IN     01 02 01 02  01 01 01 01  01 02 01 01  01 01 00 01  ................  2.0ms  2017/07/18  15:11:35.389  ntoskrnl      
                         01 01 01 02  01 01 01 01  01 02 01 01  01 01 00 01  ................                                                 
                         00 01 01 01  01 02 01 01  01 01 01 01  01 01 02 01  ................                                                 
                         01 01 01 01  01 01 01 01  01 01 01 01  02 01 02 01  ................                                                 
  29.3        32  IN     55 33 56 54  00 00 20 00  c1 0f 00 00  00 00 00 00  U3VT.. .........   20us  2017/07/18  15:11:35.389  ntoskrnl      	# trailer_size is 0x20(32). block is 0xfc1(4033). status is 0x0000. valid_payload_size is 0x140000(1310720). trailer_size_y is 0x400(1024).
                         00 00 00 00  00 00 14 00  00 00 00 00  00 04 00 00  ................                                                 
  29.3        52  IN     55 33 56 4c  00 00 34 00  c2 0f 00 00  00 00 00 00  U3VL..4.........   16us  2017/07/18  15:11:35.389  ntoskrnl      	# block is 0xfc2(4034) chunk_mode_active is 0. timestamp is 0xd56309856(57280600150) pixel_format is 0x01080009(BayerRG8). size_x is 0x500(1280). size_y is 0x400(1024). offset_x is 0x0(0). offset_y is 0x0(0).
                         00 00 01 00  56 98 30 56  0d 00 00 00  09 00 08 01  ....V.0V........                                                 
                         00 05 00 00  00 04 00 00  00 00 00 00  00 00 00 00  ................                                                 
                         00 00 00 00                                         ....                                                             
  29.3   1048576  IN     00 01 00 00  00 01 00 00  01 00 00 00  00 00 00 01  ................  8.6ms  2017/07/18  15:11:35.398  ntoskrnl      
                         00 00 00 00  00 01 00 00  00 00 00 01  00 00 01 00  ................                                                 
                         00 00 00 01  00 01 01 00  00 00 00 00  01 00 00 01  ................                                                 
                         00 01 00 00  00 00 01 00  00 01 00 00  01 00 00 00  ................                                                 
  29.3    262144  IN     02 01 01 01  01 02 01 01  01 02 01 01  01 01 01 01  ................  2.0ms  2017/07/18  15:11:35.400  ntoskrnl      
                         01 01 01 01  01 01 01 01  02 01 01 01  01 02 00 01  ................                                                 
                         00 01 01 02  01 01 01 01  01 01 01 01  01 01 02 01  ................                                                 
                         01 01 01 02  01 02 01 01  01 01 01 01  02 01 01 02  ................                                                 
  29.3        32  IN     55 33 56 54  00 00 20 00  c2 0f 00 00  00 00 00 00  U3VT.. .........   35us  2017/07/18  15:11:35.400  ntoskrnl      	# trailer_size is 0x20(32). block is 0xfc2(4034). status is 0x0000. valid_payload_size is 0x140000(1310720). trailer_size_y is 0x400(1024).
                         00 00 00 00  00 00 14 00  00 00 00 00  00 04 00 00  ................                                                 
  29.3        52  IN     55 33 56 4c  00 00 34 00  c3 0f 00 00  00 00 00 00  U3VL..4.........   17us  2017/07/18  15:11:35.400  ntoskrnl      	# block is 0xfc3(4035) chunk_mode_active is 0. timestamp is 0xd56d49e60(57291349600) pixel_format is 0x01080009(BayerRG8). size_x is 0x500(1280). size_y is 0x400(1024). offset_x is 0x0(0). offset_y is 0x0(0).
                         00 00 01 00  60 9e d4 56  0d 00 00 00  09 00 08 01  ....`..V........                                                 
                         00 05 00 00  00 04 00 00  00 00 00 00  00 00 00 00  ................                                                 
                         00 00 00 00                                         ....                                                             
  29.3   1048576  IN     00 00 00 00  00 00 00 00  00 00 01 00  00 00 00 01  ................  8.6ms  2017/07/18  15:11:35.409  ntoskrnl      
                         00 00 00 00  00 00 00 00  01 00 00 00  00 00 00 00  ................                                                 
                         00 00 01 01  00 00 00 00  00 00 00 01  00 00 00 00  ................                                                 
                         00 00 00 00  00 00 01 00  01 00 00 00  00 01 00 00  ................                                                 
  29.3    262144  IN     02 01 01 01  02 01 01 01  02 02 01 01  01 01 01 01  ................  2.0ms  2017/07/18  15:11:35.411  ntoskrnl      
                         01 01 01 01  01 01 01 01  01 02 00 01  01 01 01 01  ................                                                 
                         00 01 01 02  01 01 01 01  01 01 01 01  01 01 02 02  ................                                                 
                         02 01 01 01  02 02 02 01  01 01 01 01  02 02 01 01  ................                                                 
  29.3        32  IN     55 33 56 54  00 00 20 00  c3 0f 00 00  00 00 00 00  U3VT.. .........   32us  2017/07/18  15:11:35.411  ntoskrnl      	# trailer_size is 0x20(32). block is 0xfc3(4035). status is 0x0000. valid_payload_size is 0x140000(1310720). trailer_size_y is 0x400(1024).
                         00 00 00 00  00 00 14 00  00 00 00 00  00 04 00 00  ................                                                 
  29.3        52  IN     55 33 56 4c  00 00 34 00  c4 0f 00 00  00 00 00 00  U3VL..4.........   18us  2017/07/18  15:11:35.411  ntoskrnl      	# block is 0xfc4(4036) chunk_mode_active is 0. timestamp is 0xd5778a451(57302099025) pixel_format is 0x01080009(BayerRG8). size_x is 0x500(1280). size_y is 0x400(1024). offset_x is 0x0(0). offset_y is 0x0(0).
                         00 00 01 00  51 a4 78 57  0d 00 00 00  09 00 08 01  ....Q.xW........                                                 
                         00 05 00 00  00 04 00 00  00 00 00 00  00 00 00 00  ................                                                 
                         00 00 00 00                                         ....                                                             
  29.3   1048576  IN     01 00 01 01  00 00 01 00  01 00 00 00  00 00 00 00  ................  8.6ms  2017/07/18  15:11:35.420  ntoskrnl      
                         00 00 00 00  00 00 00 00  00 00 00 00  00 00 01 00  ................                                                 
                         01 00 00 00  00 00 00 00  00 00 00 00  00 00 00 00  ................                                                 
                         00 01 00 00  00 00 00 00  01 01 00 00  00 00 00 00  ................                                                 
  29.3    262144  IN     02 01 01 01  01 01 01 01  01 01 01 01  01 01 01 01  ................  2.0ms  2017/07/18  15:11:35.422  ntoskrnl      
                         01 01 01 01  01 01 01 01  01 01 01 01  00 01 01 01  ................                                                 
                         00 01 01 01  01 01 01 01  01 01 01 02  01 01 02 01  ................                                                 
                         02 01 01 02  01 02 01 01  01 01 02 01  01 01 01 01  ................                                                 
  29.3        32  IN     55 33 56 54  00 00 20 00  c4 0f 00 00  00 00 00 00  U3VT.. .........   17us  2017/07/18  15:11:35.422  ntoskrnl      	# trailer_size is 0x20(32). block is 0xfc4(4036). status is 0x0000. valid_payload_size is 0x140000(1310720). trailer_size_y is 0x400(1024).
                         00 00 00 00  00 00 14 00  00 00 00 00  00 04 00 00  ................                                                 
  29.3        52  IN     55 33 56 4c  00 00 34 00  c5 0f 00 00  00 00 00 00  U3VL..4.........   15us  2017/07/18  15:11:35.422  ntoskrnl      	# block is 0xfc5(4037) chunk_mode_active is 0. timestamp is 0xd581caa5b(57312848475) pixel_format is 0x01080009(BayerRG8). size_x is 0x500(1280). size_y is 0x400(1024). offset_x is 0x0(0). offset_y is 0x0(0).
                         00 00 01 00  5b aa 1c 58  0d 00 00 00  09 00 08 01  ....[..X........                                                 
                         00 05 00 00  00 04 00 00  00 00 00 00  00 00 00 00  ................                                                 
                         00 00 00 00                                         ....                                                             
  29.3   1048576  IN     00 00 00 00  00 00 00 00  00 00 00 00  01 00 00 01  ................  8.7ms  2017/07/18  15:11:35.430  ntoskrnl      
                         00 00 00 00  00 00 00 00  00 00 00 01  00 00 00 00  ................                                                 
                         00 00 01 00  00 00 00 00  00 00 00 00  01 00 00 00  ................                                                 
                         00 00 00 00  00 00 00 01  01 00 00 00  01 00 00 00  ................                                                 
  29.3    262144  IN     01 01 01 01  01 02 01 01  01 01 02 01  01 01 01 01  ................  2.0ms  2017/07/18  15:11:35.432  ntoskrnl      
                         01 02 01 02  01 02 01 01  01 02 00 01  01 01 01 01  ................                                                 
                         00 01 01 01  01 01 01 00  01 01 01 01  01 01 02 00  ................                                                 
                         01 01 01 02  01 01 01 01  01 01 01 01  01 01 01 01  ................                                                 
  29.3        32  IN     55 33 56 54  00 00 20 00  c5 0f 00 00  00 00 00 00  U3VT.. .........   37us  2017/07/18  15:11:35.432  ntoskrnl      	# trailer_size is 0x20(32). block is 0xfc5(4037). status is 0x0000. valid_payload_size is 0x140000(1310720). trailer_size_y is 0x400(1024).
                         00 00 00 00  00 00 14 00  00 00 00 00  00 04 00 00  ................                                                 
  29.3        52  IN     55 33 56 4c  00 00 34 00  c6 0f 00 00  00 00 00 00  U3VL..4.........   25us  2017/07/18  15:11:35.432  ntoskrnl      	# block is 0xfc6(4038) chunk_mode_active is 0. timestamp is 0xd58c0b065(57323597925) pixel_format is 0x01080009(BayerRG8). size_x is 0x500(1280). size_y is 0x400(1024). offset_x is 0x0(0). offset_y is 0x0(0).
                         00 00 01 00  65 b0 c0 58  0d 00 00 00  09 00 08 01  ....e..X........                                                 
                         00 05 00 00  00 04 00 00  00 00 00 00  00 00 00 00  ................                                                 
                         00 00 00 00                                         ....                                                             
  29.3   1048576  IN     00 00 00 00  00 00 00 00  00 00 00 00  00 00 00 01  ................  8.5ms  2017/07/18  15:11:35.441  ntoskrnl      
                         00 00 00 00  00 00 00 00  00 00 00 00  00 00 00 00  ................                                                 
                         00 00 01 01  00 00 01 00  00 00 00 01  00 00 01 00  ................                                                 
                         01 00 00 00  00 01 01 00  00 01 00 01  01 01 00 00  ................                                                 
  29.3    262144  IN     01 01 02 01  02 02 01 01  01 01 02 01  01 01 01 01  ................  2.0ms  2017/07/18  15:11:35.443  ntoskrnl      
                         01 02 01 01  01 01 01 01  01 02 01 01  01 01 01 01  ................                                                 
                         00 01 01 02  02 01 00 01  01 01 01 01  02 01 02 01  ................                                                 
                         02 01 02 01  01 01 01 01  01 01 01 01  01 01 01 01  ................                                                 
  29.3        32  IN     55 33 56 54  00 00 20 00  c6 0f 00 00  00 00 00 00  U3VT.. .........   37us  2017/07/18  15:11:35.443  ntoskrnl      	# trailer_size is 0x20(32). block is 0xfc6(4038). status is 0x0000. valid_payload_size is 0x140000(1310720). trailer_size_y is 0x400(1024).
                         00 00 00 00  00 00 14 00  00 00 00 00  00 04 00 00  ................                                                 
  29.3        52  IN     55 33 56 4c  00 00 34 00  c7 0f 00 00  00 00 00 00  U3VL..4.........   21us  2017/07/18  15:11:35.443  ntoskrnl      	# block is 0xfc7(4039) chunk_mode_active is 0. timestamp is 0xd5964b66f(57334347375) pixel_format is 0x01080009(BayerRG8). size_x is 0x500(1280). size_y is 0x400(1024). offset_x is 0x0(0). offset_y is 0x0(0).
                         00 00 01 00  6f b6 64 59  0d 00 00 00  09 00 08 01  ....o.dY........                                                 
                         00 05 00 00  00 04 00 00  00 00 00 00  00 00 00 00  ................                                                 
                         00 00 00 00                                         ....                                                             
  29.3   1048576  IN     00 00 00 00  01 00 01 00  00 00 01 00  00 00 00 01  ................  8.5ms  2017/07/18  15:11:35.452  ntoskrnl      
                         00 00 00 00  00 00 00 00  00 00 00 01  00 01 00 01  ................                                                 
                         00 00 00 00  00 00 01 00  00 00 00 00  01 00 00 00  ................                                                 
                         01 00 01 00  00 00 00 00  01 00 00 00  00 00 00 00  ................                                                 
  29.3    262144  IN     02 01 01 01  01 01 01 00  01 01 01 01  01 01 01 01  ................  2.0ms  2017/07/18  15:11:35.454  ntoskrnl      
                         01 01 01 01  01 01 01 01  01 01 01 01  00 01 01 01  ................                                                 
                         00 00 01 01  01 01 01 01  01 01 01 01  01 01 02 01  ................                                                 
                         02 01 01 01  01 01 01 01  01 01 01 01  01 01 01 01  ................                                                 
  29.3        32  IN     55 33 56 54  00 00 20 00  c7 0f 00 00  00 00 00 00  U3VT.. .........   33us  2017/07/18  15:11:35.454  ntoskrnl      	# trailer_size is 0x20(32). block is 0xfc7(4039). status is 0x0000. valid_payload_size is 0x140000(1310720). trailer_size_y is 0x400(1024).
                         00 00 00 00  00 00 14 00  00 00 00 00  00 04 00 00  ................                                                 
  29.3        52  IN     55 33 56 4c  00 00 34 00  c8 0f 00 00  00 00 00 00  U3VL..4.........   24us  2017/07/18  15:11:35.454  ntoskrnl      	# block is 0xfc8(4040) chunk_mode_active is 0. timestamp is 0xd5a08bc60(57345096800) pixel_format is 0x01080009(BayerRG8). size_x is 0x500(1280). size_y is 0x400(1024). offset_x is 0x0(0). offset_y is 0x0(0).
                         00 00 01 00  60 bc 08 5a  0d 00 00 00  09 00 08 01  ....`..Z........                                                 
                         00 05 00 00  00 04 00 00  00 00 00 00  00 00 00 00  ................                                                 
                         00 00 00 00                                         ....                                                             
  29.3   1048576  IN     00 00 01 00  01 01 01 00  00 00 00 00  01 00 00 01  ................  8.6ms  2017/07/18  15:11:35.463  ntoskrnl      
                         00 00 00 01  00 00 00 00  00 00 00 00  00 00 01 00  ................                                                 
                         00 00 00 01  00 00 00 00  00 00 00 01  00 00 00 00  ................                                                 
                         00 00 00 01  00 00 01 01  01 01 00 00  00 01 00 00  ................                                                 
  29.3    262144  IN     01 01 01 01  02 01 01 01  01 01 01 01  01 01 01 01  ................  2.0ms  2017/07/18  15:11:35.465  ntoskrnl      
                         01 01 01 02  01 01 01 01  01 01 01 01  01 01 00 01  ................                                                 
                         00 01 01 01  02 01 01 01  01 01 01 01  01 01 02 01  ................                                                 
                         02 01 01 02  01 01 01 01  01 01 02 01  02 01 01 02  ................                                                 
  29.3        32  IN     55 33 56 54  00 00 20 00  c8 0f 00 00  00 00 00 00  U3VT.. .........   31us  2017/07/18  15:11:35.465  ntoskrnl      	# trailer_size is 0x20(32). block is 0xfc8(4040). status is 0x0000. valid_payload_size is 0x140000(1310720). trailer_size_y is 0x400(1024).
                         00 00 00 00  00 00 14 00  00 00 00 00  00 04 00 00  ................                                                 
  29.3        52  IN     55 33 56 4c  00 00 34 00  c9 0f 00 00  00 00 00 00  U3VL..4.........   51us  2017/07/18  15:11:35.465  ntoskrnl      	# block is 0xfc9(4041) chunk_mode_active is 0. timestamp is 0xd5aac9a79(57355836025) pixel_format is 0x01080009(BayerRG8). size_x is 0x500(1280). size_y is 0x400(1024). offset_x is 0x0(0). offset_y is 0x0(0).
                         00 00 01 00  79 9a ac 5a  0d 00 00 00  09 00 08 01  ....y..Z........                                                 
                         00 05 00 00  00 04 00 00  00 00 00 00  00 00 00 00  ................                                                 
                         00 00 00 00                                         ....                                                             
  29.3   1048576  IN     00 00 00 00  00 00 01 00  00 00 01 00  00 00 00 01  ................  8.5ms  2017/07/18  15:11:35.473  ntoskrnl      
                         00 00 00 00  00 00 01 00  00 00 00 01  00 00 00 00  ................                                                 
                         00 00 01 00  00 00 00 00  00 00 00 00  01 00 00 00  ................                                                 
                         00 00 00 00  00 00 00 01  01 00 00 01  00 01 01 00  ................                                                 
  29.3    262144  IN     01 02 01 01  01 02 02 01  02 01 01 01  01 01 01 01  ................  2.0ms  2017/07/18  15:11:35.475  ntoskrnl      
                         01 01 02 02  01 02 01 02  01 01 01 01  01 01 01 00  ................                                                 
                         00 01 01 02  01 02 01 01  02 01 01 01  02 01 02 01  ................                                                 
                         02 01 01 01  01 01 02 01  01 01 02 01  02 01 01 01  ................                                                 
  29.3        32  IN     55 33 56 54  00 00 20 00  c9 0f 00 00  00 00 00 00  U3VT.. .........   43us  2017/07/18  15:11:35.475  ntoskrnl      	# trailer_size is 0x20(32). block is 0xfc9(4041). status is 0x0000. valid_payload_size is 0x140000(1310720). trailer_size_y is 0x400(1024).
                         00 00 00 00  00 00 14 00  00 00 00 00  00 04 00 00  ................                                                 
  29.3        52  IN     55 33 56 4c  00 00 34 00  ca 0f 00 00  00 00 00 00  U3VL..4.........   24us  2017/07/18  15:11:35.475  ntoskrnl      	# block is 0xfca(4042) chunk_mode_active is 0. timestamp is 0xd5b50a083(57366585475) pixel_format is 0x01080009(BayerRG8). size_x is 0x500(1280). size_y is 0x400(1024). offset_x is 0x0(0). offset_y is 0x0(0).
                         00 00 01 00  83 a0 50 5b  0d 00 00 00  09 00 08 01  ......P[........                                                 
                         00 05 00 00  00 04 00 00  00 00 00 00  00 00 00 00  ................                                                 
                         00 00 00 00                                         ....                                                             
  29.3   1048576  IN     00 00 00 00  00 00 00 00  00 00 00 00  00 00 01 01  ................  8.5ms  2017/07/18  15:11:35.484  ntoskrnl      
                         00 00 00 00  00 00 00 00  00 00 00 01  00 01 00 01  ................                                                 
                         00 00 01 00  00 01 00 00  00 00 00 00  00 00 00 00  ................                                                 
                         00 00 01 00  00 00 00 01  01 01 01 00  00 01 00 00  ................                                                 
  29.3    262144  IN     01 02 01 01  02 01 01 01  01 01 01 01  01 02 01 01  ................  2.0ms  2017/07/18  15:11:35.486  ntoskrnl      
                         01 02 01 02  01 01 01 01  01 01 01 01  01 01 01 01  ................                                                 
                         00 02 02 02  02 01 01 01  01 01 01 01  01 01 02 01  ................                                                 
                         02 01 01 01  01 02 02 01  01 01 01 01  01 01 02 01  ................                                                 
  29.3        32  IN     55 33 56 54  00 00 20 00  ca 0f 00 00  00 00 00 00  U3VT.. .........   24us  2017/07/18  15:11:35.486  ntoskrnl      	# trailer_size is 0x20(32). block is 0xfca(4042). status is 0x0000. valid_payload_size is 0x140000(1310720). trailer_size_y is 0x400(1024).
                         00 00 00 00  00 00 14 00  00 00 00 00  00 04 00 00  ................                                                 
  29.3        52  IN     55 33 56 4c  00 00 34 00  cb 0f 00 00  00 00 00 00  U3VL..4.........   10us  2017/07/18  15:11:35.486  ntoskrnl      	# block is 0xfcb(4043) chunk_mode_active is 0. timestamp is 0xd5bf4a68d(57377334925) pixel_format is 0x01080009(BayerRG8). size_x is 0x500(1280). size_y is 0x400(1024). offset_x is 0x0(0). offset_y is 0x0(0).
                         00 00 01 00  8d a6 f4 5b  0d 00 00 00  09 00 08 01  .......[........                                                 
                         00 05 00 00  00 04 00 00  00 00 00 00  00 00 00 00  ................                                                 
                         00 00 00 00                                         ....                                                             
  29.3   1048576  IN     00 00 00 00  00 00 00 00  00 00 00 00  00 01 00 00  ................  8.6ms  2017/07/18  15:11:35.495  ntoskrnl      
                         00 01 00 00  01 00 00 00  00 00 00 00  00 00 00 01  ................                                                 
                         00 00 00 00  00 00 01 00  00 00 00 01  00 00 00 00  ................                                                 
                         00 01 01 00  00 00 00 01  00 01 00 00  00 00 00 00  ................                                                 
  29.3    262144  IN     01 02 01 01  02 01 01 01  01 01 01 01  02 01 01 01  ................  2.0ms  2017/07/18  15:11:35.497  ntoskrnl      
                         01 01 01 01  01 01 01 01  01 01 01 01  01 02 01 01  ................                                                 
                         00 01 01 02  01 02 01 01  01 01 01 01  01 01 02 01  ................                                                 
                         02 02 01 01  01 01 01 01  01 01 01 01  01 02 01 01  ................                                                 
  29.3        32  IN     55 33 56 54  00 00 20 00  cb 0f 00 00  00 00 00 00  U3VT.. .........   46us  2017/07/18  15:11:35.497  ntoskrnl      	# trailer_size is 0x20(32). block is 0xfcb(4043). status is 0x0000. valid_payload_size is 0x140000(1310720). trailer_size_y is 0x400(1024).
                         00 00 00 00  00 00 14 00  00 00 00 00  00 04 00 00  ................                                                 
  29.3        52  IN     55 33 56 4c  00 00 34 00  cc 0f 00 00  00 00 00 00  U3VL..4.........   16us  2017/07/18  15:11:35.497  ntoskrnl      	# block is 0xfcc(4044) chunk_mode_active is 0. timestamp is 0xd5c98ac97(57388084375) pixel_format is 0x01080009(BayerRG8). size_x is 0x500(1280). size_y is 0x400(1024). offset_x is 0x0(0). offset_y is 0x0(0).
                         00 00 01 00  97 ac 98 5c  0d 00 00 00  09 00 08 01  .......\........                                                 
                         00 05 00 00  00 04 00 00  00 00 00 00  00 00 00 00  ................                                                 
                         00 00 00 00                                         ....                                                             
  29.3   1048576  IN     01 00 01 00  00 00 00 00  00 00 00 00  00 01 00 01  ................  8.6ms  2017/07/18  15:11:35.506  ntoskrnl      
                         00 00 00 00  01 00 00 00  00 00 00 00  00 01 00 00  ................                                                 
                         01 00 00 00  00 00 00 00  00 00 00 00  00 00 00 00  ................                                                 
                         01 00 00 00  00 00 00 01  01 01 00 00  00 00 00 00  ................                                                 
  29.3    262144  IN     02 01 01 01  01 01 01 01  02 01 02 01  02 01 01 01  ................  2.0ms  2017/07/18  15:11:35.508  ntoskrnl      
                         01 01 01 01  00 01 01 01  01 01 01 01  01 01 00 01  ................                                                 
                         00 01 01 02  01 02 01 01  01 01 01 01  01 01 02 01  ................                                                 
                         02 02 01 01  01 01 01 01  01 01 01 01  01 01 02 01  ................                                                 
  29.3        32  IN     55 33 56 54  00 00 20 00  cc 0f 00 00  00 00 00 00  U3VT.. .........   43us  2017/07/18  15:11:35.508  ntoskrnl      	# trailer_size is 0x20(32). block is 0xfcc(4044). status is 0x0000. valid_payload_size is 0x140000(1310720). trailer_size_y is 0x400(1024).
                         00 00 00 00  00 00 14 00  00 00 00 00  00 04 00 00  ................                                                 
  29.3        52  IN     55 33 56 4c  00 00 34 00  cd 0f 00 00  00 00 00 00  U3VL..4.........   27us  2017/07/18  15:11:35.508  ntoskrnl      	# block is 0xfcd(4045) chunk_mode_active is 0. timestamp is 0xd5d3cb288(57398833800) pixel_format is 0x01080009(BayerRG8). size_x is 0x500(1280). size_y is 0x400(1024). offset_x is 0x0(0). offset_y is 0x0(0).
                         00 00 01 00  88 b2 3c 5d  0d 00 00 00  09 00 08 01  ......<]........                                                 
                         00 05 00 00  00 04 00 00  00 00 00 00  00 00 00 00  ................                                                 
                         00 00 00 00                                         ....                                                             
  29.3   1048576  IN     00 00 01 00  00 01 00 00  00 00 00 00  00 00 00 00  ................  8.5ms  2017/07/18  15:11:35.516  ntoskrnl      
                         00 00 00 00  00 00 00 00  00 00 00 00  00 00 00 00  ................                                                 
                         00 00 01 01  00 00 00 00  00 01 00 00  00 00 00 00  ................                                                 
                         01 00 00 00  00 00 00 00  01 00 00 00  00 01 01 00  ................                                                 
  29.3    262144  IN     01 01 01 01  01 01 01 01  01 01 01 01  01 01 01 00  ................  2.0ms  2017/07/18  15:11:35.518  ntoskrnl      
                         01 01 01 02  01 01 01 01  01 01 01 01  00 01 00 01  ................                                                 
                         00 01 01 02  01 01 01 01  01 01 01 02  01 01 02 01  ................                                                 
                         02 01 01 02  01 01 01 01  00 01 01 00  01 01 01 01  ................                                                 
  29.3        32  IN     55 33 56 54  00 00 20 00  cd 0f 00 00  00 00 00 00  U3VT.. .........   18us  2017/07/18  15:11:35.518  ntoskrnl      	# trailer_size is 0x20(32). block is 0xfcd(4045). status is 0x0000. valid_payload_size is 0x140000(1310720). trailer_size_y is 0x400(1024).
                         00 00 00 00  00 00 14 00  00 00 00 00  00 04 00 00  ................                                                 
  29.3        52  IN     55 33 56 4c  00 00 34 00  ce 0f 00 00  00 00 00 00  U3VL..4.........   16us  2017/07/18  15:11:35.518  ntoskrnl      	# block is 0xfce(4046) chunk_mode_active is 0. timestamp is 0xd5de0b892(57409583250) pixel_format is 0x01080009(BayerRG8). size_x is 0x500(1280). size_y is 0x400(1024). offset_x is 0x0(0). offset_y is 0x0(0).
                         00 00 01 00  92 b8 e0 5d  0d 00 00 00  09 00 08 01  .......]........                                                 
                         00 05 00 00  00 04 00 00  00 00 00 00  00 00 00 00  ................                                                 
                         00 00 00 00                                         ....                                                             
  29.3   1048576  IN     00 00 01 00  00 01 00 00  00 00 00 00  00 00 00 01  ................  8.6ms  2017/07/18  15:11:35.527  ntoskrnl      
                         00 01 00 00  01 00 00 00  00 00 00 01  00 00 00 00  ................                                                 
                         01 00 00 00  00 01 00 00  00 00 00 01  00 00 00 00  ................                                                 
                         00 01 00 00  00 00 01 00  01 01 00 00  00 00 00 00  ................                                                 
  29.3    262144  IN     01 02 01 01  01 01 01 01  01 01 02 01  01 02 01 01  ................  2.0ms  2017/07/18  15:11:35.529  ntoskrnl      
                         01 02 02 01  01 01 00 01  01 01 01 01  01 01 01 01  ................                                                 
                         00 01 02 02  01 02 01 01  01 01 02 01  01 01 02 01  ................                                                 
                         02 01 01 01  02 01 02 01  01 01 02 01  01 01 01 01  ................                                                 
  29.3        32  IN     55 33 56 54  00 00 20 00  ce 0f 00 00  00 00 00 00  U3VT.. .........   40us  2017/07/18  15:11:35.529  ntoskrnl      	# trailer_size is 0x20(32). block is 0xfce(4046). status is 0x0000. valid_payload_size is 0x140000(1310720). trailer_size_y is 0x400(1024).
                         00 00 00 00  00 00 14 00  00 00 00 00  00 04 00 00  ................                                                 
  29.3        52  IN     55 33 56 4c  00 00 34 00  cf 0f 00 00  00 00 00 00  U3VL..4.........   31us  2017/07/18  15:11:35.529  ntoskrnl      	# block is 0xfcf(4047) chunk_mode_active is 0. timestamp is 0xd5e84be9c(57420332700) pixel_format is 0x01080009(BayerRG8). size_x is 0x500(1280). size_y is 0x400(1024). offset_x is 0x0(0). offset_y is 0x0(0).
                         00 00 01 00  9c be 84 5e  0d 00 00 00  09 00 08 01  .......^........                                                 
                         00 05 00 00  00 04 00 00  00 00 00 00  00 00 00 00  ................                                                 
                         00 00 00 00                                         ....                                                             
  29.3   1048576  IN     00 00 00 00  00 00 00 00  00 00 00 00  00 00 00 01  ................  8.6ms  2017/07/18  15:11:35.538  ntoskrnl      
                         00 00 00 01  00 01 00 00  00 00 00 00  00 00 00 00  ................                                                 
                         00 00 00 00  00 00 00 00  00 00 01 01  00 00 00 00  ................                                                 
                         00 01 00 00  00 00 00 01  01 00 00 00  00 00 00 00  ................                                                 
  29.3    262144  IN     01 01 01 01  01 01 01 01  01 01 01 01  01 01 00 01  ................  2.0ms  2017/07/18  15:11:35.540  ntoskrnl      
                         01 02 01 01  01 00 01 01  01 02 01 01  00 01 01 01  ................                                                 
                         00 01 01 01  01 01 01 01  00 01 01 01  01 01 02 01  ................                                                 
                         02 01 01 02  01 01 01 01  00 01 01 01  01 01 01 01  ................                                                 
  29.3        32  IN     55 33 56 54  00 00 20 00  cf 0f 00 00  00 00 00 00  U3VT.. .........   25us  2017/07/18  15:11:35.540  ntoskrnl      	# trailer_size is 0x20(32). block is 0xfcf(4047). status is 0x0000. valid_payload_size is 0x140000(1310720). trailer_size_y is 0x400(1024).
                         00 00 00 00  00 00 14 00  00 00 00 00  00 04 00 00  ................                                                 
  29.3        52  IN     55 33 56 4c  00 00 34 00  d0 0f 00 00  00 00 00 00  U3VL..4.........   12us  2017/07/18  15:11:35.540  ntoskrnl      	# block is 0xfd0(4048) chunk_mode_active is 0. timestamp is 0xd5f28c4a6(57431082150) pixel_format is 0x01080009(BayerRG8). size_x is 0x500(1280). size_y is 0x400(1024). offset_x is 0x0(0). offset_y is 0x0(0).
                         00 00 01 00  a6 c4 28 5f  0d 00 00 00  09 00 08 01  ......(_........                                                 
                         00 05 00 00  00 04 00 00  00 00 00 00  00 00 00 00  ................                                                 
                         00 00 00 00                                         ....                                                             
  29.3   1048576  IN     00 00 00 00  00 00 00 00  01 00 00 00  00 00 00 01  ................  8.6ms  2017/07/18  15:11:35.549  ntoskrnl      
                         00 01 00 00  00 00 00 00  00 00 00 01  00 00 00 00  ................                                                 
                         00 00 01 00  00 00 01 00  00 01 00 00  01 00 00 00  ................                                                 
                         00 00 00 00  00 00 00 00  01 00 00 00  00 01 01 00  ................                                                 
  29.3    262144  IN     01 01 01 01  01 01 01 01  02 01 01 01  01 01 01 01  ................  2.0ms  2017/07/18  15:11:35.551  ntoskrnl      
                         01 01 02 01  01 01 01 01  01 01 01 01  01 01 01 01  ................                                                 
                         00 01 01 02  01 02 01 01  01 01 01 01  01 01 02 01  ................                                                 
                         01 01 01 01  01 01 01 01  01 01 02 01  01 01 01 01  ................                                                 
  29.3        32  IN     55 33 56 54  00 00 20 00  d0 0f 00 00  00 00 00 00  U3VT.. .........   21us  2017/07/18  15:11:35.551  ntoskrnl      	# trailer_size is 0x20(32). block is 0xfd0(4048). status is 0x0000. valid_payload_size is 0x140000(1310720). trailer_size_y is 0x400(1024).
                         00 00 00 00  00 00 14 00  00 00 00 00  00 04 00 00  ................                                                 
  29.3        52  IN     55 33 56 4c  00 00 34 00  d1 0f 00 00  00 00 00 00  U3VL..4.........   17us  2017/07/18  15:11:35.551  ntoskrnl      	# block is 0xfd1(4049) chunk_mode_active is 0. timestamp is 0xd5fcca2bf(57441821375) pixel_format is 0x01080009(BayerRG8). size_x is 0x500(1280). size_y is 0x400(1024). offset_x is 0x0(0). offset_y is 0x0(0).
                         00 00 01 00  bf a2 cc 5f  0d 00 00 00  09 00 08 01  ......._........                                                 
                         00 05 00 00  00 04 00 00  00 00 00 00  00 00 00 00  ................                                                 
                         00 00 00 00                                         ....                                                             
  29.3   1048576  IN     00 01 00 01  00 00 00 00  00 00 00 00  00 01 00 01  ................  8.6ms  2017/07/18  15:11:35.559  ntoskrnl      
                         00 00 00 00  00 00 00 00  00 00 00 00  00 00 00 00  ................                                                 
                         00 00 00 00  00 00 00 00  01 00 00 00  00 00 00 00  ................                                                 
                         01 00 00 00  00 00 00 01  00 00 00 00  01 00 01 00  ................                                                 
  29.3    262144  IN     01 01 01 01  02 02 02 01  02 01 02 01  01 01 01 01  ................  2.0ms  2017/07/18  15:11:35.561  ntoskrnl      
                         01 02 02 02  01 01 01 01  01 02 01 01  01 01 01 01  ................                                                 
                         00 01 01 02  01 01 01 01  01 01 01 01  01 02 02 01  ................                                                 
                         02 01 01 01  02 01 02 02  01 01 01 01  01 01 01 01  ................                                                 
  29.3        32  IN     55 33 56 54  00 00 20 00  d1 0f 00 00  00 00 00 00  U3VT.. .........   18us  2017/07/18  15:11:35.561  ntoskrnl      	# trailer_size is 0x20(32). block is 0xfd1(4049). status is 0x0000. valid_payload_size is 0x140000(1310720). trailer_size_y is 0x400(1024).
                         00 00 00 00  00 00 14 00  00 00 00 00  00 04 00 00  ................                                                 
  29.3        52  IN     55 33 56 4c  00 00 34 00  d2 0f 00 00  00 00 00 00  U3VL..4.........   15us  2017/07/18  15:11:35.561  ntoskrnl      	# block is 0xfd2(4050) chunk_mode_active is 0. timestamp is 0xd6070a8b0(57452570800) pixel_format is 0x01080009(BayerRG8). size_x is 0x500(1280). size_y is 0x400(1024). offset_x is 0x0(0). offset_y is 0x0(0).
                         00 00 01 00  b0 a8 70 60  0d 00 00 00  09 00 08 01  ......p`........                                                 
                         00 05 00 00  00 04 00 00  00 00 00 00  00 00 00 00  ................                                                 
                         00 00 00 00                                         ....                                                             
  29.3   1048576  IN     00 00 00 00  00 00 00 00  00 00 01 00  00 00 00 01  ................  8.6ms  2017/07/18  15:11:35.570  ntoskrnl      
                         00 00 00 00  00 00 00 00  00 00 00 00  00 00 00 01  ................                                                 
                         00 00 01 00  00 00 01 00  00 00 01 00  01 00 00 00  ................                                                 
                         00 00 00 01  00 00 00 01  00 00 00 00  00 00 00 00  ................                                                 
  29.3    262144  IN     01 02 01 01  02 01 01 01  01 01 02 01  02 02 01 01  ................  2.0ms  2017/07/18  15:11:35.572  ntoskrnl      
                         01 02 01 01  01 01 01 02  01 01 00 01  01 01 01 00  ................                                                 
                         00 01 01 02  01 02 01 01  01 01 01 01  01 01 02 01  ................                                                 
                         02 01 01 01  01 01 01 01  01 01 01 01  02 01 01 01  ................                                                 
  29.3        32  IN     55 33 56 54  00 00 20 00  d2 0f 00 00  00 00 00 00  U3VT.. .........   43us  2017/07/18  15:11:35.572  ntoskrnl      	# trailer_size is 0x20(32). block is 0xfd2(4050). status is 0x0000. valid_payload_size is 0x140000(1310720). trailer_size_y is 0x400(1024).
                         00 00 00 00  00 00 14 00  00 00 00 00  00 04 00 00  ................                                                 
  29.3        52  IN     55 33 56 4c  00 00 34 00  d3 0f 00 00  00 00 00 00  U3VL..4.........   34us  2017/07/18  15:11:35.572  ntoskrnl      	# block is 0xfd3(4051) chunk_mode_active is 0. timestamp is 0xd6114aeba(57463320250) pixel_format is 0x01080009(BayerRG8). size_x is 0x500(1280). size_y is 0x400(1024). offset_x is 0x0(0). offset_y is 0x0(0).
                         00 00 01 00  ba ae 14 61  0d 00 00 00  09 00 08 01  .......a........                                                 
                         00 05 00 00  00 04 00 00  00 00 00 00  00 00 00 00  ................                                                 
                         00 00 00 00                                         ....                                                             
  29.3   1048576  IN     00 00 00 00  00 00 00 00  00 00 01 00  00 00 00 01  ................  8.5ms  2017/07/18  15:11:35.581  ntoskrnl      
                         00 01 00 00  00 00 00 00  01 00 00 01  00 00 00 00  ................                                                 
                         00 00 00 00  00 00 01 00  00 00 01 00  00 01 00 00  ................                                                 
                         00 01 01 00  00 00 00 01  01 00 00 00  00 01 00 00  ................                                                 
  29.3    262144  IN     01 01 01 01  01 01 01 01  01 01 01 01  01 01 01 01  ................  2.0ms  2017/07/18  15:11:35.583  ntoskrnl      
                         02 01 01 01  02 01 01 01  01 01 01 01  01 01 01 01  ................                                                 
                         00 01 01 02  01 01 01 01  01 01 01 01  01 01 02 01  ................                                                 
                         02 01 01 02  01 01 01 01  01 01 01 01  01 01 01 01  ................                                                 
  29.3        32  IN     55 33 56 54  00 00 20 00  d3 0f 00 00  00 00 00 00  U3VT.. .........   20us  2017/07/18  15:11:35.583  ntoskrnl      	# trailer_size is 0x20(32). block is 0xfd3(4051). status is 0x0000. valid_payload_size is 0x140000(1310720). trailer_size_y is 0x400(1024).
                         00 00 00 00  00 00 14 00  00 00 00 00  00 04 00 00  ................                                                 
  29.3        52  IN     55 33 56 4c  00 00 34 00  d4 0f 00 00  00 00 00 00  U3VL..4.........   19us  2017/07/18  15:11:35.583  ntoskrnl      	# block is 0xfd4(4052) chunk_mode_active is 0. timestamp is 0xd61b8b4c4(57474069700) pixel_format is 0x01080009(BayerRG8). size_x is 0x500(1280). size_y is 0x400(1024). offset_x is 0x0(0). offset_y is 0x0(0).
                         00 00 01 00  c4 b4 b8 61  0d 00 00 00  09 00 08 01  .......a........                                                 
                         00 05 00 00  00 04 00 00  00 00 00 00  00 00 00 00  ................                                                 
                         00 00 00 00                                         ....                                                             
  29.3   1048576  IN     01 01 01 00  00 01 00 00  01 00 00 00  00 00 00 01  ................  8.6ms  2017/07/18  15:11:35.591  ntoskrnl      
                         00 00 00 00  00 00 00 00  00 00 00 01  00 00 00 01  ................                                                 
                         00 00 00 00  00 00 00 00  00 00 01 00  00 00 00 00  ................                                                 
                         01 01 00 00  00 00 00 01  01 00 00 00  00 00 00 00  ................                                                 
  29.3    262144  IN     01 01 01 02  01 02 01 01  01 01 01 01  01 01 01 01  ................  2.0ms  2017/07/18  15:11:35.594  ntoskrnl      
                         01 02 01 01  01 01 01 01  01 01 01 01  01 01 01 01  ................                                                 
                         00 01 01 02  01 02 01 01  01 01 01 01  01 01 02 01  ................                                                 
                         02 02 01 01  02 01 01 01  01 01 01 01  02 01 01 02  ................                                                 
  29.3        32  IN     55 33 56 54  00 00 20 00  d4 0f 00 00  00 00 00 00  U3VT.. .........   25us  2017/07/18  15:11:35.594  ntoskrnl      	# trailer_size is 0x20(32). block is 0xfd4(4052). status is 0x0000. valid_payload_size is 0x140000(1310720). trailer_size_y is 0x400(1024).
                         00 00 00 00  00 00 14 00  00 00 00 00  00 04 00 00  ................                                                 
  29.3        52  IN     55 33 56 4c  00 00 34 00  d5 0f 00 00  00 00 00 00  U3VL..4.........   11us  2017/07/18  15:11:35.594  ntoskrnl      	# block is 0xfd5(4053) chunk_mode_active is 0. timestamp is 0xd625cbace(57484819150) pixel_format is 0x01080009(BayerRG8). size_x is 0x500(1280). size_y is 0x400(1024). offset_x is 0x0(0). offset_y is 0x0(0).
                         00 00 01 00  ce ba 5c 62  0d 00 00 00  09 00 08 01  ......\b........                                                 
                         00 05 00 00  00 04 00 00  00 00 00 00  00 00 00 00  ................                                                 
                         00 00 00 00                                         ....                                                             
  29.3   1048576  IN     00 00 00 00  00 00 01 00  00 00 00 00  00 00 00 01  ................  8.7ms  2017/07/18  15:11:35.602  ntoskrnl      
                         00 01 00 00  00 01 00 01  00 00 00 00  00 00 00 01  ................                                                 
                         00 00 00 00  00 01 00 00  00 00 00 00  00 00 00 00  ................                                                 
                         00 00 00 00  00 00 00 01  01 00 01 00  00 01 00 00  ................                                                 
  29.3    262144  IN     01 02 01 01  01 01 01 01  01 01 01 01  01 01 01 01  ................  2.0ms  2017/07/18  15:11:35.604  ntoskrnl      
                         01 02 01 01  01 01 01 02  02 02 01 01  00 01 00 01  ................                                                 
                         00 01 02 02  01 01 01 01  01 01 01 01  01 01 02 01  ................                                                 
                         02 01 01 01  01 02 01 01  01 01 02 01  02 01 01 01  ................                                                 
  29.3        32  IN     55 33 56 54  00 00 20 00  d5 0f 00 00  00 00 00 00  U3VT.. .........   42us  2017/07/18  15:11:35.604  ntoskrnl      	# trailer_size is 0x20(32). block is 0xfd5(4053). status is 0x0000. valid_payload_size is 0x140000(1310720). trailer_size_y is 0x400(1024).
                         00 00 00 00  00 00 14 00  00 00 00 00  00 04 00 00  ................                                                 
  29.3        52  IN     55 33 56 4c  00 00 34 00  d6 0f 00 00  00 00 00 00  U3VL..4.........   34us  2017/07/18  15:11:35.604  ntoskrnl      	# block is 0xfd6(4054) chunk_mode_active is 0. timestamp is 0xd6300c0d8(57495568600) pixel_format is 0x01080009(BayerRG8). size_x is 0x500(1280). size_y is 0x400(1024). offset_x is 0x0(0). offset_y is 0x0(0).
                         00 00 01 00  d8 c0 00 63  0d 00 00 00  09 00 08 01  .......c........                                                 
                         00 05 00 00  00 04 00 00  00 00 00 00  00 00 00 00  ................                                                 
                         00 00 00 00                                         ....                                                             
  29.3   1048576  IN     01 00 00 00  01 01 00 00  00 00 00 01  00 00 00 01  ................  8.5ms  2017/07/18  15:11:35.613  ntoskrnl      
                         00 00 00 00  00 00 00 00  00 00 00 00  00 00 00 00  ................                                                 
                         00 00 00 00  00 01 00 00  00 00 00 00  00 00 00 00  ................                                                 
                         01 00 00 00  00 00 00 00  00 00 00 00  00 00 00 00  ................                                                 
  29.3    262144  IN     01 01 01 01  01 01 01 01  01 01 01 00  01 01 01 01  ................  2.0ms  2017/07/18  15:11:35.615  ntoskrnl      
                         01 01 01 01  01 01 01 01  01 01 01 01  01 01 00 01  ................                                                 
                         00 00 01 02  01 00 01 00  01 01 01 01  01 01 01 01  ................                                                 
                         01 01 01 02  01 01 02 01  01 00 02 01  02 01 01 01  ................                                                 
  29.3        32  IN     55 33 56 54  00 00 20 00  d6 0f 00 00  00 00 00 00  U3VT.. .........   19us  2017/07/18  15:11:35.615  ntoskrnl      	# trailer_size is 0x20(32). block is 0xfd6(4054). status is 0x0000. valid_payload_size is 0x140000(1310720). trailer_size_y is 0x400(1024).
                         00 00 00 00  00 00 14 00  00 00 00 00  00 04 00 00  ................                                                 
  29.3        52  IN     55 33 56 4c  00 00 34 00  d7 0f 00 00  00 00 00 00  U3VL..4.........   22us  2017/07/18  15:11:35.615  ntoskrnl      	# block is 0xfd7(4055) chunk_mode_active is 0. timestamp is 0xd63a4c6c9(57506318025) pixel_format is 0x01080009(BayerRG8). size_x is 0x500(1280). size_y is 0x400(1024). offset_x is 0x0(0). offset_y is 0x0(0).
                         00 00 01 00  c9 c6 a4 63  0d 00 00 00  09 00 08 01  .......c........                                                 
                         00 05 00 00  00 04 00 00  00 00 00 00  00 00 00 00  ................                                                 
                         00 00 00 00                                         ....                                                             
  29.3   1048576  IN     00 00 00 00  00 01 01 00  00 00 00 00  00 00 00 01  ................  8.6ms  2017/07/18  15:11:35.624  ntoskrnl      
                         00 01 00 00  00 00 00 00  01 00 00 01  00 00 00 01  ................                                                 
                         01 00 00 00  00 00 01 00  00 01 01 00  00 00 00 01  ................                                                 
                         00 01 00 00  00 00 00 00  00 01 01 00  00 01 00 00  ................                                                 
  29.3    262144  IN     01 02 01 01  02 01 01 01  01 01 01 01  02 01 01 00  ................  2.0ms  2017/07/18  15:11:35.626  ntoskrnl      
                         01 02 01 01  01 01 01 01  01 02 00 01  01 01 01 01  ................                                                 
                         00 01 01 01  01 01 01 01  01 01 01 01  01 01 02 01  ................                                                 
                         01 01 01 01  01 02 01 01  01 01 02 01  01 01 01 01  ................                                                 
  29.3        32  IN     55 33 56 54  00 00 20 00  d7 0f 00 00  00 00 00 00  U3VT.. .........   21us  2017/07/18  15:11:35.626  ntoskrnl      	# trailer_size is 0x20(32). block is 0xfd7(4055). status is 0x0000. valid_payload_size is 0x140000(1310720). trailer_size_y is 0x400(1024).
                         00 00 00 00  00 00 14 00  00 00 00 00  00 04 00 00  ................                                                 
  29.3        52  IN     55 33 56 4c  00 00 34 00  d8 0f 00 00  00 00 00 00  U3VL..4.........   10us  2017/07/18  15:11:35.626  ntoskrnl      	# block is 0xfd8(4056) chunk_mode_active is 0. timestamp is 0xd6448a4e2(57517057250) pixel_format is 0x01080009(BayerRG8). size_x is 0x500(1280). size_y is 0x400(1024). offset_x is 0x0(0). offset_y is 0x0(0).
                         00 00 01 00  e2 a4 48 64  0d 00 00 00  09 00 08 01  ......Hd........                                                 
                         00 05 00 00  00 04 00 00  00 00 00 00  00 00 00 00  ................                                                 
                         00 00 00 00                                         ....                                                             
  29.3   1048576  IN     00 00 00 00  00 00 00 00  00 00 00 00  00 00 00 01  ................  8.7ms  2017/07/18  15:11:35.635  ntoskrnl      
                         00 00 00 00  00 00 00 00  00 00 00 00  00 00 00 00  ................                                                 
                         00 00 00 00  00 00 00 00  00 00 00 01  00 00 00 00  ................                                                 
                         00 00 00 00  00 00 00 00  01 00 00 00  00 00 00 00  ................                                                 
  29.3    262144  IN     01 01 01 01  01 02 01 01  01 02 01 01  02 01 01 01  ................  2.0ms  2017/07/18  15:11:35.637  ntoskrnl      
                         01 02 01 02  01 01 01 01  01 02 01 01  01 01 01 01  ................                                                 
                         00 01 01 01  02 01 01 01  01 01 01 01  01 01 02 01  ................                                                 
                         02 01 01 02  01 01 01 01  01 01 01 01  01 01 01 01  ................                                                 
  29.3        32  IN     55 33 56 54  00 00 20 00  d8 0f 00 00  00 00 00 00  U3VT.. .........   45us  2017/07/18  15:11:35.637  ntoskrnl      	# trailer_size is 0x20(32). block is 0xfd8(4056). status is 0x0000. valid_payload_size is 0x140000(1310720). trailer_size_y is 0x400(1024).
                         00 00 00 00  00 00 14 00  00 00 00 00  00 04 00 00  ................                                                 
  29.3        52  IN     55 33 56 4c  00 00 34 00  d9 0f 00 00  00 00 00 00  U3VL..4.........   16us  2017/07/18  15:11:35.637  ntoskrnl      	# block is 0xfd9(4057) chunk_mode_active is 0. timestamp is 0xd64ecaaec(57527806700) pixel_format is 0x01080009(BayerRG8). size_x is 0x500(1280). size_y is 0x400(1024). offset_x is 0x0(0). offset_y is 0x0(0).
                         00 00 01 00  ec aa ec 64  0d 00 00 00  09 00 08 01  .......d........                                                 
                         00 05 00 00  00 04 00 00  00 00 00 00  00 00 00 00  ................                                                 
                         00 00 00 00                                         ....                                                             
  29.3   1048576  IN     00 00 00 01  00 01 00 00  00 00 01 00  00 00 00 01  ................  8.6ms  2017/07/18  15:11:35.645  ntoskrnl      
                         00 01 00 00  00 00 00 00  00 00 00 00  00 00 00 01  ................                                                 
                         00 00 00 00  00 00 00 00  00 00 00 00  00 00 00 00  ................                                                 
                         00 00 00 00  00 00 00 00  01 00 00 00  00 01 00 00  ................                                                 
  29.3    262144  IN     01 01 01 01  01 02 01 01  02 01 01 01  01 01 01 01  ................  2.0ms  2017/07/18  15:11:35.647  ntoskrnl      
                         01 01 01 01  01 01 01 01  01 02 01 01  01 02 01 01  ................                                                 
                         00 01 01 02  02 01 01 01  01 01 01 01  01 01 02 01  ................                                                 
                         01 01 01 02  01 01 01 01  00 01 01 01  01 01 01 01  ................                                                 
  29.3        32  IN     55 33 56 54  00 00 20 00  d9 0f 00 00  00 00 00 00  U3VT.. .........   33us  2017/07/18  15:11:35.647  ntoskrnl      	# trailer_size is 0x20(32). block is 0xfd9(4057). status is 0x0000. valid_payload_size is 0x140000(1310720). trailer_size_y is 0x400(1024).
                         00 00 00 00  00 00 14 00  00 00 00 00  00 04 00 00  ................                                                 
  29.3        52  IN     55 33 56 4c  00 00 34 00  da 0f 00 00  00 00 00 00  U3VL..4.........   15us  2017/07/18  15:11:35.647  ntoskrnl      	# block is 0xfda(4058) chunk_mode_active is 0. timestamp is 0xd6590b0f6(57538556150) pixel_format is 0x01080009(BayerRG8). size_x is 0x500(1280). size_y is 0x400(1024). offset_x is 0x0(0). offset_y is 0x0(0).
                         00 00 01 00  f6 b0 90 65  0d 00 00 00  09 00 08 01  .......e........                                                 
                         00 05 00 00  00 04 00 00  00 00 00 00  00 00 00 00  ................                                                 
                         00 00 00 00                                         ....                                                             
  29.3   1048576  IN     01 00 00 00  00 00 01 00  00 00 01 00  00 00 00 01  ................  8.5ms  2017/07/18  15:11:35.656  ntoskrnl      
                         00 00 00 00  00 00 00 00  01 00 00 00  00 01 00 00  ................                                                 
                         00 00 01 00  00 00 00 00  00 00 00 01  00 00 00 00  ................                                                 
                         00 01 01 01  00 00 01 01  01 00 00 00  00 01 00 00  ................                                                 
  29.3    262144  IN     01 01 01 01  01 01 01 01  01 01 01 01  01 01 01 01  ................  2.0ms  2017/07/18  15:11:35.658  ntoskrnl      
                         01 01 01 01  01 01 01 01  01 01 01 01  01 01 01 00  ................                                                 
                         00 01 02 02  01 01 01 01  01 01 02 01  01 01 02 01  ................                                                 
                         02 01 01 01  01 01 01 02  00 01 01 01  01 01 01 01  ................                                                 
  29.3        32  IN     55 33 56 54  00 00 20 00  da 0f 00 00  00 00 00 00  U3VT.. .........   73us  2017/07/18  15:11:35.658  ntoskrnl      	# trailer_size is 0x20(32). block is 0xfda(4058). status is 0x0000. valid_payload_size is 0x140000(1310720). trailer_size_y is 0x400(1024).
                         00 00 00 00  00 00 14 00  00 00 00 00  00 04 00 00  ................                                                 
  29.3        52  IN     55 33 56 4c  00 00 34 00  db 0f 00 00  00 00 00 00  U3VL..4.........   38us  2017/07/18  15:11:35.658  ntoskrnl      	# block is 0xfdb(4059) chunk_mode_active is 0. timestamp is 0xd6634b700(57549305600) pixel_format is 0x01080009(BayerRG8). size_x is 0x500(1280). size_y is 0x400(1024). offset_x is 0x0(0). offset_y is 0x0(0).
                         00 00 01 00  00 b7 34 66  0d 00 00 00  09 00 08 01  ......4f........                                                 
                         00 05 00 00  00 04 00 00  00 00 00 00  00 00 00 00  ................                                                 
                         00 00 00 00                                         ....                                                             
  29.3   1048576  IN     00 00 01 00  00 00 00 00  00 00 00 00  00 00 00 00  ................  8.5ms  2017/07/18  15:11:35.667  ntoskrnl      
                         00 01 00 01  01 00 00 00  00 00 00 00  00 00 00 00  ................                                                 
                         00 01 01 00  00 00 01 00  01 00 01 00  00 00 00 00  ................                                                 
                         00 00 00 00  00 00 00 01  00 00 00 00  00 00 00 00  ................                                                 
  29.3    262144  IN     01 01 01 01  01 02 01 01  01 01 01 01  02 01 01 01  ................  2.0ms  2017/07/18  15:11:35.669  ntoskrnl      
                         01 01 01 02  01 01 01 01  01 02 01 01  00 01 01 01  ................                                                 
                         00 01 01 02  02 01 01 01  01 01 01 01  01 01 02 01  ................                                                 
                         02 01 01 02  01 02 01 01  01 01 01 01  01 01 01 01  ................                                                 
  29.3        32  IN     55 33 56 54  00 00 20 00  db 0f 00 00  00 00 00 00  U3VT.. .........   78us  2017/07/18  15:11:35.669  ntoskrnl      	# trailer_size is 0x20(32). block is 0xfdb(4059). status is 0x0000. valid_payload_size is 0x140000(1310720). trailer_size_y is 0x400(1024).
                         00 00 00 00  00 00 14 00  00 00 00 00  00 04 00 00  ................                                                 
  29.3        52  IN     55 33 56 4c  00 00 34 00  dc 0f 00 00  00 00 00 00  U3VL..4.........   36us  2017/07/18  15:11:35.669  ntoskrnl      	# block is 0xfdc(4060) chunk_mode_active is 0. timestamp is 0xd66d8bcf1(57560055025) pixel_format is 0x01080009(BayerRG8). size_x is 0x500(1280). size_y is 0x400(1024). offset_x is 0x0(0). offset_y is 0x0(0).
                         00 00 01 00  f1 bc d8 66  0d 00 00 00  09 00 08 01  .......f........                                                 
                         00 05 00 00  00 04 00 00  00 00 00 00  00 00 00 00  ................                                                 
                         00 00 00 00                                         ....                                                             
  29.3   1048576  IN     00 00 00 00  00 00 00 00  00 00 00 00  00 00 00 01  ................  8.6ms  2017/07/18  15:11:35.678  ntoskrnl      
                         00 00 00 00  00 00 00 00  00 00 00 00  00 00 00 00  ................                                                 
                         00 00 00 00  00 01 00 00  00 00 00 00  00 00 00 00  ................                                                 
                         01 00 00 00  00 00 00 00  01 00 00 00  00 00 00 00  ................                                                 
  29.3    262144  IN     01 00 01 01  01 01 02 01  01 01 01 01  02 01 01 01  ................  2.0ms  2017/07/18  15:11:35.680  ntoskrnl      
                         01 01 02 01  01 01 01 01  01 01 00 01  01 01 01 00  ................                                                 
                         00 01 01 02  01 02 01 01  01 01 01 01  02 01 02 01  ................                                                 
                         02 02 01 01  01 01 01 01  00 01 02 01  02 02 01 01  ................                                                 
  29.3        32  IN     55 33 56 54  00 00 20 00  dc 0f 00 00  00 00 00 00  U3VT.. .........   40us  2017/07/18  15:11:35.680  ntoskrnl      	# trailer_size is 0x20(32). block is 0xfdc(4060). status is 0x0000. valid_payload_size is 0x140000(1310720). trailer_size_y is 0x400(1024).
                         00 00 00 00  00 00 14 00  00 00 00 00  00 04 00 00  ................                                                 
  29.3        52  IN     55 33 56 4c  00 00 34 00  dd 0f 00 00  00 00 00 00  U3VL..4.........   28us  2017/07/18  15:11:35.680  ntoskrnl      	# block is 0xfdd(4061) chunk_mode_active is 0. timestamp is 0xd677cc2fb(57570804475) pixel_format is 0x01080009(BayerRG8). size_x is 0x500(1280). size_y is 0x400(1024). offset_x is 0x0(0). offset_y is 0x0(0).
                         00 00 01 00  fb c2 7c 67  0d 00 00 00  09 00 08 01  .......g........                                                 
                         00 05 00 00  00 04 00 00  00 00 00 00  00 00 00 00  ................                                                 
                         00 00 00 00                                         ....                                                             
  29.3   1048576  IN     00 00 00 00  00 00 00 00  00 00 01 00  00 00 00 01  ................  8.5ms  2017/07/18  15:11:35.688  ntoskrnl      
                         00 00 00 01  00 00 00 00  00 00 00 00  00 00 00 00  ................                                                 
                         00 00 01 00  00 00 01 00  00 00 01 01  01 00 00 00  ................                                                 
                         00 00 00 00  00 00 00 01  00 00 00 00  00 00 01 00  ................                                                 
  29.3    262144  IN     01 00 01 01  01 01 01 01  01 01 01 01  01 01 01 01  ................  2.0ms  2017/07/18  15:11:35.690  ntoskrnl      
                         01 01 01 01  01 01 01 01  01 01 00 00  01 01 00 01  ................                                                 
                         00 01 01 02  01 01 01 01  01 01 01 01  01 01 02 01  ................                                                 
                         02 01 01 01  01 01 01 01  01 01 01 01  02 01 01 02  ................                                                 
  29.3        32  IN     55 33 56 54  00 00 20 00  dd 0f 00 00  00 00 00 00  U3VT.. .........   44us  2017/07/18  15:11:35.690  ntoskrnl      	# trailer_size is 0x20(32). block is 0xfdd(4061). status is 0x0000. valid_payload_size is 0x140000(1310720). trailer_size_y is 0x400(1024).
                         00 00 00 00  00 00 14 00  00 00 00 00  00 04 00 00  ................                                                 
  29.3        52  IN     55 33 56 4c  00 00 34 00  de 0f 00 00  00 00 00 00  U3VL..4.........   18us  2017/07/18  15:11:35.690  ntoskrnl      	# block is 0xfde(4062) chunk_mode_active is 0. timestamp is 0xd6820c905(57581553925) pixel_format is 0x01080009(BayerRG8). size_x is 0x500(1280). size_y is 0x400(1024). offset_x is 0x0(0). offset_y is 0x0(0).
                         00 00 01 00  05 c9 20 68  0d 00 00 00  09 00 08 01  ...... h........                                                 
                         00 05 00 00  00 04 00 00  00 00 00 00  00 00 00 00  ................                                                 
                         00 00 00 00                                         ....                                                             
  29.3   1048576  IN     00 01 00 00  01 00 01 00  00 00 01 00  00 00 00 01  ................  8.6ms  2017/07/18  15:11:35.699  ntoskrnl      
                         01 00 00 00  00 01 00 00  00 00 00 00  00 00 00 01  ................                                                 
                         00 00 00 00  01 00 00 00  00 00 01 00  00 00 00 01  ................                                                 
                         00 01 00 00  00 00 01 00  01 01 00 00  01 01 00 00  ................                                                 
  29.3    262144  IN     01 01 01 02  02 01 01 01  01 01 01 01  02 01 01 01  ................  2.0ms  2017/07/18  15:11:35.701  ntoskrnl      
                         02 02 01 01  01 01 01 01  01 02 01 01  01 01 01 01  ................                                                 
                         00 01 01 02  01 02 01 01  01 01 01 02  01 01 02 01  ................                                                 
                         02 01 01 02  02 01 01 01  01 01 02 01  02 01 01 02  ................                                                 
  29.3        32  IN     55 33 56 54  00 00 20 00  de 0f 00 00  00 00 00 00  U3VT.. .........   35us  2017/07/18  15:11:35.701  ntoskrnl      	# trailer_size is 0x20(32). block is 0xfde(4062). status is 0x0000. valid_payload_size is 0x140000(1310720). trailer_size_y is 0x400(1024).
                         00 00 00 00  00 00 14 00  00 00 00 00  00 04 00 00  ................                                                 
  29.3        52  IN     55 33 56 4c  00 00 34 00  df 0f 00 00  00 00 00 00  U3VL..4.........   17us  2017/07/18  15:11:35.701  ntoskrnl      	# block is 0xfdf(4063) chunk_mode_active is 0. timestamp is 0xd68c4a71e(57592293150) pixel_format is 0x01080009(BayerRG8). size_x is 0x500(1280). size_y is 0x400(1024). offset_x is 0x0(0). offset_y is 0x0(0).
                         00 00 01 00  1e a7 c4 68  0d 00 00 00  09 00 08 01  .......h........                                                 
                         00 05 00 00  00 04 00 00  00 00 00 00  00 00 00 00  ................                                                 
                         00 00 00 00                                         ....                                                             
  29.3   1048576  IN     01 01 00 00  00 01 01 00  00 00 00 00  00 01 00 01  ................  8.6ms  2017/07/18  15:11:35.710  ntoskrnl      
                         00 00 00 01  00 01 00 00  00 00 00 00  00 01 00 00  ................                                                 
                         00 00 00 00  00 00 00 00  00 00 00 00  01 00 00 00  ................                                                 
                         01 01 00 00  00 00 01 01  01 01 00 00  00 01 00 00  ................                                                 
  29.3    262144  IN     02 01 01 01  01 02 01 01  02 02 01 01  02 01 01 01  ................  2.0ms  2017/07/18  15:11:35.712  ntoskrnl      
                         02 02 01 02  01 01 01 01  01 02 01 01  00 02 01 01  ................                                                 
                         01 01 02 02  01 02 01 01  01 01 01 01  02 01 03 01  ................                                                 
                         02 01 01 02  02 01 01 01  01 02 02 01  02 02 01 01  ................                                                 
  29.3        32  IN     55 33 56 54  00 00 20 00  df 0f 00 00  00 00 00 00  U3VT.. .........   27us  2017/07/18  15:11:35.712  ntoskrnl      	# trailer_size is 0x20(32). block is 0xfdf(4063). status is 0x0000. valid_payload_size is 0x140000(1310720). trailer_size_y is 0x400(1024).
                         00 00 00 00  00 00 14 00  00 00 00 00  00 04 00 00  ................                                                 
  29.3        52  IN     55 33 56 4c  00 00 34 00  e0 0f 00 00  00 00 00 00  U3VL..4.........   12us  2017/07/18  15:11:35.712  ntoskrnl      	# block is 0xfe0(4064) chunk_mode_active is 0. timestamp is 0xd6968ad28(57603042600) pixel_format is 0x01080009(BayerRG8). size_x is 0x500(1280). size_y is 0x400(1024). offset_x is 0x0(0). offset_y is 0x0(0).
                         00 00 01 00  28 ad 68 69  0d 00 00 00  09 00 08 01  ....(.hi........                                                 
                         00 05 00 00  00 04 00 00  00 00 00 00  00 00 00 00  ................                                                 
                         00 00 00 00                                         ....                                                             
  29.3   1048576  IN     00 00 00 00  00 00 00 00  00 00 01 00  00 00 01 00  ................  8.6ms  2017/07/18  15:11:35.720  ntoskrnl      
                         01 00 00 00  00 00 00 00  00 00 00 01  00 00 00 00  ................                                                 
                         00 00 00 00  00 00 01 00  00 00 00 01  00 00 00 00  ................                                                 
                         00 00 00 00  00 00 01 01  00 00 00 00  00 01 00 00  ................                                                 
  29.3    262144  IN     01 01 01 01  02 01 01 01  01 01 01 01  01 02 01 01  ................  2.0ms  2017/07/18  15:11:35.723  ntoskrnl      
                         01 01 01 02  01 01 01 01  01 01 01 01  01 01 01 00  ................                                                 
                         00 01 01 01  02 01 01 01  01 01 01 01  01 01 02 01  ................                                                 
                         02 01 01 02  01 02 01 01  01 01 01 01  01 01 01 01  ................                                                 
  29.3        32  IN     55 33 56 54  00 00 20 00  e0 0f 00 00  00 00 00 00  U3VT.. .........   48us  2017/07/18  15:11:35.723  ntoskrnl      	# trailer_size is 0x20(32). block is 0xfe0(4064). status is 0x0000. valid_payload_size is 0x140000(1310720). trailer_size_y is 0x400(1024).
                         00 00 00 00  00 00 14 00  00 00 00 00  00 04 00 00  ................                                                 
  29.3        52  IN     55 33 56 4c  00 00 34 00  e1 0f 00 00  00 00 00 00  U3VL..4.........   18us  2017/07/18  15:11:35.723  ntoskrnl      	# block is 0xfe1(4065) chunk_mode_active is 0. timestamp is 0xd6a0cb319(57613792025) pixel_format is 0x01080009(BayerRG8). size_x is 0x500(1280). size_y is 0x400(1024). offset_x is 0x0(0). offset_y is 0x0(0).
                         00 00 01 00  19 b3 0c 6a  0d 00 00 00  09 00 08 01  .......j........                                                 
                         00 05 00 00  00 04 00 00  00 00 00 00  00 00 00 00  ................                                                 
                         00 00 00 00                                         ....                                                             
  29.3   1048576  IN     01 00 00 00  00 00 00 00  00 00 00 00  00 00 00 01  ................  8.6ms  2017/07/18  15:11:35.731  ntoskrnl      
                         00 00 00 00  00 00 00 00  00 00 00 01  00 00 00 01  ................                                                 
                         00 00 00 00  00 01 00 00  00 00 00 01  00 00 00 00  ................                                                 
                         00 01 00 00  00 00 01 00  01 00 00 00  00 01 00 00  ................                                                 
  29.3    262144  IN     02 01 01 01  02 01 01 01  01 01 01 02  02 02 01 01  ................  2.0ms  2017/07/18  15:11:35.733  ntoskrnl      
                         01 02 01 01  01 01 01 01  01 01 01 01  01 01 00 01  ................                                                 
                         00 01 01 02  01 01 01 01  01 02 01 01  01 01 02 01  ................                                                 
                         02 02 01 01  02 02 01 01  01 01 02 01  01 02 02 01  ................                                                 
  29.3        32  IN     55 33 56 54  00 00 20 00  e1 0f 00 00  00 00 00 00  U3VT.. .........   27us  2017/07/18  15:11:35.733  ntoskrnl      	# trailer_size is 0x20(32). block is 0xfe1(4065). status is 0x0000. valid_payload_size is 0x140000(1310720). trailer_size_y is 0x400(1024).
                         00 00 00 00  00 00 14 00  00 00 00 00  00 04 00 00  ................                                                 
  29.3        52  IN     55 33 56 4c  00 00 34 00  e2 0f 00 00  00 00 00 00  U3VL..4.........   12us  2017/07/18  15:11:35.733  ntoskrnl      	# block is 0xfe2(4066) chunk_mode_active is 0. timestamp is 0xd6ab0b923(57624541475) pixel_format is 0x01080009(BayerRG8). size_x is 0x500(1280). size_y is 0x400(1024). offset_x is 0x0(0). offset_y is 0x0(0).
                         00 00 01 00  23 b9 b0 6a  0d 00 00 00  09 00 08 01  ....#..j........                                                 
                         00 05 00 00  00 04 00 00  00 00 00 00  00 00 00 00  ................                                                 
                         00 00 00 00                                         ....                                                             
  29.3   1048576  IN     00 00 00 00  00 00 00 00  00 00 00 00  01 01 00 01  ................  8.7ms  2017/07/18  15:11:35.742  ntoskrnl      
                         00 01 00 00  00 00 00 00  00 00 00 00  00 00 00 00  ................                                                 
                         00 00 00 00  00 00 01 00  00 00 00 01  00 00 00 00  ................                                                 
                         00 01 01 00  00 00 00 01  00 01 00 00  00 00 01 00  ................                                                 
  29.3    262144  IN     01 01 01 01  01 02 01 01  02 02 01 01  01 02 01 01  ................  2.0ms  2017/07/18  15:11:35.744  ntoskrnl      
                         01 02 01 01  01 01 01 01  01 02 01 01  00 01 00 01  ................                                                 
                         00 01 01 02  01 02 01 01  01 01 01 01  01 01 02 01  ................                                                 
                         02 01 01 01  01 01 01 01  01 01 01 01  02 01 01 01  ................                                                 
  29.3        32  IN     55 33 56 54  00 00 20 00  e2 0f 00 00  00 00 00 00  U3VT.. .........   21us  2017/07/18  15:11:35.744  ntoskrnl      	# trailer_size is 0x20(32). block is 0xfe2(4066). status is 0x0000. valid_payload_size is 0x140000(1310720). trailer_size_y is 0x400(1024).
                         00 00 00 00  00 00 14 00  00 00 00 00  00 04 00 00  ................                                                 
  29.3        52  IN     55 33 56 4c  00 00 34 00  e3 0f 00 00  00 00 00 00  U3VL..4.........   10us  2017/07/18  15:11:35.744  ntoskrnl      	# block is 0xfe3(4067) chunk_mode_active is 0. timestamp is 0xd6b54bf2d(57635290925) pixel_format is 0x01080009(BayerRG8). size_x is 0x500(1280). size_y is 0x400(1024). offset_x is 0x0(0). offset_y is 0x0(0).
                         00 00 01 00  2d bf 54 6b  0d 00 00 00  09 00 08 01  ....-.Tk........                                                 
                         00 05 00 00  00 04 00 00  00 00 00 00  00 00 00 00  ................                                                 
                         00 00 00 00                                         ....                                                             
  29.3   1048576  IN     00 00 00 00  00 00 00 00  00 00 00 00  00 00 00 01  ................  8.6ms  2017/07/18  15:11:35.753  ntoskrnl      
                         00 00 00 00  00 00 00 00  00 00 00 00  00 01 00 00  ................                                                 
                         00 00 00 00  00 00 00 00  00 00 00 00  00 00 00 00  ................                                                 
                         00 00 01 00  00 00 00 00  00 00 00 00  00 00 00 00  ................                                                 
  29.3    262144  IN     01 01 01 02  02 01 01 02  01 01 01 01  02 01 01 01  ................  2.0ms  2017/07/18  15:11:35.755  ntoskrnl      
                         01 02 01 02  01 01 01 01  01 02 01 01  01 01 01 01  ................                                                 
                         00 01 02 02  02 01 01 01  02 01 02 01  01 01 02 01  ................                                                 
                         02 01 01 02  01 02 02 01  01 01 01 01  01 01 01 02  ................                                                 
  29.3        32  IN     55 33 56 54  00 00 20 00  e3 0f 00 00  00 00 00 00  U3VT.. .........   24us  2017/07/18  15:11:35.755  ntoskrnl      	# trailer_size is 0x20(32). block is 0xfe3(4067). status is 0x0000. valid_payload_size is 0x140000(1310720). trailer_size_y is 0x400(1024).
                         00 00 00 00  00 00 14 00  00 00 00 00  00 04 00 00  ................                                                 
  29.3        52  IN     55 33 56 4c  00 00 34 00  e4 0f 00 00  00 00 00 00  U3VL..4.........   13us  2017/07/18  15:11:35.755  ntoskrnl      	# block is 0xfe4(4068) chunk_mode_active is 0. timestamp is 0xd6bf8c537(57646040375) pixel_format is 0x01080009(BayerRG8). size_x is 0x500(1280). size_y is 0x400(1024). offset_x is 0x0(0). offset_y is 0x0(0).
                         00 00 01 00  37 c5 f8 6b  0d 00 00 00  09 00 08 01  ....7..k........                                                 
                         00 05 00 00  00 04 00 00  00 00 00 00  00 00 00 00  ................                                                 
                         00 00 00 00                                         ....                                                             
  29.3   1048576  IN     00 00 01 00  00 00 00 00  00 00 00 00  00 01 00 01  ................  8.6ms  2017/07/18  15:11:35.763  ntoskrnl      
                         00 01 00 00  00 00 00 00  00 00 00 00  00 00 00 00  ................                                                 
                         00 00 01 00  00 00 00 00  00 01 00 00  01 00 00 00  ................                                                 
                         00 01 01 00  00 00 00 00  01 00 00 00  00 01 00 00  ................                                                 
  29.3    262144  IN     01 02 01 01  02 02 01 01  01 01 01 01  01 01 01 01  ................  2.0ms  2017/07/18  15:11:35.766  ntoskrnl      
                         01 01 01 02  01 01 01 01  01 01 01 01  00 01 00 01  ................                                                 
                         00 01 01 02  01 01 01 01  00 01 01 01  01 01 02 01  ................                                                 
                         02 01 00 01  01 01 01 01  01 01 01 01  01 02 01 01  ................                                                 
  29.3        32  IN     55 33 56 54  00 00 20 00  e4 0f 00 00  00 00 00 00  U3VT.. .........   22us  2017/07/18  15:11:35.766  ntoskrnl      	# trailer_size is 0x20(32). block is 0xfe4(4068). status is 0x0000. valid_payload_size is 0x140000(1310720). trailer_size_y is 0x400(1024).
                         00 00 00 00  00 00 14 00  00 00 00 00  00 04 00 00  ................                                                 
  29.3        52  IN     55 33 56 4c  00 00 34 00  e5 0f 00 00  00 00 00 00  U3VL..4.........   10us  2017/07/18  15:11:35.766  ntoskrnl      	# block is 0xfe5(4069) chunk_mode_active is 0. timestamp is 0xd6c9ccb28(57656789800) pixel_format is 0x01080009(BayerRG8). size_x is 0x500(1280). size_y is 0x400(1024). offset_x is 0x0(0). offset_y is 0x0(0).
                         00 00 01 00  28 cb 9c 6c  0d 00 00 00  09 00 08 01  ....(..l........                                                 
                         00 05 00 00  00 04 00 00  00 00 00 00  00 00 00 00  ................                                                 
                         00 00 00 00                                         ....                                                             
  29.3   1048576  IN     00 00 00 00  00 00 00 00  00 00 00 00  00 00 00 01  ................  8.6ms  2017/07/18  15:11:35.774  ntoskrnl      
                         00 00 00 00  01 00 00 00  00 00 00 01  00 00 00 00  ................                                                 
                         01 00 00 00  00 00 01 00  00 01 00 01  00 00 00 01  ................                                                 
                         01 01 00 00  00 00 01 00  01 00 00 00  00 00 00 00  ................                                                 
  29.3    262144  IN     01 01 01 01  02 01 01 01  01 01 01 01  02 01 01 01  ................  2.0ms  2017/07/18  15:11:35.776  ntoskrnl      
                         01 01 01 01  01 01 01 01  01 02 01 01  00 01 01 01  ................                                                 
                         00 01 01 02  01 02 01 01  01 01 01 01  01 01 02 01  ................                                                 
                         02 01 01 02  01 01 01 01  01 01 01 01  02 01 01 01  ................                                                 
  29.3        32  IN     55 33 56 54  00 00 20 00  e5 0f 00 00  00 00 00 00  U3VT.. .........   25us  2017/07/18  15:11:35.776  ntoskrnl      	# trailer_size is 0x20(32). block is 0xfe5(4069). status is 0x0000. valid_payload_size is 0x140000(1310720). trailer_size_y is 0x400(1024).
                         00 00 00 00  00 00 14 00  00 00 00 00  00 04 00 00  ................                                                 
  29.3        52  IN     55 33 56 4c  00 00 34 00  e6 0f 00 00  00 00 00 00  U3VL..4.........   17us  2017/07/18  15:11:35.776  ntoskrnl      	# block is 0xfe6(4070) chunk_mode_active is 0. timestamp is 0xd6d40a941(57667529025) pixel_format is 0x01080009(BayerRG8). size_x is 0x500(1280). size_y is 0x400(1024). offset_x is 0x0(0). offset_y is 0x0(0).
                         00 00 01 00  41 a9 40 6d  0d 00 00 00  09 00 08 01  ....A.@m........                                                 
                         00 05 00 00  00 04 00 00  00 00 00 00  00 00 00 00  ................                                                 
                         00 00 00 00                                         ....                                                             
  29.3   1048576  IN     00 01 01 00  00 01 00 00  00 00 00 00  00 00 00 01  ................  8.6ms  2017/07/18  15:11:35.785  ntoskrnl      
                         00 00 00 01  00 00 00 00  00 00 00 00  00 00 01 00  ................                                                 
                         00 00 01 00  00 01 01 00  00 00 00 00  01 00 01 00  ................                                                 
                         00 00 01 00  00 00 00 01  01 01 01 00  00 01 00 00  ................                                                 
  29.3    262144  IN     01 01 02 02  02 01 01 01  02 02 02 01  01 02 01 01  ................  2.0ms  2017/07/18  15:11:35.787  ntoskrnl      
                         02 02 01 01  01 01 01 02  01 01 01 01  01 02 01 01  ................                                                 
                         00 01 01 01  01 01 01 01  01 01 01 01  01 01 02 01  ................                                                 
                         02 01 01 01  02 01 01 01  01 01 01 01  01 02 01 01  ................                                                 
  29.3        32  IN     55 33 56 54  00 00 20 00  e6 0f 00 00  00 00 00 00  U3VT.. .........   20us  2017/07/18  15:11:35.787  ntoskrnl      	# trailer_size is 0x20(32). block is 0xfe6(4070). status is 0x0000. valid_payload_size is 0x140000(1310720). trailer_size_y is 0x400(1024).
                         00 00 00 00  00 00 14 00  00 00 00 00  00 04 00 00  ................                                                 
  29.3        52  IN     55 33 56 4c  00 00 34 00  e7 0f 00 00  00 00 00 00  U3VL..4.........   13us  2017/07/18  15:11:35.787  ntoskrnl      	# block is 0xfe7(4071) chunk_mode_active is 0. timestamp is 0xd6de4af4b(57678278475) pixel_format is 0x01080009(BayerRG8). size_x is 0x500(1280). size_y is 0x400(1024). offset_x is 0x0(0). offset_y is 0x0(0).
                         00 00 01 00  4b af e4 6d  0d 00 00 00  09 00 08 01  ....K..m........                                                 
                         00 05 00 00  00 04 00 00  00 00 00 00  00 00 00 00  ................                                                 
                         00 00 00 00                                         ....                                                             
  29.3   1048576  IN     00 00 01 00  00 01 00 00  00 00 00 00  00 00 01 01  ................  8.6ms  2017/07/18  15:11:35.796  ntoskrnl      
                         00 00 00 00  00 01 01 00  00 00 00 00  00 00 00 00  ................                                                 
                         00 00 01 00  00 01 00 00  00 00 01 01  00 00 00 00  ................                                                 
                         01 01 00 01  00 00 00 00  01 01 01 00  00 01 01 00  ................                                                 
  29.3    262144  IN     01 01 01 01  02 01 01 02  02 01 01 01  01 01 01 01  ................  2.0ms  2017/07/18  15:11:35.798  ntoskrnl      
                         01 02 02 02  01 02 01 01  01 01 01 01  01 01 01 01  ................                                                 
                         00 01 01 02  02 01 01 00  01 01 01 01  02 01 02 01  ................                                                 
                         01 01 01 02  01 01 01 01  01 01 02 01  02 01 01 01  ................                                                 
  29.3        32  IN     55 33 56 54  00 00 20 00  e7 0f 00 00  00 00 00 00  U3VT.. .........   20us  2017/07/18  15:11:35.798  ntoskrnl      	# trailer_size is 0x20(32). block is 0xfe7(4071). status is 0x0000. valid_payload_size is 0x140000(1310720). trailer_size_y is 0x400(1024).
                         00 00 00 00  00 00 14 00  00 00 00 00  00 04 00 00  ................                                                 
  29.3        52  IN     55 33 56 4c  00 00 34 00  e8 0f 00 00  00 00 00 00  U3VL..4.........   35us  2017/07/18  15:11:35.798  ntoskrnl      	# block is 0xfe8(4072) chunk_mode_active is 0. timestamp is 0xd6e88b555(57689027925) pixel_format is 0x01080009(BayerRG8). size_x is 0x500(1280). size_y is 0x400(1024). offset_x is 0x0(0). offset_y is 0x0(0).
                         00 00 01 00  55 b5 88 6e  0d 00 00 00  09 00 08 01  ....U..n........                                                 
                         00 05 00 00  00 04 00 00  00 00 00 00  00 00 00 00  ................                                                 
                         00 00 00 00                                         ....                                                             
  29.3   1048576  IN     00 00 01 00  00 01 00 01  01 00 00 00  00 00 00 01  ................  8.6ms  2017/07/18  15:11:35.806  ntoskrnl      
                         00 01 00 00  00 00 00 00  00 00 00 00  00 00 00 01  ................                                                 
                         00 00 01 00  00 01 00 00  00 00 01 00  01 00 01 00  ................                                                 
                         00 00 00 00  00 00 01 00  01 00 00 00  00 00 01 00  ................                                                 
  29.3    262144  IN     01 01 02 01  01 02 01 01  01 01 01 01  01 02 01 01  ................  2.1ms  2017/07/18  15:11:35.809  ntoskrnl      
                         01 02 01 02  01 02 01 01  01 02 01 01  01 02 01 01  ................                                                 
                         00 01 01 02  02 01 01 01  01 01 01 02  01 01 02 01  ................                                                 
                         02 01 01 01  01 01 02 01  01 01 01 01  02 01 01 01  ................                                                 
  29.3        32  IN     55 33 56 54  00 00 20 00  e8 0f 00 00  00 00 00 00  U3VT.. .........   40us  2017/07/18  15:11:35.809  ntoskrnl      	# trailer_size is 0x20(32). block is 0xfe8(4072). status is 0x0000. valid_payload_size is 0x140000(1310720). trailer_size_y is 0x400(1024).
                         00 00 00 00  00 00 14 00  00 00 00 00  00 04 00 00  ................                                                 
  29.3        52  IN     55 33 56 4c  00 00 34 00  e9 0f 00 00  00 00 00 00  U3VL..4.........   33us  2017/07/18  15:11:35.809  ntoskrnl      	# block is 0xfe9(4073) chunk_mode_active is 0. timestamp is 0xd6f2cbb5f(57699777375) pixel_format is 0x01080009(BayerRG8). size_x is 0x500(1280). size_y is 0x400(1024). offset_x is 0x0(0). offset_y is 0x0(0).
                         00 00 01 00  5f bb 2c 6f  0d 00 00 00  09 00 08 01  ...._.,o........                                                 
                         00 05 00 00  00 04 00 00  00 00 00 00  00 00 00 00  ................                                                 
                         00 00 00 00                                         ....                                                             
  29.3   1048576  IN     00 00 00 00  00 00 00 00  00 00 00 01  00 00 00 01  ................  8.6ms  2017/07/18  15:11:35.817  ntoskrnl      
                         00 00 00 00  00 00 00 00  00 00 00 01  00 00 00 00  ................                                                 
                         01 00 00 00  00 00 00 00  00 00 00 00  00 00 00 00  ................                                                 
                         00 00 00 00  00 00 00 00  00 00 00 00  00 00 00 00  ................                                                 
  29.3    262144  IN     01 01 01 01  02 01 01 01  02 01 02 01  01 01 01 01  ................  2.0ms  2017/07/18  15:11:35.819  ntoskrnl      
                         01 02 01 01  01 01 01 01  01 01 00 01  01 01 01 01  ................                                                 
                         00 01 01 02  01 02 01 01  01 01 01 01  01 01 02 01  ................                                                 
                         02 01 01 02  02 01 01 01  01 01 01 01  02 02 01 01  ................                                                 
  29.3        32  IN     55 33 56 54  00 00 20 00  e9 0f 00 00  00 00 00 00  U3VT.. .........   31us  2017/07/18  15:11:35.819  ntoskrnl      	# trailer_size is 0x20(32). block is 0xfe9(4073). status is 0x0000. valid_payload_size is 0x140000(1310720). trailer_size_y is 0x400(1024).
                         00 00 00 00  00 00 14 00  00 00 00 00  00 04 00 00  ................                                                 
  29.3        52  IN     55 33 56 4c  00 00 34 00  ea 0f 00 00  00 00 00 00  U3VL..4.........    9us  2017/07/18  15:11:35.819  ntoskrnl      	# block is 0xfea(4074) chunk_mode_active is 0. timestamp is 0xd6fd0c150(57710526800) pixel_format is 0x01080009(BayerRG8). size_x is 0x500(1280). size_y is 0x400(1024). offset_x is 0x0(0). offset_y is 0x0(0).
                         00 00 01 00  50 c1 d0 6f  0d 00 00 00  09 00 08 01  ....P..o........                                                 
                         00 05 00 00  00 04 00 00  00 00 00 00  00 00 00 00  ................                                                 
                         00 00 00 00                                         ....                                                             
  29.3   1048576  IN     00 00 00 00  00 00 00 00  01 00 01 00  00 01 00 01  ................  8.5ms  2017/07/18  15:11:35.828  ntoskrnl      
                         00 01 00 00  00 00 00 00  00 00 01 00  00 00 00 00  ................                                                 
                         00 00 00 00  00 00 00 00  00 00 00 00  00 00 00 00  ................                                                 
                         00 01 00 00  00 00 00 01  01 00 00 00  01 01 00 00  ................                                                 
  29.3    262144  IN     01 01 01 01  01 01 01 01  02 01 01 01  01 01 01 01  ................  2.0ms  2017/07/18  15:11:35.830  ntoskrnl      
                         01 02 02 01  01 01 01 01  01 01 01 01  01 01 01 00  ................                                                 
                         00 01 01 01  01 01 01 01  01 01 01 01  01 01 02 01  ................                                                 
                         01 01 01 01  01 01 01 01  01 01 01 02  01 01 00 01  ................                                                 
  29.3        32  IN     55 33 56 54  00 00 20 00  ea 0f 00 00  00 00 00 00  U3VT.. .........   19us  2017/07/18  15:11:35.830  ntoskrnl      	# trailer_size is 0x20(32). block is 0xfea(4074). status is 0x0000. valid_payload_size is 0x140000(1310720). trailer_size_y is 0x400(1024).
                         00 00 00 00  00 00 14 00  00 00 00 00  00 04 00 00  ................                                                 
  29.3        52  IN     55 33 56 4c  00 00 34 00  eb 0f 00 00  00 00 00 00  U3VL..4.........   11us  2017/07/18  15:11:35.830  ntoskrnl      	# block is 0xfeb(4075) chunk_mode_active is 0. timestamp is 0xd7074c75a(57721276250) pixel_format is 0x01080009(BayerRG8). size_x is 0x500(1280). size_y is 0x400(1024). offset_x is 0x0(0). offset_y is 0x0(0).
                         00 00 01 00  5a c7 74 70  0d 00 00 00  09 00 08 01  ....Z.tp........                                                 
                         00 05 00 00  00 04 00 00  00 00 00 00  00 00 00 00  ................                                                 
                         00 00 00 00                                         ....                                                             
  29.3   1048576  IN     00 00 00 00  00 00 00 00  00 00 01 00  00 00 00 01  ................  8.6ms  2017/07/18  15:11:35.839  ntoskrnl      
                         00 00 00 00  00 00 00 01  00 00 00 00  00 00 00 00  ................                                                 
                         00 00 00 01  00 00 01 00  00 00 01 00  01 00 01 00  ................                                                 
                         00 00 00 01  00 00 01 00  01 01 00 00  01 00 00 00  ................                                                 
  29.3    262144  IN     02 02 01 02  02 02 02 01  02 02 01 01  02 01 01 01  ................  2.0ms  2017/07/18  15:11:35.841  ntoskrnl      
                         01 02 02 02  01 01 01 01  02 01 01 01  01 01 01 01  ................                                                 
                         00 01 01 02  01 01 01 01  01 02 02 02  02 01 02 01  ................                                                 
                         02 01 01 01  01 01 02 01  01 01 01 02  01 02 01 01  ................                                                 
  29.3        32  IN     55 33 56 54  00 00 20 00  eb 0f 00 00  00 00 00 00  U3VT.. .........   21us  2017/07/18  15:11:35.841  ntoskrnl      	# trailer_size is 0x20(32). block is 0xfeb(4075). status is 0x0000. valid_payload_size is 0x140000(1310720). trailer_size_y is 0x400(1024).
                         00 00 00 00  00 00 14 00  00 00 00 00  00 04 00 00  ................                                                 
  29.3        52  IN     55 33 56 4c  00 00 34 00  ec 0f 00 00  00 00 00 00  U3VL..4.........    9us  2017/07/18  15:11:35.841  ntoskrnl      	# block is 0xfec(4076) chunk_mode_active is 0. timestamp is 0xd7118cd64(57732025700) pixel_format is 0x01080009(BayerRG8). size_x is 0x500(1280). size_y is 0x400(1024). offset_x is 0x0(0). offset_y is 0x0(0).
                         00 00 01 00  64 cd 18 71  0d 00 00 00  09 00 08 01  ....d..q........                                                 
                         00 05 00 00  00 04 00 00  00 00 00 00  00 00 00 00  ................                                                 
                         00 00 00 00                                         ....                                                             
